index,post_id,title,flair,score,post_upvote_ratio,subreddit,url,num_comments,body,created,body_word_token,body_tag,body_string,topics,sentiment
0,t7bjyw,Willem Dafoe's performance in The Lighthouse is the most entertaining performance I have seen in ages.,Discussion,9862,0.95,movies,https://www.reddit.com/r/movies/comments/t7bjyw/willem_dafoes_performance_in_the_lighthouse_is/,517,"the lighthouse is a weird film and dafoe's character is even weirder. but does dafoe do a stupendous job in selling his character. from the sailor speak to his accent to delivering lengthy monologues seamlessly and displaying an artillery of expressions, dafoe hits each scene perfectly.

robert pattinson is not far behind as he does a great job too. it is just that dafoe's character is more interesting and dafoe just takes it many notches up. even in some serious scene i was smiling as to how entertaining the character was.

i think it was a snub for dafoe, deserved a supporting act nomination for that performance.",1646493422.0,"['lighthouse', 'weird', 'film', 'dafoe', ""'s"", 'character', 'even', 'weirder', '.', 'dafoe', 'stupendous', 'job', 'sell', 'character', '.', 'sailor', 'speak', 'accent', 'deliver', 'lengthy', 'monologue', 'seamlessly', 'display', 'artillery', 'expression', ',', 'dafoe', 'hit', 'scene', 'perfectly', '.', 'robert', 'pattinson', 'far', 'behind', 'great', 'job', '.', 'dafoe', ""'s"", 'character', 'interest', 'dafoe', 'take', 'many', 'notch', '.', 'even', 'serious', 'scene', 'smile', 'entertain', 'character', '.', 'think', 'snub', 'dafoe', ',', 'deserve', 'support', 'act', 'nomination', 'performance', '.']","[[('lighthouse', 'NN')], [('weird', 'NN')], [('film', 'NN')], [('dafoe', 'NN')], [(""'s"", 'POS')], [('character', 'NN')], [('even', 'RB')], [('weirder', 'NN')], [('.', '.')], [('dafoe', 'NN')], [('stupendous', 'JJ')], [('job', 'NN')], [('selling', 'VBG')], [('character', 'NN')], [('.', '.')], [('sailor', 'NN')], [('speak', 'NN')], [('accent', 'NN')], [('delivering', 'VBG')], [('lengthy', 'NN')], [('monologues', 'NNS')], [('seamlessly', 'RB')], [('displaying', 'VBG')], [('artillery', 'NN')], [('expressions', 'NNS')], [(',', ',')], [('dafoe', 'NN')], [('hits', 'NNS')], [('scene', 'NN')], [('perfectly', 'RB')], [('.', '.')], [('robert', 'NN')], [('pattinson', 'NN')], [('far', 'RB')], [('behind', 'IN')], [('great', 'JJ')], [('job', 'NN')], [('.', '.')], [('dafoe', 'NN')], [(""'s"", 'POS')], [('character', 'NN')], [('interesting', 'VBG')], [('dafoe', 'NN')], [('takes', 'VBZ')], [('many', 'JJ')], [('notches', 'NNS')], [('.', '.')], [('even', 'RB')], [('serious', 'JJ')], [('scene', 'NN')], [('smiling', 'VBG')], [('entertaining', 'VBG')], [('character', 'NN')], [('.', '.')], [('think', 'NN')], [('snub', 'NN')], [('dafoe', 'NN')], [(',', ',')], [('deserved', 'VBN')], [('supporting', 'VBG')], [('act', 'NN')], [('nomination', 'NN')], [('performance', 'NN')], [('.', '.')]]","lighthouse weird film dafoe 's character even weirder . dafoe stupendous job sell character . sailor speak accent deliver lengthy monologue seamlessly display artillery expression , dafoe hit scene perfectly . robert pattinson far behind great job . dafoe 's character interest dafoe take many notch . even serious scene smile entertain character . think snub dafoe , deserve support act nomination performance .",0_movie_watch_one_like,4
1,t77o9w,The King's Man (2021) was all over the place,Discussion,1084,0.91,movies,https://www.reddit.com/r/movies/comments/t77o9w/the_kings_man_2021_was_all_over_the_place/,289,i thoroughly enjoyed it but it did not feel like a kingsman movie.  i know it is an origin story but it misses the mark. it does not have the same magic as the first one. rasputin was a highlight of the movie. that dance fighting scene was awesome. that guy was so bizarre and hilarious. i liked the fact that there were historical figures. there were some cool fight sequences. we all need a little polly in our life. i just love gemma arterton. still looking forward to the sequel though.,1646480203.0,"['thoroughly', 'enjoy', 'feel', 'like', 'kingsman', 'movie', '.', 'know', 'origin', 'story', 'miss', 'mark', '.', 'magic', 'first', 'one', '.', 'rasputin', 'highlight', 'movie', '.', 'dance', 'fight', 'scene', 'awesome', '.', 'guy', 'bizarre', 'hilarious', '.', 'like', 'fact', 'historical', 'figure', '.', 'cool', 'fight', 'sequence', '.', 'need', 'little', 'polly', 'life', '.', 'love', 'gemma', 'arterton', '.', 'still', 'look', 'forward', 'sequel', 'though', '.']","[[('thoroughly', 'RB')], [('enjoyed', 'VBN')], [('feel', 'NN')], [('like', 'IN')], [('kingsman', 'NN')], [('movie', 'NN')], [('.', '.')], [('know', 'VB')], [('origin', 'NN')], [('story', 'NN')], [('misses', 'NNS')], [('mark', 'NN')], [('.', '.')], [('magic', 'NN')], [('first', 'RB')], [('one', 'CD')], [('.', '.')], [('rasputin', 'NN')], [('highlight', 'NN')], [('movie', 'NN')], [('.', '.')], [('dance', 'NN')], [('fighting', 'VBG')], [('scene', 'NN')], [('awesome', 'NN')], [('.', '.')], [('guy', 'NN')], [('bizarre', 'NN')], [('hilarious', 'JJ')], [('.', '.')], [('liked', 'VBN')], [('fact', 'NN')], [('historical', 'JJ')], [('figures', 'NNS')], [('.', '.')], [('cool', 'NN')], [('fight', 'NN')], [('sequences', 'NNS')], [('.', '.')], [('need', 'NN')], [('little', 'JJ')], [('polly', 'RB')], [('life', 'NN')], [('.', '.')], [('love', 'NN')], [('gemma', 'NN')], [('arterton', 'NN')], [('.', '.')], [('still', 'RB')], [('looking', 'VBG')], [('forward', 'RB')], [('sequel', 'NN')], [('though', 'IN')], [('.', '.')]]",thoroughly enjoy feel like kingsman movie . know origin story miss mark . magic first one . rasputin highlight movie . dance fight scene awesome . guy bizarre hilarious . like fact historical figure . cool fight sequence . need little polly life . love gemma arterton . still look forward sequel though .,-1_film_movie_like_see,3
11,t79bw1,Rewatching Inglourious Basterds today. How could Brad Pitt not have been nominated for any of the major awards for his performance?,Discussion,64,0.64,movies,https://www.reddit.com/r/movies/comments/t79bw1/rewatching_inglourious_basterds_today_how_could/,98,obviously noone would have beaten christoph waltz that year anyway but i find brad's performance as aldo so compelling and funny i was surprised when i looked up the nominations that year and he was not anywhere. not even a golden globe.  i do not think it was a particularly stacked year in the category either in my opinion.,1646486500.0,"['obviously', 'noone', 'would', 'beaten', 'christoph', 'waltz', 'year', 'anyway', 'find', 'brad', ""'s"", 'performance', 'aldo', 'compelling', 'funny', 'surprised', 'look', 'nomination', 'year', 'anywhere', '.', 'even', 'golden', 'globe', '.', 'think', 'particularly', 'stack', 'year', 'category', 'either', 'opinion', '.']","[[('obviously', 'RB')], [('noone', 'NN')], [('would', 'MD')], [('beaten', 'NN')], [('christoph', 'NN')], [('waltz', 'NN')], [('year', 'NN')], [('anyway', 'RB')], [('find', 'VB')], [('brad', 'NN')], [(""'s"", 'POS')], [('performance', 'NN')], [('aldo', 'NN')], [('compelling', 'NN')], [('funny', 'NN')], [('surprised', 'JJ')], [('looked', 'VBD')], [('nominations', 'NNS')], [('year', 'NN')], [('anywhere', 'RB')], [('.', '.')], [('even', 'RB')], [('golden', 'JJ')], [('globe', 'NN')], [('.', '.')], [('think', 'NN')], [('particularly', 'RB')], [('stacked', 'VBN')], [('year', 'NN')], [('category', 'NN')], [('either', 'DT')], [('opinion', 'NN')], [('.', '.')]]",obviously noone would beaten christoph waltz year anyway find brad 's performance aldo compelling funny surprised look nomination year anywhere . even golden globe . think particularly stack year category either opinion .,-1_film_movie_like_see,3
13,t798t3,"Films with characters that are ""alone, but not lonely?"" — happily exploring life alone. Flâneur types!",Recommendation,36,0.78,movies,https://www.reddit.com/r/movies/comments/t798t3/films_with_characters_that_are_alone_but_not/,32,"i am looking for films where characters are more loners in the world, but it are not a bad thing. they are happy with themselves and love spending time alone. these open-minded people get along with others well in general but ultimately they are their own best friend and the fact that they can be happy alone like that, is simply magical.

kind of hard to pinpoint this exact sorta feeling i want but some flâneur action would be great! characters that loves spending their time experiencing the world through their lens and meeting people, but at the end of the day, love to wind down with a glass of wine alone. or maybe end the night tearing up (happy tears) over how beautiful the tokyo city skyline is... alone.

not looking for a depressing film about loneliness. there is a key difference here. i am looking for something more inspirational and beautiful. it is beautiful when people are in touch with themselves on such a deep level like that.

these loners love (but not limited to) nature, views, city skylines, neon lights, intimate bars, exploring off the beaten path areas, sunrises, sunsets, connecting with real souls, dining alone etc.

i do not know if the vibe i am going for will make sense to you all, but hopefully it does. you know those independent people you meet that are adventurous and are just happy doing their own thing? that!

thanks!",1646486207.0,"['look', 'film', 'character', 'loner', 'world', ',', 'bad', 'thing', '.', 'happy', 'love', 'spending', 'time', 'alone', '.', 'open-minded', 'people', 'get', 'along', 'others', 'well', 'general', 'ultimately', 'best', 'friend', 'fact', 'happy', 'alone', 'like', ',', 'simply', 'magical', '.', 'kind', 'hard', 'pinpoint', 'exact', 'sorta', 'feel', 'want', 'flâneur', 'action', 'would', 'great', '!', 'character', 'love', 'spending', 'time', 'experience', 'world', 'lens', 'meeting', 'people', ',', 'end', 'day', ',', 'love', 'wind', 'glass', 'wine', 'alone', '.', 'maybe', 'end', 'night', 'tear', '(', 'happy', 'tear', ')', 'beautiful', 'tokyo', 'city', 'skyline', '...', 'alone', '.', 'look', 'depress', 'film', 'loneliness', '.', 'key', 'difference', '.', 'look', 'something', 'inspirational', 'beautiful', '.', 'beautiful', 'people', 'touch', 'deep', 'level', 'like', '.', 'loner', 'love', '(', 'limited', ')', 'nature', ',', 'view', ',', 'city', 'skyline', ',', 'neon', 'light', ',', 'intimate', 'bar', ',', 'explore', 'beaten', 'path', 'area', ',', 'sunrise', ',', 'sunset', ',', 'connect', 'real', 'soul', ',', 'din', 'alone', 'etc', '.', 'know', 'vibe', 'go', 'make', 'sense', ',', 'hopefully', '.', 'know', 'independent', 'people', 'meet', 'adventurous', 'happy', 'thing', '?', '!', 'thanks', '!']","[[('looking', 'VBG')], [('films', 'NNS')], [('characters', 'NNS')], [('loners', 'NNS')], [('world', 'NN')], [(',', ',')], [('bad', 'JJ')], [('thing', 'NN')], [('.', '.')], [('happy', 'JJ')], [('love', 'NN')], [('spending', 'NN')], [('time', 'NN')], [('alone', 'RB')], [('.', '.')], [('open-minded', 'JJ')], [('people', 'NNS')], [('get', 'VB')], [('along', 'IN')], [('others', 'NNS')], [('well', 'RB')], [('general', 'JJ')], [('ultimately', 'RB')], [('best', 'JJS')], [('friend', 'NN')], [('fact', 'NN')], [('happy', 'JJ')], [('alone', 'RB')], [('like', 'IN')], [(',', ',')], [('simply', 'RB')], [('magical', 'JJ')], [('.', '.')], [('kind', 'NN')], [('hard', 'JJ')], [('pinpoint', 'NN')], [('exact', 'NN')], [('sorta', 'NN')], [('feeling', 'VBG')], [('want', 'NN')], [('flâneur', 'NN')], [('action', 'NN')], [('would', 'MD')], [('great', 'JJ')], [('!', '.')], [('characters', 'NNS')], [('loves', 'NNS')], [('spending', 'NN')], [('time', 'NN')], [('experiencing', 'VBG')], [('world', 'NN')], [('lens', 'NNS')], [('meeting', 'NN')], [('people', 'NNS')], [(',', ',')], [('end', 'NN')], [('day', 'NN')], [(',', ',')], [('love', 'NN')], [('wind', 'NN')], [('glass', 'NN')], [('wine', 'NN')], [('alone', 'RB')], [('.', '.')], [('maybe', 'RB')], [('end', 'NN')], [('night', 'NN')], [('tearing', 'VBG')], [('(', '(')], [('happy', 'JJ')], [('tears', 'NNS')], [(')', ')')], [('beautiful', 'NN')], [('tokyo', 'NN')], [('city', 'NN')], [('skyline', 'NN')], [('...', ':')], [('alone', 'RB')], [('.', '.')], [('looking', 'VBG')], [('depressing', 'VBG')], [('film', 'NN')], [('loneliness', 'NN')], [('.', '.')], [('key', 'NN')], [('difference', 'NN')], [('.', '.')], [('looking', 'VBG')], [('something', 'NN')], [('inspirational', 'JJ')], [('beautiful', 'NN')], [('.', '.')], [('beautiful', 'NN')], [('people', 'NNS')], [('touch', 'NN')], [('deep', 'NN')], [('level', 'NN')], [('like', 'IN')], [('.', '.')], [('loners', 'NNS')], [('love', 'NN')], [('(', '(')], [('limited', 'JJ')], [(')', ')')], [('nature', 'NN')], [(',', ',')], [('views', 'NNS')], [(',', ',')], [('city', 'NN')], [('skylines', 'NNS')], [(',', ',')], [('neon', 'NN')], [('lights', 'NNS')], [(',', ',')], [('intimate', 'NN')], [('bars', 'NNS')], [(',', ',')], [('exploring', 'VBG')], [('beaten', 'NN')], [('path', 'NN')], [('areas', 'NNS')], [(',', ',')], [('sunrises', 'NNS')], [(',', ',')], [('sunsets', 'NNS')], [(',', ',')], [('connecting', 'VBG')], [('real', 'JJ')], [('souls', 'NNS')], [(',', ',')], [('dining', 'VBG')], [('alone', 'RB')], [('etc', 'NN')], [('.', '.')], [('know', 'VB')], [('vibe', 'NN')], [('going', 'VBG')], [('make', 'VB')], [('sense', 'NN')], [(',', ',')], [('hopefully', 'RB')], [('.', '.')], [('know', 'VB')], [('independent', 'JJ')], [('people', 'NNS')], [('meet', 'NN')], [('adventurous', 'JJ')], [('happy', 'JJ')], [('thing', 'NN')], [('?', '.')], [('!', '.')], [('thanks', 'NNS')], [('!', '.')]]","look film character loner world , bad thing . happy love spending time alone . open-minded people get along others well general ultimately best friend fact happy alone like , simply magical . kind hard pinpoint exact sorta feel want flâneur action would great ! character love spending time experience world lens meeting people , end day , love wind glass wine alone . maybe end night tear ( happy tear ) beautiful tokyo city skyline ... alone . look depress film loneliness . key difference . look something inspirational beautiful . beautiful people touch deep level like . loner love ( limited ) nature , view , city skyline , neon light , intimate bar , explore beaten path area , sunrise , sunset , connect real soul , din alone etc . know vibe go make sense , hopefully . know independent people meet adventurous happy thing ? ! thanks !",-1_film_movie_like_see,4
14,t76a40,"What's one movie that you thoroughly enjoyed and thought was really good, but you have no intention of watching it again?",Discussion,60,0.75,movies,https://www.reddit.com/r/movies/comments/t76a40/whats_one_movie_that_you_thoroughly_enjoyed_and/,166,"for me it is manchester by the sea. i loved it. i could see how it was critically revered and won academy awards. the writing and direction were fantastic, and the performances were superb.

however, i just cannot bring myself to watch it again. it was too emotionally draining. and it was a weird type of emotionally draining. it is a movie that wrenches at your heart strings numerous times.",1646474262.0,"['manchester', 'sea', '.', 'love', '.', 'could', 'see', 'critically', 'revere', 'academy', 'award', '.', 'write', 'direction', 'fantastic', ',', 'performance', 'superb', '.', 'however', ',', 'bring', 'watch', '.', 'emotionally', 'drain', '.', 'weird', 'type', 'emotionally', 'drain', '.', 'movie', 'wrench', 'heart', 'string', 'numerous', 'time', '.']","[[('manchester', 'NN')], [('sea', 'NN')], [('.', '.')], [('loved', 'VBN')], [('.', '.')], [('could', 'MD')], [('see', 'VB')], [('critically', 'RB')], [('revered', 'VBN')], [('academy', 'NN')], [('awards', 'NNS')], [('.', '.')], [('writing', 'VBG')], [('direction', 'NN')], [('fantastic', 'JJ')], [(',', ',')], [('performances', 'NNS')], [('superb', 'NN')], [('.', '.')], [('however', 'RB')], [(',', ',')], [('bring', 'NN')], [('watch', 'NN')], [('.', '.')], [('emotionally', 'RB')], [('draining', 'VBG')], [('.', '.')], [('weird', 'NN')], [('type', 'NN')], [('emotionally', 'RB')], [('draining', 'VBG')], [('.', '.')], [('movie', 'NN')], [('wrenches', 'NNS')], [('heart', 'NN')], [('strings', 'NNS')], [('numerous', 'JJ')], [('times', 'NNS')], [('.', '.')]]","manchester sea . love . could see critically revere academy award . write direction fantastic , performance superb . however , bring watch . emotionally drain . weird type emotionally drain . movie wrench heart string numerous time .",-1_film_movie_like_see,2
15,t7i98b,The Ballad of Buster Scruggs.,Discussion,8,1.0,movies,https://www.reddit.com/r/movies/comments/t7i98b/the_ballad_of_buster_scruggs/,0,"i just watched this movie on netflix (yes, it was my first time... ; ) ) and absolutely loved it. wonderful imagery and superb acting. i absolutely loved “meal ticket”. i did not realize that was liam neeson at first and holy cow that is dudley! the imagery in this story was gorgeous, especially some of the shots of dudley in the wagon.",1646512574.0,"['watch', 'movie', 'netflix', '(', 'yes', ',', 'first', 'time', '...', ';', ')', ')', 'absolutely', 'love', '.', 'wonderful', 'imagery', 'superb', 'act', '.', 'absolutely', 'love', '“', 'meal', 'ticket', '”', '.', 'realize', 'liam', 'neeson', 'first', 'holy', 'cow', 'dudley', '!', 'imagery', 'story', 'gorgeous', ',', 'especially', 'shot', 'dudley', 'wagon', '.']","[[('watched', 'VBN')], [('movie', 'NN')], [('netflix', 'NN')], [('(', '(')], [('yes', 'NNS')], [(',', ',')], [('first', 'RB')], [('time', 'NN')], [('...', ':')], [(';', ':')], [(')', ')')], [(')', ')')], [('absolutely', 'RB')], [('loved', 'VBN')], [('.', '.')], [('wonderful', 'NN')], [('imagery', 'NN')], [('superb', 'NN')], [('acting', 'VBG')], [('.', '.')], [('absolutely', 'RB')], [('loved', 'VBN')], [('“', 'NN')], [('meal', 'NN')], [('ticket', 'NN')], [('”', 'NN')], [('.', '.')], [('realize', 'VB')], [('liam', 'NN')], [('neeson', 'NN')], [('first', 'RB')], [('holy', 'NN')], [('cow', 'NN')], [('dudley', 'NN')], [('!', '.')], [('imagery', 'NN')], [('story', 'NN')], [('gorgeous', 'JJ')], [(',', ',')], [('especially', 'RB')], [('shots', 'NNS')], [('dudley', 'NN')], [('wagon', 'NN')], [('.', '.')]]","watch movie netflix ( yes , first time ... ; ) ) absolutely love . wonderful imagery superb act . absolutely love “ meal ticket ” . realize liam neeson first holy cow dudley ! imagery story gorgeous , especially shot dudley wagon .",-1_film_movie_like_see,5
17,t7g35f,Worst movie experience?,Question,10,0.77,movies,https://www.reddit.com/r/movies/comments/t7g35f/worst_movie_experience/,29,"what is the worst movie theater experience you went through whether it was a fight breaking out , someone not stfu , power outage , somehow you went to the wrong theater , someone on their phones , whatever . mine was , watching ‘noah’ with the fam and i was bout 12 . there was a couple in front of us and ig the wife was on her phone and kept talking during the movie and then my mom kicked her chair , and this was towards the end of the movie , so when it was over the lady was tryna run the fade with my mom and the husband tryna get in a verbal argument with my pops , but if anything went down , i would have stopped that shit as soon as possible .",1646506288.0,"['bad', 'movie', 'theater', 'experience', 'go', 'whether', 'fight', 'break', ',', 'someone', 'stfu', ',', 'power', 'outage', ',', 'somehow', 'go', 'wrong', 'theater', ',', 'someone', 'phone', ',', 'whatever', '.', 'mine', ',', 'watch', '‘', 'noah', '’', 'fam', 'bout', '12', '.', 'couple', 'front', 'u', 'ig', 'wife', 'phone', 'kept', 'talk', 'movie', 'mom', 'kick', 'chair', ',', 'towards', 'end', 'movie', ',', 'lady', 'tryna', 'run', 'fade', 'mom', 'husband', 'tryna', 'get', 'verbal', 'argument', 'pop', ',', 'anything', 'go', ',', 'would', 'stop', 'shit', 'soon', 'possible', '.']","[[('worst', 'JJS')], [('movie', 'NN')], [('theater', 'NN')], [('experience', 'NN')], [('went', 'VBD')], [('whether', 'IN')], [('fight', 'NN')], [('breaking', 'VBG')], [(',', ',')], [('someone', 'NN')], [('stfu', 'NN')], [(',', ',')], [('power', 'NN')], [('outage', 'NN')], [(',', ',')], [('somehow', 'NN')], [('went', 'VBD')], [('wrong', 'JJ')], [('theater', 'NN')], [(',', ',')], [('someone', 'NN')], [('phones', 'NNS')], [(',', ',')], [('whatever', 'WDT')], [('.', '.')], [('mine', 'NN')], [(',', ',')], [('watching', 'VBG')], [('‘', 'NN')], [('noah', 'NN')], [('’', 'NN')], [('fam', 'NN')], [('bout', 'NN')], [('12', 'CD')], [('.', '.')], [('couple', 'NN')], [('front', 'NN')], [('us', 'PRP')], [('ig', 'NN')], [('wife', 'NN')], [('phone', 'NN')], [('kept', 'NN')], [('talking', 'VBG')], [('movie', 'NN')], [('mom', 'NN')], [('kicked', 'VBN')], [('chair', 'NN')], [(',', ',')], [('towards', 'NNS')], [('end', 'NN')], [('movie', 'NN')], [(',', ',')], [('lady', 'NN')], [('tryna', 'NN')], [('run', 'VB')], [('fade', 'NN')], [('mom', 'NN')], [('husband', 'NN')], [('tryna', 'NN')], [('get', 'VB')], [('verbal', 'NN')], [('argument', 'NN')], [('pops', 'NNS')], [(',', ',')], [('anything', 'NN')], [('went', 'VBD')], [(',', ',')], [('would', 'MD')], [('stopped', 'VBD')], [('shit', 'NN')], [('soon', 'RB')], [('possible', 'JJ')], [('.', '.')]]","bad movie theater experience go whether fight break , someone stfu , power outage , somehow go wrong theater , someone phone , whatever . mine , watch ‘ noah ’ fam bout 12 . couple front u ig wife phone kept talk movie mom kick chair , towards end movie , lady tryna run fade mom husband tryna get verbal argument pop , anything go , would stop shit soon possible .",-1_film_movie_like_see,1
18,t6tyni,Minority Report turns 20 this year - and it remains one of the best sci-fi films ever made.,Recommendation,387,0.81,movies,https://www.reddit.com/r/movies/comments/t6tyni/minority_report_turns_20_this_year_and_it_remains/,120,"i recently rewatched this and it feels like spielberg is giving us a masterclass in how to propel plot forward. 

the movie has so much more going for it than its basic premise and sci-fi future setting - that is what makes it work so incredibly well. at its heart it is a noir detective thriller and the way it weaves that with science fiction is perfect. it does not rely on the precognition as a gimmick - but instead makes it central to more individual, personal questions about individual choice vs predeterminism.

at times spielberg can be a little heavy handed with fatherhood themes (e.g. war of the worlds) but here, again, it marries perfectly with the plot and feels more authentic.

i love everything about this movie.",1646430803.0,"['recently', 'rewatched', 'feel', 'like', 'spielberg', 'give', 'u', 'masterclass', 'propel', 'plot', 'forward', '.', 'movie', 'much', 'go', 'basic', 'premise', 'sci-fi', 'future', 'set', '-', 'make', 'work', 'incredibly', 'well', '.', 'heart', 'noir', 'detective', 'thriller', 'way', 'weave', 'science', 'fiction', 'perfect', '.', 'rely', 'precognition', 'gimmick', '-', 'instead', 'make', 'central', 'individual', ',', 'personal', 'question', 'individual', 'choice', 'v', 'predeterminism', '.', 'time', 'spielberg', 'little', 'heavy', 'hand', 'fatherhood', 'theme', '(', 'e.g', '.', 'war', 'world', ')', ',', ',', 'marries', 'perfectly', 'plot', 'feel', 'authentic', '.', 'love', 'everything', 'movie', '.']","[[('recently', 'RB')], [('rewatched', 'VBN')], [('feels', 'NNS')], [('like', 'IN')], [('spielberg', 'NN')], [('giving', 'VBG')], [('us', 'PRP')], [('masterclass', 'NN')], [('propel', 'NN')], [('plot', 'NN')], [('forward', 'RB')], [('.', '.')], [('movie', 'NN')], [('much', 'JJ')], [('going', 'VBG')], [('basic', 'JJ')], [('premise', 'NN')], [('sci-fi', 'NN')], [('future', 'NN')], [('setting', 'VBG')], [('-', ':')], [('makes', 'VBZ')], [('work', 'NN')], [('incredibly', 'RB')], [('well', 'RB')], [('.', '.')], [('heart', 'NN')], [('noir', 'NN')], [('detective', 'NN')], [('thriller', 'NN')], [('way', 'NN')], [('weaves', 'NNS')], [('science', 'NN')], [('fiction', 'NN')], [('perfect', 'NN')], [('.', '.')], [('rely', 'RB')], [('precognition', 'NN')], [('gimmick', 'NN')], [('-', ':')], [('instead', 'RB')], [('makes', 'VBZ')], [('central', 'JJ')], [('individual', 'JJ')], [(',', ',')], [('personal', 'JJ')], [('questions', 'NNS')], [('individual', 'JJ')], [('choice', 'NN')], [('vs', 'NN')], [('predeterminism', 'NN')], [('.', '.')], [('times', 'NNS')], [('spielberg', 'NN')], [('little', 'JJ')], [('heavy', 'JJ')], [('handed', 'VBN')], [('fatherhood', 'NN')], [('themes', 'NNS')], [('(', '(')], [('e.g', 'NN')], [('.', '.')], [('war', 'NN')], [('worlds', 'NNS')], [(')', ')')], [(',', ',')], [(',', ',')], [('marries', 'NNS')], [('perfectly', 'RB')], [('plot', 'NN')], [('feels', 'NNS')], [('authentic', 'JJ')], [('.', '.')], [('love', 'NN')], [('everything', 'NN')], [('movie', 'NN')], [('.', '.')]]","recently rewatched feel like spielberg give u masterclass propel plot forward . movie much go basic premise sci-fi future set - make work incredibly well . heart noir detective thriller way weave science fiction perfect . rely precognition gimmick - instead make central individual , personal question individual choice v predeterminism . time spielberg little heavy hand fatherhood theme ( e.g . war world ) , , marries perfectly plot feel authentic . love everything movie .",-1_film_movie_like_see,5
