index,post_id,title,flair,score,post_upvote_ratio,subreddit,url,num_comments,body,created,body_word_token,body_tag,body_string,topics,sentiment
151,t70523,Rambo 4 is on par with First Blood,Discussion,0,0.49,movies,https://www.reddit.com/r/movies/comments/t70523/rambo_4_is_on_par_with_first_blood/,13,i am so glad stallone had the balls to up the gore to 11. the film also has a rawness to it that i cannot seem to put my finger on. it has a indie film feel about it and maybe it was due to the gore. i enjoy going into a film with an expectation but then having that expectation blown out of the water. its a completely different kind of film to 2 or 3. i will never forget that scene where he blow that guy into a red mist with that large caliber gun,1646449995.0,"['glad', 'stallone', 'ball', 'gore', '11.', 'film', 'also', 'rawness', 'seem', 'put', 'finger', '.', 'indie', 'film', 'feel', 'maybe', 'due', 'gore', '.', 'enjoy', 'go', 'film', 'expectation', 'expectation', 'blown', 'water', '.', 'completely', 'different', 'kind', 'film', '2', '3.', 'never', 'forget', 'scene', 'blow', 'guy', 'red', 'mist', 'large', 'caliber', 'gun']","[[('glad', 'NN')], [('stallone', 'NN')], [('balls', 'NNS')], [('gore', 'NN')], [('11.', 'CD')], [('film', 'NN')], [('also', 'RB')], [('rawness', 'NN')], [('seem', 'NN')], [('put', 'NN')], [('finger', 'NN')], [('.', '.')], [('indie', 'NN')], [('film', 'NN')], [('feel', 'NN')], [('maybe', 'RB')], [('due', 'JJ')], [('gore', 'NN')], [('.', '.')], [('enjoy', 'NN')], [('going', 'VBG')], [('film', 'NN')], [('expectation', 'NN')], [('expectation', 'NN')], [('blown', 'NN')], [('water', 'NN')], [('.', '.')], [('completely', 'RB')], [('different', 'JJ')], [('kind', 'NN')], [('film', 'NN')], [('2', 'CD')], [('3.', 'CD')], [('never', 'RB')], [('forget', 'NN')], [('scene', 'NN')], [('blow', 'NN')], [('guy', 'NN')], [('red', 'JJ')], [('mist', 'NN')], [('large', 'JJ')], [('caliber', 'NN')], [('gun', 'NN')]]",glad stallone ball gore 11. film also rawness seem put finger . indie film feel maybe due gore . enjoy go film expectation expectation blown water . completely different kind film 2 3. never forget scene blow guy red mist large caliber gun,-1_film_movie_like_see,5
152,t6i62b,"Do the possessed go to hell, The Conjuring: The Devil Made Me Do It",Question,7,0.6,movies,https://www.reddit.com/r/movies/comments/t6i62b/do_the_possessed_go_to_hell_the_conjuring_the/,27,"toward the end, ed warren says the demon was promised a sound and will not go to hell without one, does this mean that if the targeted person were a devout christian, their soul would be sent to hell with the demon.

is the point of the possession and goal of taking a life and ending their own, to prevent them from gods forgiveness and send them to hell.

or if the possessed were christian would god forgive them as it was not them doing it but the devil.

is the point to just because suffering or for the demon to return to hell and bring a would be innocent soul with them.",1646397828.0,"['toward', 'end', ',', 'ed', 'warren', 'say', 'demon', 'promise', 'sound', 'go', 'hell', 'without', 'one', ',', 'mean', 'target', 'person', 'devout', 'christian', ',', 'soul', 'would', 'sent', 'hell', 'demon', '.', 'point', 'possession', 'goal', 'take', 'life', 'end', ',', 'prevent', 'god', 'forgiveness', 'send', 'hell', '.', 'possess', 'christian', 'would', 'god', 'forgive', 'devil', '.', 'point', 'suffer', 'demon', 'return', 'hell', 'bring', 'would', 'innocent', 'soul', '.']","[[('toward', 'IN')], [('end', 'NN')], [(',', ',')], [('ed', 'NN')], [('warren', 'NNS')], [('says', 'VBZ')], [('demon', 'NN')], [('promised', 'VBN')], [('sound', 'NN')], [('go', 'VB')], [('hell', 'NN')], [('without', 'IN')], [('one', 'CD')], [(',', ',')], [('mean', 'NN')], [('targeted', 'VBN')], [('person', 'NN')], [('devout', 'NN')], [('christian', 'NN')], [(',', ',')], [('soul', 'NN')], [('would', 'MD')], [('sent', 'NN')], [('hell', 'NN')], [('demon', 'NN')], [('.', '.')], [('point', 'NN')], [('possession', 'NN')], [('goal', 'NN')], [('taking', 'VBG')], [('life', 'NN')], [('ending', 'VBG')], [(',', ',')], [('prevent', 'NN')], [('gods', 'NNS')], [('forgiveness', 'NN')], [('send', 'NN')], [('hell', 'NN')], [('.', '.')], [('possessed', 'VBN')], [('christian', 'NN')], [('would', 'MD')], [('god', 'NN')], [('forgive', 'JJ')], [('devil', 'NN')], [('.', '.')], [('point', 'NN')], [('suffering', 'VBG')], [('demon', 'NN')], [('return', 'NN')], [('hell', 'NN')], [('bring', 'NN')], [('would', 'MD')], [('innocent', 'NN')], [('soul', 'NN')], [('.', '.')]]","toward end , ed warren say demon promise sound go hell without one , mean target person devout christian , soul would sent hell demon . point possession goal take life end , prevent god forgiveness send hell . possess christian would god forgive devil . point suffer demon return hell bring would innocent soul .",0_movie_watch_one_like,2
153,t6bqkz,This might be a Hot Take but I think Hans Zimmer’s animated movies soundtracks are better than his live action movies soundtracks,Discussion,25,0.62,movies,https://www.reddit.com/r/movies/comments/t6bqkz/this_might_be_a_hot_take_but_i_think_hans_zimmers/,21,"which is not to say his live action movies soundtracks are bad, they are amazing, but i just always feel so much more when watching the animated movies he is worked on.

lion king, prince of egypt, kung fu panda etc are bloody amazing in terms of music and it is honestly tragic how underrated those scores are compared to his inceptions, his dark knights and his dunes.",1646372189.0,"['say', 'live', 'action', 'movie', 'soundtrack', 'bad', ',', 'amaze', ',', 'always', 'feel', 'much', 'watch', 'animate', 'movie', 'work', '.', 'lion', 'king', ',', 'prince', 'egypt', ',', 'kung', 'fu', 'panda', 'etc', 'bloody', 'amaze', 'term', 'music', 'honestly', 'tragic', 'underrated', 'score', 'compare', 'inception', ',', 'dark', 'knight', 'dune', '.']","[[('say', 'VB')], [('live', 'JJ')], [('action', 'NN')], [('movies', 'NNS')], [('soundtracks', 'NNS')], [('bad', 'JJ')], [(',', ',')], [('amazing', 'VBG')], [(',', ',')], [('always', 'RB')], [('feel', 'NN')], [('much', 'JJ')], [('watching', 'VBG')], [('animated', 'VBN')], [('movies', 'NNS')], [('worked', 'VBN')], [('.', '.')], [('lion', 'NN')], [('king', 'NN')], [(',', ',')], [('prince', 'NN')], [('egypt', 'NN')], [(',', ',')], [('kung', 'NN')], [('fu', 'NN')], [('panda', 'NN')], [('etc', 'NN')], [('bloody', 'NN')], [('amazing', 'VBG')], [('terms', 'NNS')], [('music', 'NN')], [('honestly', 'RB')], [('tragic', 'NN')], [('underrated', 'JJ')], [('scores', 'NNS')], [('compared', 'VBN')], [('inceptions', 'NNS')], [(',', ',')], [('dark', 'NN')], [('knights', 'NNS')], [('dunes', 'NNS')], [('.', '.')]]","say live action movie soundtrack bad , amaze , always feel much watch animate movie work . lion king , prince egypt , kung fu panda etc bloody amaze term music honestly tragic underrated score compare inception , dark knight dune .",-1_film_movie_like_see,3
156,t72khl,Your favorite movie with Little People.,Discussion,0,0.29,movies,https://www.reddit.com/r/movies/comments/t72khl/your_favorite_movie_with_little_people/,28,"there are not many movies with little people. some only have little people in the background. others have main characters, which are little people.


my favorite is a movie called 'under the rainbow' (1981).  -  a visiting dignitary, a cia agent, a nazi spy, japanese tourists, an assassin and a group of little people actors fromthe wizard of oz (1939) all check into an elite los angeles hotel called under the rainbow.


what is your favorite movie with little people?",1646458607.0,"['many', 'movie', 'little', 'people', '.', 'little', 'people', 'background', '.', 'others', 'main', 'character', ',', 'little', 'people', '.', 'favorite', 'movie', 'call', ""'under"", 'rainbow', ""'"", '(', '1981', ')', '.', '-', 'visit', 'dignitary', ',', 'cia', 'agent', ',', 'nazi', 'spy', ',', 'japanese', 'tourist', ',', 'assassin', 'group', 'little', 'people', 'actor', 'fromthe', 'wizard', 'oz', '(', '1939', ')', 'check', 'elite', 'los', 'angeles', 'hotel', 'call', 'rainbow', '.', 'favorite', 'movie', 'little', 'people', '?']","[[('many', 'JJ')], [('movies', 'NNS')], [('little', 'JJ')], [('people', 'NNS')], [('.', '.')], [('little', 'JJ')], [('people', 'NNS')], [('background', 'NN')], [('.', '.')], [('others', 'NNS')], [('main', 'JJ')], [('characters', 'NNS')], [(',', ',')], [('little', 'JJ')], [('people', 'NNS')], [('.', '.')], [('favorite', 'NN')], [('movie', 'NN')], [('called', 'VBN')], [(""'under"", 'NN')], [('rainbow', 'NN')], [(""'"", ""''"")], [('(', '(')], [('1981', 'CD')], [(')', ')')], [('.', '.')], [('-', ':')], [('visiting', 'VBG')], [('dignitary', 'JJ')], [(',', ',')], [('cia', 'NN')], [('agent', 'NN')], [(',', ',')], [('nazi', 'NN')], [('spy', 'NN')], [(',', ',')], [('japanese', 'JJ')], [('tourists', 'NNS')], [(',', ',')], [('assassin', 'NN')], [('group', 'NN')], [('little', 'JJ')], [('people', 'NNS')], [('actors', 'NNS')], [('fromthe', 'NN')], [('wizard', 'NN')], [('oz', 'NN')], [('(', '(')], [('1939', 'CD')], [(')', ')')], [('check', 'NN')], [('elite', 'NN')], [('los', 'NN')], [('angeles', 'NNS')], [('hotel', 'NN')], [('called', 'VBN')], [('rainbow', 'NN')], [('.', '.')], [('favorite', 'NN')], [('movie', 'NN')], [('little', 'JJ')], [('people', 'NNS')], [('?', '.')]]","many movie little people . little people background . others main character , little people . favorite movie call 'under rainbow ' ( 1981 ) . - visit dignitary , cia agent , nazi spy , japanese tourist , assassin group little people actor fromthe wizard oz ( 1939 ) check elite los angeles hotel call rainbow . favorite movie little people ?",0_movie_watch_one_like,3
158,t6bs1a,Movie scenes where music makes a bad thing cool,Discussion,16,0.68,movies,https://www.reddit.com/r/movies/comments/t6bs1a/movie_scenes_where_music_makes_a_bad_thing_cool/,26,"what are some movies scenes where bad things happening are made cool by the use of music accompanying them?

e.g.
- “free bird” during the church scene in “kingsmen”
- “stuck in the middle with you” in the torture scene in “reservoir dogs”
- “lust for life” while running from authorities in “trainspotting”
- “white room” during the riots in “joker”

these are some of my favourite examples, what are some of yours?",1646372337.0,"['movie', 'scene', 'bad', 'thing', 'happen', 'make', 'cool', 'use', 'music', 'accompany', '?', 'e.g', '.', '-', '“', 'free', 'bird', '”', 'church', 'scene', '“', 'kingsmen', '”', '-', '“', 'stuck', 'middle', '”', 'torture', 'scene', '“', 'reservoir', 'dog', '”', '-', '“', 'lust', 'life', '”', 'run', 'authority', '“', 'trainspotting', '”', '-', '“', 'white', 'room', '”', 'riot', '“', 'joker', '”', 'favourite', 'example', ',', '?']","[[('movies', 'NNS')], [('scenes', 'NNS')], [('bad', 'JJ')], [('things', 'NNS')], [('happening', 'VBG')], [('made', 'VBN')], [('cool', 'NN')], [('use', 'NN')], [('music', 'NN')], [('accompanying', 'VBG')], [('?', '.')], [('e.g', 'NN')], [('.', '.')], [('-', ':')], [('“', 'NN')], [('free', 'JJ')], [('bird', 'NN')], [('”', 'NN')], [('church', 'NN')], [('scene', 'NN')], [('“', 'NN')], [('kingsmen', 'NNS')], [('”', 'NN')], [('-', ':')], [('“', 'NN')], [('stuck', 'NN')], [('middle', 'NN')], [('”', 'NN')], [('torture', 'NN')], [('scene', 'NN')], [('“', 'NN')], [('reservoir', 'NN')], [('dogs', 'NNS')], [('”', 'NN')], [('-', ':')], [('“', 'NN')], [('lust', 'NN')], [('life', 'NN')], [('”', 'NN')], [('running', 'VBG')], [('authorities', 'NNS')], [('“', 'NN')], [('trainspotting', 'VBG')], [('”', 'NN')], [('-', ':')], [('“', 'NN')], [('white', 'JJ')], [('room', 'NN')], [('”', 'NN')], [('riots', 'NNS')], [('“', 'NN')], [('joker', 'NN')], [('”', 'NN')], [('favourite', 'NN')], [('examples', 'NNS')], [(',', ',')], [('?', '.')]]","movie scene bad thing happen make cool use music accompany ? e.g . - “ free bird ” church scene “ kingsmen ” - “ stuck middle ” torture scene “ reservoir dog ” - “ lust life ” run authority “ trainspotting ” - “ white room ” riot “ joker ” favourite example , ?",-1_film_movie_like_see,4
159,t6wcr6,Cinematic Universes in order of apperance.,Discussion,0,0.44,movies,https://www.reddit.com/r/movies/comments/t6wcr6/cinematic_universes_in_order_of_apperance/,16,"the fritz lang-dr mabuse universe. (the four dr. mabuse films and ""m"". could very well be the first shared film universe)

the universial monster universe (the horror films by universial, from dracula to abbot and costello meet frankenstein. continuity is flimsy at best. the creature from the black lagoon trilogy may or may not be in the same universe)

the toho kaiju ""showa"" universe. (pretty much every kaiju movie they made up to terror of mecha godzilla. destroy all monsters was more or less the endgame of it is time, and all films following it were prequels.)

the toho kaiju ""hesei"" universe (godzilla films and a few mothra spin offs)

the view-askewneverse.  (the films by kevin smith, in particular the clerks movies, jay and silent bob movies, dogma, and mallrats)

the mcu (you know what the mcu is)

the dceu (you know what the dceu is)

the monster-verse (you know what the monster-verse is.)

any that i missed?",1646437730.0,"['fritz', 'lang-dr', 'mabuse', 'universe', '.', '(', 'four', 'dr.', 'mabuse', 'film', '``', ""''"", '.', 'could', 'well', 'first', 'share', 'film', 'universe', ')', 'universial', 'monster', 'universe', '(', 'horror', 'film', 'universial', ',', 'dracula', 'abbot', 'costello', 'meet', 'frankenstein', '.', 'continuity', 'flimsy', 'best', '.', 'creature', 'black', 'lagoon', 'trilogy', 'may', 'may', 'universe', ')', 'toho', 'kaiju', '``', 'showa', ""''"", 'universe', '.', '(', 'pretty', 'much', 'every', 'kaiju', 'movie', 'make', 'terror', 'mecha', 'godzilla', '.', 'destroy', 'monster', 'less', 'endgame', 'time', ',', 'film', 'follow', 'prequels', '.', ')', 'toho', 'kaiju', '``', 'hesei', ""''"", 'universe', '(', 'godzilla', 'film', 'mothra', 'spin', 'offs', ')', 'view-askewneverse', '.', '(', 'film', 'kevin', 'smith', ',', 'particular', 'clerk', 'movie', ',', 'jay', 'silent', 'bob', 'movie', ',', 'dogma', ',', 'mallrats', ')', 'mcu', '(', 'know', 'mcu', ')', 'dceu', '(', 'know', 'dceu', ')', 'monster-verse', '(', 'know', 'monster-verse', '.', ')', 'miss', '?']","[[('fritz', 'NN')], [('lang-dr', 'NN')], [('mabuse', 'NN')], [('universe', 'NN')], [('.', '.')], [('(', '(')], [('four', 'CD')], [('dr.', 'NN')], [('mabuse', 'NN')], [('films', 'NNS')], [('``', '``')], [(""''"", ""''"")], [('.', '.')], [('could', 'MD')], [('well', 'RB')], [('first', 'RB')], [('shared', 'VBN')], [('film', 'NN')], [('universe', 'NN')], [(')', ')')], [('universial', 'JJ')], [('monster', 'NN')], [('universe', 'NN')], [('(', '(')], [('horror', 'NN')], [('films', 'NNS')], [('universial', 'JJ')], [(',', ',')], [('dracula', 'NN')], [('abbot', 'NN')], [('costello', 'NN')], [('meet', 'NN')], [('frankenstein', 'NN')], [('.', '.')], [('continuity', 'NN')], [('flimsy', 'NN')], [('best', 'JJS')], [('.', '.')], [('creature', 'NN')], [('black', 'JJ')], [('lagoon', 'NN')], [('trilogy', 'NN')], [('may', 'MD')], [('may', 'MD')], [('universe', 'NN')], [(')', ')')], [('toho', 'NN')], [('kaiju', 'NN')], [('``', '``')], [('showa', 'NN')], [(""''"", ""''"")], [('universe', 'NN')], [('.', '.')], [('(', '(')], [('pretty', 'RB')], [('much', 'JJ')], [('every', 'DT')], [('kaiju', 'NN')], [('movie', 'NN')], [('made', 'VBN')], [('terror', 'NN')], [('mecha', 'NN')], [('godzilla', 'NN')], [('.', '.')], [('destroy', 'NN')], [('monsters', 'NNS')], [('less', 'RBR')], [('endgame', 'NN')], [('time', 'NN')], [(',', ',')], [('films', 'NNS')], [('following', 'VBG')], [('prequels', 'NNS')], [('.', '.')], [(')', ')')], [('toho', 'NN')], [('kaiju', 'NN')], [('``', '``')], [('hesei', 'NN')], [(""''"", ""''"")], [('universe', 'NN')], [('(', '(')], [('godzilla', 'NN')], [('films', 'NNS')], [('mothra', 'NN')], [('spin', 'NN')], [('offs', 'NNS')], [(')', ')')], [('view-askewneverse', 'NN')], [('.', '.')], [('(', '(')], [('films', 'NNS')], [('kevin', 'NN')], [('smith', 'NN')], [(',', ',')], [('particular', 'JJ')], [('clerks', 'NNS')], [('movies', 'NNS')], [(',', ',')], [('jay', 'NN')], [('silent', 'NN')], [('bob', 'NN')], [('movies', 'NNS')], [(',', ',')], [('dogma', 'NN')], [(',', ',')], [('mallrats', 'NNS')], [(')', ')')], [('mcu', 'NN')], [('(', '(')], [('know', 'VB')], [('mcu', 'NN')], [(')', ')')], [('dceu', 'NN')], [('(', '(')], [('know', 'VB')], [('dceu', 'NN')], [(')', ')')], [('monster-verse', 'NN')], [('(', '(')], [('know', 'VB')], [('monster-verse', 'NN')], [('.', '.')], [(')', ')')], [('missed', 'VBN')], [('?', '.')]]","fritz lang-dr mabuse universe . ( four dr. mabuse film `` '' . could well first share film universe ) universial monster universe ( horror film universial , dracula abbot costello meet frankenstein . continuity flimsy best . creature black lagoon trilogy may may universe ) toho kaiju `` showa '' universe . ( pretty much every kaiju movie make terror mecha godzilla . destroy monster less endgame time , film follow prequels . ) toho kaiju `` hesei '' universe ( godzilla film mothra spin offs ) view-askewneverse . ( film kevin smith , particular clerk movie , jay silent bob movie , dogma , mallrats ) mcu ( know mcu ) dceu ( know dceu ) monster-verse ( know monster-verse . ) miss ?",1_movie_batman_sequel_film,2
162,t716hd,Does this year's Oscar Best Picture lineup hold the record for most remakes/retellings?,Question,0,0.27,movies,https://www.reddit.com/r/movies/comments/t716hd/does_this_years_oscar_best_picture_lineup_hold/,11,"as far as i can tell, only one reamke - the departed (2006) has ever won best picture. this year this could change as **4** of the nominated films are remakes/retellings.

* coda is a remake of french film la famille belier
* dune, west side story and nightmare alley all have had previous movie iterations (one of them (west side story) even winning best picture before)",1646453584.0,"['far', 'tell', ',', 'one', 'reamke', '-', 'depart', '(', '2006', ')', 'ever', 'best', 'picture', '.', 'year', 'could', 'change', '*', '*', '4', '*', '*', 'nominate', 'film', 'remakes/retellings', '.', '*', 'coda', 'remake', 'french', 'film', 'la', 'famille', 'belier', '*', 'dune', ',', 'west', 'side', 'story', 'nightmare', 'alley', 'previous', 'movie', 'iteration', '(', 'one', '(', 'west', 'side', 'story', ')', 'even', 'win', 'best', 'picture', ')']","[[('far', 'RB')], [('tell', 'NN')], [(',', ',')], [('one', 'CD')], [('reamke', 'NN')], [('-', ':')], [('departed', 'VBN')], [('(', '(')], [('2006', 'CD')], [(')', ')')], [('ever', 'RB')], [('best', 'JJS')], [('picture', 'NN')], [('.', '.')], [('year', 'NN')], [('could', 'MD')], [('change', 'NN')], [('*', 'NN')], [('*', 'NN')], [('4', 'CD')], [('*', 'NN')], [('*', 'NN')], [('nominated', 'VBN')], [('films', 'NNS')], [('remakes/retellings', 'NNS')], [('.', '.')], [('*', 'NN')], [('coda', 'NN')], [('remake', 'NN')], [('french', 'JJ')], [('film', 'NN')], [('la', 'NN')], [('famille', 'NN')], [('belier', 'NN')], [('*', 'NN')], [('dune', 'NN')], [(',', ',')], [('west', 'NN')], [('side', 'NN')], [('story', 'NN')], [('nightmare', 'NN')], [('alley', 'NN')], [('previous', 'JJ')], [('movie', 'NN')], [('iterations', 'NNS')], [('(', '(')], [('one', 'CD')], [('(', '(')], [('west', 'NN')], [('side', 'NN')], [('story', 'NN')], [(')', ')')], [('even', 'RB')], [('winning', 'VBG')], [('best', 'JJS')], [('picture', 'NN')], [(')', ')')]]","far tell , one reamke - depart ( 2006 ) ever best picture . year could change * * 4 * * nominate film remakes/retellings . * coda remake french film la famille belier * dune , west side story nightmare alley previous movie iteration ( one ( west side story ) even win best picture )",1_movie_batman_sequel_film,4
