index,post_id,title,flair,score,post_upvote_ratio,subreddit,url,num_comments,body,created,body_word_token,body_tag,body_string,topics,sentiment
87,t740xb,Movies about fictional terrorist attacks on the US?,Recommendation,3,0.61,movies,https://www.reddit.com/r/movies/comments/t740xb/movies_about_fictional_terrorist_attacks_on_the_us/,53,"hi everyone. this may be a bit too obscure of an ask, but i am looking for movies about fictional terrorist attacks on the united states. think: olympus has fallen, air force one, white house down. i would prefer a movie similar to ohf that takes itself seriously, i found whd a little too comedic for my tastes.

if that is a little too obscure, then movies about real terrorist attacks on the us would also be ok, as long as it has an interesting plot. think: united 93, pearl harbor. movies about terrorist attacks on other countries or the world would be ok too, as long as it is kept somewhat realistic. i am generally not a fan of super-outlandish bond-style “world takeover” films. 

thanks in advance!",1646464377.0,"['hi', 'everyone', '.', 'may', 'bit', 'obscure', 'ask', ',', 'look', 'movie', 'fictional', 'terrorist', 'attack', 'united', 'state', '.', 'think', ':', 'olympus', 'fall', ',', 'air', 'force', 'one', ',', 'white', 'house', '.', 'would', 'prefer', 'movie', 'similar', 'ohf', 'take', 'seriously', ',', 'found', 'whd', 'little', 'comedic', 'taste', '.', 'little', 'obscure', ',', 'movie', 'real', 'terrorist', 'attack', 'u', 'would', 'also', 'ok', ',', 'long', 'interest', 'plot', '.', 'think', ':', 'united', '93', ',', 'pearl', 'harbor', '.', 'movie', 'terrorist', 'attack', 'country', 'world', 'would', 'ok', ',', 'long', 'kept', 'somewhat', 'realistic', '.', 'generally', 'fan', 'super-outlandish', 'bond-style', '“', 'world', 'takeover', '”', 'film', '.', 'thanks', 'advance', '!']","[[('hi', 'NN')], [('everyone', 'NN')], [('.', '.')], [('may', 'MD')], [('bit', 'NN')], [('obscure', 'NN')], [('ask', 'NN')], [(',', ',')], [('looking', 'VBG')], [('movies', 'NNS')], [('fictional', 'JJ')], [('terrorist', 'NN')], [('attacks', 'NNS')], [('united', 'JJ')], [('states', 'NNS')], [('.', '.')], [('think', 'NN')], [(':', ':')], [('olympus', 'NN')], [('fallen', 'VBN')], [(',', ',')], [('air', 'NN')], [('force', 'NN')], [('one', 'CD')], [(',', ',')], [('white', 'JJ')], [('house', 'NN')], [('.', '.')], [('would', 'MD')], [('prefer', 'NN')], [('movie', 'NN')], [('similar', 'JJ')], [('ohf', 'NN')], [('takes', 'VBZ')], [('seriously', 'RB')], [(',', ',')], [('found', 'NN')], [('whd', 'NN')], [('little', 'JJ')], [('comedic', 'NN')], [('tastes', 'NNS')], [('.', '.')], [('little', 'JJ')], [('obscure', 'NN')], [(',', ',')], [('movies', 'NNS')], [('real', 'JJ')], [('terrorist', 'NN')], [('attacks', 'NNS')], [('us', 'PRP')], [('would', 'MD')], [('also', 'RB')], [('ok', 'NN')], [(',', ',')], [('long', 'RB')], [('interesting', 'VBG')], [('plot', 'NN')], [('.', '.')], [('think', 'NN')], [(':', ':')], [('united', 'JJ')], [('93', 'CD')], [(',', ',')], [('pearl', 'NN')], [('harbor', 'NN')], [('.', '.')], [('movies', 'NNS')], [('terrorist', 'NN')], [('attacks', 'NNS')], [('countries', 'NNS')], [('world', 'NN')], [('would', 'MD')], [('ok', 'NN')], [(',', ',')], [('long', 'RB')], [('kept', 'NN')], [('somewhat', 'RB')], [('realistic', 'JJ')], [('.', '.')], [('generally', 'RB')], [('fan', 'NN')], [('super-outlandish', 'JJ')], [('bond-style', 'NN')], [('“', 'NN')], [('world', 'NN')], [('takeover', 'NN')], [('”', 'NN')], [('films', 'NNS')], [('.', '.')], [('thanks', 'NNS')], [('advance', 'NN')], [('!', '.')]]","hi everyone . may bit obscure ask , look movie fictional terrorist attack united state . think : olympus fall , air force one , white house . would prefer movie similar ohf take seriously , found whd little comedic taste . little obscure , movie real terrorist attack u would also ok , long interest plot . think : united 93 , pearl harbor . movie terrorist attack country world would ok , long kept somewhat realistic . generally fan super-outlandish bond-style “ world takeover ” film . thanks advance !",-1_film_movie_like_see,3
88,t6jkia,Everything Is Illuminated (2005),Recommendation,66,0.83,movies,https://www.reddit.com/r/movies/comments/t6jkia/everything_is_illuminated_2005/,18,"/

this is one of my all time favorite movies.  and given that the ukraine is on most peoples brains, i thought i would share.  

first it is at least semi-autobiographical.  based on the authors search for his ukrainian jewish roots.  it is a quirky and beautifully shot film.  superb acting and some uniquely hilarious moments and dialogue.  there is also sadness and history.  

it is basically the story of a young jewish man who travels to ukraine to find the woman who saved his grandpa from the nazis.  that is all i really want to tell you.

if you do watch this movie.  keep in mind the current story flying around of the old ukrainians ladies giving russian soldiers sunflower seeds.  there will be a sunflower scene in this movie.  and after hearing these stories, it made me think of this movie and the context of that scene.  there seems to be a historical basis for this idea.  it is also what made me think to post this movie here.

edit:  i should add that eugene hutz of the band gogol bordello is in this movie.  great band and excellent live shows.  he is also extremely funny in this movie.  noticed there were some fans out there, so i added it.",1646402404.0,"['/', 'one', 'time', 'favorite', 'movie', '.', 'give', 'ukraine', 'people', 'brain', ',', 'thought', 'would', 'share', '.', 'first', 'least', 'semi-autobiographical', '.', 'base', 'author', 'search', 'ukrainian', 'jewish', 'root', '.', 'quirky', 'beautifully', 'shot', 'film', '.', 'superb', 'act', 'uniquely', 'hilarious', 'moment', 'dialogue', '.', 'also', 'sadness', 'history', '.', 'basically', 'story', 'young', 'jewish', 'man', 'travel', 'ukraine', 'find', 'woman', 'save', 'grandpa', 'nazi', '.', 'really', 'want', 'tell', '.', 'watch', 'movie', '.', 'keep', 'mind', 'current', 'story', 'fly', 'around', 'old', 'ukrainian', 'lady', 'give', 'russian', 'soldier', 'sunflower', 'seed', '.', 'sunflower', 'scene', 'movie', '.', 'hearing', 'story', ',', 'make', 'think', 'movie', 'context', 'scene', '.', 'seem', 'historical', 'basis', 'idea', '.', 'also', 'make', 'think', 'post', 'movie', '.', 'edit', ':', 'add', 'eugene', 'hutz', 'band', 'gogol', 'bordello', 'movie', '.', 'great', 'band', 'excellent', 'live', 'show', '.', 'also', 'extremely', 'funny', 'movie', '.', 'notice', 'fan', ',', 'add', '.']","[[('/', 'NN')], [('one', 'CD')], [('time', 'NN')], [('favorite', 'NN')], [('movies', 'NNS')], [('.', '.')], [('given', 'VBN')], [('ukraine', 'NN')], [('peoples', 'NNS')], [('brains', 'NNS')], [(',', ',')], [('thought', 'NN')], [('would', 'MD')], [('share', 'NN')], [('.', '.')], [('first', 'RB')], [('least', 'JJS')], [('semi-autobiographical', 'JJ')], [('.', '.')], [('based', 'VBN')], [('authors', 'NNS')], [('search', 'NN')], [('ukrainian', 'JJ')], [('jewish', 'NN')], [('roots', 'NNS')], [('.', '.')], [('quirky', 'NN')], [('beautifully', 'RB')], [('shot', 'NN')], [('film', 'NN')], [('.', '.')], [('superb', 'NN')], [('acting', 'VBG')], [('uniquely', 'RB')], [('hilarious', 'JJ')], [('moments', 'NNS')], [('dialogue', 'NN')], [('.', '.')], [('also', 'RB')], [('sadness', 'NN')], [('history', 'NN')], [('.', '.')], [('basically', 'RB')], [('story', 'NN')], [('young', 'JJ')], [('jewish', 'NN')], [('man', 'NN')], [('travels', 'NNS')], [('ukraine', 'NN')], [('find', 'VB')], [('woman', 'NN')], [('saved', 'VBN')], [('grandpa', 'NN')], [('nazis', 'NN')], [('.', '.')], [('really', 'RB')], [('want', 'NN')], [('tell', 'NN')], [('.', '.')], [('watch', 'NN')], [('movie', 'NN')], [('.', '.')], [('keep', 'VB')], [('mind', 'NN')], [('current', 'JJ')], [('story', 'NN')], [('flying', 'VBG')], [('around', 'IN')], [('old', 'JJ')], [('ukrainians', 'NNS')], [('ladies', 'NNS')], [('giving', 'VBG')], [('russian', 'JJ')], [('soldiers', 'NNS')], [('sunflower', 'NN')], [('seeds', 'NNS')], [('.', '.')], [('sunflower', 'NN')], [('scene', 'NN')], [('movie', 'NN')], [('.', '.')], [('hearing', 'NN')], [('stories', 'NNS')], [(',', ',')], [('made', 'VBN')], [('think', 'NN')], [('movie', 'NN')], [('context', 'NN')], [('scene', 'NN')], [('.', '.')], [('seems', 'VBZ')], [('historical', 'JJ')], [('basis', 'NN')], [('idea', 'NN')], [('.', '.')], [('also', 'RB')], [('made', 'VBN')], [('think', 'NN')], [('post', 'NN')], [('movie', 'NN')], [('.', '.')], [('edit', 'NN')], [(':', ':')], [('add', 'VB')], [('eugene', 'NN')], [('hutz', 'NN')], [('band', 'NN')], [('gogol', 'NN')], [('bordello', 'NN')], [('movie', 'NN')], [('.', '.')], [('great', 'JJ')], [('band', 'NN')], [('excellent', 'NN')], [('live', 'JJ')], [('shows', 'NNS')], [('.', '.')], [('also', 'RB')], [('extremely', 'RB')], [('funny', 'NN')], [('movie', 'NN')], [('.', '.')], [('noticed', 'VBN')], [('fans', 'NNS')], [(',', ',')], [('added', 'VBD')], [('.', '.')]]","/ one time favorite movie . give ukraine people brain , thought would share . first least semi-autobiographical . base author search ukrainian jewish root . quirky beautifully shot film . superb act uniquely hilarious moment dialogue . also sadness history . basically story young jewish man travel ukraine find woman save grandpa nazi . really want tell . watch movie . keep mind current story fly around old ukrainian lady give russian soldier sunflower seed . sunflower scene movie . hearing story , make think movie context scene . seem historical basis idea . also make think post movie . edit : add eugene hutz band gogol bordello movie . great band excellent live show . also extremely funny movie . notice fan , add .",-1_film_movie_like_see,5
90,t6see7,"Has anybody seen ""Fresh""?",Discussion,17,0.73,movies,https://www.reddit.com/r/movies/comments/t6see7/has_anybody_seen_fresh/,66,"have not see it discussed here yet other than trailers so i am wondering if anyone else saw it too? what did you think? i thought it was really well made and the characters and the soundtrack was soooo good. i feel like some characters could have been more fleshed out but overall it was one of my favourites of 2022. it easily could have even been made into a limited tv series i believe!

soo what do you all think about it?",1646426462.0,"['see', 'discuss', 'yet', 'trailer', 'wonder', 'anyone', 'else', 'saw', '?', 'think', '?', 'thought', 'really', 'well', 'make', 'character', 'soundtrack', 'soooo', 'good', '.', 'feel', 'like', 'character', 'could', 'flesh', 'overall', 'one', 'favourite', '2022.', 'easily', 'could', 'even', 'make', 'limited', 'tv', 'series', 'believe', '!', 'soo', 'think', '?']","[[('see', 'VB')], [('discussed', 'VBN')], [('yet', 'RB')], [('trailers', 'NNS')], [('wondering', 'VBG')], [('anyone', 'NN')], [('else', 'RB')], [('saw', 'NN')], [('?', '.')], [('think', 'NN')], [('?', '.')], [('thought', 'NN')], [('really', 'RB')], [('well', 'RB')], [('made', 'VBN')], [('characters', 'NNS')], [('soundtrack', 'NN')], [('soooo', 'NN')], [('good', 'JJ')], [('.', '.')], [('feel', 'NN')], [('like', 'IN')], [('characters', 'NNS')], [('could', 'MD')], [('fleshed', 'VBN')], [('overall', 'JJ')], [('one', 'CD')], [('favourites', 'NNS')], [('2022.', 'CD')], [('easily', 'RB')], [('could', 'MD')], [('even', 'RB')], [('made', 'VBN')], [('limited', 'JJ')], [('tv', 'NN')], [('series', 'NN')], [('believe', 'VB')], [('!', '.')], [('soo', 'NN')], [('think', 'NN')], [('?', '.')]]",see discuss yet trailer wonder anyone else saw ? think ? thought really well make character soundtrack soooo good . feel like character could flesh overall one favourite 2022. easily could even make limited tv series believe ! soo think ?,-1_film_movie_like_see,5
92,t7euz6,Does stuff like wrestling events and snooker coaching videos count as films?,Question,0,0.47,movies,https://www.reddit.com/r/movies/comments/t7euz6/does_stuff_like_wrestling_events_and_snooker/,3,"the way it is i am losing track of what movies i have seen and have not etc, so i am going to create an imdb account to keep track. i have seen some wrestlemania's and a few videos of various snooker professionals teaching various snooker skills and was wondering if they count as films since they are on imdb.",1646502785.0,"['way', 'lose', 'track', 'movie', 'see', 'etc', ',', 'go', 'create', 'imdb', 'account', 'keep', 'track', '.', 'see', 'wrestlemania', ""'s"", 'video', 'various', 'snooker', 'professional', 'teach', 'various', 'snooker', 'skill', 'wonder', 'count', 'film', 'since', 'imdb', '.']","[[('way', 'NN')], [('losing', 'VBG')], [('track', 'NN')], [('movies', 'NNS')], [('seen', 'VBN')], [('etc', 'NN')], [(',', ',')], [('going', 'VBG')], [('create', 'NN')], [('imdb', 'NN')], [('account', 'NN')], [('keep', 'VB')], [('track', 'NN')], [('.', '.')], [('seen', 'VBN')], [('wrestlemania', 'NN')], [(""'s"", 'POS')], [('videos', 'NNS')], [('various', 'JJ')], [('snooker', 'NN')], [('professionals', 'NNS')], [('teaching', 'VBG')], [('various', 'JJ')], [('snooker', 'NN')], [('skills', 'NNS')], [('wondering', 'VBG')], [('count', 'NN')], [('films', 'NNS')], [('since', 'IN')], [('imdb', 'NN')], [('.', '.')]]","way lose track movie see etc , go create imdb account keep track . see wrestlemania 's video various snooker professional teach various snooker skill wonder count film since imdb .",-1_film_movie_like_see,3
93,t7g9td,The Dark Knight - Shakespearean Tragedy,Discussion,0,0.33,movies,https://www.reddit.com/r/movies/comments/t7g9td/the_dark_knight_shakespearean_tragedy/,0,"shakespeare has so much influence even today in the modern art form called movies. a lot of movies can be identified if they fall into this by checking if they tick the below conditions.

the 10 characteristics of a shakespearean tragedy are

1. a tragic hero

harvey dent was supposed to be the knight in shining armor and the poster boy for gotham city in it is fight against crime but ends up becoming a killer towards the end.

2. a dichotomy of good and evil

harvey dent was a good person and his descent into his alter ego, two-face due to his split personality disorder turns him evil. we do not even need joker and batman as an example in this case.

3. a tragic waste

gordon and batman had high hopes on him at the beginning of the movie and in the end joker turns him to the dark side. it was a tragic waste even though they both managed to cover it up.

4. hamartia (the hero’s tragic flaw)

harvey was called two-face even when he was in internal affairs. he could not put the greater good of the city before his mission for revenge. despite everyone idolizing him, he was a very flawed person.

5. issues of fate or fortune

the fate and fortune always determines the outcome. in this case, it was losing rachel that spiralled him into a cold blooded killer.

6. greed

harvey dent was not a selfless person in the beginning, he was obsessed with becoming the messiah figure of gotham, he wanted to lock away every criminals and win everything.

7. foul revenge

harvey's final revenge was supposed to be gordon's son which does not go as planned.

8. supernatural elements

let us just assume the joker is far from a normal human person as he executes every plan with inhumane perfection. and, batman again is a symbol here.

9. internal and external pressures

joker's undue influence, his internal split personality disorder and the quest for revenge, everything can be regarded as pressures.

10. the paradox of life

in the end, it did not even matter if he got his revenge, he threw it all away because of his misplaced priorities.

in this way, i believe the dark knight movie was more about harvey dent's fall than it was about batman or joker.

 [references](-shakespeare-tragedies-2985293)
[instagram post]()",1646506811.0,"['shakespeare', 'much', 'influence', 'even', 'today', 'modern', 'art', 'form', 'call', 'movie', '.', 'lot', 'movie', 'identify', 'fall', 'check', 'tick', 'condition', '.', '10', 'characteristic', 'shakespearean', 'tragedy', '1.', 'tragic', 'hero', 'harvey', 'dent', 'suppose', 'knight', 'shin', 'armor', 'poster', 'boy', 'gotham', 'city', 'fight', 'crime', 'end', 'become', 'killer', 'towards', 'end', '.', '2.', 'dichotomy', 'good', 'evil', 'harvey', 'dent', 'good', 'person', 'descent', 'alter', 'ego', ',', 'two-face', 'due', 'split', 'personality', 'disorder', 'turn', 'evil', '.', 'even', 'need', 'joker', 'batman', 'example', 'case', '.', '3.', 'tragic', 'waste', 'gordon', 'batman', 'high', 'hope', 'begin', 'movie', 'end', 'joker', 'turn', 'dark', 'side', '.', 'tragic', 'waste', 'even', 'though', 'manage', 'cover', '.', '4.', 'hamartia', '(', 'hero', '’', 'tragic', 'flaw', ')', 'harvey', 'call', 'two-face', 'even', 'internal', 'affair', '.', 'could', 'put', 'great', 'good', 'city', 'mission', 'revenge', '.', 'despite', 'everyone', 'idolize', ',', 'flaw', 'person', '.', '5.', 'issue', 'fate', 'fortune', 'fate', 'fortune', 'always', 'determines', 'outcome', '.', 'case', ',', 'lose', 'rachel', 'spiral', 'cold', 'blood', 'killer', '.', '6.', 'greed', 'harvey', 'dent', 'selfless', 'person', 'begin', ',', 'obsess', 'become', 'messiah', 'figure', 'gotham', ',', 'want', 'lock', 'away', 'every', 'criminal', 'win', 'everything', '.', '7.', 'foul', 'revenge', 'harvey', ""'s"", 'final', 'revenge', 'suppose', 'gordon', ""'s"", 'son', 'go', 'plan', '.', '8.', 'supernatural', 'element', 'let', 'u', 'assume', 'joker', 'far', 'normal', 'human', 'person', 'executes', 'every', 'plan', 'inhumane', 'perfection', '.', ',', 'batman', 'symbol', '.', '9.', 'internal', 'external', 'pressure', 'joker', ""'s"", 'undue', 'influence', ',', 'internal', 'split', 'personality', 'disorder', 'quest', 'revenge', ',', 'everything', 'regard', 'pressure', '.', '10.', 'paradox', 'life', 'end', ',', 'even', 'matter', 'get', 'revenge', ',', 'threw', 'away', 'misplace', 'priority', '.', 'way', ',', 'believe', 'dark', 'knight', 'movie', 'harvey', 'dent', ""'s"", 'fall', 'batman', 'joker', '.', '[', 'reference', ']', '(', '-shakespeare-tragedies-2985293', ')', '[', 'instagram', 'post', ']', '(', ')']","[[('shakespeare', 'NN')], [('much', 'JJ')], [('influence', 'NN')], [('even', 'RB')], [('today', 'NN')], [('modern', 'JJ')], [('art', 'NN')], [('form', 'NN')], [('called', 'VBN')], [('movies', 'NNS')], [('.', '.')], [('lot', 'NN')], [('movies', 'NNS')], [('identified', 'VBN')], [('fall', 'NN')], [('checking', 'VBG')], [('tick', 'NN')], [('conditions', 'NNS')], [('.', '.')], [('10', 'CD')], [('characteristics', 'NNS')], [('shakespearean', 'NN')], [('tragedy', 'NN')], [('1.', 'CD')], [('tragic', 'NN')], [('hero', 'NN')], [('harvey', 'NN')], [('dent', 'NN')], [('supposed', 'VBN')], [('knight', 'NN')], [('shining', 'VBG')], [('armor', 'NN')], [('poster', 'NN')], [('boy', 'NN')], [('gotham', 'NN')], [('city', 'NN')], [('fight', 'NN')], [('crime', 'NN')], [('ends', 'NNS')], [('becoming', 'VBG')], [('killer', 'NN')], [('towards', 'NNS')], [('end', 'NN')], [('.', '.')], [('2.', 'CD')], [('dichotomy', 'NN')], [('good', 'JJ')], [('evil', 'NN')], [('harvey', 'NN')], [('dent', 'NN')], [('good', 'JJ')], [('person', 'NN')], [('descent', 'NN')], [('alter', 'NN')], [('ego', 'NN')], [(',', ',')], [('two-face', 'NN')], [('due', 'JJ')], [('split', 'NN')], [('personality', 'NN')], [('disorder', 'NN')], [('turns', 'NNS')], [('evil', 'NN')], [('.', '.')], [('even', 'RB')], [('need', 'NN')], [('joker', 'NN')], [('batman', 'NN')], [('example', 'NN')], [('case', 'NN')], [('.', '.')], [('3.', 'CD')], [('tragic', 'NN')], [('waste', 'NN')], [('gordon', 'NN')], [('batman', 'NN')], [('high', 'JJ')], [('hopes', 'NNS')], [('beginning', 'VBG')], [('movie', 'NN')], [('end', 'NN')], [('joker', 'NN')], [('turns', 'NNS')], [('dark', 'NN')], [('side', 'NN')], [('.', '.')], [('tragic', 'NN')], [('waste', 'NN')], [('even', 'RB')], [('though', 'IN')], [('managed', 'VBN')], [('cover', 'NN')], [('.', '.')], [('4.', 'CD')], [('hamartia', 'NN')], [('(', '(')], [('hero', 'NN')], [('’', 'NN')], [('tragic', 'NN')], [('flaw', 'NN')], [(')', ')')], [('harvey', 'NN')], [('called', 'VBN')], [('two-face', 'NN')], [('even', 'RB')], [('internal', 'JJ')], [('affairs', 'NNS')], [('.', '.')], [('could', 'MD')], [('put', 'NN')], [('greater', 'JJR')], [('good', 'JJ')], [('city', 'NN')], [('mission', 'NN')], [('revenge', 'NN')], [('.', '.')], [('despite', 'IN')], [('everyone', 'NN')], [('idolizing', 'VBG')], [(',', ',')], [('flawed', 'VBN')], [('person', 'NN')], [('.', '.')], [('5.', 'CD')], [('issues', 'NNS')], [('fate', 'NN')], [('fortune', 'NN')], [('fate', 'NN')], [('fortune', 'NN')], [('always', 'RB')], [('determines', 'NNS')], [('outcome', 'NN')], [('.', '.')], [('case', 'NN')], [(',', ',')], [('losing', 'VBG')], [('rachel', 'NN')], [('spiralled', 'VBN')], [('cold', 'NN')], [('blooded', 'VBN')], [('killer', 'NN')], [('.', '.')], [('6.', 'CD')], [('greed', 'NN')], [('harvey', 'NN')], [('dent', 'NN')], [('selfless', 'NN')], [('person', 'NN')], [('beginning', 'VBG')], [(',', ',')], [('obsessed', 'VBN')], [('becoming', 'VBG')], [('messiah', 'NN')], [('figure', 'NN')], [('gotham', 'NN')], [(',', ',')], [('wanted', 'VBD')], [('lock', 'NN')], [('away', 'RB')], [('every', 'DT')], [('criminals', 'NNS')], [('win', 'NN')], [('everything', 'NN')], [('.', '.')], [('7.', 'CD')], [('foul', 'NN')], [('revenge', 'NN')], [('harvey', 'NN')], [(""'s"", 'POS')], [('final', 'JJ')], [('revenge', 'NN')], [('supposed', 'VBN')], [('gordon', 'NN')], [(""'s"", 'POS')], [('son', 'NN')], [('go', 'VB')], [('planned', 'VBN')], [('.', '.')], [('8.', 'CD')], [('supernatural', 'JJ')], [('elements', 'NNS')], [('let', 'VB')], [('us', 'PRP')], [('assume', 'VB')], [('joker', 'NN')], [('far', 'RB')], [('normal', 'JJ')], [('human', 'NN')], [('person', 'NN')], [('executes', 'NNS')], [('every', 'DT')], [('plan', 'NN')], [('inhumane', 'NN')], [('perfection', 'NN')], [('.', '.')], [(',', ',')], [('batman', 'NN')], [('symbol', 'NN')], [('.', '.')], [('9.', 'CD')], [('internal', 'JJ')], [('external', 'JJ')], [('pressures', 'NNS')], [('joker', 'NN')], [(""'s"", 'POS')], [('undue', 'JJ')], [('influence', 'NN')], [(',', ',')], [('internal', 'JJ')], [('split', 'NN')], [('personality', 'NN')], [('disorder', 'NN')], [('quest', 'NN')], [('revenge', 'NN')], [(',', ',')], [('everything', 'NN')], [('regarded', 'VBN')], [('pressures', 'NNS')], [('.', '.')], [('10.', 'CD')], [('paradox', 'NN')], [('life', 'NN')], [('end', 'NN')], [(',', ',')], [('even', 'RB')], [('matter', 'NN')], [('got', 'VBD')], [('revenge', 'NN')], [(',', ',')], [('threw', 'NN')], [('away', 'RB')], [('misplaced', 'VBN')], [('priorities', 'NNS')], [('.', '.')], [('way', 'NN')], [(',', ',')], [('believe', 'VB')], [('dark', 'NN')], [('knight', 'NN')], [('movie', 'NN')], [('harvey', 'NN')], [('dent', 'NN')], [(""'s"", 'POS')], [('fall', 'NN')], [('batman', 'NN')], [('joker', 'NN')], [('.', '.')], [('[', 'NN')], [('references', 'NNS')], [(']', 'NN')], [('(', '(')], [('-shakespeare-tragedies-2985293', 'NN')], [(')', ')')], [('[', 'NN')], [('instagram', 'NN')], [('post', 'NN')], [(']', 'NN')], [('(', '(')], [(')', ')')]]","shakespeare much influence even today modern art form call movie . lot movie identify fall check tick condition . 10 characteristic shakespearean tragedy 1. tragic hero harvey dent suppose knight shin armor poster boy gotham city fight crime end become killer towards end . 2. dichotomy good evil harvey dent good person descent alter ego , two-face due split personality disorder turn evil . even need joker batman example case . 3. tragic waste gordon batman high hope begin movie end joker turn dark side . tragic waste even though manage cover . 4. hamartia ( hero ’ tragic flaw ) harvey call two-face even internal affair . could put great good city mission revenge . despite everyone idolize , flaw person . 5. issue fate fortune fate fortune always determines outcome . case , lose rachel spiral cold blood killer . 6. greed harvey dent selfless person begin , obsess become messiah figure gotham , want lock away every criminal win everything . 7. foul revenge harvey 's final revenge suppose gordon 's son go plan . 8. supernatural element let u assume joker far normal human person executes every plan inhumane perfection . , batman symbol . 9. internal external pressure joker 's undue influence , internal split personality disorder quest revenge , everything regard pressure . 10. paradox life end , even matter get revenge , threw away misplace priority . way , believe dark knight movie harvey dent 's fall batman joker . [ reference ] ( -shakespeare-tragedies-2985293 ) [ instagram post ] ( )",-1_film_movie_like_see,4
