post_id,comment,comment_id,parent_id,created,is_submitter
so030f,Cinnamon + sugar on cheese.,hw5t75c,t3_so030f,1644368218.0,False
so030f,Canned tuna and ramen,hw5ubwo,t3_so030f,1644368703.0,False
so030f,Peanut butter and jelly hamburgers,hw5ucy8,t3_so030f,1644368714.0,False
so030f,I don't enjoy this but I knew someone who liked to eat gold fish and drink chocolate milk at the same time,hw5t4mi,t3_so030f,1644368187.0,False
so030f,Apples and strawberry jellos powder,hw5tuzb,t3_so030f,1644368501.0,False
so02u3,The first AND second defenestration of Prague.  I think that's a tradition the united states needs to adopt.,hw5u0ah,t3_so02u3,1644368565.0,False
so02u3,That Arab journalist throwing a shoe at Bush,hw5whzv,t3_so02u3,1644369638.0,False
so02tc,They numb the toe and cut down each peice of the big toe nailon each side horizontally. They give you pain pills but make sure you NEVER EVER EVER EVER !!!! bump that toe on anything while it's healing,hw5tcfo,t3_so02tc,1644368280.0,False
so02tc,"I had an outpatient deal, no anesthesia or anything.  I went in, the dude dug at my foot with a metal doohikcy for a few minutes, which hurt like hell tbh, then it was over.  Pain during the procedure was right up there with breaking bones.  But afterward it felt a lot better.  Sore for a few days of course, but no big deal.",hw5udsp,t3_so02tc,1644368724.0,False
so02r2,Pro tip: if you make someone's life easier they'll stick around..,hw5sxs6,t3_so02r2,1644368104.0,False
so02o5,"Bertha.

It's both big and it mentions pregnancy.",hw5sr54,t3_so02o5,1644368026.0,False
so02o5,I'M GIVING BIRTH-UH!!,hw5t13y,t1_hw5sr54,1644368144.0,False
so02o5,Birth a what? Birth a my boy? This is a terrible way to start a first date. We've not had sex yet. By the looks of you I'm gay now.   I'm not the father.,hw5t72h,t1_hw5t13y,1644368217.0,False
so02o5,Nancy,hw5sx34,t3_so02o5,1644368095.0,False
so02o5,Gertrude,hw5tflw,t3_so02o5,1644368318.0,False
so02o5,why are you posting this,hw5t02i,t3_so02o5,1644368131.0,False
so02o5,Bloodrayne,hw5t2wc,t3_so02o5,1644368166.0,False
so02o5,"Fecarella, Duchess of Turds",hw5tea0,t3_so02o5,1644368302.0,False
so02j7,Apologize for invading his personal space,hw5stvf,t3_so02j7,1644368057.0,False
so02j7,Idk what that is. So id try watching it with them,hw5sq8f,t3_so02j7,1644368015.0,False
so02j7,Shoving stuff down the eye of your cock,hw5st2c,t1_hw5sq8f,1644368048.0,True
so02j7,*Exits Immediately*,hw5svlz,t1_hw5st2c,1644368078.0,False
so02j7,"WHAT.

THE ACTUAL.

FUCK",hw5tovs,t1_hw5st2c,1644368429.0,False
so02j7,"Ask that he not do that when I'm around, and to have at least one towel ready.",hw5tm1u,t3_so02j7,1644368395.0,False
so02ix,"lie, truth, truth",hw5som9,t3_so02ix,1644367996.0,False
so02ix,"1) I have a big group of friends

2) I'm antisocial

3) I have a crush on my best friend",hw5trxm,t3_so02ix,1644368464.0,False
so02ix,Is the lie…#3?,hw5two7,t1_hw5trxm,1644368522.0,True
so02ix,Incorrect,hw5u3bj,t1_hw5two7,1644368601.0,False
so02ix,I give up!,hw5ubt7,t1_hw5u3bj,1644368701.0,True
so02ix,The lie is #1,hw5uomo,t1_hw5ubt7,1644368854.0,False
so02e3,"Yes, bc it quenches the thirst of the ancients.",hw5sqcj,t3_so02e3,1644368016.0,False
so02e3,"Probably. It would still help with swallowing food or medicine, if there wasn’t another beverage around.",hw5sovh,t3_so02e3,1644367998.0,False
so02e3,Wash down unpleasant taste.,hw5spsa,t3_so02e3,1644368009.0,False
so02e3,"No, it doesn’t satisfy any of my many addictions to sugar and salt and stuff, just my need for hydration",hw5srlv,t3_so02e3,1644368031.0,False
so02e3,"Yes, it is the only thing that makes me not thirsty anymore and doesn’t leave a weird taste in my mouth.",hw5ss3j,t3_so02e3,1644368036.0,False
so02e3,"I'm going to be honest. I don't often drink it as it is but the big question is when I do drink it my body seems to crave it. it's refreshing and healing. but if I don't need it to live do I still get that feeling? are those ""God it's fucking good"" feelings because I'm a dehydrated mess or just cause I like the taste? because if it's the former probably not.",hw5t1t5,t3_so02e3,1644368153.0,False
so02e3,"Nope

Water is for washing

Dickel's for drinking.",hw5vr1j,t3_so02e3,1644369317.0,False
so02e3,Yeah. It feels good to drink really cold water. Makes it feel like my allergies aren't so bad.,hw5wmdj,t3_so02e3,1644369690.0,False
so02aa,It's called whiskey.,hw5ukb3,t3_so02aa,1644368801.0,False
so0276,"I think that they are poor, & needy.",hw5svot,t3_so0276,1644368079.0,False
so0276,I think they're disgusting,hw5smhl,t3_so0276,1644367970.0,False
so0276,"It is not their fault, though...",hw5sxye,t1_hw5smhl,1644368106.0,False
so0276,Fuck poor people,hw5tbkl,t1_hw5smhl,1644368270.0,False
so023q,"25, absolutely great , very few complaints. Could use a new truck though",hw5st7v,t3_so023q,1644368050.0,False
so023q,"I wish you a fully restored early 80s block Chevy truck, or a fully restored 60s C-10 slant-roof Chevy, unless you are a Ford man...",hw5tb94,t1_hw5st7v,1644368266.0,False
so023q,Rollercoaster,hw5st9l,t3_so023q,1644368050.0,False
so023q,Cue Love Rollercoaster by The Ohio Players...,hw5tftk,t1_hw5st9l,1644368320.0,False
so023q,Its een going so great:),hw5sv3m,t3_so023q,1644368072.0,False
so023q,"Do you really mean thiis, though?",hw5thuw,t1_hw5sv3m,1644368345.0,False
so023q,Yes I really do!!,hw5tr3o,t1_hw5thuw,1644368455.0,False
so023q,I smiled at you.,hw5ueus,t1_hw5tr3o,1644368736.0,False
so023q,"Professionally: meh, socially: oof, romantically: ugh",hw5t0oe,t3_so023q,1644368139.0,False
so023q,"Pretty fuckin magical. I don't deserve it btw, one bit.",hw5t250,t3_so023q,1644368157.0,False
so023q,Lucky!!!,hw5tw9x,t1_hw5t250,1644368517.0,False
so023q,I always say/remember this!!! It is pure luck imo.,hw5uin7,t1_hw5tw9x,1644368781.0,False
so023q,"Annoyingly

I'm trying to make a go of it as an independent massage therapist.  People can be stupid and really self centered.   

For example I've literally sent people my schedule of when I work.  I've had them read it and ask if closed means I'm not available that day.  

I've had someone no show for thier appointment and then say, ""who is this. Oh yeah I decided not to go.""",hw5t5ql,t3_so023q,1644368201.0,False
so023q,"Of course there are always things that would make my life just a little (lot) bit better, but I recognize that in the grand scheme of things, I am very blessed and my life is going well. I have a lot of good things to be thankful for, and there are a lot of bad things I’m thankful I don’t have to deal with (or at least not as much as other people).",hw5syao,t3_so023q,1644368110.0,False
so023q,Shitty. But I'm not going to get on to that rolarcoaster of emotion.,hw5u19x,t3_so023q,1644368577.0,False
so023q,On an upswing after a little bump but doing pretty well,hw5wmav,t3_so023q,1644369689.0,False
so023q,Awwwwwww…fine!,hw5wqrf,t3_so023q,1644369742.0,False
so0239,YikYak post?,hw5sliu,t3_so0239,1644367958.0,False
so0239,Yeah like on the app yikyak,hw5t363,t1_hw5sliu,1644368169.0,True
so01t5,"**Attention! [Serious] Tag Notice**

* [Jokes, puns, and off-topic comments are not permitted](https://www.reddit.com/r/AskReddit/wiki/index#wiki_-rule_6-) in **any** comment, parent or child.

* Parent comments that aren't from the target group will be removed, along with their child replies. 

* Report comments that violate these rules.

Posts that have few relevant answers within the first hour, and posts that are not appropriate for the [Serious] tag will be removed. Consider doing an AMA request instead.

Thanks for your cooperation and enjoy the discussion!


*I am a bot, and this action was performed automatically. Please [contact the moderators of this subreddit](/message/compose/?to=/r/AskReddit) if you have any questions or concerns.*",hw5sg1x,t3_so01t5,1644367894.0,False
so01t5,"Elitism. That's a broad umbrella that covers many things (bigotry, selfishness, a lack of empathy for others, etc.).",hw5stno,t3_so01t5,1644368055.0,False
so01t5,"I personally can't. Whatever sin I could think of would really just a subgroup of one of the stated 7 sins.

Great question!!",hw5srnh,t3_so01t5,1644368031.0,False
so01t5,Willful ignorance.,hw5st05,t3_so01t5,1644368047.0,False
so01t5,"All the main categorical sins are already covered. However, if you'll allow subcategories, pedophilia.",hw5uxvc,t3_so01t5,1644368965.0,False
so01t5,I'd go with hypocrisy.,hw5sh2z,t3_so01t5,1644367906.0,True
so01t5,Trumpsters,hw5uzyn,t3_so01t5,1644368990.0,False
so01t5,"Lack of compassion, so call it heartlessness.",hw5vpct,t3_so01t5,1644369297.0,False
so01t5,Proselytizing,hw5w7b7,t3_so01t5,1644369513.0,False
so01t5,Boomers,hw5snwa,t3_so01t5,1644367987.0,False
so01t5,Pineapples on pizza,hw5u3xm,t3_so01t5,1644368608.0,False
so01t5,"The question says ""Serious Replies Only.""",hw5ur8g,t1_hw5u3xm,1644368885.0,False
so01t5,Shit,hw5vof8,t1_hw5ur8g,1644369285.0,False
so01t5,Torture,hw5skvq,t3_so01t5,1644367950.0,False
so01t5,Fake News,hw5u01x,t3_so01t5,1644368562.0,False
so01t5,exploitation,hw5u0ir,t3_so01t5,1644368568.0,False
so01o3,The Hitachi Magic Wand actually makes for a pretty good back massager.,hw5sy49,t3_so01o3,1644368108.0,False
so01o3,"Books, they are the thing you need if you want to annoy someone.",hw5uap0,t3_so01o3,1644368688.0,False
so01o3,"Here we go: there’s a tool called a rivet buster, it’s a pneumatic jackhammer type thing that was originally designed for, wait for it, breaking rivets on metal. However, it’s a very efficient jackhammer for concrete demolition, based on the weight to power per hit ratio (30 pounds weight, roughly 28 pounds of force per hit)",hw5wupd,t3_so01o3,1644369788.0,False
so01my,"Oftentimes, threads like this prompt users to ask how visually impaired people use reddit. r/blind has an FAQ [here](https://www.reddit.com/r/Blind/wiki/faq/sighted#wiki_q.3A_how_do_blind_people_use_computers.3F) that answers this question. As with any other thread, please be respectful to other users and note that ableism is not tolerated in r/AskReddit.

*I am a bot, and this action was performed automatically. Please [contact the moderators of this subreddit](/message/compose/?to=/r/AskReddit) if you have any questions or concerns.*",hw5sey3,t3_so01my,1644367881.0,False
so01my,big tall thing with massive neck and pointy head at the top,hw5soyf,t3_so01my,1644367999.0,False
so01my,We're blind not fucking stupid.,hw5urwx,t3_so01my,1644368893.0,False
so01k9,"Ectopic pregnancy. If untreated, I would have bled to death internally.",hw5suk2,t3_so01k9,1644368065.0,False
so01k9,"On foot , my birth givers BF tried to off me as a child. In a vehicle, It was last years’ cold snap. I was on my way back to the terminal and got a feel of “You’re gonna die if you stay on this path” I decided to slowly exit off the ramp and take the long way around. Later on the news i saw the 100 car pile up I would’ve been in if I ignored my gut",hw5t711,t3_so01k9,1644368216.0,False
so01k9,I got beaten up and almost crushed to death by some man in 2001 and it left the right side of my face/arm paralysed.,hw5szs4,t3_so01k9,1644368128.0,False
so01k9,"I was riding my bike, waiting for a car to pass. I did not know there was another car behind it.",hw5szyj,t3_so01k9,1644368130.0,False
so01k9,"16 years old, 50cc motorbike, took a corner way too fast and came head on with a car coming round the bend.. Thankfully they managed to mount the verge.. otherwise I would have been toast! - Calmed down after that!",hw5t01m,t3_so01k9,1644368131.0,False
so01k9,"4 years ago i went on vacations with my uncle and his daughter. Arrived there we wanted to do some bike you know. His daughter was 3 years older so he told her ""always stay in front of him"" which she didnt listen. There was a cliff. I went down, tried to be cool but ended up being ejected. 360° in the air, right on the handle. I couldnt breath for at least a minute. What saved me was a nurse who was there at the same time. Im so grateful for that.",hw5t2yy,t3_so01k9,1644368167.0,False
so01k9,"Back in like 2017 I was playing pokemon go with my friends, we got to a crosswalk, but I was too focused in the game (that mixed with my partial deafness) to notice that my friends stopped, and there was a car speeding towards us, or rather towards me. 

My friend pulled me back by my shirt just in time, the wind force of the car even almost knocked my phone out of my hands",hw5tjva,t3_so01k9,1644368369.0,False
so01k9,Car wrapped around a tree good times,hw5tsdy,t3_so01k9,1644368470.0,False
so01k9,"Post-surgical bleed while on blood thinners. I went to the ER to have the sutures looked at. The doctor ignored me to tend to a patient with the flu until my BP was 50/20. They stapled the incision with surgical staples sans anesthesia. 

I woke up in the ICU after being given 4 units of blood and a bag of plasma. I spent two weeks in hospital. And because of California's shitty medical malpractice laws I couldn't sue the doctor.",hw5uaha,t3_so01k9,1644368686.0,False
so01k9,Probably when my heart stopped for 13 seconds,hw5un72,t3_so01k9,1644368837.0,False
so01k9,An ATV accident. I still have the scars almost twenty years later.,hw5v206,t3_so01k9,1644369015.0,False
so01k9,"while doing 40-something kmh on my mtb with eurobeat blasting in my earphones, I rode onto an old railroad crossing with no signals and rolled in front of a runaway tanker car rolling down the tracks... I had to process for at least 10 minutes what the fuck happend and how am I still alive. to think of it, If I was just half a meter further back, I might not be posting this comment here",hw5vi40,t3_so01k9,1644369209.0,False
so01k9,"forgot to add, the next day on news, they stated that some left this car with faulty brakes on a sidetrack, which it rolled down, and derailing in a wheat field, about 1 km from that railroad crossing",hw5vvy6,t1_hw5vi40,1644369375.0,False
so01k9,Skydiving accident where someone went into my parachute at ~10k feet.,hw5xabg,t3_so01k9,1644369977.0,False
so01k9,"Well... I'm sure you know your history, young man.",hw5xfq6,t3_so01k9,1644370043.0,False
so01k9,a stripper nearly sucked my dick off.,hw5xh9r,t3_so01k9,1644370061.0,False
so01i7,"American police are rarely “fully trained”, in fact their firearms training is, on average, pretty bad. One of the takeaways from the Amadou Diallo shooting (you know, the original ""shoot a black man for being black"" trial) was that the cops missed most of the times they pulled the trigger. It is hard to shoot well when you are under stress, and the honest to god truth is most cops aren't 'gun people' who will train with their weapons constantly. They rarely even break leather on a regular basis.

So, before all of this came to the forefront, there was an awful lot of hushed conversation about the general militarization of police, a surprising amount of it from conservative circles. The case in question revolves around a white police officer who shot a white suspect who was following the officer's orders, but the officer gave contradicting orders and then shot the suspect dead. Turns out, this cop had 'kill' etched into his rifle and was generally someone that ought not be allowed to carry a weapon.

Just look up the shooting of Daniel Shaver.",hw5tras,t3_so01i7,1644368457.0,False
so01i7,"> So, before all of this came to the forefront, there was an awful lot of hushed conversation about the general militarization of police, a surprising amount of it from conservative circles.

It's not super surprising.  On reddit in 2022, sure, it's mostly lefties talking about it.  In the real world in 1998, it was righties because they were mad about Waco and Ruby Ridge.",hw5vckp,t1_hw5tras,1644369141.0,False
so01i7,In 1998 it was still lefties primarily talking about it. While there are periods like waco when conservatives joined in - let's not erase when those Venn diagrams overlap and people are just pissed at the state.,hw5wxjx,t1_hw5vckp,1644369823.0,False
so01i7,Bullshit.,hw5spa4,t3_so01i7,1644368003.0,False
so01i7,You think the double standard is bullshit or that the claim that a double standard exists at all is bullshit?,hw5vvcs,t1_hw5spa4,1644369368.0,False
so01i7,"I don't support the excuse, I also don't support the Grossman's killology crap. 

If our soldier in war zones can limit use of force - we can expect better.",hw5tbry,t3_so01i7,1644368272.0,False
so01i7,Not great.,hw5sfnd,t3_so01i7,1644367889.0,False
so01i7,"I do wonder why they are able to deal with law, mental and physical health issues and carry a gun, when any other person in any one of those specific professions must go to school and pass state boards to practice.",hw5sop9,t3_so01i7,1644367996.0,False
so01i7,Fucking weird,hw5sllw,t3_so01i7,1644367959.0,False
so01i7,"These are most definitely not “mild musings,” OP 😉",hw5wfbu,t3_so01i7,1644369607.0,False
so01i7,"This will get downvoted but you make an excellent, if obvious, point.",hw5umo0,t3_so01i7,1644368830.0,False
so01i7,"I'm pretty sure if a civilian shoots someone in an ""I feared for my life situation,"" they'd likely walk on grounds of self defense.",hw5v9y6,t3_so01i7,1644369110.0,False
so01i7,Not if that someone was a cop who was about to shoot them for no good reason.,hw5w09u,t1_hw5v9y6,1644369428.0,False
so01i7,You have the same rights as an officer does to self defense. They just deal with those situations more often than the average population.,hw5uqgp,t3_so01i7,1644368876.0,False
so01i7,"Both are generally held to a reasonable person standard, the main difference is that police are more likely to be given the benefit of the doubt when investigated by their colleagues, which is probably inevitable.",hw5v7kj,t3_so01i7,1644369081.0,False
so01i7,">untrained civilians, are expected to remain calm in the presence of a firearm

I don't know what planet you're living on that this is the expectation.",hw5vo7d,t3_so01i7,1644369282.0,False
so01i7,"***Fuck the Police!!***

American police are considered superior to American civilians, because America is a police state. We will never have police reform in this shithole country because the police work exactly as designed.",hw5vehr,t3_so01i7,1644369165.0,False
so01i7,"Love your username, OP.

As to how I feel, “pissed off and impotent” sums it up nicely.",hw5wpyi,t3_so01i7,1644369732.0,False
so01i7,OP is making a false claim.,hw5xdbs,t3_so01i7,1644370014.0,False
so01i7,Keep a heater with you. Mmm stay warm gurl it's February,hw5xdt7,t3_so01i7,1644370020.0,False
so01g5,That's fine 🙄,hw5sgk6,t3_so01g5,1644367900.0,False
so01g5,Good,hw5siuj,t3_so01g5,1644367926.0,False
so01g5,Europe would be so much better off without them.,hw5sozm,t3_so01g5,1644368000.0,False
so01g5,Here's your business opportunity,hw5tfce,t3_so01g5,1644368315.0,False
so01g5,He's made his money.,hw5snrn,t3_so01g5,1644367985.0,False
so01g5,Lizard man gave up on his conquest in Europe,hw5so6f,t3_so01g5,1644367990.0,False
so01g5,Don't threaten me with a good time.,hw5vyrb,t3_so01g5,1644369409.0,False
so01g5,hell yes! so many people who must immediately get a real job and maybe become a better part of the society haha,hw5wlrc,t3_so01g5,1644369682.0,False
so01g5,"Good luck, sounds like media black out coming.",hw5wyvw,t3_so01g5,1644369839.0,False
so01ax,We're *Putin* on a brave face.,hw5sfrb,t3_so01ax,1644367890.0,False
so01ax,Best not be Russian around,hw5shug,t1_hw5sfrb,1644367914.0,False
so01ax,Nice,hw5sj6u,t1_hw5sfrb,1644367930.0,True
so01ax,There's been a war for the last 8 years in Ukraine.,hw5stpo,t3_so01ax,1644368055.0,False
so01ax,I'm aware. Been following it for quite a while. I'm curious if life has changed there though based on the worldwide attention on the country as of recent. Many people aren't aware of the fact you just stated.,hw5t04s,t1_hw5stpo,1644368132.0,True
so0167,Lol no.  Media profits on hysteria.,hw5sjbn,t3_so0167,1644367932.0,False
so0167,Are we doing your homework right now? This feels like a homework question….,hw5smnk,t3_so0167,1644367972.0,False
so0167,"hahahahhahaha.  Do you work for them?  Of course the media isn't uniting people, they're doing the exact opposite.  Divisiveness drives clicks and reads.",hw5vck3,t3_so0167,1644369141.0,False
so0167,"no, because ""the media"" is not a cohesive entity",hw5sl0y,t3_so0167,1644367952.0,False
so0167,"Eh, social media is as influential as old school newspapers and t.v. and radio (if not more influential with Millennials and Gen Z). So how are we defining ""media"" now.",hw5slg5,t3_so0167,1644367957.0,False
so0131,Quetzalquatalus giant pterosaur. Not a Dino but I wanna be big af and fly.  Seems hella chill,hw5snyk,t3_so0131,1644367987.0,False
so0131,I just saw life-sized reconstructions of those fellows/ladies for the first time a few years ago. I still can't believe we live on the same planet they did. Amazing creatures.,hw5tvab,t1_hw5snyk,1644368505.0,False
so0131,"This was my thought as well. Wasn't sure if we'd be given a pass for Pteros, but Quetzals just seem majestic af. Would love to be a big wingy boi, chomping on baby trexes",hw5wa7y,t1_hw5snyk,1644369546.0,False
so0131,"T-Rex, just to see what I could do with the tiny arms.",hw5sj8a,t3_so0131,1644367931.0,False
so0131,Ankylosaurus because they look difficult to prey upon. Tough dorsal hide with a powerful tail.,hw5sym7,t3_so0131,1644368114.0,False
so0131,same dude i would love to be a Ankylosaurus.,hw5tgb0,t1_hw5sym7,1644368326.0,True
so0131,"Triceratops. I wouldn’t like having T-Rex arms. Plus, face spikes are a perk.",hw5syxj,t3_so0131,1644368118.0,False
so0131,"Stegosaurus. Too big to mess with, but doesn't have to fight for food.",hw5sgjr,t3_so0131,1644367900.0,False
so0131,"That is sound logic, my friend.",hw5stho,t1_hw5sgjr,1644368052.0,False
so0131,::The meme with that guy who points at his own head.::,hw5syfs,t1_hw5stho,1644368112.0,False
so0131,I absolutely adore the upright kite-shaped armour plates on their back,hw5vpqc,t1_hw5sgjr,1644369301.0,False
so0131,🤫 (I didn't want people to know it was secretly for aesthetic reasons. Those spikes are awesome.),hw5vtjo,t1_hw5vpqc,1644369347.0,False
so0131,Velociraptor because in my opinion they were the proto-human race that foreshadowed human dominance,hw5srki,t3_so0131,1644368031.0,False
so0131,"A bird, because I wouldn't be extinct.

Seriously, though, I'd go with my favorite: Parasaurolophus walkeri. I just love the way their crests look, and imagining them making sounds with them to communicate is awesome. Just knowing a bit more about them than we do most other dinosaurs, given some of the sounds they could make, makes them seem more real to me.

https://www.sandia.gov/media/dinosaur.htm
About how Sandia Labs reconstructed the crest and deduced what sounds it could make.
https://www.youtube.com/watch?v=49tCINKQmVY
Some of the sounds P. could have made while alive. Really haunting (made my cat stare at the speaker, and may be a bit loud).",hw5tp6u,t3_so0131,1644368432.0,False
so0131,">Parasaurolophus

cool bro. yeah i love the look of their crests so unique.",hw5ufef,t1_hw5tp6u,1644368743.0,True
so0131,"Godzilla, because... Godzilla.",hw5ufb2,t3_so0131,1644368742.0,False
so0131,lmao,hw5ujd5,t1_hw5ufb2,1644368790.0,True
so0131,I also choose your wife.,hw5x1ll,t3_so0131,1644369871.0,False
so0131,a helicopter cause fuck you,hw5ujyt,t3_so0131,1644368797.0,False
so00zm,Hogarth,hw5sdme,t3_so00zm,1644367866.0,False
so00zm,[deleted],hw5scfc,t3_so00zm,1644367853.0,False
so00zm,Steve,hw5sius,t3_so00zm,1644367926.0,False
so00zm,bartholomew,hw5sjjz,t3_so00zm,1644367935.0,False
so00zm,Varina,hw5sksn,t3_so00zm,1644367949.0,False
so00zm,Keith nuff said,hw5st45,t3_so00zm,1644368048.0,False
so00zm,That name is hot af.,hw5us1i,t1_hw5st45,1644368895.0,False
so00zm,Is it your name,hw5uuea,t1_hw5us1i,1644368923.0,False
so00zm,No,hw5uw80,t1_hw5uuea,1644368945.0,False
so00zm,Ohh yeah Keith hardah hardah,hw5v0ax,t1_hw5uw80,1644368994.0,False
so00zm,Oh fuck me keith!,hw5v8d9,t1_hw5v0ax,1644369091.0,False
so00zm,Yeah I couldn’t moan that,hw5vb47,t1_hw5v8d9,1644369123.0,False
so00zm,I'll moan that name allll night,hw5vewz,t1_hw5vb47,1644369170.0,False
so00zm,Do it for us both bro,hw5vhkc,t1_hw5vewz,1644369202.0,False
so00zm,Much obliged,hw5vm8p,t1_hw5vhkc,1644369259.0,False
so00zm,I say dumb thing.,hw5vrok,t1_hw5vm8p,1644369325.0,False
so00zm,.?,hw5vu9t,t1_hw5vrok,1644369355.0,False
so00r7,Haven't been to either city but the ones that popped into my mind: Chicago and Birmingham.,hw5selr,t3_so00r7,1644367877.0,False
so00r7,Chicago is a globally influential city unlike Birmingham.,hw5t4qc,t1_hw5selr,1644368188.0,False
so00r7,London and NY? Kinda similar,hw5snml,t3_so00r7,1644367983.0,False
so00r7,Lisbon and San Francisco,hw5sno2,t3_so00r7,1644367984.0,False
so00r7,Liverpool and Los Angeles,hw5svwk,t3_so00r7,1644368081.0,False
so00r7,Belfast in the 1990s and East St. Louis,hw5t9x4,t3_so00r7,1644368251.0,False
so00r7,Pittsburgh and Sheffield England or Magnitogorsk Russia,hw5wzpp,t3_so00r7,1644369849.0,False
so00oj,"Nice try, FBI.",hw5sdew,t3_so00oj,1644367863.0,False
so00oj,I'll pay you to shoot me,hw5svaq,t3_so00oj,1644368074.0,False
so00oj,"Shave yoourself bald and get a tat of a barcode on the back of your head, legal name change to: 47",hw5sgci,t3_so00oj,1644367897.0,False
so00oj,Post your amateur kills to YouTube in hopes of getting noticed by somebody influential in the industry.,hw5soqf,t3_so00oj,1644367997.0,False
so00oj,Im calling the police,hw5sacq,t3_so00oj,1644367829.0,False
so00oj,by posting your information and questions online about it and turning yourself into to the local authorities.,hw5t00y,t3_so00oj,1644368131.0,False
so00oj,Money=Death,hw5ul7n,t3_so00oj,1644368813.0,False
so00oj,Craigslist,hw5uowv,t3_so00oj,1644368857.0,False
so00oj,Sell at least a million copies,hw5wwqh,t3_so00oj,1644369813.0,False
