post_id,comment,comment_id,parent_id,created,is_submitter
snzbk6,"I guess until it starts having a negative effect in your everyday life, whether mood, work, social relationships, etc. 

Usually a defining factor in addiction, a habit that is pleasurable which you can no longer partake in without the habit being detrimental to other facets of your life. I imagine certain fetishes can potentially have effects mentally or socially, maybe in how one views themselves and/or those around them. Like some inherent jealously or self doubt related to the watching thing. I mean I’m into some kinky stuff but you have to watch the degree of s importance to which they play in your life.",hw5nw4g,t3_snzbk6,1644365971.0,False
snzbk6,"That's a given. Thinking more in terms of is it a norm? Do most ppl put others first? Contrary to the golden rule, so much of job, relationship, habit, health advice is to put yourself first then focus on others.",hw5oefb,t1_hw5nw4g,1644366180.0,True
snzbk6,"When someone is being coerced, manipulated, or taken advantage of (such as doing sexual stuff with a child).",hw5tcy3,t3_snzbk6,1644368286.0,False
snzbk6,"That's a given that asks the question:
How does one differentiate between those and honest choice or socioeconomic background and nurture?

Flipping it another way in the crass context- 2 consenting adults and sexual activities. One partner gets off on the other partner getting off. Could that ever become a problem or dealbreaker?",hw5x9yr,t1_hw5tcy3,1644369973.0,True
snzbk6,I feel like feeders are a problem. When they keep giving mass amounts of food to someone very very unhealthily overweight and there's some sort of pleasure in watching someone gorge themselves.,hw5oc9v,t3_snzbk6,1644366155.0,False
snzbk6,"That's one I didn't know existed. Thanks. Kinda like the grandma filling up a third plate while saying ""Be a good child and clean your plate."" 

I was thinking more win-win. Like the cook getting a dopamine rush from  that the fact the water is enjoying food. Kinda a symbiotic relationship doesn't really have any negatives",hw5pfre,t1_hw5oc9v,1644366621.0,True
snzb9n,"No, and nothing. Lol.",hw5nq5q,t3_snzb9n,1644365902.0,False
snzb9n,Not even if it was a portable Xbox system or something fun like that?,hw5obtr,t1_hw5nq5q,1644366150.0,True
snzb9n,Why bother when phone OSes are on their way out. Concentrate on firmware for other smart devices instead.,hw5npl6,t3_snzb9n,1644365895.0,False
snzb9n,Phone OSes are on their way out? What will next gen phones use?,hw5ntu6,t1_hw5npl6,1644365944.0,True
snzb9n,Telepathy.,hw5pioy,t1_hw5ntu6,1644366656.0,False
snzb9n,"Phone? What's a phone? You mean the pad I stick behind my ear that interacts with my watch? Edit: oh, you mean the ability to do a call with my glasses! Yeah, I guess you could call the arms my phone.",hw5pmu3,t1_hw5ntu6,1644366705.0,False
snzb9n,Didn't they already try that?,hw5ntif,t3_snzb9n,1644365940.0,False
snzb9n,Not sure! I'll have to look into it and see if they did.,hw5o4ju,t1_hw5ntif,1644366066.0,True
snzb9n,If I was going to purchase a phone without one of the big two OSs I'd get a Linux phone for kicks,hw5nzab,t3_snzb9n,1644366008.0,False
snzb9n,Ubuntu phone? lol,hw5o5tt,t1_hw5nzab,1644366081.0,True
snzb9n,"There is such a thing, I think it'd be fun to fuck around with",hw5oaf6,t1_hw5o5tt,1644366134.0,False
snzb9n,Windows Phone is always going to suck because the first thing Microsoft ask themselves as part of their design strategy is 'how can this device force users to become better Microsoft consumers?',hw5o7gk,t3_snzb9n,1644366100.0,False
snzb9n,"If they come with the option to run Android apps similar like W11, maybe. Otherwise it can never compete",hw5put5,t3_snzb9n,1644366799.0,False
snzb9n,"I loved Windows Phone, it’s just sad that there are basically only two mobile OSes left. Windows Phones hold up incredibly well compared to, especially, Android phones of that era but there is no chance MS could pull off a revival, it is unfortunately just too late.",hw5re3r,t3_snzb9n,1644367449.0,False
snzb9n,"Nah, I don't think that they would offer something different from what we already have (at least in phone OS)",hw5ocf4,t3_snzb9n,1644366156.0,False
snzb9n,Nice try Microsoft CEO Satya Nadella!,hw5oe01,t3_snzb9n,1644366175.0,False
snzb65,Probably coca cola,hw5o4kh,t3_snzb65,1644366067.0,False
snzb65,Porn. There used to be a plot. You actually *cared* about why someone was getting banged.,hw5ot51,t3_snzb65,1644366352.0,False
snzb65,"There was a porn I watched back in middle school (80s) called “Beauty.” I can’t remember what the plot was exactly, only that it was legit. Like, you were like, “aight girl, hurry up and finish gobbling them cocks. I want to know if Louis got the job!”",hw5pa8l,t1_hw5ot51,1644366557.0,False
snzb65,"Smores cereal from the 80s.  The stuff that's come out since I can't call Smores cereal, I call it garbage.",hw5nuvb,t3_snzb65,1644365956.0,False
snzb65,McDonald's french fries when they used tallow to fry them,hw5nvcb,t3_snzb65,1644365962.0,False
snzb65,I have a feeling that Ferrero Rocher tastes different now.,hw5nwb0,t3_snzb65,1644365973.0,False
snzb65,Butterfingers,hw5nyrh,t3_snzb65,1644366002.0,False
snzb65,"McDonald's Chicken Nuggets used to be different before they did some switch like 15-20 years ago, they used to have a mix of white and dark meat in there, plus they were bigger.",hw5o72b,t3_snzb65,1644366095.0,False
snzb65,"L & P.

Back in the day, it was New Zealand's own soft drink. Real lemon, real mineral spring water. Then Coca Cola bought, it dropped the mineral water for filtered tap water and changed the lemon juice out for generic lemon/lime flavouring #24665. Now it's as refreshing as listening to a child whine for 30 minutes.",hw5ooah,t3_snzb65,1644366295.0,False
snzb65,KFC did something to their original recipe. Tasted totally different back in the early 80s. Sucks now.,hw5pfp5,t3_snzb65,1644366620.0,False
snzb65,The Krusty Krab has never been the same ever since Mr Krabs changed the krabby patty formula,hw5nqwo,t3_snzb65,1644365911.0,False
snzb65,Terro ant killer. Used to attract and kill the whole nest. New formula doesn’t attract.,hw5o2r9,t3_snzb65,1644366047.0,False
snzb65,"Cigarettes, before they started using FSC paper.",hw5ovvx,t3_snzb65,1644366386.0,False
snzb65,"Timberland boots before they became this watered down fashion brand. My first pair of boots were timberlands and they lasted a long time. After they crapped out I bought another pair of timberlands that lasted quite a bit too. My third pair lasted 3 months because the soles split open and eventually filled with water while at work one day. I wasn’t having it. 

Now for work I wear red wings. Best work boot I’ve worn and my first pair of red wings for work purposes are still going after 2 and a half years but I’m looking at replacing them. 

If you wear boots outside of work definitely buy a pair of Thorogoods.",hw5pc37,t3_snzb65,1644366578.0,False
snzb65,"Playstation and Xbox, fuck paying for multiplayer, steam gives me that shit for free.",hw5qxho,t3_snzb65,1644367255.0,False
snzb65,WWE Games,hw5sh11,t3_snzb65,1644367905.0,False
snzb65,Haas mills. Since they IPO’ed quality has crash and burned.,hw5skej,t3_snzb65,1644367945.0,False
snzb4s,Summer Nights from Grease.,hw5ntdl,t3_snzb4s,1644365939.0,False
snzb4s,Eminem and Rihanna,hw5nu7f,t3_snzb4s,1644365948.0,False
snzb4s,Freddie Mercury and David Bowie,hw5o57j,t3_snzb4s,1644366074.0,False
snzb4s,Kenny & Dolly - Islands in the Stream,hw5pjvk,t3_snzb4s,1644366670.0,False
snzb4s,a classic!,hw5pxpw,t1_hw5pjvk,1644366834.0,True
snzb4s,Aaliyah and Ja Rule,hw5nqlf,t3_snzb4s,1644365907.0,False
snzb4s,"what happened when Aaliyah and Ja Rule went to the Bahamas? 


They caught fyre",hw5q9lg,t1_hw5nqlf,1644366973.0,True
snzb4s,Bing Crosby and David Bowie -- Little Drummer Boy,hw5pxlu,t3_snzb4s,1644366832.0,False
snzb4s,Simón and Garfunkel,hw5wx0m,t3_snzb4s,1644369816.0,False
snzb4s,Cheech and Chong,hw5wy55,t3_snzb4s,1644369830.0,False
snzb00,Marvel I want super powers,hw5obfl,t3_snzb00,1644366146.0,False
snzb00,The shire!,hw5noh1,t3_snzb00,1644365883.0,False
snzb00,"Bloodborne. 
Infinite vampire/squid/warewolf hunting and if you die you go back to a dream with a cute sex doll.
Could be potentially worst",hw5nww7,t3_snzb00,1644365979.0,False
snzb00,"A fictional story set in this world. I only just figured out taxes, I'm not doing it again accounting for magic tax breaks.",hw5nzjt,t3_snzb00,1644366012.0,False
snzb00,Pokemon Kanto region,hw5o41v,t3_snzb00,1644366061.0,False
snzb00,Gm_construct,hw5o9zq,t3_snzb00,1644366129.0,False
snzb00,Boku no pico,hw5oqta,t3_snzb00,1644366324.0,False
snzb00,"I live in a fictional world any time I'm immersed into a social hive. It's like ruling in hell, it's fun for once.",hw5sg6t,t3_snzb00,1644367895.0,False
snzb00,"If Fictional versions of Earth count, then definitely Mega Man Battle Network, I always wanted a Netnavi, and being in the world they came from definitely helps. Otherwise, I guess I’ll go with Pokémon.",hw5yl1t,t3_snzb00,1644370536.0,False
snzas3,"Immediate family aside; I have ten cousins. I love them all, but I do have a favourite because even though she knows I'm shy and not a people person (even though I'd like to be), she NEVER FAILS to make me join in family activities or make me feel excluded.",hw5nhp9,t3_snzas3,1644365803.0,True
snzas3,"My older sister, our bond is perfect. No need to see each other everyday but always nice when we do",hw5nl23,t3_snzas3,1644365842.0,False
snzas3,"Still living and not offspring, probably my cousin Tracy. She's just about my favorite person on the planet. We get along on almost every level and I just adore her. 

If we include those passed, then it's my sister. She was my very best friend and the day she died I lost something very dear to me. She was funny, and she saw through my bullshit and could see the person inside and only wanted to help him come out.",hw5o0ya,t3_snzas3,1644366027.0,False
snzas3,"Excluding immediate family, my aunt (dad's older sister).  She's a lot of fun to talk to and hang out with.",hw5o1l2,t3_snzas3,1644366035.0,False
snzas3,"my cousin jason

he is lvl headed disciplined and has a good nature to him",hw5p3xp,t3_snzas3,1644366481.0,False
snzas3,"Can't say without being banned, lol.",hw5qr89,t3_snzas3,1644367181.0,False
snzas3,My brother because he actually listens to me and we share similar ideals.,hw5r7x2,t3_snzas3,1644367376.0,False
snzaqn,It's a small chocolate biscuit.,hw5o0j4,t3_snzaqn,1644366023.0,False
snzaqn,Kind of chocolate biscuit,hw5oqt7,t3_snzaqn,1644366324.0,False
snzaqn,American in the sense of USA or north and South America (if not USA it means a wine),hw5nkcx,t3_snzaqn,1644365834.0,False
snzaqn,"American Whisky, which uses different grains to traditional ones. It's sweeter, but not too bad.",hw5nkw3,t3_snzaqn,1644365840.0,False
snzaqn,"The Dynasty, street or beverage?",hw5nl43,t3_snzaqn,1644365843.0,False
snzaqn,In Spain bourbon is a political party I think,hw5nmul,t3_snzaqn,1644365863.0,False
snzaqn,I think it's a whisky?,hw5nxrp,t3_snzaqn,1644365990.0,False
snzaqn,"A type of booze, but also the French royal House of Bourbon. There's such a thing as a ""Bourbon nose"" meaning someone with a huge snout like the Bourbon kings had.",hw5oznk,t3_snzaqn,1644366430.0,False
snzaqn,I think it's a kind of whiskey? Or a brand of whiskey?,hw5thf5,t3_snzaqn,1644368340.0,False
snzaqn,I'm American and I boycott Kentucky,hw5u90i,t3_snzaqn,1644368669.0,False
snzaqn,Wine/upper class,hw5uqv1,t3_snzaqn,1644368881.0,False
snzaqn,Whisky and a biscuit,hw5vfbq,t3_snzaqn,1644369175.0,False
snzaqn,A chocolate biscuit,hw5vpse,t3_snzaqn,1644369302.0,False
snzaqn,Alcohol that I've never tried before.,hw5vtqc,t3_snzaqn,1644369349.0,False
snzaoz,When I hated my job it was because the VP of my department was a total psychopath who fostered a culture of ass kissing and fake-ness. Happy to say I no longer work there and most of the other employees left as well. She’s honestly a demon.,hw5np8z,t3_snzaoz,1644365892.0,False
snzaoz,Gotta love when higher ups brown nose. Like seriously?,hw5nxil,t1_hw5np8z,1644365987.0,False
snzaoz,"Sometimes I’d have meetings with her—just the two of us—and midway through the meeting she’d take a call or start writing an email about something completely unrelated. 

Literally the worst person, in every possible way.",hw5opjj,t1_hw5nxil,1644366309.0,False
snzaoz,The disrespect/stereotypes. Work > life,hw5nojo,t3_snzaoz,1644365883.0,False
snzaoz,Because it’s work in general. You are forced to be somewhere and trade your time. People should strive to retire instead of reaching for careers.,hw5paol,t3_snzaoz,1644366562.0,False
snzaoz,"I was the front desk manager at a hotel. 

The owner would sit in the break room crushing beers (his wife was religious and didn’t allow alcohol in the house) he then would drive the 45 minutes drunk home. 

He didn’t pay me well (despite making me manager) 

He was an asshole to employees and hotel patrons, when he was drunk he told me to upcharge anyone for a room that wasn’t white. 

He didn’t give me thursdays off despite him knowing I had therapy every Thursday. 

I needed the job at the time, but honestly when drunk hotel guests were in the hot tub and one of them shit in it and he told me to “just handle it” I quit.",hw5o570,t3_snzaoz,1644366074.0,False
snzaoz,"Toxic leadership, ridiculous hours, physically exhausting and painful",hw5psnq,t3_snzaoz,1644366774.0,False
snzaoz,"For me, it's NOT the job itself I can't stand, but some facets of it.

My main issue is the managerial department.

My supervisor (who I won't name but we'll call her ""Vickie Hereford"" or ""VH""). She means well but she's an embodiment of ""The road to hell is paved with good intentions"" and, ever since she became main supervisor, she's done nothing but screw up our phoneline. 

More to this, she refuses to innovate and will ask us (the workers) for suggestions on how to improve things but will be so quick to shoot them down or make excuses. Woe betide you if she doesn't like you because she'll make up a reason to fire you. It's no wonder we're losing workers. 

The other thing that I don't much care for is some of the callers we get. See, we're a mental health phoneline but we will some callers that try to get sexual, belligerent, sexually belligerent, or they call and hang-up. No, we can't block callers, as our system does not allow for caller ID. 

Answering phones. I hate answering phones but I put up with it because I work from home",hw5q41e,t3_snzaoz,1644366907.0,False
snzaoz,Mandatory unpaid internship,hw5tjy0,t3_snzaoz,1644368370.0,False
snzak0,To the center of it. 😂,hw5nhhi,t3_snzak0,1644365800.0,False
snzak0,Mariana Trench,hw5nif0,t3_snzak0,1644365811.0,False
snzak0,Bora Bora. I don't know anyone thats been there so they can't ruin it for me.,hw5no17,t3_snzak0,1644365877.0,False
snzak0,Japan,hw5nwfh,t3_snzak0,1644365974.0,False
snzak0,Amsterdam.,hw5o2c8,t3_snzak0,1644366042.0,False
snzak0,Russia.,hw5p02k,t3_snzak0,1644366435.0,False
snzak0,Andora,hw5p7lb,t3_snzak0,1644366524.0,False
snzak0,Wherever you will go…I’ll go wherever you will goooooo!,hw5ql5z,t3_snzak0,1644367109.0,False
snzak0,From 0 meters above the sea level  to where ever space begins in below 10 secs,hw5uxdj,t3_snzak0,1644368959.0,False
snzak0,Kokomo I'll get there fast and then I'll take it slow.,hw5xa1x,t3_snzak0,1644369974.0,False
snzaie,Every time I joke about fucking dogs and people think I'm a real dogfucker.,hw5nn4s,t3_snzaie,1644365866.0,False
snzaie,bruh lol,hw5nqdf,t1_hw5nn4s,1644365904.0,True
snzaie,But you ARE a real motherfucker,hw5o1co,t1_hw5nn4s,1644366032.0,False
snzaie,the true question is who's mom they fucked,hw5obdl,t1_hw5o1co,1644366145.0,True
snzaie,With a name like that? Probably all of our mothers at the same time,hw5ogh7,t1_hw5obdl,1644366204.0,False
snzaie,maybe they are zeus,hw5oo4s,t1_hw5ogh7,1644366292.0,True
snzahh,"As a man with chronic pain, i really love when my partner offers me spontaneous massages once in a while, takes care of some chores so i can relax or sleep a bit longer, and is generally physically affectionnate. Some loving sex doesn't hurt. 

But in short, help that person by comforting its body and removing some burden from them.",hw5nwja,t3_snzahh,1644365975.0,False
snzahh,"Yes, good stuff.",hw5pljt,t1_hw5nwja,1644366690.0,True
snza9p,Wake up and breathe unfortunately,hw5ny0g,t3_snza9p,1644365993.0,False
snza9p,"Wake up

Pee

My hubs & I cuddle our kid 

Grab my kid & make coffee

Hang out with my husband before he goes to work (we drink coffee together)

Make breakfast for my kid and I 

I feed my cats

We eat

I get my kid ready for the day

I get ready for the day while my kid plays

We go for a walk somewhere (sometimes the museum, sometimes the park, sometimes somewhere random)

We go back home & I put my kid down for a nap.

I have about 2 hours to work (content creation, recording & editing; some days I’ll skip the work & relax or workout)

My kid wakes up

I make us lunch 

We eat (duhhh)

My cats get lunch

I clean while my kid plays (sometimes my kid joins in but they’re only 1 and 2 months soooo)

I make dinner (except for Wednesdays & Thursday cause those days I babysit my cousin so I’m too tired to cook dinner)

Husband comes home & we eat dinner while watching Steven universe! 

We go for a walk.

Get our kid down for bed

Then we hangout for an hour or 2 and go to bed 🤷🏻‍♀️

That’s as detailed as I can get :) but",hw5osnf,t3_snza9p,1644366347.0,False
snza9p,Sounds pretty legit. I admire your day 💜,hw5su4a,t1_hw5osnf,1644368060.0,True
snza9p,"Regret most of my life choices…

Rinse and repeat.",hw5qrtb,t3_snza9p,1644367188.0,False
snza9p,I work 4:48am until 12:43pm; so that means bedtime around 7pm and up around 3am; I do chores and watch TV after work; Try to get some good walks in a few times each week,hw5no3a,t3_snza9p,1644365878.0,False
snza9p,"Work, sleep, use phone a little bit then back to work",hw5o363,t3_snza9p,1644366051.0,False
snza9p,"Bear in mind I’m looking for work and have no social life, but I get up, have coffee, read, visit Reddit, have something to eat, maybe go for a walk some days, watch tv, Reddit some more, go to bed. It’s a bit sad but I’m hanging in there at least",hw5qrkg,t3_snza9p,1644367185.0,False
snza9p,Hey this is on par this is an actual question you are doing great,hw5qw6n,t1_hw5qrkg,1644367239.0,True
snza9p,"Literally jack, shit",hw5v444,t3_snza9p,1644369040.0,False
snza9p,jsut wanted to make sure im on par,hw5vmhi,t1_hw5v444,1644369262.0,True
snza7q,Chinese Democracy,hw5nkhj,t3_snza7q,1644365835.0,False
snza7q,Yup,hw5ogot,t1_hw5nkhj,1644366206.0,False
snza7q,"You know, it sucked…and you knew it would, but it kind of grew on me. Like the transition from Appetite to Use Your Illusion. Obviously, UYI 1&2 turned out to be classics, but initially it was a jarring change. Very artsy compared to Appetite. I viewed Chinese Democracy as a mediocre attempt at UYI 3. 

But Buckethead is no Slash and that alone just makes it a lesser endeavor.",hw5s2o3,t1_hw5nkhj,1644367739.0,False
snza7q,Agreed. Was so hyped for this.,hw5xba1,t1_hw5nkhj,1644369989.0,False
snza7q,weezer green album,hw5nn45,t3_snza7q,1644365866.0,False
snza7q,Funny enough I liked the green album more than pinkerton. I'm ready for the downvotes,hw5nqp8,t1_hw5nn45,1644365908.0,True
snza7q,Big day chance the rapper,hw5nqg8,t3_snza7q,1644365905.0,False
snza7q,Hot Damn hot shower,hw5ns6k,t1_hw5nqg8,1644365925.0,True
snza7q,Whole lotta red,hw5ofux,t3_snza7q,1644366196.0,False
snza7q,Down In The Weeds Where The World Once Was,hw5p2j4,t3_snza7q,1644366464.0,False
snza7q,My exs soundcloud. It was so bad he deleted it,hw5p37u,t3_snza7q,1644366472.0,False
snza7q,Encore,hw5ph5b,t3_snza7q,1644366637.0,False
snza7q,"B.O.B. - Anything after The Adventures of Bobby Ray.

Eminem - Relapse.",hw5rk5y,t3_snza7q,1644367521.0,False
snza7q,Believe,hw5xdyu,t3_snza7q,1644370022.0,False
snza4d,DJ who??,hw5nsun,t3_snza4d,1644365933.0,False
snza4d,Who?,hw5nt1n,t3_snza4d,1644365935.0,False
snza4d,"continue with my life since americans can't even find my country in a map, so I shouldn't worry",hw5oe9b,t3_snza4d,1644366178.0,False
snza4d,"As an American I can confirm that whatever your country is, most of us probably couldn’t find it on a map. I have a 24 year old friend that needed a gps just to go to the next town over..",hw5pdqz,t1_hw5oe9b,1644366598.0,False
snza4d,"I applaud your honesty

I'm from Chile Btw",hw5ptzb,t1_hw5pdqz,1644366790.0,False
snza4d,"Much appreciated. And I actually know where that is! It’s that super thin strip on the West side of South America! Never been but my dad has been to Brazil and I like looking at maps a lot so I happen to be one of the few Americans that knows lol

Also, greetings from Texas",hw5wkez,t1_hw5ptzb,1644369667.0,False
snza4d,flip a coin and go to either Mexico or Canada.,hw5np6l,t3_snza4d,1644365891.0,False
snza4d,I loved his whole “I’m fast as fuck boi” thing a long time ago but come on that mf should never be president lmao,hw5nscb,t3_snza4d,1644365927.0,False
snza4d,Ohhhhhh come onnnnnnn aren't you curious?,hw5objy,t1_hw5nscb,1644366147.0,True
snza4d,"No. I’m really not lol. I’d probably rather have Steve-O as President, because at least he’d be brutally honest about his fuck ups",hw5p7s9,t1_hw5objy,1644366527.0,False
snza4d,I can't legally say,hw5omqi,t3_snza4d,1644366276.0,False
snza4d,Call Alex stupid,hw5pif3,t3_snza4d,1644366653.0,False
snza4d,"Although I have no idea who that is, it sounds like a rapper, so all press conferences and SOTU addresses should be rap.",hw5ptte,t3_snza4d,1644366788.0,False
snza4d,Google who that is,hw5x8bw,t3_snza4d,1644369953.0,False
snza4d,Anyone who can take a stone cold stunner deserves to be president.,hw5xpbn,t3_snza4d,1644370157.0,False
snza22,[Bones in the Ocean](https://youtu.be/vcGoqa3yLg8),hw5nl8l,t3_snza22,1644365844.0,False
snza22,Nas - NY State of Mind,hw5nmnv,t3_snza22,1644365861.0,False
snza22,Dance with the Devil-Immortal Technique,hw5nnsb,t3_snza22,1644365874.0,False
snza22,Comfortably Numb - Pink Floyd,hw5npux,t3_snza22,1644365898.0,False
snza22,"Prom/King - Saba 
Maad City - Kendrick Lamar 
Be Alright - Dean Lewis
Just to name a few",hw5nyhi,t3_snza22,1644365999.0,False
snza22,[Ravel's Bolero](https://www.youtube.com/watch?v=E9PiL5icwic),hw5p5dh,t3_snza22,1644366498.0,False
snza22,I have never experienced this. Bravo to those who can.,hw5q03r,t3_snza22,1644366863.0,False
snza22,Tash Sultana - Blackbird,hw5srp7,t3_snza22,1644368032.0,False
snza22,"I don’t know if I’d call it an “experience,” but “Stan” by Eminem is a pretty compelling story. He has a few songs that tell vivid, cogent stories. Some are just flat out disturbing (“Kim” is fucking mental. The song, I mean. I won’t even listen to it, it’s so disturbing). Some of the biographical stuff (e.g., Cleaning Out My Closet; 8-Mile Road) set the scene in a compelling way. I think he’s better at actual story telling than most rappers, at least in some of his songs.",hw5t8iu,t3_snza22,1644368234.0,False
snza22,https://youtu.be/Q80_LmmJWno,hw5trc7,t3_snza22,1644368457.0,False
snza22,"Brittle Bones Nicky, one and two",hw5uo9j,t3_snza22,1644368850.0,False
snza22,Hotel California- The Eagles,hw5xqxr,t3_snza22,1644370177.0,False
snza0p,Chicken and waffles. I will take the downvotes but those things don’t belong together.,hw5nvo5,t3_snza0p,1644365966.0,False
snza0p,"Pineapple on pizza, duh!",hw5nqpg,t3_snza0p,1644365908.0,False
snza0p,And burgers.,hw5tok2,t1_hw5nqpg,1644368424.0,False
snza0p,Chocolate Orange Mayonnaise,hw5ndlp,t3_snza0p,1644365753.0,False
snza0p,McDonald's Saweetie meal,hw5nhda,t3_snza0p,1644365799.0,False
snza0p,Not exactly what you were asking for but Taco Bell and long John silvers being in the same building should’ve never happened,hw5owht,t3_snza0p,1644366393.0,False
snza0p,A commercial for a McDonald’s McNuggets on a double hamburger was the inspiration for this post,hw5qcg3,t3_snza0p,1644367005.0,True
snza0p,Cisco & Eggs…pledging a fraternity really sucks in a lot of ways.,hw5tfit,t3_snza0p,1644368317.0,False
snza03,Brony,hw5nec0,t3_snza03,1644365762.0,False
snza03,Ratting my bangs and wearing lots of neon.  80s.,hw5nlm0,t3_snza03,1644365849.0,False
snza03,Rat tails for us boys,hw5q3ch,t1_hw5nlm0,1644366899.0,False
snza03,"Yup, my brother rocked one of those, kept it in a long braid.  When he cut it off, Mom kept it in her jewelry box for years.",hw5rxi0,t1_hw5q3ch,1644367679.0,False
snza03,JNCO jeans,hw5nq08,t3_snza03,1644365900.0,False
snza03,I lowkey want those to make a comeback. I miss having pants with REAL pockets. You could fit your entire lunch AND a discman in one pocket and still have room,hw5o8nq,t1_hw5nq08,1644366113.0,False
snza03,Pokemon,hw5o4lr,t3_snza03,1644366067.0,False
snza03,Rollerblades,hw5q351,t3_snza03,1644366897.0,False
snza03,JNCO jeans,hw5tf40,t3_snza03,1644368312.0,False
snza03,Tight rolling my jeans.,hw5xfco,t3_snza03,1644370038.0,False
snz982,"2009: Won a car!

2011: Won a car!",hw5ng1h,t3_snz982,1644365783.0,False
snz982,"I won a ""Technical Emmy"" which is an award given to people/teams that provide a new/novel or important technical or engineering feat. In my case, it was for participating on the team that first built the routing and transmission technologies that power 4K and 8K studio recording. 

I have a picture of me with the Emmy and everything, it was a pretty big career accomplishment.",hw5q10w,t3_snz982,1644366874.0,False
snz982,That’s so cool!!!,hw5qya2,t1_hw5q10w,1644367264.0,False
snz982,Did you ever get your own statue?,hw5qz7d,t1_hw5q10w,1644367275.0,False
