post_id,comment,comment_id,parent_id,created,is_submitter
so0rdd,They can’t admit when they’re wrong.,hw5x1qb,t3_so0rdd,1644369873.0,False
so0rdd,Political bumper stickers,hw5x3x6,t3_so0rdd,1644369899.0,False
so0rdd,Check my last few comments. Im an idiot,hw5x415,t3_so0rdd,1644369901.0,False
so0ra7,What,hw5x28i,t3_so0ra7,1644369879.0,False
so0ra7,Pinocchio,hw5x3fm,t3_so0ra7,1644369893.0,False
so0ra7,Isabella Madrigal.,hw5x3iu,t3_so0ra7,1644369894.0,False
so0r35,Not at all for me,hw5x2sh,t3_so0r35,1644369885.0,False
so0r05,Nurse.,hw5x03f,t3_so0r05,1644369854.0,False
so0r05,Custodial engineer,hw5x1c6,t3_so0r05,1644369868.0,False
so0qzq,October 28 (https://nationaltoday.com/national-immigrants-day/),hw5x191,t3_so0qzq,1644369867.0,False
so0qz5,"Money, I'm not into women",hw5wyw7,t3_so0qz5,1644369839.0,False
so0qz5,Dick or money?,hw5x1bl,t1_hw5wyw7,1644369868.0,True
so0qz5,"Money. I have a man to give me dick. And if I didn't, vibrators exist",hw5x4bs,t1_hw5x1bl,1644369904.0,False
so0qz5,Matters how good and how much.,hw5x01r,t3_so0qz5,1644369853.0,False
so0qz5,Money. Money can bring the other (not to say what you’re gonna get is worth anything),hw5x022,t3_so0qz5,1644369853.0,False
so0qz5,"Money, im gay",hw5x0z7,t3_so0qz5,1644369864.0,False
so0qz5,Money. Eventually it can buy pussy.,hw5x11a,t3_so0qz5,1644369864.0,False
so0qz5,Money dont care about sex,hw5x3i1,t3_so0qz5,1644369894.0,False
so0qty,"""No"" after I asked her for some head.",hw5wypl,t3_so0qty,1644369837.0,False
so0qty,I don't know what I'm doing in my marriage. She was on her third husband.,hw5x48k,t3_so0qty,1644369903.0,False
so0qts,"I needed the ""pick me"" up right after a breakup",hw5x1l0,t3_so0qts,1644369871.0,False
so0qts,"Because they aren’t the my match, and I’m not digging what the other person is saying for some reason",hw5x2ia,t3_so0qts,1644369882.0,False
so0qtq,"Inside, there is no reason to extend the wet area",hw5x1qq,t3_so0qtq,1644369873.0,False
so0qov,"Wings, onion rings, nuggets! And lots of chips! 

Nono is anything healthy",hw5x48x,t3_so0qov,1644369903.0,False
so0qln,"A goddamn dishwasher. Maybe you don’t NEED one, but you’ll feel the difference.",hw5x0da,t3_so0qln,1644369857.0,False
so0qln,Money,hw5wvqk,t3_so0qln,1644369801.0,False
so0qln,Food,hw5wwwg,t3_so0qln,1644369815.0,False
so0qln,God,hw5wyzi,t3_so0qln,1644369840.0,False
so0qf5,Food,hw5wu9v,t3_so0qf5,1644369783.0,False
so0qf5,Everything,hw5wwbg,t3_so0qf5,1644369808.0,False
so0qf5,Taxes,hw5wwm3,t3_so0qf5,1644369811.0,False
so0qb7,"Honestly, it would be pretty functional. Im not saying we’re totally functional now, far from it, but the amount the world has changed from the pandemic shows we’re able to adapt if we ABSOLUTELY have to.",hw5wwdz,t3_so0qb7,1644369809.0,False
so0q4d,"I felt so proud of myself for figuring out how to solve one face of a Rubik's cube. Then I realized I had inadvertently solved the whole thing and my mind was blown. Even now that I've learned how to solve them quickly it still blows my mind how astronomical a coincidence that was, and I have literally no way to prove it happened.",hw5x15j,t3_so0q4d,1644369866.0,False
so0ptv,[r/luciddreamscapes](https://www.youtube.com/watch?v=A4B6-doaPMY),hw5wvsq,t3_so0ptv,1644369801.0,False
so0ptv,Wow the first time ive actually been rick rolled,hw5x210,t1_hw5wvsq,1644369877.0,True
so0ppr,"Married At First Sight (Australia) is truly vile. Just awful, awful people.",hw5wra7,t3_so0ppr,1644369748.0,False
so0ppr,"Realty, not reality",hw5wtss,t1_hw5wra7,1644369778.0,True
so0ppr,I thought it was a typo,hw5wwyq,t1_hw5wtss,1644369816.0,False
so0ppr,It’s not,hw5wyh1,t1_hw5wwyq,1644369834.0,True
so0ppr,I know that now,hw5x099,t1_hw5wyh1,1644369855.0,False
so0ppr,Same answer then.,hw5wxuz,t1_hw5wtss,1644369827.0,False
so0ppr,"Realty is an industry term which most accurately describes the services rendered by real estate agents, property managers and brokerages related to the purchase, sale, leasing and managing of real estate.",hw5x1cb,t1_hw5wxuz,1644369868.0,True
so0ppr,Honestly. The title suggests that,hw5wvay,t1_hw5wra7,1644369795.0,False
so0ppr,All of them,hw5wut4,t3_so0ppr,1644369789.0,False
so0ppr,The news,hw5wrvy,t3_so0ppr,1644369756.0,False
so0ppr,What’s that have to do with realty?,hw5wv8d,t1_hw5wrvy,1644369794.0,True
so0ppr,"Lol my bad, I was watching a movie and looked to quick thought it said reality, in that case any of those fake home buying shows",hw5x2uf,t1_hw5wv8d,1644369886.0,False
so0ppr,Anyone remember Dog Eat Dog?  Good premise but they were all attractive (and fake) as you can get.,hw5x4v8,t3_so0ppr,1644369911.0,False
so0pbl,"**Attention! [Serious] Tag Notice**

* [Jokes, puns, and off-topic comments are not permitted](https://www.reddit.com/r/AskReddit/wiki/index#wiki_-rule_6-) in **any** comment, parent or child.

* Parent comments that aren't from the target group will be removed, along with their child replies. 

* Report comments that violate these rules.

Posts that have few relevant answers within the first hour, and posts that are not appropriate for the [Serious] tag will be removed. Consider doing an AMA request instead.

Thanks for your cooperation and enjoy the discussion!


*I am a bot, and this action was performed automatically. Please [contact the moderators of this subreddit](/message/compose/?to=/r/AskReddit) if you have any questions or concerns.*",hw5wl6s,t3_so0pbl,1644369676.0,False
so0pbl,"Best guess? Because they're uninformed. At least that's what I hope the answer is because the bad that PETA has done very, ***very*** strongly outnumbers the good.

A Google search as simple as something like ""why do people hate PETA"" should be enough to sway any reasonable person who's currently unaware of how terrible the organization is.",hw5x0ni,t3_so0pbl,1644369860.0,False
so0pbl,"I don't know how they're still in business.

I'm not even an hardcore animal rights enthusiast, but even I feel like they've gone too far one too many times.

It's only a matter of time till it's ""supporters"" get some braincells.",hw5wzqk,t3_so0pbl,1644369849.0,False
so0p7l,"No, I haven’t",hw5wpnz,t3_so0p7l,1644369729.0,False
so0p7l,*close thread*,hw5wzf9,t1_hw5wpnz,1644369845.0,True
so0p17,All of them.,hw5wlxq,t3_so0p17,1644369684.0,False
so0p17,Lmao my brother has been talking about it. I haven’t looked into it yet but he claims I can make good money with it?,hw5wsk3,t1_hw5wlxq,1644369763.0,True
so0p17,You're brother's either being scammed or is guilty of scamming others.,hw5x4ng,t1_hw5wsk3,1644369908.0,False
so0p17,All NFT's are for dummies.,hw5wob2,t3_so0p17,1644369713.0,False
so0p17,"It's a digital certificate of ownership, hosted on a block chain, that you own a piece of digital art.

EDIT: Side note, don't try to ""invest"" in one. They have no tangible monetary value that's tied to anything useful or measurable, and the bubble that's going on right is basically just Dutch Tulips for nerds. If you want to own a piece of digital art, don't buy one. Learn photoshop and make one.",hw5wp2q,t3_so0p17,1644369721.0,False
so0p17,This seems insane,hw5wzk9,t1_hw5wp2q,1644369847.0,True
so0p17,"I have heard some people say that that does not give you copyright though, so it is basically just a meaningless token is that true or does it actually have some value to own the NFT?",hw5x2t6,t1_hw5wp2q,1644369886.0,False
so0p17,It's like a shitty poorly made money laundering scheme that makes bank off of selling images that were made in Microsoft Paint.,hw5wp5j,t3_so0p17,1644369723.0,False
so0p17,Microsoft paint?! Bruh I used to be a boss at paint pics,hw5wxyl,t1_hw5wp5j,1644369828.0,True
so0p17,A grift for suckers and morons.,hw5wq9q,t3_so0p17,1644369736.0,False
so0p17,Beanie Babies for the 21st century.,hw5wqw6,t3_so0p17,1644369744.0,False
so0p17,I have this NFT of a bridge I can sell you.,hw5wszh,t3_so0p17,1644369768.0,False
so0p17,"Right now, mostly scams. they are just tickets basically that can be as exclusive as the creator wants them to be. That may be a overly simplifying it, but you did say dummies.",hw5wyke,t3_so0p17,1644369835.0,False
so0p17,"Basically it’s a digital picture that you “own” which is tracked by a blockchain, something used to keep track of ownership of nft’s.",hw5wzdj,t3_so0p17,1644369845.0,False
so0p17,How do I start? Lmao. He claims his friend made a quick 1000 off of one,hw5x50q,t1_hw5wzdj,1644369913.0,True
so0p17,"It's basically a jpg. Think like a free porn pic. Now imagine paying $50,000 for it. It's an investment now....",hw5x52a,t3_so0p17,1644369913.0,False
so0p16,Germany won WW2,hw5wsuz,t3_so0p16,1644369767.0,False
so0p16,What if Ryan Leaf sat down and stfud and learned to work like Peyton Manning.,hw5wu2d,t3_so0p16,1644369781.0,False
so0p16,What if King George III and the British parliament had granted the American colonies a redress from their grievances and kept them loyal colonies?,hw5x1mc,t3_so0p16,1644369872.0,False
so0okw,whats reddit?,hw5wjtw,t3_so0okw,1644369660.0,False
so0okw,"I miss how free it was, it was a genuinely fascinating place to come 10+ years ago. Now there are so many rules and so many things are banned, it's so boring.",hw5wnyh,t3_so0okw,1644369709.0,False
so0okw,It was the wild west... Like the whole internet 1.0 was...,hw5wtdd,t1_hw5wnyh,1644369773.0,False
so0okw,"I still use old reddit.  Haven't even seen new reddit yet, though I hear RES is going bye bye, so maybe old reddit is on its last legs.",hw5wqoo,t3_so0okw,1644369741.0,False
so0okw,I liked the shitty old format back when it looked like Craigslist. Also I liked it better as a website than an app. Can't trust apps.,hw5wsmr,t3_so0okw,1644369764.0,False
so0okp,Books about us taxcode.,hw5wiv7,t3_so0okp,1644369649.0,False
so0okp,that would be USELESS in the UK,hw5wn9a,t1_hw5wiv7,1644369700.0,False
so0okp,the greek oddessy,hw5wpal,t3_so0okp,1644369724.0,False
so0okp,Self finance,hw5wubc,t3_so0okp,1644369783.0,False
so0okp,"Grace of Kings

Why? Because it's a good book and a fantastic example of world building and character writing",hw5x1qj,t3_so0okp,1644369873.0,False
so0okp,Maus.... Bwhahaha...,hw5x378,t3_so0okp,1644369890.0,False
so0ofa,"They won’t be anywhere, 10k isn’t enough",hw5winc,t3_so0ofa,1644369646.0,False
so0ofa,"No shit, that's like a months salary",hw5wp9p,t1_hw5winc,1644369724.0,False
so0ofa,"Wait, not even 10k each? Worst deal in the history of trade deals.",hw5wrdz,t3_so0ofa,1644369750.0,False
so0ofa,Nowhere. No way I'm getting company logos permanently on my body. Capitalism sucks enough.,hw5wllg,t3_so0ofa,1644369681.0,False
so0ofa,10k isn’t enough. For logos. I’d want a salary annually.,hw5wmzl,t3_so0ofa,1644369697.0,False
so0ofa,"I'd do it for free depending on the company. In fact one time I deadass reached out to a company and was like ""hey if I get a giant tattoo of your logo, will you pay for it?"" The person who responded on behalf of the company said they loved the idea but the company had way more important things to handle than that so it was pretty likely that nobody would ever see my request",hw5woce,t3_so0ofa,1644369713.0,False
so0ofa,10k per week and I might consider it.,hw5wpfq,t3_so0ofa,1644369726.0,False
so0ofa,Ford right on my fordhead,hw5wx64,t3_so0ofa,1644369818.0,False
so0oaj,When it stops giving them karma.,hw5wnk8,t3_so0oaj,1644369704.0,False
so0oaj,When we start to collectively downvote them,hw5wwqy,t3_so0oaj,1644369813.0,False
so0oaj,"I know sometimes people do it because it gives people a chance to answer the question and have their question not get lost in the trending one. 
But mainly because of  karma 🙄",hw5wyp7,t3_so0oaj,1644369837.0,False
so0o8h,Video Game streamer.,hw5wlry,t3_so0o8h,1644369683.0,False
so0o8h,I would love to run my own hobby/tabletop store.,hw5wlsb,t3_so0o8h,1644369683.0,False
so0o8h,Independent mattress tester.  Sleep on them.  Have sex on them.  Report my findings to companies.,hw5wmau,t3_so0o8h,1644369689.0,False
so0o8h,Porn assessor,hw5wyv5,t3_so0o8h,1644369839.0,False
so0o8h,Infectious disease expert,hw5x21u,t3_so0o8h,1644369877.0,False
so0o8h,High school baseball coach,hw5x4rp,t3_so0o8h,1644369910.0,False
so0o5t,"Why isn't Delaware as rich as it could be? It's a coastal Mid-Atlantic state with close proximity to New York, Philly, and DC. Tons of Fortune 500 companies are headquartered/registered/domiciled here. It has a rich history and culture. Amazing weather, landscape, and geography. Borders Maryland, the state with the highest median household income. So what's the catch?",hw5we9n,t3_so0o5t,1644369594.0,True
so0o5t,It’s pretty small isn’t it?,hw5wqll,t1_hw5we9n,1644369740.0,False
so0o5t,"Cuz nobody gives a shit about Delaware...

It's fucking Delaware.",hw5wid1,t3_so0o5t,1644369643.0,False
so0nyj,I… I think that’s me.,hw5wjfg,t3_so0nyj,1644369655.0,False
so0nyj,"Yeah, it's a real bummer.",hw5wl4o,t3_so0nyj,1644369676.0,False
so0nyj,"why yes, yes i do",hw5wq20,t3_so0nyj,1644369733.0,False
so0nyj,I hate lots of things. So yes probably on my list,hw5wq2f,t3_so0nyj,1644369733.0,False
so0nyj,"Both sides do it. Not sure what they did, but if my guy did something horrible, I'm sure there is some small out-of-context thing your guy did that will totally excuse it.",hw5wusv,t3_so0nyj,1644369789.0,False
so0ntb,"when i went to austrailia, i rode a kangaroo and noodle fought my brother. i was like 11, and too be honest, i should have been drop kicked by the kangaroo but didnt somehow.",hw5wlwn,t3_so0ntb,1644369684.0,False
so0nme,i love fez,hw5wdbv,t3_so0nme,1644369583.0,False
so0nme,What do you like about him?,hw5x2qq,t1_hw5wdbv,1644369885.0,True
so0nme,someone had to do it🤷🏻‍♀️,hw5wdj5,t3_so0nme,1644369586.0,False
so0nme,"Wasn't really a fight and in reality Nate would've beat Fez up had he not been hit with a bottle, still satisfying though.",hw5wfcx,t3_so0nme,1644369607.0,False
so0nme,I'm surprised Nate didn't even fight back tbh,hw5woe7,t1_hw5wfcx,1644369714.0,True
so0n69,"Rose's are red
The earth isn't hollow
Stop trying to chew
More than you can swallow",hw5wfwg,t3_so0n69,1644369613.0,False
so0n69,"Buy  
Bitcoins  
You  
Dipshit.",hw5wg8a,t3_so0n69,1644369617.0,False
so0n69,"do not worry

it will be fine

dont be sorry

have a good time",hw5wcfw,t3_so0n69,1644369572.0,False
so0n69,"Roses are red,

Violets are blue,

Go balls deep in bitcoin,

End of poem",hw5wisx,t3_so0n69,1644369648.0,False
so0n69,"Keep being you,

Your reasons are true.

Don't bend for them.

You're a real gem.",hw5wytc,t3_so0n69,1644369838.0,False
so0mxx,"If I have set a boundary, but they intentionally flaunt it. Goes with everyone. I don’t like being startled. If you know that, and startle be as a joke, we’re not friends.",hw5wgwd,t3_so0mxx,1644369625.0,False
so0mxx,"Extremely loud people

I have a sensitivity to sound and I can't handle extremely loud people, loud music, etc",hw5wkui,t3_so0mxx,1644369672.0,False
so0mxx,I would say just dont get really gross stuff everywhere and me clean it up.,hw5wifv,t3_so0mxx,1644369644.0,False
so0mxx,Have to clean up after yourself and pull your share with chores. I am not your mother or housekeeper,hw5wds9,t3_so0mxx,1644369588.0,False
so0mxx,Using my stuff or going in my room without permission,hw5x2u1,t3_so0mxx,1644369886.0,False
so0mvg,James Corden,hw5wci4,t3_so0mvg,1644369573.0,False
so0mvg,Can I pick everyone on The View and all its clones?,hw5wf6n,t3_so0mvg,1644369605.0,False
so0mvg,Jimmy Fallon and in actually love him but he could at least try to make his laughter sound and look real.,hw5wadr,t3_so0mvg,1644369548.0,False
so0mvg,Rob Derdrick,hw5wwuc,t3_so0mvg,1644369814.0,False
so0mvg,The Thunder Cunts! AKA the View.,hw5wtlt,t3_so0mvg,1644369775.0,False
so0mvg,"James Corden.

We really doing this again?",hw5wawx,t3_so0mvg,1644369554.0,False
so0mvg,The guy who always apologizes to Matt Damon,hw5wbul,t3_so0mvg,1644369565.0,False
so0mvg,Jimmy Kimmel.,hw5wex2,t1_hw5wbul,1644369602.0,True
so0mvg,His name is like Lord Voldemort to me,hw5wzvz,t1_hw5wex2,1644369851.0,False
so0mu9,Pretty bland.,hw5wl5m,t3_so0mu9,1644369676.0,False
so0mu9,Fester keeps farting,hw5w9my,t3_so0mu9,1644369539.0,False
so0mtt,"**Attention! [Serious] Tag Notice**

* [Jokes, puns, and off-topic comments are not permitted](https://www.reddit.com/r/AskReddit/wiki/index#wiki_-rule_6-) in **any** comment, parent or child.

* Parent comments that aren't from the target group will be removed, along with their child replies. 

* Report comments that violate these rules.

Posts that have few relevant answers within the first hour, and posts that are not appropriate for the [Serious] tag will be removed. Consider doing an AMA request instead.

Thanks for your cooperation and enjoy the discussion!


*I am a bot, and this action was performed automatically. Please [contact the moderators of this subreddit](/message/compose/?to=/r/AskReddit) if you have any questions or concerns.*",hw5w564,t3_so0mtt,1644369486.0,False
so0msd,"At this point?

All.",hw5wdnx,t3_so0msd,1644369587.0,False
so0msd,Snapchat,hw5weu2,t3_so0msd,1644369601.0,False
so0msd,Reddit,hw5wjej,t3_so0msd,1644369655.0,False
so0msd,Tumblr sadly,hw5wknp,t3_so0msd,1644369670.0,False
so0msd,Forgot that was a thing,hw5wp1h,t1_hw5wknp,1644369721.0,False
so0msd,Tik tok,hw5wqbf,t3_so0msd,1644369737.0,False
so0mky,"For example if I ever casually meet Jason Bateman I'm going to ask ""Hey aren't you that guy from Train?""

https://youtu.be/kVpv8-5XWOI",hw5w7ce,t3_so0mky,1644369513.0,True
so0mfz,.....what?,hw5w5ba,t3_so0mfz,1644369488.0,False
so0mfz,Get married. Pretty soon you'll be wishing for death.,hw5wt39,t3_so0mfz,1644369769.0,False
so0mfz,Knowing there is nothing you can do to stop it.,hw5wddn,t3_so0mfz,1644369584.0,False
so0mfz,"Just don't think about it, or pretend it won't happen (which was basically what religions do).",hw5wh4n,t3_so0mfz,1644369628.0,False
so0mfz,"Having the serenity to accept the things you cannot change, change the things you can, and the wisdom to know the difference.",hw5wvm7,t3_so0mfz,1644369799.0,False
so0mfz,"Realize that everything has an end, and that you should make the most of your life(which in most cases that is a very, very long time). doesn't mean you need to achieve the greatest or be #1, but to live like every day is your last and remember that the bad times make the good times so much nicer. stop saying you'll do that one thing later, and stop worrying about what everyone else thinks of your goals or things you enjoy.",hw5x1kn,t3_so0mfz,1644369871.0,False
so0mfz,"You commit suicide, I promise you’ll stop worrying after that",hw5wdvy,t3_so0mfz,1644369589.0,False
so0m8g,"Have sex with a living, willing participant.",hw5w73r,t3_so0m8g,1644369510.0,False
so0m8g,Riding motorcycles and chasing pussy,hw5w6dl,t3_so0m8g,1644369501.0,False
so0m8g,On the motorcycle? Because there’s no way pussy could outrun a motorcycle. So this just seems foolproof.,hw5wi80,t1_hw5w6dl,1644369641.0,False
so0m8g,Go for a ~~s~~troll,hw5w9y9,t3_so0m8g,1644369543.0,False
so0m8g,Literally anything else…,hw5x2ae,t3_so0m8g,1644369880.0,False
so0llm,they look happy,hw5w394,t3_so0llm,1644369463.0,False
so0llm,Redditors can *love?*,hw5wlcb,t3_so0llm,1644369678.0,False
so0lk7,"There's plenty of YouTube videos that can help you with that, good luck!",hw5w2pq,t3_so0lk7,1644369457.0,False
so0lk7,Online tutorials. It's all about knowing ever so slightly more than your colleagues. This way they'll never find out how much you lied on your resume about your Microsoft Office proficiency.,hw5w4ti,t3_so0lk7,1644369482.0,False
so0lk7,To use it,hw5wey8,t3_so0lk7,1644369602.0,False
so0lk1,STOP ASKING THIS GOSH DARN QUESTION!!!,hw5w4tv,t3_so0lk1,1644369482.0,False
so0lk1,It's not even a good repost lol.,hw5walw,t1_hw5w4tv,1644369551.0,False
so0lk1,Why are we still here just to suffer WITH ALL THOSE GOD DAMN REPOSTS,hw5wov7,t3_so0lk1,1644369719.0,False
so0lk1,Gertude,hw5wp96,t3_so0lk1,1644369724.0,False
so0lk1,You can stop riding the bandwagon now.,hw5vzj4,t3_so0lk1,1644369419.0,False
so0lk1,mckenzie,hw5w6yj,t3_so0lk1,1644369508.0,False
so0lk1,Farla,hw5wd95,t3_so0lk1,1644369582.0,False
so0lk1,Karen,hw5wq0z,t3_so0lk1,1644369733.0,False
so0lk1,I answered this a hundred times ago when you asked.,hw5wve1,t3_so0lk1,1644369796.0,False
so0lk1,Cockina,hw5wyk9,t3_so0lk1,1644369835.0,False
so0lk1,Bertha,hw5x0mp,t3_so0lk1,1644369860.0,False
so0lk1,"Helga

And also Dorcas",hw5vzwv,t3_so0lk1,1644369423.0,False
so0lk1,Norma,hw5w2lb,t3_so0lk1,1644369456.0,False
so0lk1,Naomi,hw5w5fq,t3_so0lk1,1644369489.0,False
so0lk1,Naomi is a great name,hw5wgpt,t1_hw5w5fq,1644369623.0,False
so0lk1,I love that name.,hw5wzp9,t1_hw5w5fq,1644369849.0,False
so0lif,Spiders. They're terrifying,hw5w5s1,t3_so0lif,1644369493.0,False
so0lif,I have good teeth but I still hate the dentist,hw5we1n,t3_so0lif,1644369591.0,False
so0lif,"Eye doctor.

I'm pretty paranoid about bad eye sight.",hw5wgrs,t3_so0lif,1644369624.0,False
so0lif,I still hate the dentist,hw5wm4s,t3_so0lif,1644369687.0,False
so0lhb,Sir Teddy.,hw5w3wk,t3_so0lhb,1644369471.0,False
so0lhb,Monkey,hw5w4gd,t3_so0lhb,1644369478.0,False
so0lhb,Teddy,hw5w69q,t3_so0lhb,1644369500.0,False
so0lhb,Suzy,hw5w93x,t3_so0lhb,1644369533.0,False
so0lhb,Was there any reason or did you just like the name Suzy,hw5wbwh,t1_hw5w93x,1644369566.0,True
so0lhb,Funny I had a stuffed bunny named Teddy.,hw5waae,t3_so0lhb,1644369547.0,False
so0lhb,"Felix. I loved names with ""x"" in it and it was the only one i knew when i was 5.",hw5wpxp,t3_so0lhb,1644369732.0,False
so0lhb,"Stump, he was a stuffed dog with very stumpy legs lol",hw5wt72,t3_so0lhb,1644369770.0,False
so0lgl,Dom or Mad,hw5w2fm,t3_so0lgl,1644369454.0,False
so0lgl,Wait this is actually a great question,hw5wfwt,t3_so0lgl,1644369613.0,False
so0lgl,"I agree. And I would like to ask my own: I have a nephew that’s NB, but wouldn’t calling them my “nephew” be somehow incorrect since it’s a masculine term?",hw5wvkd,t1_hw5wfwt,1644369799.0,False
so0lgl,Make your own rules imo.,hw5w9wt,t3_so0lgl,1644369542.0,False
so0lgl,One term I’ve heard is Ren,hw5wri2,t3_so0lgl,1644369751.0,False
so0lgl,Mam,hw5ws9e,t3_so0lgl,1644369760.0,False
so0lgl,Xom or Xad,hw5wsip,t3_so0lgl,1644369763.0,False
so0lgl,Non-binary parental figure,hw5wy31,t3_so0lgl,1644369829.0,False
so0lgl,Usually just their first names,hw5x29i,t3_so0lgl,1644369880.0,False
so0l7x,"Waking up on a cold winter morning in a nice warm bed on your day off, knowing you don't have to get up except for the fact you really have to pee.",hw5whoj,t3_so0l7x,1644369635.0,False
so0l7x,Having to get out from under my blanket of cold days,hw5ww0c,t3_so0l7x,1644369804.0,False
so0l7x,Other people,hw5w2kh,t3_so0l7x,1644369455.0,False
so0l7x,Other people,hw5w37o,t3_so0l7x,1644369463.0,False
so0kvv,"Once i saw someone saying ""pedophilia is okay if the child consents, americans are just too moralist""",hw5w0bu,t3_so0kvv,1644369429.0,False
so0kvv,Don’t be ridiculous. That’s when a flamethrower thru the internet is totally ok.,hw5w9pi,t1_hw5w0bu,1644369540.0,False
so0kvv,Every post that defends MAPs or Zoos,hw5w9eo,t3_so0kvv,1644369537.0,False
so0kvv,Every time some schmuck that plays video games and lives at home says they want to kill themselves because someone in the family or something or whatever predisposition decided to adopt and and their father was a psychotic psychopath and they don’t talk to their mom Because I’m not close anymore but she still buys video games food shelter school etc.,hw5wrhd,t3_so0kvv,1644369751.0,False
so0ktk,That all politicians suck.  They're not here for you,hw5w57v,t3_so0ktk,1644369487.0,False
so0ktk,"I'm leaning right, but the taxes are flawed, why aren't taxing major companies and why did we raise the lower tax for grocery items etc",hw5w4gu,t3_so0ktk,1644369478.0,False
so0ktk,"Canadian who leans right;  We have got to get off the fucking religious train, and stop picking 'the next white guy in line' for our leaders.  There's a fuckton of things the Left does right by me; Freedom to be who you want, your body your choice, and support programs for those who need it.  Socially I want to lean left, but politically I want a balanced budget, freedom to choose what I want to do, and to be left the fuck alone.",hw5wb4f,t3_so0ktk,1644369557.0,False
so0ktk,"It really doesn't matter which side you choose. They are all corrupt and have their own agenda outside of the ""promises"" that they make. They all give the illusion of transparency and choices but in reality the only transparency is that you can choose option a or option b and they both lead to option c..which is what they want.",hw5wdd6,t3_so0ktk,1644369584.0,False
so0ktk,Antisemitism,hw5wkad,t3_so0ktk,1644369666.0,False
so0ktk,American who leans right; the lack of support for the poor on my side.,hw5wl2u,t3_so0ktk,1644369675.0,False
so0ktk,Libs can be too accommodating when trying to establish common ground,hw5wms1,t3_so0ktk,1644369695.0,False
so0ktk,Leftie. “Defund the police” sounds like an idiot came up with that. Definitely want to put funds into non-police responders but “defund” is shitty phrasing.,hw5wmv7,t3_so0ktk,1644369696.0,False
so0ktk,Politics is just a dog and pony show. They don’t care about us.,hw5wno2,t3_so0ktk,1644369705.0,False
so0ktk,"Lean right, but people on the right in general have been too focused for years just on trying to win elections so that they can get their precious tax cuts.  Meanwhile we've let the Left completely take over and dominate much of the culture and most of the institutions.",hw5x1dr,t3_so0ktk,1644369869.0,False
so0ktk,"Liberal politicians on my “side” resign too quickly amid scandal.  Al Franken resigns over a silly photo.  Meanwhile, the GOP runs Herbert the Pervert for the AL senate seat.  Grow a pair.

Also, the woke PC shit has gone far enough.  Things  are bad enough, without pissing away the last vestiges of our collective sense of humor about it.",hw5x61d,t3_so0ktk,1644369925.0,False
