post_id,title,score,upvote_ratio,subreddit,url,num_comments,body,created
sohjvy,he predicted it!,2,1.0,gaming,https://i.redd.it/3bjv15p73ug81.jpg,0,,1644423968.0
sohi6d,Anyone fancy checking out my gaming website??,2,0.67,gaming,https://www.mothgaming.co.uk/,1,,1644423844.0
sohi5k,I'll leave this here,1,0.6,gaming,https://i.redd.it/v7t3jw0u2ug81.jpg,0,,1644423842.0
sohhwp,"Does anyone know about or have played this fun old game? Came out in 2002, only released in Japan & Europe.",3,1.0,gaming,https://www.reddit.com/gallery/sohhwp,0,,1644423824.0
sohgc0,"Sony & Polyphony Digital launch ""Sophy"" AI racing competitors",3,1.0,gaming,https://www.ai.sony/articles/sonyai009/,0,,1644423706.0
sohfd2,what do you mean covering the entire map with tracks isn't a viable strategy?!?!?,15,1.0,gaming,https://i.redd.it/mja4g8l22ug81.png,1,,1644423631.0
sohf26,legend of zelda: link to the past. snes or gba?,1,1.0,gaming,https://www.reddit.com/r/gaming/comments/sohf26/legend_of_zelda_link_to_the_past_snes_or_gba/,2,which is the better version to play? thought gba might have been but the snes version actually looks better despite being 16bit. any advice?,1644423611.0
sohddr,"Open World Games Should Come With A ""Linear"" Option",0,0.33,gaming,https://www.reddit.com/r/gaming/comments/sohddr/open_world_games_should_come_with_a_linear_option/,3,"I love a good open world game but I have limited game time and just can't pour 40 or 80 hours into a 10 main plot. Let me flip a switch that is COMPLETE INDEPENDENT of the difficulty setting that shuts off side quests and balances for whatever gear or xp or other progression you didn't get.

The vast majority of open world games have linear plots at their core that can be experienced in a fraction of the ""play time"" of the game. I should be able to do so without resorting to cheats or spoiling the rest of the game with walkthroughs or what.",1644423492.0
sohd99,Can anyone tell me what old Nintendo (i think) game I'm describing?,1,0.67,gaming,https://www.reddit.com/r/gaming/comments/sohd99/can_anyone_tell_me_what_old_nintendo_i_think_game/,2,"youre like this little kid ninja. and you eat rice balls. and you can turn into a fat little ninja too. and collect gold coins.

it's a 20+yr old memory of a game I played at a friend's house (I wasn't allowed to have video games) so I dont have much to work with 

thanks!",1644423483.0
sohcdu,[oc] It's happening guys! I can feel it :D,3,0.71,gaming,https://i.redd.it/m516pulh1ug81.png,1,,1644423420.0
sohcbk,Please recommend to me a long story game. I'm starving for a good storytelling game,2,1.0,gaming,https://www.reddit.com/r/gaming/comments/sohcbk/please_recommend_to_me_a_long_story_game_im/,10,,1644423415.0
sohbvm,Why PC Game Ports STILL Suck,1,1.0,gaming,https://www.youtube.com/watch?v=tF013HYQd2Q,0,,1644423383.0
sohbnj,It’s a miracle,17,0.95,gaming,https://i.redd.it/u9lhc75f1ug81.gif,2,,1644423366.0
sohbne,Lets play a game,1,0.6,gaming,https://i.redd.it/02dhbk4f1ug81.jpg,13,,1644423366.0
sohaep,Is this minecraft anymore ? Luna HD Resourcepack,4,0.7,gaming,https://i.redd.it/jwid25c51ug81.jpg,3,,1644423281.0
soh747,"switch to rechargeable if you still haven't, might be heavy on pocket at start but is a great investment in long term",12,0.88,gaming,https://i.redd.it/cjx4or1h0ug81.jpg,7,,1644423050.0
soh6ww,Did anyone ever play Backyard Baseball? Or just me,7,1.0,gaming,https://i.redd.it/5vrx1rsf0ug81.gif,3,,1644423036.0
soh5os,"""The Fergie-Heist""",0,0.35,gaming,https://i.redd.it/tfixycm60ug81.png,4,,1644422951.0
soh0hh,First character personalisation,2,1.0,gaming,https://www.reddit.com/r/gaming/comments/soh0hh/first_character_personalisation/,2,"I'm writing an essay for my degree on virtual identity. I was wondering if anyone knew the first digital game to have detailed character personalisation? 
I mean eye colour, skin colour, hair style...the full lot, rather than stats ect.",1644422574.0
sogwqf,Horizon Forbidden West - PlayStation 4 Footage | February 18th,1,1.0,gaming,https://gfycat.com/greedybeneficialblobfish,0,,1644422347.0
sogtr0,Is there a way to compensate the heating problems of a gaming laptop?,1,0.67,gaming,https://www.reddit.com/r/gaming/comments/sogtr0/is_there_a_way_to_compensate_the_heating_problems/,5,"I already have a fan, sadly it's not enough to compensate the heating problems my laptop has. I've also tried undervolting with a built in software, it said that it does decrease the average temperature, but im not sure how effective it s. Are there any other methods to cool down my laptop even more? My laptop is a Victus 16-d0108TX.

And yes i already know that i should get a gaming PC instead. Sadly it's not negotiable at the moment under my current circumstance. So i have to save for it while using this laptop.

Also, while im at it, is there a way to determine my gpu and cpu health? My laptop has been through a lot of rough shut downs due to overheating so i wanna check my laptop's health.",1644422134.0
sogsjt,Why was Mass Effect 3 controversial?,2,0.67,gaming,https://www.reddit.com/r/gaming/comments/sogsjt/why_was_mass_effect_3_controversial/,11,"I was out of gaming for about a decade (college, career, baby), but I'd occasionally browse r/gaming. I remember some outrage at or disappointment with Mass Effect 3 at launch. I got back in a couple years ago since I have some free time now, and I finally finished the trilogy (ME2 was one of my favorite games a decade ago). I think ME3 is great! The endings were a little silly, but the main plot has always been a silly, especially since ME2. The individual characters and stories were so much fun, especially Priority: Tuchanka and Priority: Whatever Tali's Planet is. Was the disappointment all about the ending?",1644422047.0
sogmz8,Pokemon Legends Arceus Digital FOundry analysis,3,0.8,gaming,https://www.youtube.com/watch?v=df0uMcDe41A&feature=emb_title,0,,1644421606.0
sogmt7,What is an original game idea that you have that you'd wish was made in a real game?,0,0.5,gaming,https://www.reddit.com/r/gaming/comments/sogmt7/what_is_an_original_game_idea_that_you_have_that/,11,Let's see if you guys are more creative than modern game devs.,1644421592.0
sogh51,The last game you played is the new world you wake up in. How screwed are you?,0,0.45,gaming,https://www.reddit.com/r/gaming/comments/sogh51/the_last_game_you_played_is_the_new_world_you/,40,,1644421164.0
sogeik,This is what I get for forcing Red Dead Redemption 2 to run on my 13 year old computer.,322,0.95,gaming,https://i.redd.it/7xkogu53utg81.gif,29,,1644420961.0
sog9xs,Why do people seem to hold singleplayer games in such a higher regard than multiplayer games?,0,0.16,gaming,https://www.reddit.com/r/gaming/comments/sog9xs/why_do_people_seem_to_hold_singleplayer_games_in/,38,"I don't get it, it sort of just comes off as elitism. Whenever people talk about multiplayer games on this subreddit, or Reddit in general, you can be sure there will at least be a few people talking about how they hate multiplayer games for whatever reason.

Is it just typical elitism from gamers? Am I missing something?

EDIT: Yeah, it's just elitism. Guess I should've expected that from the venn diagram of gamers and Redditors.",1644420615.0
sog7bu,Story Game Recommendations?,1,0.6,gaming,https://www.reddit.com/r/gaming/comments/sog7bu/story_game_recommendations/,25,"So currently, I don't really have jack shit to play. Everything I have I've either beaten, quit due to toxicity (cough R6 cough) or the ending got spoiled (what are the fucking chances someone is still posting the ending to Fallout 4 and Dying Light in 2022). I just don't have anything to play rn, and it makes me sad cause I do really fucking enjoy video games, but I have no drive to play them rn. 

 My favorite games so far are both Portals, Detroit Become Human, and Titanfall 2 (the campaign, as soon as I bought the game the servers went down, so I got like 2 or 3 online matches in before it broke. fun as hell while it lasted). 

My main and pretty much only issue with all 3 of those games is how little time they took. I beat both portals in 2 days, beat the Titanfall 2 campaign in like 5 hours, and finished Detroit in 2. I've played all 3 of these in the past year, and each one actually made me excited to get home from school and hop on the same way they did as a kid. Just trying to find that again.

So I'm looking for story games that will last me longer than a day. I know I mentioned Dying Light and Fallout 4, and again fucking TikTok spoiled both game's endings, so I'm not really as into playing them anymore. Probably still gonna finish Fallout tho since it's fucking great so far. But I want a game that I can feel attached to the characters, something where I'm genuinely into it. I don't really care about graphics or age, recommend as far back as you like cause I probably haven't played it (strict parents are fun). Idk if this is too much to ask or not, but any and all help is welcome. Also, any game in general too I guess, doesn't have to be a story game, I've just had the best experience with story games so far. Thanks!",1644420416.0
sog6wj,Sean Murray trolling me again!! 😂 No Man's Sky Experimental Multitool,0,0.5,gaming,https://youtu.be/EGDWfuRL7Ls,0,,1644420387.0
sog541,BR Suc,67,0.85,gaming,https://i.redd.it/0sn1qv25stg81.jpg,14,,1644420245.0
sog2jg,"if there is one, is there any DLC that you consider to be either better than the main game, or, it's own game all by itself (it doesn't need to have a standalone release for this). My two easy choices would be Secrets of the Maw for little nightmares, and my favorite game ever made, Minerva's Den",5,0.86,gaming,https://www.reddit.com/r/gaming/comments/sog2jg/if_there_is_one_is_there_any_dlc_that_you/,15,"Title says it all, one more i could think of would be Kingdom Hearts III's Re:Mind scenario

&#x200B;

Edit: sorry for some punctuation errors folks",1644420055.0
sog1ek,Kirby Supremacy,44,0.89,gaming,https://i.redd.it/isn8lzebrtg81.jpg,1,,1644419969.0
sog0b4,Me when the,111,0.93,gaming,https://i.redd.it/zjjsocx2rtg81.jpg,19,,1644419890.0
sofysd,Changed the sky of the volcano world in my upcoming castlebuilder game. Which is better?,14,0.8,gaming,https://www.reddit.com/gallery/sofysd,24,,1644419774.0
sofx6n,I painted some ghouls from fallout!,47,0.92,gaming,https://i.redd.it/3io7qzocqtg81.jpg,6,,1644419652.0
sofvu1,Video Games Ranked By All-Time Esports Earnings (1998-2021),4,0.75,gaming,https://www.youtube.com/watch?v=yw8hfeVYcpg&t=-17s,3,,1644419551.0
sofv1r,What is the best gaming trailer on your opinion?,2,0.58,gaming,https://www.reddit.com/r/gaming/comments/sofv1r/what_is_the_best_gaming_trailer_on_your_opinion/,16,"For me MGSV E3 - 2014
go go go...",1644419489.0
sofsp7,NBA 2K League relocating main studio from NY to Indianapolis,2,0.75,gaming,https://apnews.com/article/coronavirus-pandemic-nba-sports-health-indiana-3bce90b286b4783079ba477df97b7279,2,,1644419320.0
sofr3o,One of the coolest things I've made yet: Meganium! (Pokemon),99,0.95,gaming,https://i.redd.it/5kozdqx0ptg81.jpg,5,,1644419198.0
sofqm9,Nintendo64 vs GameCube let’s settle this debate once and for all,0,0.27,gaming,https://i.redd.it/x6oe1y7xotg81.jpg,32,,1644419162.0
sofq4z,My collection of GBA games for my PC emulator. Tell me what I should get next.,4,0.57,gaming,https://i.redd.it/81b840usotg81.jpg,57,,1644419124.0
sofpnv,The Salt Mines are flooding,3,0.57,gaming,https://i.redd.it/yoitjwipotg81.jpg,3,,1644419091.0
sofpmj,"Schizophrenic Shooter Sharing Post #1: E.Y.E Divine Cybermancy, by StreumOn Studio.",4,0.83,gaming,https://www.reddit.com/gallery/sofpmj,3,,1644419088.0
sofijt,Does Days Gone had a good story?,3,0.72,gaming,https://www.reddit.com/r/gaming/comments/sofijt/does_days_gone_had_a_good_story/,16,just asking,1644418591.0
sofh1x,Lvl 2 in Pokémon unite wooo,0,0.5,gaming,https://i.redd.it/g8dxgvrvmtg81.jpg,2,,1644418476.0
soff93,Katt Williams is the Gaming OG (How Katt Williams Convinced His Son Not to Get the Xbox),5,0.57,gaming,https://www.youtube.com/watch?v=6cgMlXaFs7w,8,,1644418341.0
sofdgq,There is a nice gift for those who find the dev room in Dying Light 2.,6,0.87,gaming,https://i.redd.it/k2uevt6zltg81.jpg,1,,1644418212.0
sofcnv,Gamers in Manchester like to share their opinions publicly 😂,6,0.69,gaming,https://i.redd.it/pnnxtphwltg81.jpg,11,,1644418149.0
sofazd,Did i get lucky? 🤯 i bought both. Monitor was just at 75$ like what?! 🤯,21,0.76,gaming,https://www.reddit.com/gallery/sofazd,31,,1644418009.0
sof34f,What are some of your fav story games?,5,0.86,gaming,https://www.reddit.com/r/gaming/comments/sof34f/what_are_some_of_your_fav_story_games/,15,"Fr looking for some reccs as well, but my faves are: ASCIV and ASCII, The Outerworlds, RDR 1 and 2, pretty much all of the GTA franchise, The Last of Us, Fallout New Vegas and 4, Far Cry 3, Witcher 3, Skyrim, and WoW.",1644417410.0
sof2ru,Good budget PC,0,0.43,gaming,https://www.reddit.com/r/gaming/comments/sof2ru/good_budget_pc/,13,"Looking for a good gamin PC not very expensive, doesn't have to be new.",1644417381.0
sof2md,My BloodRayne cosplay~,870,0.9,gaming,https://i.redd.it/8auev4eljtg81.jpg,49,,1644417371.0
sof28h,"22 Year Old Game, Still an active community",8,0.73,gaming,https://i.redd.it/goau5ckejtg81.jpg,19,,1644417341.0
sof097,Intellivision Entertainment Will Be Bankrupt In A Couple Of Months,9,0.86,gaming,https://i.redd.it/fbymixeqitg81.png,4,,1644417184.0
soezqk,Your favourite game boss is now your personal bodyguard - how would you fare?,2,0.63,gaming,https://www.reddit.com/r/gaming/comments/soezqk/your_favourite_game_boss_is_now_your_personal/,19,Morbidity curious to see what kinds of answers I’d get for a question like this.,1644417147.0
soex2g,"Shenanigans in Foxhole, a persistent war MMO",1,0.56,gaming,https://www.youtube.com/watch?v=-jrKaSrXgL8,0,,1644416968.0
soetr7,What on gods steel earth is this first option,478,0.94,gaming,https://i.redd.it/ddr8e9vlhtg81.jpg,61,,1644416705.0
soepca,The camera is so close to your character in Plants vs. Zombies Garden Warfare 2.,1,1.0,gaming,https://www.reddit.com/r/gaming/comments/soepca/the_camera_is_so_close_to_your_character_in/,0,Does anyone find that the camera in garden warfare 2 is so close to your character? The camera is never that close in battle of neighborville.,1644416386.0
soeowd,Has anyone played this game before? I saw it on gamepass and downloaded it and it’s kinda fun,0,0.2,gaming,https://i.redd.it/zvln5j8kgtg81.jpg,4,,1644416351.0
soeorv,Check out the new r/ARKEXPLICIT community page!,0,0.07,gaming,https://i.redd.it/i3hgfe9jgtg81.jpg,2,,1644416341.0
soemww,A nice ending of a classic space-themed story. Can you guess which game is it?,0,0.5,gaming,https://i.redd.it/iag76rhzftg81.gif,2,,1644416191.0
soem10,One of the greatest character select screens ever,23,0.78,gaming,https://i.redd.it/h32m53jrftg81.png,11,,1644416122.0
soekf8,"The Developer: ""The player probably wont get past wave 30"". The players:",0,0.35,gaming,https://gfycat.com/vapidimmediatearabianwildcat,6,,1644415989.0
soejc1,are u planning to transition to virtual reality game anytime soon,0,0.45,gaming,https://www.reddit.com/r/gaming/comments/soejc1/are_u_planning_to_transition_to_virtual_reality/,19,,1644415909.0
soei16,A Brief history of Gaming (>1990),29,0.85,gaming,https://i.redd.it/fo7c7x1vetg81.jpg,16,,1644415814.0
soe5dh,What soundtrack do you often listen to?,44,0.79,gaming,https://i.redd.it/v0v9ebd5ctg81.jpg,38,,1644414867.0
soe26p,When you play Guile too much,3,0.72,gaming,https://streamable.com/eiixzn,2,,1644414611.0
soe0j9,"300 guns from different games pixel art. They all come from different games (not exactly ""video games"")",48,0.86,gaming,https://i.redd.it/2neyz24j7tg81.png,43,,1644414472.0
sodtso,How many hours have you managed to spend in a single game? Do you feel bad about it retrospectively?,4,0.67,gaming,https://i.redd.it/nokptkxb9tg81.jpg,32,,1644413919.0
sodpwe,EA being EA (y tf do emotes cost more than skins?),7,0.71,gaming,https://www.reddit.com/gallery/sodpwe,14,,1644413577.0
sodpup,[QUESTION] Looking for games where you feel overwhelmingly powerful,8,0.79,gaming,https://www.reddit.com/r/gaming/comments/sodpup/question_looking_for_games_where_you_feel/,22,"I need more games like ""Star Wars - The Force Unleashed""

Witcher and the old Assassins Creed was good as well.",1644413574.0
sodmz6,Games with features to sit down and relax,1,1.0,gaming,https://www.reddit.com/r/gaming/comments/sodmz6/games_with_features_to_sit_down_and_relax/,9,"Maybe I am not looking right, but I kinda think why most games are more exhausting than relaxing nowadays is simply because there is little to no relaxing feature in games anymore. I mean like features that let you immerse better into the world and simply take in the ambiance. Where your character can just build a zone to relax, sit down, sleep, eat, drink and just taking the time in that world before heading out to more adventures and fights. Most games are rushing from one point to the next or the one that do offer similar features are simply lowered down like they let your character rest but you are stuck in some sort of menu to do other things like watching over your character's skill and so on which is of course nice but once you done it you done it and then you wanna leave that menu but can't chill around. This is why I appreciate walking feature so much in games where the character is usually on the run to remind you to relax from time to time.  
Do you know if there are any games with those features? And do you also crave more experiences like these in a game?",1644413366.0
sodh4q,What do you think of this article on Needy Girl Overdose?,0,0.4,gaming,https://www.dualshockers.com/hololive-streaming-needy-girl-overdose-explained/,6,,1644412920.0
sodgtw,Evil Dead The Video Game,5,0.86,gaming,https://www.reddit.com/r/gaming/comments/sodgtw/evil_dead_the_video_game/,4,"So here's everything we know about this so called ""Definitive Evil Dead Experience"" in terms of the title:


They got the actors behind Pablo, Kelly, Shelly, Scott, to lend their voices to their movie and show roles 


There will be no story mode for the game, Tim Wilitis who worked with ID for many years on the Quake Franchise, Doom, Rage and now runs Saber interactive has stated in an interview that there will be a few single player missions, and offline multiplayer being playable with A.I. bots but the main focus of the game is asymmetrical multiplayer with PVP/PVE gameplay. 


The S-Mart, Army Of Darkness Medievel Armor Ash, and Evil Dead 1 Ash skins are locked behind preorder dlc and not unlockable in the main game. 


The ""Collectors edition"" which comes with a replica Necromicon Ex Mortis, Vinyl Soundtrack, hardcover art book, dlc codes for a Savini designed ash skin, army of darkness knight outfit, Evil dead 1 ash skin, s-Mart uniform skin, has already been sold out due to scalpers getting their hands on the preorders too. 


It's a PVP/PVE focused experience where 4 players will work together to stop the Deadites from causing chaos in the multiplayer maps available, with each character a different class, while one player gets to play as a Kandarian demon using the environment, deadites, and eventually be able to possess players. 


The car is somewhat useable in cutscenes and traveling to certain areas of the map when needed. 


It will be on PS4, Xbox One, PC, Xbox Series X, PS5 and Nintendo switch. 


I can expect people to be trolls as any asymmetrical multiplayer experience by spawn killing, team killing, cheating with hacked bots, ruining the game for all of the people that play it. 


Bruce says this is the definitive evil dead experience in the interview with Geoff Keighly, and Tim Wilitis but I don't think it is to be honest. I don't think a lot of the Evil Dead fanbase was asking for a multiplayer PvP and PVE style experience from the franchise.",1644412898.0
sode4b,What is a game that was abandoned during development that developers should have kept working on?,3,0.62,gaming,https://i.redd.it/jkylh7vk5tg81.jpg,19,,1644412667.0
sodduf,A tired father [Pokemon Legends Arceus],10,0.71,gaming,https://i.redd.it/mcbxnn6e5tg81.jpg,5,,1644412641.0
sod9oa,Best gaming company?,0,0.5,gaming,https://www.reddit.com/r/gaming/comments/sod9oa/best_gaming_company/,18,"For me it’s Remedy Entertainment. It seems like they really love what they do and they want to make great games, not just money (also my favourite person, Sami Järvi, works for them).",1644412287.0
sod5sb,"Probably one of my favourite games, that no one remembers or talk about.",5,0.73,gaming,https://i.redd.it/sbnvv5tj3tg81.jpg,5,,1644411976.0
sod2wa,What is your favourite horror game?,0,0.47,gaming,https://i.redd.it/ws6c4imv2tg81.gif,34,,1644411750.0
socvdm,Ever love a game even though you know its flawed?,101,0.88,gaming,https://i.redd.it/fa4ufqz11tg81.jpg,44,,1644411167.0
soctzj,"Fuck off with the remaster wishes, I want new ideas, settings, and innovations",835,0.82,gaming,https://www.reddit.com/r/gaming/comments/soctzj/fuck_off_with_the_remaster_wishes_i_want_new/,223,"Every remaster and such takes away resources from new titles that could take gaming forward. I don't want stagnation, I want evolution. Old games that were good back then still are good as they are. I could pick up and play Ocarina of Time just fine as it is and would enjoy it immensely.

If you just need to have rehashes of old games to feel alive, request games that had good ideas executed poorly, like Neverdead.",1644411053.0
soctkh,Games that are best experienced by going in blind?,4,0.71,gaming,https://www.reddit.com/r/gaming/comments/soctkh/games_that_are_best_experienced_by_going_in_blind/,16,I've been chasing that feeling of diving into the depths of Subnautica for the first time. I hadn't known anything about that game and figuring out things myself was extremely satisfying. Any other games like that?,1644411018.0
soct8u,"I put up with a lot when it comes to gaming i don’t mind live service games, i dont mind pay to play games(WoW). But the fact i have to update a controller that was working just fine and now its not is insane.",0,0.36,gaming,https://i.imgur.com/qPwUy9C.jpg,18,,1644410990.0
socs7p,mouse pad/mouse mat is not working,1,0.67,gaming,https://www.reddit.com/r/gaming/comments/socs7p/mouse_padmouse_mat_is_not_working/,4,"i washed my mousepad like they said in internet and now my mouse doesnt slide normally on the pad, can this be fixed or do i have to buy new?",1644410892.0
socr9g,Recommandations please,2,0.76,gaming,https://www.reddit.com/r/gaming/comments/socr9g/recommandations_please/,8,"Hi!
My brother and i was wondering if there was a game for PS4 that is a little similar to World of Warcraft, not an MMO, but just for playing him and i online, as we just moved away from our parents, ans would like an online game, but not a game that require us to be online at specific times and not monthly payments, as we both are studying and don't have the time to play as often.
Just an online role playing game we can play together.

Heard about diablo III and Divinity original sin II, but are there others? And what would you recommend of the two?

Thx 🙏🙏",1644410798.0
soci8e,I've never liked vegetables until now.,9,0.61,gaming,https://i.redd.it/pgew12yzwsg81.png,7,,1644409969.0
sochj0,"Yeah I'm a COD gamer, how could you tell?",377,0.88,gaming,https://i.redd.it/hr94fhrdxsg81.jpg,36,,1644409906.0
socggi,I got this after finishing GTA V for the second time. Never seen it the last time I finished it,9,0.75,gaming,https://i.redd.it/z0gxd284xsg81.jpg,8,,1644409815.0
socb2s,I still play these,14,0.59,gaming,https://i.redd.it/anho4swkvsg81.png,40,,1644409297.0
soc8fk,When you have unlimited inventory and you are greedy,121,0.98,gaming,https://i.redd.it/1rbqhuilusg81.png,13,,1644409046.0
soc7mg,Some games have bunched up on my epic account and I want you to recommend something good to me PS. I have already tested everything on the first frame,0,0.38,gaming,https://www.reddit.com/gallery/soc7mg,7,,1644408963.0
soc72v,Redemption in Tahiti,7,0.67,gaming,https://i.redd.it/joai4hwfusg81.jpg,0,,1644408912.0
soc4lp,Why do mobile gamers complain when free games have ads or micro transactions?,0,0.27,gaming,https://www.reddit.com/r/gaming/comments/soc4lp/why_do_mobile_gamers_complain_when_free_games/,11,It's a free game because mobile gamers are tight af with their money and think a £5 game is too expensive. How else are devs supposed to make money when nobody will buy their games?,1644408683.0
sobp1f,Hmmmm,0,0.4,gaming,https://www.reddit.com/r/gaming/comments/sobp1f/hmmmm/,1,How to get assassin creed Valhalla in cheapest prize in ub connect or epic,1644407253.0
