post_id,title,score,upvote_ratio,subreddit,url,num_comments,body,created
snzjjz,Are we expecting too much?,0,0.32,gaming,https://www.reddit.com/r/gaming/comments/snzjjz/are_we_expecting_too_much/,29,"The past 18 months have been rough for the industry, with AAA titles being shot down within weeks of launch, and it's got me thinking.

Are gamers expecting too much? 

Gaming back in the 2000s felt great; games like call of duty, guild wars, battlefield etc were great places to meet like-minded gamers, catch up with friends & just kill some free time. 

Jumping forward to 2017 onwards, gaming has become more of an obsession, with many gamers even threatening developers over social media. Games like Cyberpunk, Battlefield 2042, and now the recently released Dying Light 2 have all undergone intense feedback. 

Something that I see on a daily basis is the ""I want a refund"" threads started in every sub-category of gaming across reddit. As someone who has a normal career path (engineer), I find it hard to believe that people are upset over spending £60.00 on a game they didn't like, its just £60.00. Many spend more than this on cosmetics, clothes, or even takeaways in a single week. 

So my main question is, are gamers no longer gaming for fun? 

Is gaming addiction a much bigger problem than we thought?

Is the gaming community just insanely hard to please?

Is £60 supposedly wasted a big deal? After all, games play no meaningful role in reality or society.",1644366463.0
snzh0o,Wholesome Videogames,3,1.0,gaming,https://www.reddit.com/r/gaming/comments/snzh0o/wholesome_videogames/,11,What game has your pick for having the most wholesome moments?,1644366268.0
snzfuj,Facebook may stop operating in Europe,17,0.76,gaming,https://i.redd.it/gxpy03y5bpg81.png,7,,1644366180.0
snzfbk,Anyone tried getting a refund for Battlefield 2042 through the BBB?,1,0.6,gaming,https://www.reddit.com/r/gaming/comments/snzfbk/anyone_tried_getting_a_refund_for_battlefield/,4,,1644366140.0
snzeeu,Did my first console repair!,7,0.75,gaming,https://i.redd.it/wjo0nfk1bpg81.jpg,1,,1644366069.0
snzdyb,Trip to France has gone too far,17,0.78,gaming,https://i.redd.it/6tqdd8uxapg81.jpg,3,,1644366033.0
snzbw7,What was the first game you can remember that your parents/guardian didn't like you playing?,17,0.74,gaming,https://i.redd.it/i47llucgapg81.jpg,48,,1644365871.0
snz8h5,I feel like I’m wrong in being annoyed about the different %’s-off here. Can someone please explain to me the “good reason for it if you look at it from ‘this’ perspective” argument that will put my mind at ease?,0,0.33,gaming,https://i.redd.it/h4zi9flp9pg81.jpg,12,,1644365620.0
snyzdi,Is Darkrai necessary to complete the Pokedex in Pokemon Legends: Arceus?,1,0.6,gaming,https://www.reddit.com/r/gaming/comments/snyzdi/is_darkrai_necessary_to_complete_the_pokedex_in/,5,"I don't have a Brilliant Diamond or Shining Pearl save file which is needed to encounter Darkrai in Legends. Sooo, can i still complete the Dex and meet Arceus, even if I dont have caught Darkrai?",1644364940.0
snyw8i,Dying light 2 is the new cyber punk I guess,0,0.35,gaming,https://www.reddit.com/r/gaming/comments/snyw8i/dying_light_2_is_the_new_cyber_punk_i_guess/,35,"I bought dying light 2 for the ps5 a few days ago and i can't get past the 2 hour mark without the game corrupting 

https://imgur.com/a/yt80KgT

This is the second time this has happened after deleting everything dying light 2 and re installing, updating the game and clearing cache. I tried posting something on r/dyinglight but got downvoted to hell because people claimed they didn't hear anything about it even though there's tons of articles about dying light 2 crashing. There's even one by Forbes talking about how millions won't beable to play dying light 2 because they printed a broken game and there's still alot of people like me that don't have internet. 

https://www.forbes.com/sites/krisholt/2022/02/03/dying-light-2-reviews-bugs-day-one-patch-slow-internet/

This is ridiculous that industry thinks it's ok to sell us broken products. If I were to sell people a knownly faulty product I'd be sued, but these developers think it's ok to sell us products they know is broken.

It's not my PS5 that's the issue, I can play any game in my library disc or downloaded they all still work. The only one that doesn't work is dying light 2.

Edit: Everyone downvoting and talking shit is the exact reason why developers are putting broken products and getting away with it. You guys are normalizing false advertising and anyone against it gets downvoted.",1644364739.0
snyrrz,Who remembers this 2007 gem and would you play a sequel or remaster? I would 110%,30,0.72,gaming,https://i.redd.it/r0n2o7t16pg81.jpg,31,,1644364409.0
snyrrw,"What ever happened to our friend, Jeff Green?",0,0.25,gaming,https://www.reddit.com/r/gaming/comments/snyrrw/what_ever_happened_to_our_friend_jeff_green/,4,"He was the literal pillar of gaming journalism a few years back (i.e., 2013). 

&#x200B;

Not sure who he is? Look at previous editions of Computer Gaming World and you will see that he was kind of a big deal.",1644364409.0
snyms4,Which sports games are cross platform?,0,0.4,gaming,https://www.reddit.com/r/gaming/comments/snyms4/which_sports_games_are_cross_platform/,5,"Im wondering for PC players of Fifa, Madden, NBA 2k etc, is there a very large population online to play head to head games, or is the pool really small because its limited to PC players?

Is there anywhere I can find statistics for numbers of PC players of these games on the servers?",1644364044.0
snyig2,Single player and multiplayer are good,0,0.44,gaming,https://www.reddit.com/r/gaming/comments/snyig2/single_player_and_multiplayer_are_good/,8,"I like single-player and multiplayer as I rather not play the same campaign over and over again and,an example of this to me is cod once you are done with single player move on to multiplayer.",1644363729.0
snyafr,"What video game sound effect can you still hear perfectly, years later?",54,0.88,gaming,https://www.reddit.com/r/gaming/comments/snyafr/what_video_game_sound_effect_can_you_still_hear/,289,,1644363158.0
sny9vv,A good gaming laptop for someone on a budget?,2,1.0,gaming,https://www.reddit.com/r/gaming/comments/sny9vv/a_good_gaming_laptop_for_someone_on_a_budget/,12,I want a laptop that can run steam and terraria really well.   I'm just on a budget at the moment,1644363121.0
sny6vm,I am older than...,6,0.8,gaming,https://www.reddit.com/r/gaming/comments/sny6vm/i_am_older_than/,35,Ghosts 'n Goblins. How about you?,1644362910.0
sny0cj,Uhhh What Does This Mean? I’m the only player.,0,0.21,gaming,https://i.redd.it/5vi37y980pg81.jpg,9,,1644362433.0
snxx83,"Given the nature of the Oldest House in Control, a procedurally generated level design approach would have fit in quite nicely. With some rooms being custom for the story.",6,0.73,gaming,https://www.reddit.com/r/gaming/comments/snxx83/given_the_nature_of_the_oldest_house_in_control_a/,0,"Also the procedurally generated rooms could have been quasi infinite, which would also fit in with the nature of the place.",1644362209.0
snxukp,hey guys im thinking about buying an xbox 360 or a ps3 but im not sure which to get. any reccomendations?,5,0.74,gaming,https://www.reddit.com/r/gaming/comments/snxukp/hey_guys_im_thinking_about_buying_an_xbox_360_or/,12,,1644362018.0
snxtim,"Cod Vanguard is good, battlefield 2042 is good, halo 4 was the best in the hall franchise, TF2 is terrible, warzone is terrible",0,0.22,gaming,https://www.reddit.com/r/gaming/comments/snxtim/cod_vanguard_is_good_battlefield_2042_is_good/,47,,1644361935.0
snxsyr,which controller feels better at hand?,0,0.5,gaming,https://www.reddit.com/r/gaming/comments/snxsyr/which_controller_feels_better_at_hand/,21,Ps5 or Series X?,1644361895.0
snxllj,FPS games that are easy?,0,0.5,gaming,https://www.reddit.com/r/gaming/comments/snxllj/fps_games_that_are_easy/,13,"I am 38 years old and the last time I played any game was when I was 16. I just got ps4 but not sure if it's a lack of practice, my dyspraxia or my very bad hand-eye coordination but I really struggle with games now.

Could you please recommend the easiest 1st person shooter game? I struggle with non-linear stuff but I am guessing all games will be open world. Just need something easy I bought Wolfenstein and Far cry 5 and GAVE up.

As I am trying to get back into gaming with my PS4 and Nintendo surely there have to be easier games for starters, more keen on ps4 games. Thanks in advance for your suggestions easier the better",1644361364.0
snxksx,Pokemon Legends : Arceus (dunkview),13,0.75,gaming,https://www.youtube.com/watch?v=-vak7MUaa5E,0,,1644361304.0
snxka0,Choosing the right font spacing for your gaming event important,155,0.9,gaming,https://i.redd.it/ayycspn6wog81.jpg,32,,1644361262.0
snxil7,So true,0,0.33,gaming,https://i.redd.it/h0nil2rfwog81.png,6,,1644361164.0
snxgq8,The mistakes Wii make,13,0.71,gaming,https://i.redd.it/1cukmis0wog81.jpg,15,,1644361019.0
snxdbb,Need gaming suggestions,0,0.5,gaming,https://www.reddit.com/r/gaming/comments/snxdbb/need_gaming_suggestions/,10,"I need Reddit's help, I need a game... I have  a couple major itches I need to scratch, I need a survival  game, preferably where I need to watch everything, hunger, thirst, temperature, everything, but I don't want to have to deal with a  lot of enemies, like I want the survival challenge without looking over my shoulder constantly, I want to build and survive with that survival challenge.... Not the forest, sons of the forest or the long dark... Those are already on my nerd radar.

Another I need is something mindless but relaxing, like any sort of base builder or nature thing, I just need something with a decent serotonin boost especially after playing sekiro haha. Examples I guess would be slime rancher, spiritfarer, Minecraft... Bit more mindless and relaxing haha.

Don't worry about the price, I can handle that. Any and all game suggestions are more than welcome, indie or professional, I really don't mind either. Thank you all so much for any help you can offer",1644360766.0
snxchb,Who else excited for ark 2?,5,0.78,gaming,https://www.reddit.com/r/gaming/comments/snxchb/who_else_excited_for_ark_2/,3,,1644360711.0
snxc6g,"I'd rather just take the deer, thank you",3,0.72,gaming,https://gfycat.com/spotlessthoughtfulbufeo,0,,1644360686.0
snxa5q,How many of you don't replay games with multiple endings?,5,0.78,gaming,https://www.reddit.com/r/gaming/comments/snxa5q/how_many_of_you_dont_replay_games_with_multiple/,16,I ask cos I play a game by immersing myself into the character and cannot imagine making any choices differently simply because the choice I make will always be the choice I make. I am aware I am missing out on different story branches and endings but that doesn't bother me. Does anyone else do this?,1644360545.0
snx6ez,What was your best excuse of you losing in a game?,11,0.61,gaming,https://i.redd.it/i95pll1ttog81.jpg,10,,1644360271.0
snx1vp,My fan art of Celeste. She found her own star fragment 🥺,32,0.82,gaming,https://i.redd.it/vjgzda8usog81.jpg,4,,1644359946.0
snx1gh,Oh... That's not good,50,0.83,gaming,https://i.redd.it/dlpy55tqsog81.png,24,,1644359913.0
snwyzl,Can Nintendo games be reworked like Xbox/Playstation games?,0,0.5,gaming,https://www.reddit.com/r/gaming/comments/snwyzl/can_nintendo_games_be_reworked_like/,24,"My main example would be the huge growth of No Man's Sky from launch to now, its an entirely different beast. 

Does Pokémon Arceus even have the ABILITY to be reworked if they wanted to enhance the graphics? Or add more landscape effects?

Gameplay and how you feel about the effects now I'm just curious IF it's possible on Nintendo games",1644359730.0
snwpng,"Motion blur, why is it even a thing?",20,0.78,gaming,https://www.reddit.com/r/gaming/comments/snwpng/motion_blur_why_is_it_even_a_thing/,22,"Anyone have a good explanation as to why motion blur is even a thing in gaming? Literally everyone I know turns it off.

I get it for film making and photography, but leave it out of games already",1644359074.0
snwpjj,I've made some icons of some games from the 00s I played to death as a teenager 🤩,124,0.93,gaming,https://i.redd.it/bbuzc228qog81.jpg,15,,1644359065.0
snwma3,One of the Best Green Shell in Mario Kart i've Ever seen,15,0.73,gaming,https://youtu.be/a1nfvqckDqk,3,,1644358833.0
snwgqy,hope it's something worth while,56,0.81,gaming,https://i.redd.it/3ruqh62eoog81.jpg,32,,1644358448.0
snwdfk,"Hey, I’m looking for a game for someone, they don’t have much experience with video games, and want a calm, no time pressure, smaller game. The one game I know they like is 2 dots. Any suggestions?",5,0.73,gaming,https://www.reddit.com/r/gaming/comments/snwdfk/hey_im_looking_for_a_game_for_someone_they_dont/,40,,1644358211.0
snwbij,Best home arcade cabinet?,1,0.67,gaming,https://www.reddit.com/r/gaming/comments/snwbij/best_home_arcade_cabinet/,2,What's everyone's thoughts on home arcade cabs. I'm leaning towards the iiracde. Currently the cheapest out of most brands but has the most to offer. I just don't love the form factor.,1644358075.0
snwbfb,The duality of a man,14,0.77,gaming,https://i.redd.it/bplzj649nog81.jpg,4,,1644358069.0
snw8oe,What are some examples of games set in the mountains?,3,1.0,gaming,https://www.reddit.com/r/gaming/comments/snw8oe/what_are_some_examples_of_games_set_in_the/,12,Any suggestions? I loved playing Call of Duty 4 and Far Cry 4 because of the really awesome scenery.,1644357881.0
snw4ab,Found this UNDERRATED GEM yesterday called 'mine sweeper',87,0.67,gaming,https://imgur.com/9geEMcT,66,,1644357611.0
snw4a7,Are power trips healthy?,0,0.38,gaming,https://www.reddit.com/r/gaming/comments/snw4a7/are_power_trips_healthy/,7,"!Wall of text warning!

I've never heard of this problem and genuinely don't know who to talk to about it.

I come from a very competitive fighting scene, me and my friends started in dragonball xenoverse, before moving to games like fighter Z, blazblue, guilty gear, tekken etc.

We were very present in the dragonball scene. We were normal weebs just having fun until they released the esl online ""tournaments"". Then everything changed.

We turned our lives into ""Work, Eat, Train, Repeat"" for a very long time. It became more than a game to us. We probably took it more seriously than we should have. 

We spent a very long time fighting eachother and naturally wanted to expand our skillsets, seeking random players to fight, often calling on multiple players to fight us individually.

Winning these 1v2/1v3 fights is the singlehanded, most intense power trip i have ever experienced. The only time i've come close to this feeling is in dark souls, successfully defending against multiple invaders simultaneously. 

Most of us have moved on to more casual things. I didn't. Every game i play seems to revolve around this desire to feel unimaginable power. And i find myself bored if i can't satisfy the feeling in me. 

I constantly feel like i have to practice to be better than my friends, it feels almost toxic when they want to have a good time and i simply can't help but obliterate them. I can't laugh, i can't say anything or give them advice because it feels so toxic, to the point where i don't want to play with my friends in fear of going overboard or ruining what could have been a good time.

I hate it because i genuinely enjoy casual games and playing with my friends, but simply can't play them anymore for this reason. Its almost addictive. I loved heavy rain, indigo prophecy and the life is strange games. But for the life of me i could not play detroit become human, despite loving the story, characters and world to death. 

Is this just a me thing? Should i stop playing games all together? Should i talk to a psychologist?",1644357610.0
snvy7q,Please help,1,0.67,gaming,https://www.reddit.com/r/gaming/comments/snvy7q/please_help/,4,So I started playing Fortnite on a PS4 and I just switched to an Xbox not too long ago. When I got on my Xbox I didn’t have my stuff even tho my Xbox live account and my PlayStation live account are both linked to the same epic games account. Someone please help I have been trying to fix this for ever!!,1644357176.0
snvx2a,Do you like weed & podcasts about games to go along with your gaming?,0,0.31,gaming,https://www.reddit.com/r/gaming/comments/snvx2a/do_you_like_weed_podcasts_about_games_to_go_along/,5,"Then check out The Game Budz! Four life-long best friends get high and talk about video games. It’s a good time!

[Game Budz Podcast](https://podcasts.apple.com/us/podcast/game-budz/id1599308321)",1644357096.0
snvwir,"Here's a game im pretty sure we have all played or at least heard about, so i made a video about it",3,0.71,gaming,https://youtu.be/p2zxJqHCFfU,0,,1644357058.0
snvuu0,What do you hope to see in the Nintendo Direct tomorrow?,43,0.79,gaming,https://i.redd.it/y2vg1wrwjog81.jpg,59,,1644356942.0
snvq8z,"Ever heard of Kohan II: Kings of War? well, without a doubt, this is one of the most underrated RTS games of all time with a surprisingly developed narrative. I played this game when I was very young. Still to this date, one of my favorites. Came across the CD last night, and want to play it again!",5,0.86,gaming,https://www.reddit.com/gallery/snvq8z,4,,1644356612.0
snvp16,Why is PlayStations ban/suspension system so broken,0,0.47,gaming,https://www.reddit.com/r/gaming/comments/snvp16/why_is_playstations_bansuspension_system_so_broken/,15,"I was recently suspended for 2 weeks for harassment after sending ""How old are you? Cus what you jus said makes you sound childish"" in a message to someone. But I've been sent grabify links, cussed out, called slurs in messages and voice chat. Have had disturbing photos sent through messages. And these dudes never get suspended.",1644356525.0
snvi1u,Why hasnt the remastered happened yet?,4098,0.88,gaming,https://i.redd.it/495x3ek2hog81.jpg,824,,1644356021.0
snvhm6,TERRY VERSUS EVIL RYU 1.1 STAGES HD,1,0.67,gaming,https://youtu.be/2bkhaUgepUc,2,,1644355992.0
snvfkz,name the best iwin games go,0,0.25,gaming,https://www.reddit.com/r/gaming/comments/snvfkz/name_the_best_iwin_games_go/,1,(i found the best like those find stuff games and also there is this game where you are a pritive man and you have to build or something and gather wood to continue. Theres also this find stuff game. i really like one where a other house has been run over with robots and a old man was captured inclouding you but you escaped) give name and opinion please,1644355843.0
snvck5,What game is a trailblazer but has not aged as well as the games that it inspired?,4,0.75,gaming,https://www.reddit.com/r/gaming/comments/snvck5/what_game_is_a_trailblazer_but_has_not_aged_as/,30,,1644355627.0
snvbbp,Should I get Assassin's Creed Unity on PC or Xbox One X?,1,0.6,gaming,https://www.reddit.com/r/gaming/comments/snvbbp/should_i_get_assassins_creed_unity_on_pc_or_xbox/,5,"Hi  


I want to finally play Unity after all these years, but I'm a bit torn between buying it for PC or Xbox One X. I know from experience that Ubisoft can't make a decent PC port, so I expect a lot of crashes and a lot of time spent on searching for ""easy fixes"" to annoying bugs. I presume on Xbox the game is much more stable, but on the other hand I suspect that the PC version looks much better and can reach a higher frame rate.   


And here I am with a dillema. Can anyone here speak from experience and recommend me which version should I get?  


Cheers.",1644355534.0
snv7oz,Odd phrasing in video games.,10,0.72,gaming,https://i.redd.it/hppi3blxeog81.jpg,7,,1644355274.0
snv0ke,"Just got fibre optic, and have a question about my PS5 connection speed.",3,0.81,gaming,https://www.reddit.com/r/gaming/comments/snv0ke/just_got_fibre_optic_and_have_a_question_about_my/,16,I have ran general house test and it says I am getting what i meant to but when i run a connection test on my PS5 it says i am getting 100 down and 100 up when i meant to be getting 500 down and 100 up?. So confused i am hard wired too with cat7.,1644354759.0
snuxt0,"Nintendo Direct To Air Tomorrow, Wednesday 9th February 2022",2,0.67,gaming,https://www.nintendolife.com/news/2022/02/nintendo-direct-to-air-tomorrow-wednesday-9th-february-2022,0,,1644354568.0
snumuw,getting old,0,0.44,gaming,https://www.reddit.com/r/gaming/comments/snumuw/getting_old/,18,"Today is the day, bought a new game and the xbox elite controller 2 but had no time to play.

To the younger people in here, enjoy the moments where you can play a new game on the first day. Because at one point, it will be your last time.",1644353831.0
snulkp,Found this relic in my basement today.,22,0.83,gaming,https://i.redd.it/36mw660eaog81.jpg,2,,1644353741.0
snukk3,Why must it be alt+f3 to open the filters,24,0.79,gaming,https://i.redd.it/0sdyfx56aog81.jpg,2,,1644353667.0
snuk0h,Raiden (Mortal Combat) graffiti on a railcar,56,0.83,gaming,https://imgur.com/mj2FW96,4,,1644353627.0
snuje2,Are there any games that you really want to play but as soon as you start it gets boring and not interesting,0,0.43,gaming,https://www.reddit.com/r/gaming/comments/snuje2/are_there_any_games_that_you_really_want_to_play/,44,,1644353583.0
snufvw,"(imagery may be mildly unsettling to viewers. marked as SPOILER for safety precautions!) I love Your Turn To Die so much and it's almost because of these frames - if this content is not allowed in this subreddit, please flag it so i can take it down. thanks!",0,0.33,gaming,https://www.reddit.com/gallery/snufvw,1,,1644353325.0
snudpr,Hey everyone!,0,0.17,gaming,https://ezrewards.gg/?ref_id=q2tE4 it can get ur acc baneed so use an at to be safe do it if u like,0,,1644353161.0
snuc84,You get video game exploits IRL,0,0.5,gaming,https://www.reddit.com/r/gaming/comments/snuc84/you_get_video_game_exploits_irl/,17,whats the first thing you do?,1644353051.0
snu8p0,My favorite games (pls no hate… pls xD),2,0.51,gaming,https://i.redd.it/p0ulxqfk7og81.jpg,52,,1644352792.0
snu303,The Unnerving Rise of Video Games that Spy on You,1,0.56,gaming,https://www.wired.com/story/video-games-data-privacy-artificial-intelligence/,5,,1644352379.0
snu2jz,It's Dark souls but i'm Chaotic good,2,0.6,gaming,https://i.redd.it/2il28yy76og81.png,1,,1644352349.0
snu274,"Saw this today, and now I refuse to believe it is not canon.",1276,0.92,gaming,https://i.redd.it/tndag3j66og81.jpg,66,,1644352325.0
sntyf8,Sifu Nightclub fight,6,0.69,gaming,https://youtu.be/_YjRHrpuFfo,0,,1644352040.0
sntyb8,Why don’t you like Raiden in MGS2?,0,0.17,gaming,https://www.reddit.com/r/gaming/comments/sntyb8/why_dont_you_like_raiden_in_mgs2/,12,,1644352032.0
sntvzx,Custom car painted PS5 panels,0,0.5,gaming,https://www.instagram.com/reel/CZuozgThrrM/?utm_medium=copy_link,0,,1644351864.0
sntuhn,"Mass effect trilogy is $30 in the playstation store, never played it before is purchasing it recommended?",25,0.76,gaming,https://www.reddit.com/r/gaming/comments/sntuhn/mass_effect_trilogy_is_30_in_the_playstation/,55,,1644351754.0
snts1p,Dying Light 2 | Water and Lightning Parkour Challenge (Gold Medal),0,0.4,gaming,https://youtu.be/h-xcUh4VV1o,7,,1644351585.0
sntr19,Dying Light 2 | The Raid (Gameplay) Pt. 6,0,0.39,gaming,https://youtu.be/6i5taQqyXAc,12,,1644351511.0
sntoft,The Case of the Missing Spartan - Halo Infinite,0,0.33,gaming,https://youtube.com/watch?v=n02ypl5EITQ&feature=share,0,,1644351327.0
snti8w,"Before and after pic. Really loving my new ps5 skin. It was a pain to put on, not perfect but I think It looks okay. Just something I wanted to share with y'all",45,0.8,gaming,https://www.reddit.com/gallery/snti8w,8,,1644350889.0
sntg11,Would you guys wanna be able to interact with your Pokémon in Legends of Arceus?,0,0.38,gaming,https://youtube.com/watch?v=pxZ0cjIV79A&feature=share,6,,1644350731.0
sntfu7,What an Arcane-style Overwatch show will be?,0,0.33,gaming,https://www.reddit.com/r/gaming/comments/sntfu7/what_an_arcanestyle_overwatch_show_will_be/,3,,1644350716.0
snt9y5,Reddits algorithm needs a little more tuning.,10,0.81,gaming,https://i.redd.it/j3tdr9n80og81.jpg,6,,1644350327.0
snt658,Does anyone know the name of this mobile game? I looked through the comments and none of them said the name. I played this all the time when I was younger and I wanna play it again,9,0.66,gaming,https://i.redd.it/lcft431gzng81.jpg,10,,1644350061.0
snt3cv,Can someone suggest a horror game (AAA or indie) where the monster has an interesting mechanic?,3,0.71,gaming,https://www.reddit.com/r/gaming/comments/snt3cv/can_someone_suggest_a_horror_game_aaa_or_indie/,11,"Beyond the usual ""don't let the monster catch you"", what horror games have interesting monster mechanics?",1644349856.0
snszi9,unpopular opinion: I loathe GOOD Graphics!,0,0.23,gaming,https://www.reddit.com/r/gaming/comments/snszi9/unpopular_opinion_i_loathe_good_graphics/,30,"I LOATHE it when game developers try to have their game look like a high budget movie, I prefer minimalism and lower rez in my game graphics, I prefer Legends arceus looking the way it does rather than having raytracing, and 54k resolution, because that would require having more EXPENSIVE hardware to run it, and i'm not inclined to pay the troll toll for an rtx 3080 (which would cost me my legs and kidneys) I prefer it lower end so the games can run on more AFFORDABLE hardware. And yeah I can hear the pitchfork wielders readying themselves, but just remember this, not everyone can afford $3k+ hardware, so games that are lower rez and not photorealistic, are easier to run on more affordable hardware, are more beneficial for the less fortunate.",1644349582.0
snsz0v,Dying Light 2 - Anyone else encountered this bug?,0,0.25,gaming,https://youtube.com/watch?v=CDcRZNte2so&feature=share,3,,1644349547.0
