post_id,title,score,upvote_ratio,subreddit,url,num_comments,body,created
sn7z4r,Need help finding a game,0,0.5,gaming,https://www.reddit.com/r/gaming/comments/sn7z4r/need_help_finding_a_game/,3,"From what I remember it was an Indie, Boss Rush, top down view, with 2D graphics. I think the protagonist was female but quiet and I think the final boss was a dark skinned angel in white clothing.",1644285955.0
sn7ya6,What is the hardest video game boss you’ve ever fought?,519,0.89,gaming,https://i.redd.it/licz4awmoig81.jpg,687,,1644285890.0
sn7u3b,Activision made a record $5.1 billion from microtransactions in 2021,39,0.86,gaming,https://www.tweaktown.com/news/84421/activision-made-record-5-1-billion-from-microtransactions-in-2021/index.html,27,,1644285597.0
sn7siu,What do you guys think about the Motorstorm series? I only got to play Arctic Edge.,2,0.63,gaming,https://i.redd.it/frinxtt5nig81.jpg,4,,1644285467.0
sn7llq,"Something's wrong, I can feel it",135,0.9,gaming,https://i.redd.it/xrxrzv6slig81.jpg,25,,1644284931.0
sn7jyn,Favorite/Recommended Games For Autistic Adults,2,0.63,gaming,https://www.reddit.com/r/gaming/comments/sn7jyn/favoriterecommended_games_for_autistic_adults/,11,"Hello, I am looking for some game recommendations. I am HFD autism so I was curious as to some games that that very much appeal to that part of me.

Thanks.",1644284802.0
sn7i91,"Would you guys be so as kind to let me know if any of these games are worth anything, before I get rid of them?",7,0.69,gaming,https://i.redd.it/pz6nlnyzkig81.jpg,8,,1644284674.0
sn7h52,Second son ps5 microstutter.,1,0.67,gaming,https://www.reddit.com/r/gaming/comments/sn7h52/second_son_ps5_microstutter/,0,"


So I’m playing second son on the ps5 and the graphical setting I have is higher resolution. The frame rate itself is great but occasionally there will be an ever so slight microstutter. Usually when I’m smoke dashing or neon dashing around. Is this normal? It’s pretty slight so maybe I’m just one of the only people noticing as I have an eagle eye with this stuff. Assuming this isn’t normal why could this be happening?",1644284592.0
sn7gmn,"The many posters of Metal Gear Solid 2, extracted. [OC]",335,0.9,gaming,https://i.redd.it/q4d5ep8jkig81.png,53,,1644284552.0
sn7bgl,Pay no attention to the flaming racoon ring...,13,0.74,gaming,https://i.redd.it/5fqlhdlbjig81.jpg,2,,1644284157.0
sn75wm,What is the reason one would sell this game ungraded?,0,0.38,gaming,https://ebay.us/fXkId5,5,,1644283728.0
sn74uc,finally got my girl a functional computer... we didn't have a mouse pad,0,0.44,gaming,https://i.redd.it/vl76kq9yhig81.jpg,10,,1644283646.0
sn740n,Cartoon Network versus Shonen Jump crossover fighting game,20,0.68,gaming,https://i.redd.it/ipdcs83rhig81.png,25,,1644283581.0
sn73jo,What game forced the most difficult decision on you?,3,0.62,gaming,https://www.reddit.com/r/gaming/comments/sn73jo/what_game_forced_the_most_difficult_decision_on/,21,For me it was Detroit become human.,1644283546.0
sn6yla,Must Play CRPGs,1,0.6,gaming,https://www.reddit.com/r/gaming/comments/sn6yla/must_play_crpgs/,12,"Ok, so I remember looking at games like Hollow Knight, Shovel Knight, Ori, Super Meat Boy, Cuphead... and thought, alright this is definitely for kids, even though I was a kid myself lol. but now someone recommended some newer games like Hades, Disco Elysium, Inscryption and Nobody Saves The World and said you have to play them, and after I did I was like holy \*\*\*\* these games are amazing and so much fun especially Disco Elysium which was even more than amazing.

After that I found the CRPG genre and there were so many games with many different opinions. Also as a mostly AAA gamer (CoD, Far Cry...), I know next to nothing about these games so when someone says ""Pillars of Divinity is absolutely great, the story, the characters, everything"" and another guy comes and says ""pillars is completely forgettable and you're better off playing the superior old CRPGs."" I'm not sure who to believe lol.

So here I am looking for the Must Plays, and for some reason my brain can't handle the fact of playing something newer like Baldur's Gate 3 before playing 1 or 2, so from old to new would be appreciated. I've also heard some great things about Planescape Torment which seems to be pretty old, so if you think a game is worth playing even today because of the gameplay, story or both, again the recommendation would be appreciated.",1644283159.0
sn6qw6,Apparantly there’s still a console war so Im just gonna say… GENESIS DOES WHAT NINTENDON’T,1,0.52,gaming,https://www.reddit.com/r/gaming/comments/sn6qw6/apparantly_theres_still_a_console_war_so_im_just/,23,Genesis has BLAST PROCESSING,1644282593.0
sn6p4b,Uh-oh 😈,3,0.59,gaming,https://i.redd.it/27y041ifeig81.jpg,3,,1644282458.0
sn6oxb,Looking to interview an indie developer for a school project,0,0.5,gaming,https://www.reddit.com/r/gaming/comments/sn6oxb/looking_to_interview_an_indie_developer_for_a/,4,"What the title says, I'm looking to do a short podcast for my senior project in high school, and since I've always enjoyed gaming I thought it would be neat to focus on indie game development. If you're interested, DM or leave a post and hopefully we can work something out.",1644282443.0
sn6j2b,I've been working on a Star Fox inspired space shooter and just released an Alpha you can play now!,3,0.72,gaming,https://www.youtube.com/watch?v=1SVDjsvqlUw,0,,1644282016.0
sn6bs3,Aerith Paintings- Happy Birthday Aerith! Here are some paintings I’ve done to celebrate!,414,0.94,gaming,https://www.reddit.com/gallery/sn6bs3,24,,1644281455.0
sn64aa,Name a competitive multiplayer game that has a non-toxic playerbase,3,0.58,gaming,https://www.reddit.com/r/gaming/comments/sn64aa/name_a_competitive_multiplayer_game_that_has_a/,55,,1644280879.0
sn63sg,Playstation's refund policy is borderline a scam.. it's going to drive consumers away and they couldn't care less..,0,0.27,gaming,https://www.reddit.com/r/gaming/comments/sn63sg/playstations_refund_policy_is_borderline_a_scam/,30,"I'm just gonna say it cuz it's true. Every other platform allows you to download a paid product, usually has a 2 hour time-frame for you to try the game, see if it's broken or has issues until you are locked out of a refund.. that's fair and reasonable and seems to work well because it's also usually supported by automated systems.

&nbsp;

Not Sony.. Hell no.

&nbsp;

Sony is supposed to uphold a marketplace for consumers where publishers and their ""finished and playable"" products make it there to be bought by consumers.. If you buy a game, download it and it's a broken mess that keeps crashing or corrupting your saves, hell i've had Black Ops games hard crash my system corrupting my entire system software forcing me to redownload the system software onto a USB stick and formatting my entire drive losing everything.. but guess what? they will still deny you a refund, why? because their policy states that the moment you download the product or have any kind of game progression, your refund is ineligible. yeah..

&nbsp;

The most asinine part of this policy is that you have to put blind faith in Sony and the publisher that their product is not broken (which is hardly the case with most games today unfortunately), but in order to even determine if a game is broken to begin with, you'd have to download the game and play it to start experiencing the above.. 

&nbsp;

Their policy is literally a scam.. they know a product is broken or they simply don't screen the products they host on their marketplace, they take consumers money, and deny them a refund after they download to find out the product is faulty then get refused their money back. idk about you guys.. but that's a god damn scam.

&nbsp;

I talked to a Sony rep about this on the phone earlier, and they literally are just robots, they don't have any human emotion or sensibility in their responses, they literally just read from transcripts based upon these policies, but that's not really a gripe because they're just people doing their jobs and making a living with what they can.. so i get it, but still.. Sony is clearly anti-consumer, all they care about is your money and greed, they don't give a shit if you never buy from them again and move to Xbox or Steam or whatever platform else, Sony is just content with their ways and don't care to change while everyone else is evolving to be better.

&nbsp;

I've supported Sony for so many years.. but enough is enough, I can't continue to support such an anti-consumer company anymore that borderline scam's their customers and doesn't blink twice about it either.",1644280844.0
sn62pf,That memory you didn’t even know you had. ‘Circa 1992’,36,0.8,gaming,https://i.redd.it/m0duqsod9ig81.jpg,12,,1644280759.0
sn61i5,How is Battlefield 2042 as of now?,0,0.33,gaming,https://www.reddit.com/r/gaming/comments/sn61i5/how_is_battlefield_2042_as_of_now/,14,"I’ve been holding off on this game for a while now. I know a lot of people also have been waiting. I really want to play it, it seems like fun but I’ve been hearing it’s a disappointment, I’m sure everyone knows it is lol. But I haven’t heard much about it as of January 2022. It’s at GameStop for $35. Is it worth it at this price?",1644280670.0
sn614b,What External Hard Drives would be good to get for my laptop?,1,0.66,gaming,https://www.reddit.com/r/gaming/comments/sn614b/what_external_hard_drives_would_be_good_to_get/,4,I just realized that I might not have enough space for Elden Ring So I decided that I might get an External Hard drive for Elden Ring as well as other big games in the future. My laptop is an Acer Nitro 5 and it only has about 250 gbs of space. One hard drive I'm thinking of buying is here -->  [﻿​​ (amazon.com)](https://www.amazon.com/Seagate-Portable-External-Hard-Drive/dp/B07CRG94G3/ref=sr_1_3?crid=2BBV5HNHUFWIR&keywords=hard+drive&qid=1644279107&s=pc&sprefix=Hard+%2Ccomputers%2C422&sr=1-3)  But I'm not sure if it's good to get so please let me know if this is a good choice or is there another hard drive that's either as expensive as this one (Which is about 60 bucks) or under (Nothing over) That would be a good choice for my laptop.,1644280640.0
sn5x0j,"Mouse aiming, with my arm.",1,1.0,gaming,https://www.reddit.com/r/gaming/comments/sn5x0j/mouse_aiming_with_my_arm/,4,"Recently I've been trying to make the switch to arm aiming because it is much better. I got a lightweight mouse and have been trying to aim with my arm. I've just been doing aim lab (aim lab sens 1.0) , and I'm not sure what I should be using as my DPI settings. Currently I'm doing 1100. Is that just to fast? 

I'm open to any reccomendations. Please spill anything you need to say.",1644280324.0
sn5vus,Why is Peter Molyneux hated so much?,0,0.29,gaming,https://www.reddit.com/r/gaming/comments/sn5vus/why_is_peter_molyneux_hated_so_much/,32,"Every time I hear his name mentioned, it sounds like he diddled a kid or something. All I know about him is he made Fable? Can someone explain who he is, and if and why he's hated so much? Is he like another Randy Pitchford? Googling didn't help much, but maybe I'm misinterpreting this...",1644280237.0
sn5uvs,"What’s your favorite gaming community? I’m not just talking about the game, but the fan base, the memes, everything else that goes along with it.",4,0.83,gaming,https://www.reddit.com/r/gaming/comments/sn5uvs/whats_your_favorite_gaming_community_im_not_just/,18,,1644280170.0
sn5ony,Is DC Universe Online worth getting?,0,0.5,gaming,https://www.reddit.com/r/gaming/comments/sn5ony/is_dc_universe_online_worth_getting/,6,"I tried playing it over a year ago-ish, and I didn't like it back then. Has it improved since then?",1644279713.0
sn5ixe,Do you guys think this laptop could run gta v at alright fps and if no what games could run alright on this,0,0.27,gaming,https://www.ebay.com/itm/Lenovo-ThinkPad-X220-Intel-Core-i5-2540M-2-6-GHz-8-GB-RAM-500-GB-HDD-12-5-Win10-/175145433079?mkcid=16&mkevt=1&_trksid=p2349624.m46890.l6249&mkrid=711-127632-2357-0,11,,1644279277.0
sn5ie0,Fortnite - improving my basic approach!,0,0.29,gaming,https://www.reddit.com/r/gaming/comments/sn5ie0/fortnite_improving_my_basic_approach/,0,"I am not a huge gamer, but I love to play Fortnite on my switch every now and then. I drop in, try and get some kills and will determine how I went based on that + ranking.

What are a few things I can start doing each game to improve how I play? What stats should I be playing against? Are there any key missions etc I should look at?

Just conscious that often times there aren't any others around and I'm just running around the map, pretty average game play 😂",1644279238.0
sn5ic7,"If Quentin Tarantino Made a Game, It Would Be This...",0,0.38,gaming,https://www.reddit.com/r/gaming/comments/sn5ic7/if_quentin_tarantino_made_a_game_it_would_be_this/,13,"I just experienced one of the most memorable games of my life.

I always hated the idea of top-down RPGs. But I loved Fallout and its setting.

When I come across Wasteland 3 I was full of doubts, But a post-apocalyptic world set in winter would be hard to resist. Little did I know, this game was more than that!

I took the leap of faith and bought this game.

Tbh, character creation is kinda meh. I made my characters and started the game and boom! The game throws game-changing decisions right from the start. I was like: ""Ok, now we're talking!""

The story is awesome. The game is all American, and I love it. (Am not an American though)

Let me talk about the decision-making aspect of the game a little more. See, most RPGs work like this: You want this or that? It's either path A or path B. Not in Wasteland 3. You have full freedom over your choices. The developers understood and implemented the butterfly effect at its finest. Also, the fame system allows you to actually have a process and the living world. If you made a bad decision that screwed your relationship with a certain faction, you have the opportunity to fix it.

The game is ruthless and I fucking love it. It's not afraid to swear, roast players, and break the fourth wall. I liked this constant communication between developer and player. You feel like you MATTER! The game is full of blood, craziness (I'm watching you Vic), and outlaws! Sometimes the game made you look like a badass. I was role-playing even irl (Saying dialogues and talking to my crew lol).

The voice acting is the best I've seen in a while; 10/10.

The soundtrack. Oh my god, the soundtrack! It's playing in my house all the time. The one great idea that was crazy was playing folk/rock/country music while fighting bad guys. It was genius! It made fights so epic, and I didn't want fights to end.

People said it was a buggy game, but I had a smooth experience. One or two bugs here and there, and it wasn't even game-breaking.

Spoilers ahead ...

I ended the game like this: >!As soon as I saw Patriarch, I knew I had to overthrow this guy. I don't know why, but I didn't like him. So I partnered with Angela and Cordite while obeying the orders of the Patriarch. I saved Steeltown from falling apart. I wiped out Gippers from existence and killed Valor. I arrested Vic just to avoid suspicions of Patriarch. Then killed Liberty and Patriarch. I continued sending supplies to Arizona and stayed in Colorado.!<

This game made me fall in love with CRPGs and now I bought Pillars of Eternity and Pathfinder.

Give this bad boy a try. It's so badass and an awesome game.

9/10.",1644279235.0
sn5br2,Are there still people who haven't been able to get the latest consoles yet?,0,0.45,gaming,https://www.reddit.com/r/gaming/comments/sn5br2/are_there_still_people_who_havent_been_able_to/,28,Surely everyone who sees them as a must have got one by now right?,1644278747.0
sn58xo,"What are some of the wildest, unexpected scenes you’ve played through?",0,0.5,gaming,https://www.reddit.com/r/gaming/comments/sn58xo/what_are_some_of_the_wildest_unexpected_scenes/,15,"For example, these three scenes that abruptly burst into chaos to the tune of heavy metal/sitar music:

- >!The Ashtray Maze in Control!<
- >!The drug trip missions in Far Cry 4!<
- >!The final Chicharron mission in Far Cry 6!<",1644278545.0
sn56l3,Scalping solution?,0,0.5,gaming,https://www.reddit.com/r/gaming/comments/sn56l3/scalping_solution/,12,"Is it to the point that beating scalpers is going to take shipping consoles to stores and limiting 1 purchase/day?

I know Microsoft, Sony, and retailers don’t care because they’re selling units like crazy online right now.

Thoughts?",1644278403.0
sn52tk,Hemp Tycoon music,0,0.5,gaming,https://www.reddit.com/r/gaming/comments/sn52tk/hemp_tycoon_music/,0,Does anyone know any music or a genre that sounds similar to the music in the Hemp Tycoon game from back in the day?,1644278118.0
sn51rm,PC Gamer plays play-to-earn game Farming Tales. Spoiler alert: It sucks ass.,10,0.75,gaming,https://gamervsgamefi.substack.com/p/gamefi-review-farming-tales?r=18n6pb&utm_campaign=post&utm_medium=web,14,,1644278038.0
sn4z8z,What was your favorite warcraft 3 mini game on Battlenet?,1,0.57,gaming,https://www.reddit.com/r/gaming/comments/sn4z8z/what_was_your_favorite_warcraft_3_mini_game_on/,11,My favorite game of all time was commandos.,1644277851.0
sn4xjw,Lets do a battle royal of board games,0,0.33,gaming,https://www.reddit.com/r/gaming/comments/sn4xjw/lets_do_a_battle_royal_of_board_games/,6,"Here are our 6 contestants

Monopoly

Trouble

Connect 4

Risk

Candy Land

and Sorry

who will win? You can vote (I'm routing Risk) in the comments",1644277729.0
sn4sw0,"So, I just found this on dying light 2",0,0.5,gaming,https://gfycat.com/familiarimpeccableiberiannase,4,,1644277388.0
sn4o0f,I was given a pretty nice gaming computer. Any recommendations on free single player games with good story modes?,0,0.25,gaming,https://www.reddit.com/r/gaming/comments/sn4o0f/i_was_given_a_pretty_nice_gaming_computer_any/,12,Just looking on recommendations on free single player story mode games to get myself interested in using this computer.  Not sure what else i would really do with it.,1644277037.0
sn4o00,I've been playing Vampyr and in narration cutscenes the protagonists always looks like the Gigachad meme.,51,0.86,gaming,https://i.redd.it/0fkomdoayhg81.jpg,9,,1644277036.0
sn4iuz,I love QTE parts of games!,0,0.33,gaming,https://www.reddit.com/r/gaming/comments/sn4iuz/i_love_qte_parts_of_games/,5,"A little weird I made this right after someone said he hates them but I seen so much hate for them and this made me want to talk about them.  

  Qte is so fun and adds to the adrenaline of a game because you feel like you have to hurry up or their are consequences. Detroit Become Human Uses it as a fear mechanism when you are saving someone from their father it does it to slow you down adding more fear in not making it in time. The game does other QTE in the game adding more adrenaline.  

 Until dawn also has QTE and can be amazing at making you think fast and get worried about failing to your death or get killed by something.  What if their was no QTE?  In my opinion QTE are best implemented in story based games, horror and adventure the reason being its meant to slow you down making you think fast and adds more worry and fear and rises your emotions deeper in the games.  

   Where is QTE'S bad? Well sometimes multiplayer games qte is preference but one genre that can't do qte are fighting as people get hyped about fighting bosses or using weapons to kill them all for it to be a qte scene and you don't get to fight them is just awful.  

  Imo Qte enhance the experience of many games except fighting!",1644276668.0
sn4fby,"I'm not even from the U.S, but damn, the whole Russian invasion was one hell of an arch in MW2 and MW3",9,0.68,gaming,https://i.redd.it/qygstifgwhg81.png,9,,1644276428.0
sn4dzo,Game that is a one block city?,5,0.78,gaming,https://www.reddit.com/r/gaming/comments/sn4dzo/game_that_is_a_one_block_city/,7,I remember hearing about a gaming project that would be a game that is set in a city block. This block of city is supposed to be super detailed with very realistic NPC and a puzzle like mission structure. Did I make this up in my head or is this a real thing. I can’t find anything about it.,1644276333.0
sn4c9n,I'm not much of a gamer but how many people out there actually care about bleeding edge graphics?,3,0.58,gaming,https://www.reddit.com/r/gaming/comments/sn4c9n/im_not_much_of_a_gamer_but_how_many_people_out/,29,"I feel like we got to a point maybe 10 years ago where peak graphics were as good as anyone really cared about and now style, storytelling, and mechanics are much more important which is why we are seeing so many games (especially indie) that don't have a focus on realistic or extremely high quality graphics at all.  Are there diehard graphics enthusiasts out there or is it just a meme and a sort of flex to have the powerful PC that can run anything at 4k 144fps?

I say this as someone who also drives a car far too fast and powerful to reach its potential on any street so I totally get that feeling btw",1644276210.0
sn498b,"New free ""prologue"" that's like Overcooked meets the Jetsons",5,0.7,gaming,https://www.reddit.com/r/gaming/comments/sn498b/new_free_prologue_thats_like_overcooked_meets_the/,1,"I was scrolling through IGN, and found something I hadn't heard of before called ""Spacelines from the Far Out"". Apparently, they just launched their prologue on Steam today:

[Spacelines from the Far Out: Flight School - Announcement Trailer - IGN](https://www.ign.com/videos/spacelines-from-the-far-out-flight-school-announcement-trailer)

It seems a bit like FTL, but MORE like Overcooked - if it were a roguelite. Procedural maps, events, co-op, RPG-like upgrades to your ship - but it's all set in a Jetson-like universe with some pretty wicked jazz music.

/insert the more you know music 

Has anyone tried it? I'm downloading it now.",1644276007.0
sn451u,Currently making a collaborative multi-player game where you can write a horror story together. Something that you can casually enjoy in your pocket. What do you think?,6,0.72,gaming,https://www.reddit.com/r/gaming/comments/sn451u/currently_making_a_collaborative_multiplayer_game/,4,"Might be a good way to practice writing, with other people.

Already started searching for play testers.  
Link, in case you are interested:  
[https://www.reddit.com/r/nevercute/comments/smxa87/this\_is\_what\_the\_menu\_looks\_like\_of\_wriley\_horror/](https://www.reddit.com/r/nevercute/comments/smxa87/this_is_what_the_menu_looks_like_of_wriley_horror/)",1644275718.0
sn42wg,What are your favorite little touches and things in video games?,2,0.67,gaming,https://www.reddit.com/r/gaming/comments/sn42wg/what_are_your_favorite_little_touches_and_things/,9,,1644275572.0
sn423y,I hate QTE's more games need to have an option to disable,6,0.8,gaming,https://www.reddit.com/r/gaming/comments/sn423y/i_hate_qtes_more_games_need_to_have_an_option_to/,14,"I am replaying spiderman and i turned on the accessibility option to disable QTE and the game is a lot more fluid now, not constantly being forced to QTE to catch a car or anything.",1644275516.0
sn40s6,Tom Clancy’s ghost recon,2,0.75,gaming,https://www.reddit.com/r/gaming/comments/sn40s6/tom_clancys_ghost_recon/,8,I want to get a good pve game on my PS4 and I’m either gonna get Tom Clancy’s ghost recon but idk wether to get wildlands on breakpoint.,1644275423.0
sn3zfn,Roblox is a good game,0,0.29,gaming,https://www.reddit.com/r/gaming/comments/sn3zfn/roblox_is_a_good_game/,9,"ok, I've heard many people call roblox bad, but in my opinion, it isn't. Roblox is where a community can share their content, and that is what makes a good platform/game. And roblox has different games with different genres, so people can find what they like easier.",1644275330.0
sn3ui8,[0C] EARTHWORM JIM. Who next? (top comment decides),29,0.81,gaming,https://www.reddit.com/gallery/sn3ui8,31,,1644274984.0
sn3t6k,Anyone else really good at small maps in cod but get wrecked in large maps?,1,0.57,gaming,https://www.reddit.com/r/gaming/comments/sn3t6k/anyone_else_really_good_at_small_maps_in_cod_but/,2,I am really good at small maps in any cod game and can compete online really well so well I am viable with a rocket launcher. My issue is because my eye sight is bad on large maps I just get slaughtered. I can hold my balance on medium maps but on large no it becomes hard fot me to see and react. If we are talking small-medium maps unless im not tryna piss people off I usually win games easily.,1644274887.0
sn3qyo,Baked a cake for husbands birthday!,170,0.93,gaming,https://i.redd.it/63pag5tirhg81.jpg,14,,1644274755.0
sn3l66,What are the best insults for gaming?,0,0.31,gaming,https://www.reddit.com/r/gaming/comments/sn3l66/what_are_the_best_insults_for_gaming/,24,,1644274347.0
sn3kdt,Dog scared of Marvel’s Spider-Man?,7,0.77,gaming,https://www.reddit.com/r/gaming/comments/sn3kdt/dog_scared_of_marvels_spiderman/,6,"Not sure if this is the right place to ask this, but figured I’d try. So, every time I start to play Marvel’s Spider-Man, my dog starts to shake and goes into fear mode. Is this happening to anyone else? And does anyone have any idea why it might be? She’s never done this with any other game.",1644274298.0
sn3gye,New TV I Choose You!,429,0.91,gaming,https://i.redd.it/86avwmxfphg81.jpg,11,,1644274055.0
sn3dc7,Can anyone tell me if this is a legitimate or fake game? Looks nothing like the ones we have in Canada. Purchased on Amazon.,2,0.6,gaming,https://www.reddit.com/gallery/sn3dc7,20,,1644273802.0
sn357z,In Battlefield V explosions can cause snow to slide off nearby roofs.,28024,0.89,gaming,https://gfycat.com/verifiablejubilantbirdofparadise,884,,1644273254.0
