post_id,title,score,upvote_ratio,subreddit,url,num_comments,body,created
snjogp,Story’s that rival read dead redemption 2,0,0.44,gaming,https://www.reddit.com/r/gaming/comments/snjogp/storys_that_rival_read_dead_redemption_2/,24,"I’ve played many games in my life but can’t seem to find a game with the same depth and characters as rdr2. I’ve tried god of war(PS4), xenoblade chronicles, final fantasy 7(og and remake.) & 15, the outer worlds and many others since first playing rdr2 and I feel as if nothing comes close. What games do y’all think rival rdr2 because I keep searching for something to beat red dead 2 but nothing comes close to levels of details, polish, great characters, and story I experienced in red dead 2. The closest I’ve prob experienced is yakuza lad, the persona series, and aforementioned god of war. What do y’all think is a game that could rival rdr2 or at least be close to it?",1644325297.0
snjkqi,"BIG Oof , first redditor who knows the game gets silver",0,0.22,gaming,https://imgur.com/a/wXJdlwT,9,,1644325013.0
snjkdc,Cyberpunk 2077 similar games?,3,0.62,gaming,https://www.reddit.com/r/gaming/comments/snjkdc/cyberpunk_2077_similar_games/,36,"I'm looking for an open-world game similar to Cyberpunk 2077. What's important to me is:
1. decision-making possibilities that can influence the flow of the game.
2. side quests with a real plot from which quest chains can develop.
3. A nice story

Any ideas?",1644324979.0
snjh04,Helicopter taken down by lightning in Far Cry 6 !? Pretty sure that is not how lightning works! :D,0,0.44,gaming,https://www.youtube.com/watch?v=nVD5kVg6w0c,26,,1644324696.0
snjd6n,Export of video games in Europe in 2020. credits: u/oolaf19988,32,0.87,gaming,https://i.redd.it/oxjktifzulg81.jpg,18,,1644324348.0
snjawx,Why don't they...?,0,0.33,gaming,https://www.reddit.com/r/gaming/comments/snjawx/why_dont_they/,3,"When I play games - I do try to trophy out of them to make sure I see whatever the developer had planned, besides the story. I game with Playstation (and am doing more PC stuff), when a producer for them releases a DLC it nests those achievements separately. My curiosity is, why didn't they do this with the multiplayer as well?  I'm trying to be more involved in it, but I acknowledge I'm not remotely good whenever I try most of the online stuff and on occasion I do try to ""git gud"" but that shit tricky.",1644324140.0
snjaig,Don't know what you think? But I like it. Made the choice to use one colour. Don't want to overdo it. It's all personal preference.,3,0.59,gaming,https://i.redd.it/vn5icr5aulg81.jpg,9,,1644324110.0
snj9b8,Please help me get my skin added to the next set of rust drops! If you own rust please vote yes!,0,0.07,gaming,https://steamcommunity.com/sharedfiles/filedetails/?id=2743620200,2,,1644324014.0
snj7gc,What happens if I Buy a game I already have on ps plus,0,0.4,gaming,https://www.reddit.com/r/gaming/comments/snj7gc/what_happens_if_i_buy_a_game_i_already_have_on_ps/,3,I have mortal kombat x from ps plus and I want buy the game since XL is on sale for 13.7$ what will happen I want XL since it unlocks all characters. Tried asking on ps community but post got removed and megathread none answered.,1644323837.0
snj5wr,Gaming Laptop recommendations?,2,0.62,gaming,https://www.reddit.com/r/gaming/comments/snj5wr/gaming_laptop_recommendations/,9,"Long story short: I'm looking to get a new gaming laptop.  Im budgeting about $900 to $1,000 USD, and I'm assuming investing in a good video card & RAM is best bet... but Id be happy to be wrong if there is a better area to focus.  


Any recommendations on best gaming laptops all things considered?  I don't mind getting pre-fab from a vendor... but will probably avoid BestBuy and the like.",1644323691.0
snj5lc,Please reccommend games for beginner (my wife),1,0.54,gaming,https://www.reddit.com/r/gaming/comments/snj5lc/please_reccommend_games_for_beginner_my_wife/,64,"I, myself have played video games since forever. Diablo 1-3, World of Warcraft (and other MMOs), Age of Empires (and other RTS), GTA... The Divison, Cyberpunk, Witcher, Metro... and so on.

My wife has not played video games almost at all, but as she sees how I enjoy my hobby of video games, she has some interest in trying out more games. She has only tried some CS in the past (beside her brother), and lately some WoW and New World (beside me). Though she has liked some aspects of WoW and NW she would like something else, I think.

But as my knowledge in all the games that are out there is not very vast, I am asking for your help.

Please reccommend some games that have a lush, beautiful world. Games that have maybe a bit of RPG elements. Maybe not so much of ""go kill 10 boars"" stuff, but more puzzle solving and adventuring and discovering. Games that are atleast in the beginning more beginner friendly and chill. (So no Dark Souls or smth :D)  


One game that caught my eye that I would like her to try is Kena: Bridge of Spirits.",1644323661.0
snizfx,"Couldn’t agree more Clare, Elliot looks like he’s okay to me too",17,0.83,gaming,https://i.redd.it/km27qw7arlg81.jpg,2,,1644323101.0
sniwir,Guillermo del Toro should make the Bioshock movie,15,0.78,gaming,https://www.reddit.com/r/gaming/comments/sniwir/guillermo_del_toro_should_make_the_bioshock_movie/,4,"After watching Nightmare Alley (which was fantastic) I'm pretty convinced that he would do a stellar job on a Bioshock movie. The dark, tormented characters of this film and its lively, sad world are things a Bioshock movie would absolutely need at its core. In terms of the more inhuman characters of Bioshock, del Toro's work in The Shape of Water or even Pan's Labrynth should be evidence enough that he could bring something like Big Daddy to life on the silver screen. Also anyone who watches Nightmare Alley would have a hard time arguing that Cate Blanchett wouldn't be an amazing Dr Tenenbaum.

I know there was almost a Bioshock movie in the past with Gore Verbinski at the helm, but I think that would've felt more adventure-y than what del Toro could do with Bioshock, and it would fit better anyway.",1644322841.0
sniw6r,[Legends of Arceus] [Spoilers] For the first time in over 20 years I completed my Pokédex,28,0.78,gaming,https://imgur.com/D84uwwx.jpg,20,,1644322814.0
sniu2u,‘Paimon’ haunts me…,0,0.5,gaming,https://www.reddit.com/r/gaming/comments/sniu2u/paimon_haunts_me/,9,"I downloaded Genshin Impact on my phone and, to skip a few, realised I didn’t actually have the storage space to accommodate the downloadable files. It was here I met Paimon, the sort of fairy being that follows you everywhere as a guide. She speaks in third person. 

After deleting it from my phone I downloaded it on my console instead and tried to get into it. Now I can’t escape her squeaky voice. It was cute at first but now I rationalise in real situations. “Would Paimon be okay with this?” I deleted the console version too.",1644322601.0
snimll,For the love of 8bit games,13,0.88,gaming,https://www.youtube.com/watch?v=w3mpbx0wFks,0,,1644321859.0
snihp1,What game do you wish had seen more popularity?,36,0.85,gaming,https://i.redd.it/zk0q6jocmlg81.jpg,22,,1644321442.0
sniho0,For anyone wondering why Medieval Engineers was cancelled.... now in graph form!,28,0.83,gaming,https://i.redd.it/c6s97ak8mlg81.png,11,,1644321439.0
snigz5,"It was Great, but gameplay...",16097,0.83,gaming,https://i.redd.it/sm5sp9r4mlg81.jpg,3991,,1644321370.0
sni3sw,What video game music sounds like it's the final boss' theme but is actually the main menu theme?,1,0.56,gaming,https://www.reddit.com/r/gaming/comments/sni3sw/what_video_game_music_sounds_like_its_the_final/,12,,1644320065.0
sni2hh,"Can anyone recommend a video game sub devoted to discussing games, and doesn't allow memes?",20,0.73,gaming,https://www.reddit.com/r/gaming/comments/sni2hh/can_anyone_recommend_a_video_game_sub_devoted_to/,30,"I'm not shitting on the memes, and I'm not asking people not to post memes. I would just prefer a gaming sub where memes aren't allowed. I see enough variations of the ""when you log in and your friends aren't online"" meme to last a lifetime.

>This does not mean that memes are not allowed on the subreddit. It means that generic memes with gaming related text are not allowed on the subreddit. In order for a meme to stay, both the image and the text must be gaming related.

And yet this rule is constantly violated, and from what I've seen, rarely enforced.",1644319936.0
snhz1h,Please cast your vote on earth2 io,0,0.1,gaming,https://www.reddit.com/r/gaming/comments/snhz1h/please_cast_your_vote_on_earth2_io/,5,https://strawpoll.com/upxaeg7p2,1644319604.0
snhyby,"Why are more and more game franchises, that didn't have RPG elements before, starting to have them in their latest entries recently?",0,0.42,gaming,https://www.reddit.com/r/gaming/comments/snhyby/why_are_more_and_more_game_franchises_that_didnt/,21,The first 2 game franchises I can remember on the top of my head that does this are Assassin's Creed (starting with Origins) and Dying Light (starting with the second game),1644319530.0
snhrii,What games have your favorite art styles? My picks:,47,0.83,gaming,https://www.reddit.com/gallery/snhrii,32,,1644318815.0
snhkcw,"Hehe, I killed his bird and left.",9,0.71,gaming,https://i.redd.it/m448wun9clg81.jpg,9,,1644318054.0
snhgt6,The new martial arts simulator is fantastic.,18,0.74,gaming,https://i.redd.it/ay6r7ka6blg81.jpg,4,,1644317686.0
snhcrv,Which modern game has the worst/most blatant padding?,4,0.67,gaming,https://www.reddit.com/r/gaming/comments/snhcrv/which_modern_game_has_the_worstmost_blatant/,32,"For me it's Luigi's Mansion 3, with the Polterkitty stuff. Makes you go back through the same level you just beat! Would've been fine if it had gone to the level before, so you can find anything you missed and see a level you didn't just spend half an hour plus on.

Also I say modern because a lot of older games padded their runtime because you often only had access to a couple of games a year.",1644317219.0
snh8mx,Hear me out! Let's take a moment to appreciate this hidden gem of gaming journey,3,0.58,gaming,https://imgur.com/fMVGLKV,3,,1644316760.0
sngxb6,Need an RBG software for everything,0,0.5,gaming,https://www.reddit.com/r/gaming/comments/sngxb6/need_an_rbg_software_for_everything/,9,"[SOLVED] I just had to make sure all fans were plugged into the controller at the back then plug that into the JRainbow header and run it through Signal RGB
 
Just made my first gaming PC and I’m trying to work out an RGB software that will sync all my components.

I have a:
MSI Z590 Gaming plus
Corsair Vengeance RGB Pro x2
MSI Coreliquid 240R V2
The MSI Gungnir 110R Case Fans x4

Open to any software suggestions, or videos on where to find solutions. Thanks in advance",1644315540.0
sngrtk,S.T.A.L.K.E.R. gunplay in 2022 mods,5,0.73,gaming,https://youtu.be/RrrKR7xeYSI,0,,1644314896.0
sngrhd,Gabriel Knight 3 - Is there a way for playing on Windows 10?,0,0.5,gaming,https://www.reddit.com/r/gaming/comments/sngrhd/gabriel_knight_3_is_there_a_way_for_playing_on/,4,"I'm currently trying to play the game for a Let's Play-series I am doing with my girlfriend. But there are some really bad graphic issues and crashes with Windows 10. Also, is there a way to play it in windowed mode? An easy soulution, like a fix or a patch would be nice, I am not the ultimate computer expert.

I would really appreciate your help, thank you!",1644314854.0
sngmpa,Gaming Set-up,85,0.87,gaming,https://i.redd.it/375ac3bc1lg81.jpg,9,,1644314384.0
sngihz,What are some of the best one-liners in video games?,42889,0.85,gaming,https://i.redd.it/keoyfeqszkg81.gif,7743,,1644313870.0
sngg33,Help me figure out what this game is,1,0.6,gaming,https://www.reddit.com/r/gaming/comments/sngg33/help_me_figure_out_what_this_game_is/,7,"I was talking to my friends about this game I saw a trailer for, but for the life of me cannot find the trailer nor can I find the name, or anything about it. I'm starting to think it never existed and I just dreamed it up, so if you know what it is, please tell me.

Here is what I remember:

The game is like a futuristic type game that takes place in a sky/cloud type setting with large buildings coming out of the clouds. The characters are walking towards each other on a bridge type thing and then end up fighting over a briefcase like object. The characters keep like knocking it away from each other and shooting guns and rockets, and then like smirking at people. 

There's some other details which I'm a little fuzzy on, that may or may not be part of it, such as one of the guys having a robotic arm and there being like a female character with dreadlocks. and there is some sort of aerial combat, like jetpacks, rocket jumps, or wind currents or something like that.

Thanks for any help.",1644313585.0
sngg2c,HELP to choose a Motherboard Z690,1,0.67,gaming,https://www.reddit.com/r/gaming/comments/sngg2c/help_to_choose_a_motherboard_z690/,1,"Which of these three motherboards is the best?

1) ASRock Z690 PG Speed   
2) ASUS ProArt Z690 CREATOR WIFI   
3) Asus ROG Strix Z690-F Gaming Wi-Fi.

Thanks :D",1644313582.0
sngfah,These are the things I want this morning.,34,0.96,gaming,https://www.reddit.com/gallery/sngfah,17,,1644313484.0
sngbqh,What's the game ost that instantly changes your mood?,3,0.8,gaming,https://www.reddit.com/r/gaming/comments/sngbqh/whats_the_game_ost_that_instantly_changes_your/,17,"For me it's Nier Automata's one, in particular Blissful Death. 

It's just so calming while at the same time depressing when you remember the story behind it.",1644313096.0
sng91c,Need a bit of help with a new monitor tv.,1,0.67,gaming,https://www.reddit.com/r/gaming/comments/sng91c/need_a_bit_of_help_with_a_new_monitor_tv/,0,"So I want to get a 40”-43” tv above my 2 monitors in my setup but thing is I always play 100hz or higher. will a 40” 4k, 60hz be just fine for me?
Also have a RTX 2080 so don’t think i can even run 4k 60 so might have to downscale. Any tips as what i should get are very welcome.",1644312785.0
sng5u3,Why does every game insist on having sbmm when it’s largely hated,0,0.29,gaming,https://www.reddit.com/r/gaming/comments/sng5u3/why_does_every_game_insist_on_having_sbmm_when/,40,"Is there a reason as to why every game seems to be add or have sbmm even thought from what I’ve heard basically everyone hates it, yet game devs keep adding and I’m wondering why as it’s not something like micro dlc which everyone also hates but it since it makes profit I understand why they aren’t just going to remove it any time soon but why not sbmm",1644312432.0
sng4gb,In response to the game physics posts. Here’s one from 1993 called *The Incredible Machine*. Players would create realist and effective Rube Goldberg machines in a testing environment.,100,0.92,gaming,https://i.redd.it/49dj3t82vkg81.jpg,25,,1644312265.0
sng3nk,Where did RTS's with customizable units go?,3,0.81,gaming,https://www.reddit.com/r/gaming/comments/sng3nk/where_did_rtss_with_customizable_units_go/,4,"Over a decade ago, there was a LOT of RTS games where our units were customizable. 

Earth 21XX series had such system, IIRC. Original War, while incorporating a couple of RPG elements, implemented such system for it's vehicle making; Incredible Creatures had such system, and it was delightful; Ancient Wars: Sparta was the pinnacle of such customization, with different kinds of soldiers, that could be outfited with different weapon types.

Now, we have SO. MUCH. MORE. computing power, and there is so much better technology (like Blender Geometric Nodes!) and the mechanic seems to have died off.

Am i mistaken, and there actually are such systems in games i have omitted? (if so, please do tell!)",1644312183.0
sng0s0,What are some deep lines of dialogue/monologue in video games?,4,0.7,gaming,https://www.reddit.com/r/gaming/comments/sng0s0/what_are_some_deep_lines_of_dialoguemonologue_in/,13,,1644311857.0
snfxxc,Decentraland Review: Everything You Should Know,0,0.4,gaming,https://www.niftyhype.com/reviews/decentraland-everything-you-should-know,1,,1644311533.0
snfsa3,Xbox and Halo,0,0.5,gaming,https://www.reddit.com/r/gaming/comments/snfsa3/xbox_and_halo/,5,"Hello, I'm and old Halo fan and I'd like to catch up (my last xbox was 360).
Id like to be able to play Halo 5, Halo infinite and the upcoming Halo 6, but would still like to play Reach, Halo 1, etc.

I am a bit confused about the xbox series s retrocompatibility. Will that suffice to my Gaming needs? Should I buy a xbox series x instead?
Also the series X looks like it may age better than the series s.. Let me know what you think!

Edit: I already own a PS4 and a Switch
Edit2: ok, Halo infinite = Halo 6. Thank you for the clarification. Also looks like i'd better get an series X with game pass (given I can find one available).
I could go with the current offer: 35€/month over 2 years. Xbox + pass",1644310877.0
snfoz7,How to make the most of your disconnected teammates in Apex Legends,7,0.77,gaming,https://youtu.be/uNuiBnO9e-w,0,,1644310548.0
snfm3l,Finally got to play God of War on PC,0,0.3,gaming,https://www.reddit.com/r/gaming/comments/snfm3l/finally_got_to_play_god_of_war_on_pc/,27,"Ive always been a Halo/Xbox fanboy but goddamn, are there any other single player (non open world) games that are even close to this good? Literally just bought a ps5 cause i want to play the previous ones and get ready for Ragnarok. Trying Ghost of Tsushima but the navigation system and fully open world just doesn't do it for me. I liked Horizon, and going to play the next, but even those are a little to ""open"" for me. Any suggestions are appreciated!",1644310247.0
snf9v2,(Switch) Game for a night with the boys (4 in total),5,0.86,gaming,https://www.reddit.com/r/gaming/comments/snf9v2/switch_game_for_a_night_with_the_boys_4_in_total/,20,"Hi all, 

We are 4 ppl looking for a switch game to play for a night in coop on one screen. 
We played castle crashers back in the days and loved it. Maybe you have some suggestions for us :)",1644308797.0
snf756,The Bus,4,0.76,gaming,https://www.reddit.com/r/gaming/comments/snf756/the_bus/,0,"Does anyone know if the the game ""The Bus"" by TML-Studios have triple monitor support?

I cant seem to find any info regarding triple monitor support on the steam page.

https://store.steampowered.com/app/491540/The_Bus/",1644308513.0
snf51t,Hitman is great but...,12,0.73,gaming,https://www.reddit.com/r/gaming/comments/snf51t/hitman_is_great_but/,27,"Why does nobody point out that a bald man with a barcode on his head is going around killing people? Like, that is the most obvious man in existence yet he keeps getting away with it. It just baffles me whenever I think about it. Especially when he's infiltrating providence facilites. All you have to do is check bald people's heads for a barcode and you no longer have the issue of him walking through the front door.",1644308294.0
snf2n1,Keep talking and nobody explodes similar games,5,0.78,gaming,https://www.reddit.com/r/gaming/comments/snf2n1/keep_talking_and_nobody_explodes_similar_games/,4,"The concept of keep talking and nobody explodes is very interesting since it mixes reality with video game.
Any similar games that do the same with a different concept?",1644308024.0
snf224,Here some nostalgia for all 2012 PC Gamers,4,0.63,gaming,https://youtu.be/6xylKNBDaoY,2,,1644307962.0
snf074,I Still play Star Wars Battlefront 2 regularly can't believe support for it was cancelled for BF2042. Enjoy :),0,0.38,gaming,https://youtu.be/Na8lrkz-Qh4,5,,1644307782.0
snertv,Fatalis being Fatalis.. I guess i need to grind more lol,3,0.64,gaming,https://youtu.be/pEcG8q_I2Vw,0,,1644306956.0
sner1g,Are the animations supposed to be clunky?,0,0.47,gaming,https://i.redd.it/1tfofdn0fkg81.jpg,10,,1644306872.0
smn29y,My dad just sent me this. Is it even possible to have all this in survival?,10,0.75,gaming,https://i.redd.it/h8869uwq1eg81.jpg,23,,1644229765.0
snedii,My Friend's Legends Arceus Experience,25,0.73,gaming,https://www.reddit.com/gallery/snedii,15,,1644305523.0
sned4z,Captain Falcon Vs Jiren MUGEN,0,0.42,gaming,https://youtu.be/PC-V0Vz2JwI,0,,1644305487.0
snec9u,Just got all The achivements in chair fucking simulator,93,0.82,gaming,https://i.redd.it/9hvi6j9makg81.jpg,24,,1644305403.0
smtftz,Dying Light 2 as much nice as dying Light?,4,0.7,gaming,https://www.reddit.com/r/gaming/comments/smtftz/dying_light_2_as_much_nice_as_dying_light/,5,"Hi guys,

I wanted to buy Dying light 2 and stream the game. What do you say? is it worth and makes as much fun as his predecessor? I loved dying light 1",1644249295.0
smux8p,Please help me find a game!,2,0.75,gaming,https://www.reddit.com/r/gaming/comments/smux8p/please_help_me_find_a_game/,7,"It was on the pc. It was a third person fantasy game with melee and firearms. It was set in an old world time. You could use an aggressive stance or passive stance. You eventually get betrayed and turn into a zombie ish kinda man. You eventually get to play this guy on a boat at this game that had white and black tokens. There was an item called a shiney thing from before. For the life of me I can't remember the name but I'm dying to see if anyone has a walkthrough on YouTube. 
Please help!",1644253026.0
snea5h,I Hope someone Remake's this Paintball Shooter,16,0.78,gaming,https://i.redd.it/yuohvh9y9kg81.jpg,9,,1644305167.0
smywut,Are there any cloud gaming services that can be used in-browser and aren’t currently in a closed beta/invite/application state? (and aren’t exorbitantly expensive) Looking for GeForce NOW alternatives.,1,1.0,gaming,https://www.reddit.com/r/gaming/comments/smywut/are_there_any_cloud_gaming_services_that_can_be/,1,,1644263035.0
smy45b,I'm looking for an online FPS similar to one of these from 2016. Anything similar nowadays?,1,1.0,gaming,https://www.reddit.com/r/gaming/comments/smy45b/im_looking_for_an_online_fps_similar_to_one_of/,2,"[Tom's Clancy Ghost Recon Phantoms](https://www.youtube.com/watch?v=HqM5Yj4tM00) is the game I'm at grief for the moment. Randomly thought of it while in the shower and I really miss it ;-;

In the same year, 2016, I've also played [Ghost in the Shell - Stand Alone Complex Online](https://www.youtube.com/watch?v=l1Lxcmweazo), which had a similar tactical feeling for me. It was important to have a good balance in the team.

I've played many other online FPS through the years after but nothing seems to flip my switch like these games did back then. Hopefully I'm not the only one who remembers these games.",1644260998.0
smyzs6,My friends list is a graveyard,108,0.95,gaming,https://i.imgur.com/4jrelQ5.jpg,8,,1644263240.0
smznlh,Made this shirt for my boyfriend. He’s a big Battlefield fan lol,31,0.79,gaming,https://i.redd.it/3nfeidzzxgg81.jpg,7,,1644264829.0
sn0ouk,Sad day my friends. My only controller I have had for 3 and a half years finally died. Im gonna but it on Display but then I discovered $70 FOR A LAST GEN CONTROLLER? WHY AND HOW ARE THEY SO EXPENSIVE,16,0.77,gaming,https://i.redd.it/yn3ogxbn5hg81.jpg,11,,1644267403.0
sn1hf0,Buying a console for the first time in over 20 years.,4,1.0,gaming,https://www.reddit.com/r/gaming/comments/sn1hf0/buying_a_console_for_the_first_time_in_over_20/,15,"As title says, I gotta figure out what to buy and just looking for a little nudge in the right direction. I am mostly gonna play sports games but I imagine I will branch out once I figure out the platform again. For someone who was basically gonna play madden a lot to start with what would you recommend? 
I don’t care about the ancillary stuff like streaming etc. basically just wanna play some competitive madden and other sports games. I’m sure you get asked this a lot but this industry has passed me by and I have no idea which way to go. Someone told me a series s because it’s available and cheaper and get a game pass and I’ll be good. Does that series s allow you to play against other people randomly? Thanks.",1644269279.0
sn1mwt,"Why do people want to play ""sexy"" characters in RPGs?",5,0.69,gaming,https://www.reddit.com/r/gaming/comments/sn1mwt/why_do_people_want_to_play_sexy_characters_in_rpgs/,24,"So I was looking at character customisation options in RPGs for a project, and I looked up ""Dragon age: Inquisition character creation female"" (I'm looking at hairstyles you can do! :) on youtube. The first thing that came up was a video titled **Dragon Age: Inquisition - How to make an attractive female elf (Character sliders).** Similar things came up when I swapped DA:I for ""Skyrim"" or ""Fallout""- all focused on making the characters ""attractive"", ""beautiful"", ""sexy"", ect. I know there are pornographic games, and games of every genre with characters designed to be titilating, but I don't really understand the latter. Wouldn't that be, I don't know, distracting? From the core mechanics and whatever you're actually supposed to be doing? I'm not the target audience of these things, but I do find it harder to focus on say, combos in combat or tightly-timed puzzles if the entire screen of something I'm playing is pure eye candy. And besides, if I'm playing something with sliders, I wanna make a little guy who looks like me, to better connect with the world of the game- am I weird for doing that? Have I been playing things wrong the whole time? What's the motivation behind making all your player characters smokeshows when they're gonna be like, in armour and fighting zombies anyway??",1644269646.0
sne34l,I am bored as fuck. Some ideas for something to play?,0,0.33,gaming,https://www.reddit.com/r/gaming/comments/sne34l/i_am_bored_as_fuck_some_ideas_for_something_to/,41,"Hi, I am super bored and want to find something to play. I am not into online games, but otherwise I am open for suggestions.  
BTW I don't have any consoles, I am only on PC",1644304444.0
