post_id,title,score,upvote_ratio,subreddit,url,num_comments,body,created
rhuzow,"Hi, this is Joss Stone. I'm excited to answer your questions. Ask me anything ! xx",1404,0.91,Music,https://www.reddit.com/r/Music/comments/rhuzow/hi_this_is_joss_stone_im_excited_to_answer_your/,455,"I had so much fun writing and recording my new album with Dave Stewart. The release date will be early next year and I can’t wait to share it with you. Follow along during my ’25 Days of Christmas Advent Calendar' as I reveal behind the scenes moments. There just might be a big surprise at the end! https://www.instagram.com/jossstone/ https://www.facebook.com/jossstone https://twitter.com/JossStone https://orcd.co/neverforgetmylove

PROOF: https://i.redd.it/u1xmu4t6as581.jpg",1639674118.0
s8m1uh,The Avalanches - Since I Left You [Plunderphonics],528,0.94,Music,https://youtu.be/wpqm-05R2Jk,65,,1642694050.0
s8dqe7,99 Luftballons or 99 Red Balloons?,1258,0.91,Music,https://www.reddit.com/r/Music/comments/s8dqe7/99_luftballons_or_99_red_balloons/,649,I don’t speak German at all and still sing along to 99 Luftballons. I think the flow in German sounds way better and fits the track more. Which do y’all prefer?,1642665335.0
s8jx84,Agents of Fortune by Blue Oyster Cult is quietly one of the best albums from the 1970s,165,0.87,Music,https://www.reddit.com/r/Music/comments/s8jx84/agents_of_fortune_by_blue_oyster_cult_is_quietly/,39,"Blue Oyster Cult's fourth studio album is an adventure from start to finish. The group was often considered by many to be ""the thinking man's heavy metal"" and honestly, this album really backs that claim.

The band seems to master this bizarre oxymoron of being loud yet soft and manic yet confident. The album starts out hot with ""This Ain't The Summer Of Love"" then does a complete 180 as ""True Confessions"" is one of the band's poppier songs. The band fluctuates from different octaves and levels throughout the album, and it's the most organized confusion I've ever listened to...which is exactly how Rock N Roll should be. And how the hell could I forget about ""(Don't Fear) The Reaper?""

The album is one of the band's biggest hits, however, it was buried in the mix as time went on. After all, the album did release in the infamous summer of 1976 which is often regarded as one of the best single years in music history.

Give 'er a listen if you haven't already, you'll be screaming more cowbell before ya know it.",1642688044.0
s86gam,Bad Company's 1974 self titled debut album is such a banger.,1505,0.92,Music,https://www.reddit.com/r/Music/comments/s86gam/bad_companys_1974_self_titled_debut_album_is_such/,216,"I'd like to point fingers and say that people don't talk about Bad Company enough when discussing classic rock but honestly, I'm one of those people. They are almost never in my regular rotation but always find them again. Bad Company (album) is a classic rock staple and a real banger from beginning to end. Thanks Spotify.",1642642035.0
s8gwoc,Ghost - Call Me Little Sunshine [Doom Metal],191,0.9,Music,https://www.youtube.com/watch?v=DD2m_iqD7dI,114,,1642678117.0
s8l7lk,Best Last Album?,89,0.95,Music,https://www.reddit.com/r/Music/comments/s8l7lk/best_last_album/,304,"There's always a lot of debate ongoing about the best debut albums of all time, but what about the best final albums? Generally, the final albums from the major classic rockers are mediocre, because they had been making music for decades and used up all their creative juices. I guess the best last albums would be from bands still in their prime, but they stopped because the main person died, like Nirvana or Sublime. Thoughts?",1642691727.0
s8h8bn,The Distillers - The Hunger [Punk Rock],145,0.95,Music,https://youtu.be/2KJeERXpVH8,13,,1642679410.0
s8lat7,New Order - Age of Consent Cover [New Wave],59,0.87,Music,https://www.youtube.com/watch?v=pPTLIHtMgyc,9,,1642691984.0
s8q708,Just did a little internet sleuthing on the When We Were Young Festival.,25,0.96,Music,https://www.reddit.com/r/Music/comments/s8q708/just_did_a_little_internet_sleuthing_on_the_when/,5,"A lot of people felt kind of sketched out by it. Calling it *Emo Fyre Fest* so I dug around to vet it's legitimacy.

First, [I looked up the trademark](https://i.imgur.com/4isVGwE.png) and it looks like it was filed quite awhile ago. In February of 2017 by a Noise Group, LLC. The address listed for the company happens to be [the same building as the Observatoty OC](https://i.imgur.com/aLTVZqs.jpg), a small [venue in southern California.](https://www.observatoryoc.com/) The same venue that was [acquired by LiveNation in 2019.](https://www.sandiegouniontribune.com/entertainment/music/story/2019-04-15/live-nation-is-buying-observatory-north-park-and-observatory-santa-ana) So I figure they had the idea maybe? And after the LiveNation acquisition, they finally wanted to bring the idea to life but had to pause due to the pandemic. Just spit balling here.

Getting back to the facts tho, I did a Whois search of the domain and it looks like it was [registered not even 2 months ago](https://i.imgur.com/IVtwN7n.png). It was [registered by a company](https://i.imgur.com/Eh6RvF2.png) called [C3 Presents](https://en.wikipedia.org/wiki/C3_Presents)*;* a company that put on Lollapoolza, Austin City Limits and Voodoo Music + Arts Festival. These are festivals that go on every year and are for the most part well respected and safe events.

While LiveNation, the company behind Astroworld Festival, does have a controlling (51%) stake in C3, it's important to note LiveNation [owns hundreds of Festival Subsidiaries](https://www.sec.gov/Archives/edgar/data/1335258/000133525820000028/lyv-20191231xex211.htm), puts on thousands of events a year that go off without a hitch.

If you're worried about a repeated Astroworld catastrophe or a Fyre Fest-style scam event, I'd say it's unlikely to happen. The parities involved seem to have a good track record as far as putting on events. I assume people felt it was sketchy because of the lack of information. The only thing I can chalk that up to is it being a rush job to get the promo out before the new year. I imagine as the year goes on, we'll hear more and the blanks will fill themselves in.

If I happened to get something incorrect or missed something, feel free to comment, I'll update the post accordingly.",1642705053.0
s7q4ru,Fiona Apple - Criminal [Alternative Rock],4296,0.92,Music,https://www.youtube.com/embed/FFOzayDpWoI,380,,1642598913.0
s8n5nc,Genesis - 'That's all' is my new favourite song,20,0.91,Music,https://www.reddit.com/r/Music/comments/s8n5nc/genesis_thats_all_is_my_new_favourite_song/,20,"I am absolutely obsessed with this song, every time I hear a Phill Collins Genesis song I haven't before it becomes my new favourite for a while. I think Phill Collins has the coolest sounding singing voice. I'll definitely be listening through all the genesis albums soon.

If anyone has any recommendations of songs that give them a similar feeling let me know.",1642697011.0
s8kfnq,Sleep Party People - I'm Not Human At All [Indie/Alternative],32,0.83,Music,https://www.youtube.com/watch?v=p3i8K6hfydQ,3,,1642689507.0
s88n8r,Cracker - Low [Alternitive /Rock] (live 1995),189,0.9,Music,https://youtu.be/81Yvd-0viIs,29,,1642648486.0
s7till,Debate with girlfriend on queen,1402,0.86,Music,https://www.reddit.com/r/Music/comments/s7till/debate_with_girlfriend_on_queen/,1229,"Alright so I was watching the queen live aid performance on YouTube. My girl commented saying “that’s some white people shit”. And because I’m half white I was told of course I would like it because it’s in my culture. Don’t get me wrong I know mainly whites will know of queen, but I just admire Freddie  Mercury’s performance for the show. The guys a damn legend from the piano, guitar, dancing, and singing skills obviously. And I loved how he had such great control of the crowd.

I got kinda irritated somewhat because she knows me very well and know me I love music in general. I mainly listen to RnB and some rap. It just bothered me that she jumped to “that’s some white ppl shit” rather than acknowledging my love for music. And saying “I could see why u like that” especially given he started off on the piano which is my favorite instrument. 

Basically for those music lovers out there. That aren’t white, if u were to watch the live aid performance for yourself. Would “that’s some white ppl shit” be the first thing you’d say?",1642608527.0
s8o82t,Bands friends would not shut up about you grew to love,10,0.82,Music,https://www.reddit.com/r/Music/comments/s8o82t/bands_friends_would_not_shut_up_about_you_grew_to/,32,"So recently I fell in love with Tool after years of a friend of mine not giving up on trying to get me to listen to them. 
I finally saw a video on the structure of Lateralus using the fibonacci sequence, decided to give them a shot and now I'm hooked.
Was wondering who else had this experience and with what band.",1642699825.0
s8ma1l,Jordan Mackampa - Midnight [folk/soul],11,0.86,Music,https://youtu.be/hbZO0kv_sLo,1,,1642694652.0
s7wkrf,Faith no More: such an underrated band,464,0.82,Music,https://www.reddit.com/r/Music/comments/s7wkrf/faith_no_more_such_an_underrated_band/,244,"I've been listening to a lot of FNM recently and they're such an underrated band. They're one of those groups that are only ever known for one song yet have tons of more lesser known decent singles. Really any single after the breakthrough success of 1989s Epic is worthy of radio play yet gets barely any. Angeldust from 1992 should have been more of a success than it was but grunge was dominating this era and it kinda got buried under that. I think because of the lackluster sales of angeldust King for a day (1995) suffered a bit. These 90s albums have aged pretty well I think. They were the band that made me appreciate experimental music more  Luckily they have enough of a cult following to be able to headline festivals still.

Anyone else have anything to say on this band?",1642616308.0
s8iaql,Adam Barrett - God Only Knows [Pop]. Brian Wilson enjoyed this cover so much that he shared it himself on Twitter,16,0.81,Music,https://youtu.be/IZdZbBdFkuM,5,,1642683150.0
s7n9h2,The song that eventually became A-ha's 'Take On Me',1699,0.97,Music,https://twistedsifter.com/videos/the-song-that-eventually-became-a-has-take-on-me/,109,,1642588434.0
s8qy7p,Carla Stokes - Big Bands [Jazz],4,1.0,Music,https://youtu.be/F25VeFpiEBA,0,,1642707091.0
s8m9ei,Disclosure - When A Fire Starts To Burn [House],5,0.78,Music,https://www.youtube.com/watch?v=WLxyfzoPxyQ,1,,1642694602.0
s8n49k,My stepdad's music,3,0.71,Music,https://www.reddit.com/r/Music/comments/s8n49k/my_stepdads_music/,5,"My stepdad has been writing music for many years and I thought it might be nice to post a selection here for your enjoyment.

[https://melstallwood.musicaneo.com/sheetmusic/](https://melstallwood.musicaneo.com/sheetmusic/)

I know there is a lot, but he has never been famous nor has he sought fame, he just enjoys writing music and his hope is that one day someone will enjoy it.",1642696905.0
s8kx8b,Aerik Watson - Knights of Cydonia (Cover) [Alternative Rock] - 2022,4,0.64,Music,https://youtu.be/H2W6VmHH7e0,0,,1642690914.0
s8orqf,Faite moi découvrir des musique,2,1.0,Music,https://www.reddit.com/r/Music/comments/s8orqf/faite_moi_découvrir_des_musique/,3,Bonjour j’aimerais découvrir de nouvelles music ou des nouveaux genre car j’écoute souvent de la musique pour gérer le stress !,1642701263.0
s8aarq,"Kid CuDi - Up, Up And Away [Rap/Pop]",20,0.79,Music,https://www.youtube.com/watch?v=qRPpLGxGNZY,5,,1642653540.0
s8o5qw,Taylor Swift Named 2022 Record Store Day Ambassador,3,0.63,Music,https://www.reddit.com/r/Music/comments/s8o5qw/taylor_swift_named_2022_record_store_day/,4,"https://recordstoreday.com/NewsItem/9949

2022 marks the 15th anniversary of our big party to celebrate record stores. We thought that for the Ambassador, we'd go big. Global, even. So we're pleased to bestow the Ambassadorial sash on to one of the biggest artists in the world, TAYLOR SWIFT.
THE RECORD STORE DAY AMBASSADOR, TAYLOR'S VERSION.

""I’m very proud to be this year's Global Ambassador for Record Store Day. The places where we go to browse and explore and discover music new and old have always been sacred to me. Record stores are so important because they help to perpetuate and foster music-loving as a passion. They create settings for live events. They employ people who adore music thoroughly and purely. Those people and shops have had a rough few years and we need to support these small businesses more now than ever to make sure they can stay alive, stay eccentric, and stay individual. It’s been a true joy for me to watch vinyl sales grow in the past few years and we, the artists, have the fans to thank for this pleasant surprise. Happy Record Store Day, everyone! Stay safe out there.""",1642699655.0
s8bjo5,Jim Croce - Tomorrow's Gonna Be A Brighter Day [Folk],17,0.9,Music,https://www.youtube.com/watch?v=TlH3HdZO6Fc,2,,1642657488.0
s86dhr,Bob Seger - Still The Same,40,0.77,Music,https://www.reddit.com/r/Music/comments/s86dhr/bob_seger_still_the_same/,6,"Listen to this at 1.25x speed for a new (imo better) experience. 

https://youtu.be/HuqagqnaDmY",1642641795.0
s8ndz0,Modern/new Punk Rock,2,1.0,Music,https://www.reddit.com/r/Music/comments/s8ndz0/modernnew_punk_rock/,26,"Can someone suggest some new music similar to bands like blink 182, greenday, rise against and sum41.
I would like to get to know some newer bands.
Thank you in advance",1642697632.0
s8mzhk,playlist music ideas,2,0.75,Music,https://www.reddit.com/r/Music/comments/s8mzhk/playlist_music_ideas/,1,"i want to add songs into my playlist that fit the same vibe as euphoria, skins etc. basically songs that all me and my friends can vibe to. so far the songs that i have on the playlist are: softcore, the perfect girl, glory box, honestly, help_urself, roll the dice, desire, fuck you all the time, yeah yeah yeahs, she knows, pretty, clear eyes, falling 4 me, lose all control, all the time, dark beach, middle of the night, u. niteboi.  , i love you by young slobe, nightcore NDA, unfair, bones HDMI (also alot of these songs are slowed, sped up, bass boosted, reverbed etc to match the vibe of the playlist)",1642696543.0
s8rq9l,Shox 11:11 (ft. Rash & Junction 11) - Mansa Musa [UK Grime],0,0.5,Music,https://open.spotify.com/track/1af49soeeaqwDQIOg3DKmt?si=cSGBaWx6SlidZ6fLPI90hQ&utm_source=copy-link,0,,1642709236.0
s8rnwx,How to legal unlock all vst plugins ???,1,1.0,Music,https://www.reddit.com/r/Music/comments/s8rnwx/how_to_legal_unlock_all_vst_plugins/,1,[https://www.reddit.com/user/CheckOutMyFilms/comments/s8rl1q/how\_to\_install\_ableton\_live\_11\_full\_unlock\_2022/?utm\_source=share&utm\_medium=web2x&context=3](https://www.reddit.com/user/CheckOutMyFilms/comments/s8rl1q/how_to_install_ableton_live_11_full_unlock_2022/?utm_source=share&utm_medium=web2x&context=3),1642709033.0
s8rm4i,Plus 44 - Chapter 13 [Rock],1,1.0,Music,https://youtu.be/RenBDTzX6XE,0,,1642708899.0
s8rjnu,Smoke & Chill Music “Chicago Nights” by Ebony “Karma” Dior🌬🍃🔥💨🥃,1,0.67,Music,https://youtu.be/zSJVNLYFIhs,2,,1642708727.0
s8rhau,250ug - lipslock(snippet) [idk what genre this would be],1,1.0,Music,https://www.reddit.com/r/Music/comments/s8rhau/250ug_lipslocksnippet_idk_what_genre_this_would_be/,0,"'\*•.¸♡ ♡¸.•\*''\*•.¸♡ ♡¸.•\*'

✧･ﾟ: \*✧･ﾟ:\*[lipslock(snippet)](https://soundcloud.com/freshbl00d/lipslock)✧･ﾟ: \*✧･ﾟ:\*

'\*•.¸♡ ♡¸.•\*''\*•.¸♡ ♡¸.•\*'

p.s (I would really love some feedback if anyone listens to this, anything helps so dont be afraid to be honest <3)",1642708548.0
s8r4bl,name of the genre of ECHO's OST?,1,0.67,Music,https://www.reddit.com/r/Music/comments/s8r4bl/name_of_the_genre_of_echos_ost/,0,here's an example: [https://www.youtube.com/watch?v=il\_vCLoEfdg](https://www.youtube.com/watch?v=il_vCLoEfdg),1642707554.0
s8r4ad,TmK - Im Afraid [Electronic],0,0.5,Music,https://soundcloud.com/tmkp/im-afraid,0,,1642707551.0
s8lwug,Anyone have any ideas for string orchestra peices?,2,0.75,Music,https://www.reddit.com/r/Music/comments/s8lwug/anyone_have_any_ideas_for_string_orchestra_peices/,3,"So my Orchestra Teacher has gotten fired/quit and we just have endless subs who know nothing of music. As a Small Composer, I have a piece I've made for us to play. Though if anyone here has ideas for pieces. Or any composers would be as so kind to let us use their work. It would be greatly appreciated as all Scores, Parts, and Pieces will be Bought and printed by me. If you would like to just suggest a piece Reply. Though if you are a Composer willing to let us play your piece message me and we can work it out! Thank you for reading this even if you cant help

Thank you so much, Everyone - DattDuck08

Ps. I know this is kinda off the topic off the group but I myself have to put together an entire repertoire for a Spring Concert so just looking to everyone for help.

Message me to work out details if you happen to be a composer who will let us use your song.",1642693669.0
s8qxfc,Haezer - Dumb [Alternative],1,0.67,Music,https://www.youtube.com/watch?v=vxn0hlukn9Y,0,,1642707032.0
s8lqv1,J Star - hallelujah [R&B],2,0.75,Music,https://www.youtube.com/watch?v=CNh0hKi3VUE,1,,1642693202.0
s8l8oq,Opinions on a new type of synthesis,2,0.75,Music,https://www.reddit.com/r/Music/comments/s8l8oq/opinions_on_a_new_type_of_synthesis/,5,"So, long story short, I am writing an essay on a (most likely) new synthesis method I invented. It focuses on analog instruments (electric guitar, electric piano, but really anything that can generate an analog output), which cannot generate a control voltage or midi note output. The method is digital and alters the input waveform to recreate FM, subtractive, analog (-ish), etc. It can also do overdrive emulation, bit crusher and probably a whole lot of other things I haven't thought of yet. The synthesizer itself is at the moment only a very incapable arduino UNO with a sample rate of 4KHz, but I will use something more powerful once I get the chance.

My question is, how do you think this would affect music and musicians? New subgenres? How would you use it?

&#x200B;

If you have suggestions on a synthesis method that resembles the one I am describing, please tell me, because I have searched for hours. That would also be helpful.",1642691814.0
s8brle,Nat King Cole - Autumn Leaves [jazz],13,0.88,Music,https://youtu.be/qFB8n0m0vSU,5,,1642658232.0
s8q5j6,Silvia Balistreri - We Are Alive [Symphonic Rock] (2022),0,0.5,Music,https://open.spotify.com/track/5OVZ5vDA89TihsD5O6k8S4?si=5835e74cc1274d39,0,,1642704942.0
s8q3w2,Silvia Balistreri - We Are Alive [Symphonic Rock] (2022),0,0.5,Music,https://www.youtube.com/watch?v=Mbr6W-KcjGU,0,,1642704814.0
s8bidj,Blockhead - The Music Scene [Trip Hop],12,0.93,Music,https://www.youtube.com/watch?v=NhheiPTdZCw&ab_channel=NinjaTune,4,,1642657361.0
s8en70,Music for elementary school rock out sessions,6,0.8,Music,https://www.reddit.com/r/Music/comments/s8en70/music_for_elementary_school_rock_out_sessions/,22,"I teach a class of second and third grade students. Turns out they all love to sing and dance, though I'm not the biggest music head myself. I'm looking to put together a Spotify playlist of songs to rock out to for our (likely daily) ""Rock Out"" sessions. Does anyone have any suggestions?

Basically the guidelines are they have to be school appropriate lyrics. And the songs have to have enough of a beat/tune that we can either dance or sing along. For example, Were not gonna take it, I'm a believer, born to be wild, tutti frutti, etc. Thanks!",1642669031.0
s8prod,Lost in Music,1,1.0,Music,https://www.reddit.com/r/Music/comments/s8prod/lost_in_music/,1,"Have you ever lost your love/interest in studying music? 
I am a classical guitar player and recently started studying the piano. Each day I lose more of my motivations to study both of the instruments. 
I feel that many new musicians have been struggling with this same feeling.
Any tips?",1642703873.0
s8pe6d,LET IT GO - Glowa,1,1.0,Music,https://linktr.ee/_glowa,0,,1642702887.0
s8pdy1,Plagued Kitten - Fucked Up My Life (Official Music Video) [rap],1,1.0,Music,https://youtube.com/watch?v=qIg62Y2MkRg&feature=share,0,,1642702872.0
s8p14n,TunaBeatz - Captain [Drill Beat] (2022),1,1.0,Music,https://youtu.be/mEkCmJn_Zs0,0,,1642701940.0
s8p0d8,Ambient Horror Sounds,1,1.0,Music,https://www.reddit.com/r/Music/comments/s8p0d8/ambient_horror_sounds/,1,"I Created a new youtube channel to share Ambient Horror Sounds, i know it's the best because its my first time doing this and I dont have the adequate tools, but i want to do it

I would like that people make a critic about the video, please constructive criticism

This is the video [https://youtu.be/DUIibiEXPfw](https://youtu.be/DUIibiEXPfw)",1642701886.0
s8onxd,Name two artists that are close in discography and talent and people reply who is better or not,0,0.38,Music,https://www.reddit.com/r/Music/comments/s8onxd/name_two_artists_that_are_close_in_discography/,29,"For example 

Fka twigs vs Charlie xcx 

Lorde vs Fiona apple 

Mos def vs Freddie Gibbs 

Flume vs disclosure 

And lastly tool vs my chemical romance",1642700976.0
s8onmz,"ProvingGroundOfFeel - Music 48. On picture: lovely girl, she lean on something, and a monster. [Electronic Music]",1,1.0,Music,https://youtu.be/VIgOo0d7ylA,0,,1642700955.0
s8ocxu,Song help,1,0.99,Music,https://www.reddit.com/r/Music/comments/s8ocxu/song_help/,0,"So, I suppose this needs some explanation. During quarantine, I went on a long youtube rabbit hole of music and one song stuck out to me. A long story of trying to find it by looking at what I had listened to that day later, I still can't find it. I know this is probably a long shot, but I remember the album, vaguely. It was like a cityscape with green highlights to it and it looked similar to Bear Ghost's album Blasterpiece and a lot like Big Wreck's album Ghosts, but more neon. I also remember it coming after Stuck in the Sound - Let's Go, but I'm not sure how long the rabbit hole went from that song before I got to the song I'm thinking of. I believe it was a relatively indie band, but I can't say for sure. I know this is probably a long shot, but I figured I might as well try, and hopefully, someone knows what I'm talking about. If you know what it might be, just post a picture of the album and I'll reach into the depths of my memories and see if it matches. Thank you so much for reading. You have no idea how long this has been bothering me.",1642700187.0
s8nzhl,Young Atlantic - From Bolivia [Rap/Hiphop],1,1.0,Music,https://youtu.be/bU6j7DlU6D0,0,,1642699187.0
s8fazf,Microwave — Tar [Alt Rock],3,0.81,Music,https://youtu.be/Upp6YJg2wyc,0,,1642671709.0
s8n5ok,"Is there something similar like ""Electrypnose - E7"" ?",1,1.0,Music,https://www.reddit.com/r/Music/comments/s8n5ok/is_there_something_similar_like_electrypnose_e7/,0,"so good...

&#x200B;

&#x200B;

i know hallucinogen, infected mushroom (the earlier are nicer), ace ventura, astrix

&#x200B;

&#x200B;

need new music... whats similar (specially that E7 one... \*shivers\*)",1642697013.0
s8n2sk,Pulp - Common People [Britpop],1,1.0,Music,https://youtu.be/VxQuoLiA08k,0,,1642696796.0
s8n2d2,Yagu Pop - Eternity[Progressive Rock],1,1.0,Music,https://www.youtube.com/watch?v=shYIEJXejDs,0,,1642696764.0
s8mwvd,Just released my new Trance track. Its a happy uplifting track with a Tech'y rolling bass. Would be nice to see what you Trance lovers think. Its released officially in 10 days on Spotify and I tunes etc. Hope you all enjoy it,0,0.5,Music,https://soundcloud.app.goo.gl/DwiKo,0,,1642696338.0
s80jfh,Cocteau Twins - Lorelei [Shoegaze],34,0.83,Music,https://youtu.be/o7tcFKakZTA,3,,1642626368.0
s83eai,LeadBelly - Where Did You Sleep Last Night [Blues],24,0.7,Music,https://youtube.com/watch?v=CjTSUIG-LXw&feature=share,5,,1642633611.0
s8mnc5,Me- Scanner Assault (Drum and bass/electronic),1,1.0,Music,https://www.youtube.com/watch?v=8JLCJIk0cLI,1,,1642695630.0
s8mjlf,Neil Young - Barn ALBUM REVIEW,1,0.67,Music,https://youtube.com/watch?v=bsmIvCba_Fc&feature=share,1,,1642695361.0
s8hrok,"Swayed, Skine - Tension (Skine x Swayed Remix)",2,1.0,Music,https://www.reddit.com/r/Music/comments/s8hrok/swayed_skine_tension_skine_x_swayed_remix/,0,"[Soundcloud \[FREE DOWNLOAD\]](https://soundcloud.com/skinemusicuk/tension-skine-x-swayed-remix?si=048e631cd187475c9237a53e4bddb954&utm_source=clipboard&utm_medium=text&utm_campaign=social_sharing)

[Spotify](https://open.spotify.com/track/5YLkUn6JBfcg2sZeBH9AKK?si=8d27f81f7ed84c8f)",1642681331.0
s8mbp4,Musical Inspiration,1,1.0,Music,https://www.reddit.com/r/Music/comments/s8mbp4/musical_inspiration/,0,"Most bands: go on a huge journey to find inspiration
The Beatles: *Literally yawns*",1642694779.0
s8maat,Anupriya - Naina [Indian Folk],1,1.0,Music,https://youtube.com/watch?v=QPUi5iS_GdY&feature=share,0,,1642694671.0
