post_id,title,score,upvote_ratio,subreddit, url,num_comments,body,created
sp9crp,When are we organizing?,8,0.75,antiwork,https://www.reddit.com/r/antiwork/comments/sp9crp/when_are_we_organizing/,23,"Speaking as an American here (28M), I’m not very optimistic of my future here. Unchecked Capitalism continues to see our nation prop up a select lucky few at the detriment of millions. Technology companies (specifically Bay Area ones) have gone basically unregulated for years, and I have a strong suspicion they’re driving the current divide even further.

When are we going to do something about this? I’m tired of waiting on government.. tired of waiting for fair treatment from employers.. tired of being abused by student loans… tired of not being able to afford a place to live where I work… tired of needing to burn myself out to survive here. The working class of America needs to go on a collective strike. Employers need us just as much as we need them.

If we don’t stand up for ourselves, the divide will get to a point where the working class can no longer survive. People wont be healthy enough to do their jobs and America will just fucking stop. Maybe it’ll take us to hit rock bottom before anything changes (likely because we’re humans), but I’m seriously ready to murder the ultra wealthy and take back what we deserve. How else are we going to solve this problem? They obviously aren’t willing to help us in any way… The ultra wealthy NEED to be threatened with very real consequences. We need to do something before Americans burn out, and our oppressors run off to Mars or wherever the fuck…",1644507450.0
sp99q5,CNBC doubling down on absurdity!,74,0.94,antiwork,https://i.redd.it/chdb2dtry0h81.png,38,,1644507224.0
sp98y2,Emergency Leave Transfer Program -US govt,6,0.8,antiwork,https://www.reddit.com/r/antiwork/comments/sp98y2/emergency_leave_transfer_program_us_govt/,1,"I am not brave enough to produce the email, but thousands of US federal workers got an email about the program in the title, which allows employees to donate unused leave to other employees who have been affected by the wildfires in Colorado.
  Because the massive multi-trillion dollar US federal govt can't afford to give extra  paid vacation to people who are still sifting through the literal...->literal<- ashes of their lives, we want our other employees to lose their unused leave.
  America, the dystopian clusterfuck.",1644507161.0
sp980t,"Saving money and investing isn't for broke people. When you luck into extra money, spend it on what you want, when you want it.",5,0.62,antiwork,https://www.reddit.com/r/antiwork/comments/sp980t/saving_money_and_investing_isnt_for_broke_people/,22,"I've never been paid a lot, despite being intelligent and having experience in many areas. Big money is apparently for silver spoons, shills, yes men, and those who ""respect the grind."" Yet, I am still young, and have a family, a house, and all of the material comforts that I have always dreamed about. And that is because I got it all when I wanted it. 

Every little bit extra on tax returns. Every bonus. Every stimulus check. All spent before someone could suggest saving it. Because what inevitably happens when you are broke is that the money you saved ends up disappearing anyways.

Why save for some far off day that you may not be alive for anyways? I want to play guitar now. I want to play video games now. I want to buy my young son every fucking thing he wants now. None of that works when I am 60. 

Your time is your own. Your money is your own. Don't let people shame you. Enjoy life while you have your health, and don't sacrifice that time, money, or health for some hypothetical future happiness.",1644507087.0
sp95z4,"Karl Marx, the OG antiworker",4360,0.98,antiwork,https://i.kym-cdn.com/photos/images/original/001/492/804/ee8.jpg,251,,1644506932.0
sp95yp,Can't interview because I always work.,6,0.88,antiwork,https://www.reddit.com/r/antiwork/comments/sp95yp/cant_interview_because_i_always_work/,14,"I sometimes see where people write, ""why don't you just get a different job?"" As if it's a galaxy brain idea.  

My problem recently is, it's generally difficult to find available times for interviews.  I work 7am - 7pm 5-7 times a week.  I can't just quit because I need money.  I also find it hard to take PTO, because I have so little I need it for emergencies that may arise.  

I'm sure there are plenty of people in this same boat.  So, when you ask, ""why don't you spend 20-30 hours a week applying, getting dresses up, and interviewing?"" this is my answer.",1644506931.0
sp95vr,Help me figure out if this employer is out of line- epilepsy and reasonable accommodations,4,0.83,antiwork,https://www.reddit.com/r/antiwork/comments/sp95vr/help_me_figure_out_if_this_employer_is_out_of/,5,"I need opinions on how my brother is being treated at his workplace. - my brother is a government contractor in a large firm (USA) you’ve probably heard of. He has epilepsy and can’t drive. His work requires him to be on site 3 days a week. He is paying out of pocket for Uber rides to and from his job site -OVER $100 A DAY. HIS WORK WILL NOT REIMBURSE HIM. HIS WORK HR HAS STEERED HIM AWAY FROM FILING FMLA. please please help us figure out what to do. He said the HR person said it’s in his best Interest to NOT file FMLA and didn’t provide him any resources. 
Shouldn’t mandatory transportation to a job site be a reasonable accommodation for someone who can’t drive??? Am I going crazy?? Please help. Thanks so much.

He is a very non-confrontational person and i think they are 100% taking advantage of him.",1644506925.0
sp93li,I really good read. A bit long and dragged out but all in all a decent good read....,37,0.76,antiwork,https://i.redd.it/w58isrtcx0h81.jpg,29,,1644506751.0
sp930e,My resignation letter to my former employer,13,0.93,antiwork,https://www.reddit.com/r/antiwork/comments/sp930e/my_resignation_letter_to_my_former_employer/,4,"*this was sent out to over 90 employees across three states.  I found this in my emails from 2018 and thought I would share


To All;
    It is with great pleasure that I tender my resignation today from ****** Enterprises and remove myself from the ranks of the ***** Windows and Doors sales team.  As an individual with over twenty five years experience in home improvement I am appalled at the lack of integrity of the brand and the gross inferiority of the product. The class action lawsuit only scratches the surface of the flaws throughout the catalog.
    The way this company from Iowa on down treats its sales team is a complete joke.  Sending out mailers with deep discounts that the commissioned salesman have to ‘eat’ from their commission or ‘negative discount’ is sham and lacks any form of integrity.  Demanding that we LIE to the homeowner about the class action lawsuit and tell them the suit only entitles them to a ‘25% discount’ (also chipped right from the salesmen’s commission) is a clear violation of the lawsuit guidelines.
       On a franchise level the owner B*** is a seven foot tall man child and a bully. Personally telling the Buffalo sales team that “he didn’t give a fuck about our kids, our family arrangements, or evening plans” and telling us we are HIS “six days a week, five nights a week and three Saturdays a month” was the clearest indicator I needed to see how much of a pile of heaping rosy cheeked shit he is.  Then came the buzz and talk throughout the company of the multiple lawsuits he is embroiled in, including sexual harassment and the fact that **** Corporate is planning on yanking the franchises out from under him due to them.  This is why the Buffalo sales team and countless others have departed since I joined the ranks. 
     This franchise has nearly a hundred people supposedly working in its offices to support the over all sales of the company.  Other than M*** H****, A**** W*****, G**** W****** and small handful of individuals  I have never felt I had support, only adversaries. G*** W****** did a great job training me on company products and options but had little she could educate me on with PQM.  
    I was sent to Iowa for two weeks where I was drilled with sales technique and how to ‘one call close’ but very little to no training on PQM or how to actually submit an order once it sold. I wasn’t educated on processing deposits or even explained that I would be the one processing them. With a supposed support staff of this size it makes little sense to saddle the 100% commission sales rep with bank related matters.  The list of incidences of ‘passing the buck’ are countless. The atmosphere of ‘cover your own ass and screw anyone else’ is systemic throughout the company.  Most are more concerned about not pissing B*** off or basking in the ego their little job title gives them than actually servicing the customer.
    Which brings me to two individuals particularly that I would like to address.  T*** S****** is mediocre salesman turned IT guy who lives by the mantra “Its not my job” and wants his little ‘service tickets’ that do nothing but satisfy his ego and delay the resolution of problems. His smug and arrogant attitude could be laughable if it weren’t so annoying…and he is a tattle tale.  
The worst sniveling petulant child in the company has to be J** “respect my authority” W*****. His petty and melodramatic behavior is also a joke. This is a man who will stop a job in its tracks over the most trivial detail. His only interest is to make a hundred keystrokes to point out a problem via email rather than making four to correct it. He is one of the root problems in this company in terms of customer service. He is widely known throughout the sales teams as a thorn. He cares very little about satisfying the customer; he only cares about satisfying his ego and not getting demerits from the ‘executive management’.
Am I perfect? Nope. I have made my share of mistakes and own them.  I have no doubt that I was set up to fail at this company simply by working with cut throats, tattle tales, buck passers and people who flat out have no interest in participating in a team atmosphere. To those who have treated me kindly I offer you the best of luck and bid you well
Regards,",1644506707.0
sp92ux,Tiff Macklem blaming workers' productivity on inflation. Can you believe this Fkn guy?!,5,0.78,antiwork,https://i.redd.it/9te4qm06x0h81.jpg,4,,1644506695.0
sp92mg,Cubicals at work are downright awful sometimes,6,0.81,antiwork,https://www.reddit.com/r/antiwork/comments/sp92mg/cubicals_at_work_are_downright_awful_sometimes/,10,"The ones in my office are designed to have the employees back facing the aisle. I'm assuming that this design is meant to improve productivity. Not only do I hate having my back exposed like that to a room, but it reeks of micromanagement. If I need to check my phone, I will.",1644506676.0
sp91iy,Friend asked me how the first day of work went,273,0.99,antiwork,https://i.redd.it/vqfwuegqw0h81.jpg,7,,1644506589.0
sp90ns,Can someone tell me what this sub is about,0,0.45,antiwork,https://www.reddit.com/r/antiwork/comments/sp90ns/can_someone_tell_me_what_this_sub_is_about/,16,Cause like i feel like it should be about the leftist perspective of abolishing work and if its not can someone direct me to a place that is about that.,1644506526.0
sp8y7z,Why does LinkedIn still have job listings w/o salary info?,7,0.82,antiwork,https://www.reddit.com/r/antiwork/comments/sp8y7z/why_does_linkedin_still_have_job_listings_wo/,5,"If I'm in New York, and if New York recently passed a law that requires salary disclosure in ads, why are there ads on LinkedIn that say the information is not available?",1644506335.0
sp8y1b,Does anyone else find it distasteful when you apply for a job and you’re required to submit two applications?,26,0.91,antiwork,https://www.reddit.com/r/antiwork/comments/sp8y1b/does_anyone_else_find_it_distasteful_when_you/,6,"It feels more and more like there’s the first application to “get their attention” and then a second one actually apply for the job. 

Multiple employers have read my app, said they like it, then tell me to do another one through another job application service. Why is this? 

*The pay is also usually crap*",1644506320.0
sp8ozv,$10.00 an hour for skilled work and requires a degree,12,0.8,antiwork,https://www.reddit.com/gallery/sp8ozv,6,,1644505634.0
sp8mxb,Update: Found out that my job removed the free tea flavor that I like because I use it.,33,0.9,antiwork,https://www.reddit.com/r/antiwork/comments/sp8mxb/update_found_out_that_my_job_removed_the_free_tea/,25,"So after Newsweek ran an article about it I decided it may be worth following up on.  I went and chatted up the front desk lady who clarified it was 'a joke' and that the supplier is just out of stock.

HOWEVER!

I'm not so sure. You see the brand is Biglow, and the tea I like is English Tea Time. And guess what I can find, literally anywhere? You gussed it! English Tea Time!

It's been 2 weeks, and I'm sick of lemon.

What I did discover is that they sell variety packs, which are one of the cheapest options, and when looking through the cupboards I find a ton of the less than desirable flavors IMO (proof below)

Now call me a conspiracy theorist but I think they are WANTING me too go through the overstock of other flavors before they order more. To save literal pennies vs ordering the one kind.

Now I'm not sure I should be drinking it and just get my own. Thoughts?


TLDR: a joke leads to more penny pinching shenanigans.",1644505484.0
sp8kx9,Couldn’t help but laugh at this hiring post. Such a fat $$check$$ they have to advertise on IG,9,0.85,antiwork,https://i.redd.it/nw7ytae6t0h81.jpg,2,,1644505342.0
sp8hd8,Starbucks fires 7 at Memphis store after they tried to form a union,55,0.95,antiwork,https://www.dailymail.co.uk/news/article-10495805/Starbucks-fires-seven-workers-Memphis-store-tried-form-union.html?ito=native_share_article-masthead,6,,1644505109.0
sp8h63,“Just work harder”,8935,0.98,antiwork,https://i.redd.it/u33ahjofs0h81.jpg,360,,1644505093.0
sp8gmu,I work my ass off 9-5 and I can’t afford to move out.,61,0.94,antiwork,https://www.reddit.com/r/antiwork/comments/sp8gmu/i_work_my_ass_off_95_and_i_cant_afford_to_move_out/,62,"It’s BS. If I’m working full time I should be making enough to live independently.

My only hope of moving out is to move out with someone else and it infuriates me, I work hard. Now let me live.",1644505048.0
sp8g2c,LOSING MOTIVATION,4,0.83,antiwork,https://www.reddit.com/r/antiwork/comments/sp8g2c/losing_motivation/,4,"I am honestly losing motivation whilst applying to jobs.My background Biology degree specialized in Fungal and Microbiology ..... 2.5 years of Undergraduate Research experience..... 1.5 years of experience in industry doing QC......... 2.5 years as a Research Assistant at a top Research Univ.......

I apply to 10 to 20 jobs a day....... only thing I hear back is the auto reply of "" We have received your application""........ No REJECTION NO UPDATES NOTHING AT ALL for weeks or months.... TELL ME SOMETHING.",1644505005.0
sp8e3y,I came across this post on my facebook memories. I hope it is okay to post it here....,17,0.95,antiwork,https://www.reddit.com/r/antiwork/comments/sp8e3y/i_came_across_this_post_on_my_facebook_memories_i/,0,"A little clarification of corporate lingo:

COMPETITIVE SALARY: We remain competitive by paying less than our competitors. 

JOIN OUR FAST-PACED COMPANY: we have no time to train you.

CASUAL WORK ATMOSPHERE: We don't pay enough to expect that you'll dress up-well, a couple of the real daring guys wear earrings. 

MUST BE DEADLINE ORIENTED: You'll be six months behind schedule on your first day.

SOME OVERTIME REQUIRED: Some time each night and some time each weekend.

DUTIES WILL VARY: Anyone in the office can boss you around.

MUST HAVE AN EYE FOR DETAIL: We have no quality control.

CAREER-MINDED: Female Applicants must be childless (and remain that way).

APPLY IN PERSON: If you're old, fat or ugly you'll be told the position has been filled.

NO PHONE CALLS PLEASE: We've filled the job, our call for resumes is just a legal formality.

SEEKING CANDIDATES WITH A WIDE VARIETY OF EXPERIENCE:  You'll need it to replace three people who just left.

PROBLEM-SOLVING SKILLS A MUST: You're walking into a company in perpetual chaos.

REQUIRES TEAM LEADERSHIP SKILLS: You'll have the responsibilities of a manager, without the pay or respect.

GOOD COMMUNICATION SKILLS: Management communicates, you, figure out what they want and do it.",1644504854.0
sp8a60,Laid-off Peloton staffers crash new CEO's all-hands meeting: report,12,0.88,antiwork,https://thehill.com/business-a-lobbying/business-a-lobbying/593593-laid-off-peloton-staffers-crash-new-ceos-all-hands?fbclid=IwAR1-rNHroYBSbEQ49vx-3Rlz8D6fPjb1okMKxisFtfLVz01IMra_RCI0QwI,3,,1644504534.0
sp875v,Willy Wonka and the Myth of the Lazy Poor,8,0.75,antiwork,https://youtube.com/watch?v=8WevybLUCNA&feature=share,1,,1644504292.0
sp8633,Resignation - how does unused leave + notice period work?,3,0.8,antiwork,https://www.reddit.com/r/antiwork/comments/sp8633/resignation_how_does_unused_leave_notice_period/,10,"I am looking to resign very soon, but have a 1 week vacation to go on, then look to give my 2 weeks notice. So 1st day back, I will resign. Just want to check, is there any reason to resign before my vacation? Obviously my employer would prefer that, but I dont GAF about that. I guess i am just antsy to resign, but part of me thinks if resign before holiday, they will prorate my leave pay, or since Im in an at will state, just fire me immediately.",1644504206.0
sp85r0,I'm a remote worker. How can I make my life easier?,4,0.75,antiwork,https://www.reddit.com/r/antiwork/comments/sp85r0/im_a_remote_worker_how_can_i_make_my_life_easier/,12,"I work entirely from home. Does anyone have tips/tricks/hacks that make working from home a better experience? I have multiple zoom meetings every day, so I can't totally disappear.",1644504177.0
sp83af,"Them: “Your healthcare, 401k, credit worthiness, are all tied to work.” Gen Z: “Ok then make the work meaningful.” Them: “Oooh, aren’t we Mr. I-want-it-all!”",75,1.0,antiwork,https://i.redd.it/90ipbzj4p0h81.jpg,6,,1644503979.0
sp82dd,"He laid off 75,000 people a month later",191,0.98,antiwork,https://i.redd.it/lwwsw4lpo0h81.jpg,25,,1644503909.0
sp81dd,"Great advice. Found on King at Newtown, NSW Australia.",473,0.98,antiwork,https://i.redd.it/w7sq2sboo0h81.jpg,15,,1644503830.0
sp80vo,Starting a new job,19,1.0,antiwork,https://www.reddit.com/r/antiwork/comments/sp80vo/starting_a_new_job/,6,"Any job is just a job at the end of the day but I just secured a remote insurance adjuster gig after only working shitty blue collar Gigs for the past 10 years.

I just wanted to share my experience, better work can be found!!",1644503786.0
sp7w5r,Hello! Noob Introduction,4,0.75,antiwork,https://www.reddit.com/r/antiwork/comments/sp7w5r/hello_noob_introduction/,4,"Hi I'm from the Uk and was a lurker but have decided to join because of the interview, I was annoyed at how it was presented and the slander :( by anti antiwork :) commenters.

I am 20's but dont have great literacy skills or computer knowledge, I was a Young carer and left school at 14 because i got sick and couldn't cope but hopefully will make up for it in persistence.

We had over a half dozen articles which I posted the comment you can see in the picture, if you have any input feel free to comment or msg. I have never used reddit or social media so its a bit confusing if I dont respond its probably because I've got confused :)

https://preview.redd.it/nzuy7s29n0h81.png?width=1174&format=png&auto=webp&s=3d610218309e6a0b7f6366165ce70c7fb7005913",1644503402.0
sp7vcq,How do you stay working under horrible bosses?,8,0.84,antiwork,https://www.reddit.com/r/antiwork/comments/sp7vcq/how_do_you_stay_working_under_horrible_bosses/,11,"I moved from California to Texas and ever since then I don't know if it's been me or my managers that have driven me out of my jobs. In California, i had very professional respectful managers that wouldn't micromanage and they were respectively at a retail setting and a community health center setting. The two worst managers I've experienced were here in Texas when I started working in doctor's offices and I guess it's due to the demand and stress but it's been really weird to see such a disconnect between what I had and what I'm experiencing now. I'm not by any means a lazy worker I really don't like to leave any work on my desk at the end of the day I try to help out as much as I can I've been cross trained and I apply my skills so I'm just wondering does long-term employment typically depend on the environment or the person? because I'd like to stay somewhere for a while but these managers are crazy. I'm ready to leave this job after only 6 months.",1644503333.0
