post_id,title,score,upvote_ratio,subreddit, url,num_comments,body,created
sotisz,This is why there are no good daycare teachers left.,8,1.0,antiwork,https://www.reddit.com/r/antiwork/comments/sotisz/this_is_why_there_are_no_good_daycare_teachers/,0,"I'll start with that I worked in daycares for almost two years. For the moment, I will not name names, because the companies are really good, just specific locations gave horrible experiences.

&#x200B;

My first daycare (partnered with a bank), back in Texas, was absolutely amazing and the people were the best coworkers I could ever ask for. Even when we only had 4 teachers after we reopened after COVID, I was allowed to call off for a mental health day, because they were accommodating my depression, even though they really didn't have to. I was only getting paid 10.50$/hr, but I loved every second of my workday, so I didn't mind.

&#x200B;

Moved up to Iowa after around 8 months of being there, and just transferred locations since it was a big company (partnered with a hospital). Started at 11$/hr, and everyone was super nice, for the first month. After a while, comments kept getting made at me and behind my back, gossiping was out of control, and even though I loved seeing my kiddos (I worked in the infant classroom), I couldn't stand being there.

I often had to call out due to illness, and got turned down lots of times. ""I have an 100.6 F temperature right now, it's not safe for me to come in and be around infants."" They told me to take ibuprofen and come in, otherwise it'd be a mark against me. Left one day due to migraine and the constant need to puke. Got talked bad about. Called out because I was literally crying from pain and had to run to the ER. ""Can you come in? We have no one to cover for you"". I literally had to contact the regional manager to get her to make my management to start doing the required daily covid checks that they weren't, and still got told to come in.

I wasn't allowed to call out, but I had a coworker calling out during a teacher shortage, and I was made to pull a 12 hour shift, open to close, with just one, one hour break (That I'm pretty sure got cut short because the teacher breaking me was needed elsewhere?) Eventually started getting less and less hours, and for my health, got moved to the preschool room when I asked, because I was in tears one day, after a really stressful day of being made to work by myself. The comments got worse, not just for me, but for everyone. Once I had a week where I was only scheduled for 8 HOURS. During NAPTIME. So no kids to interact or play with. Turned in my 2weeks the next day for a remote position. My last day of work, HR started calling all the employees to ""finally meet them"", but really enough of us had reported our managers that they started investigating. (I was informed that the regional manager covered for them and so they were not removed from the positions.)

(Edit: I just checked, and the director and co-director of this center are actually gone! As are most the people I actually knew, but a lot of them were working on leaving when I was.)

&#x200B;

2 months later, I missed working with kids, so I looked for new daycares. Ended up at another big company, like my last one, but making 14$/hr, which was still low, but much better pay. The teachers in the infant room seems really nice... but I started looking for a new job after the first week. Despite COVID, teachers were moved between rooms like crazy, even in the middle of their shifts. My co-teachers started talking bad about me to my director, and complaining about my habits instead of talking to me about it. One day, we got no afternoon bathroom breaks in the infant and toddler classrooms. I quietly brought this up to the co-director as I was headed out for the day, and got scolded the next day for being ""assertive"" and ""disrespectful"". I later got told that ""no gossiping is allowed. That's what breaks a team"", and then my directors next line was ""\[A\] told me that \[B\] said that you..""

Since I'm not used to the cold, post-nasal drips have been very common since I moved, and so I brought it up during my lunch one day that I had one, and was promptly sent home and told not to come back without getting tested, which I guess is fair, except for the fact that I called and told the co-director that it would take maybe 10 hours for the results, to which she said ""We'll assume we'll see you tomorrow then unless you call and say otherwise!"" I got scolded the next morning as I tried to discreetly show my negative test to my director, and she said I was supposed to call and tell them I was coming.

They were in absolute disbelief when I told them that none of my other coworkers at my other two daycares have never had a problem with my behaviour and teamwork. They were the first to refuse to understand me and work with me on literally anything. Although.. they did say that they'd love to see me leading a classroom one day.. I am very confused about that still.

And one day I came in, after walking in the pouring rain, and left halfway through with signs of hypothermia, and they gave me a strike for leaving early, because I wouldn't let them call an ambulance and put me in even more medical debt than I was already in. When I turned in my ""week and a half notice"", they went ""We'd be more than happy to make it one week!"" And I took it because I wanted to be gone more than they wanted me gone.

&#x200B;

Now I'm working retail, and even though I do more physical labor than I did in the daycare field, I am much happier to be in a supportive place instead of a nightmare daycare.

&#x200B;

I also ran into one of my coworkers from the last daycare, and they said that most of the preschool room was quitting because they hate it there, and they have no idea how the center even passed re-certification, because the teachers treat the kids horribly too.",1644455871.0
sotic1,I have to beg to be paid the minimum wage,11,0.87,antiwork,https://www.reddit.com/r/antiwork/comments/sotic1/i_have_to_beg_to_be_paid_the_minimum_wage/,13,"I'm a pilot. Specifically a charter pilot for a company doing a whole heap of medical evacuations all over my country. I havent had a full day off in months and I life in fear of checking my phone for calls from boss because I know I'm being stretched to my limit.

Now I'm absolutely ok with all of this. These are trying times, I'm happy to he working...
If I was being paid the correct amount.

I started at this company 3 years ago, very junior but eager. Over those 3 years I've increased my qualifications and experience ten fold, to a point where I have become an integral part of the company, and alot of flights would not be able to go ahead without me.

Naturally I assumed my qualifications would come with a pay rise, and according to the law, it should raise my pay by about 10 dollars an hour.
Woohoo right?
well Humble reader, not woohoo, very far from it.

you see, after asking the HR manager about my now legally required minimum pay rate (that I've been entitled to for 5 months now), he told me to talk to finance, who then passed me back to HR who then told me to email the companies CEO.
I sent an email to him, asking him when I could expect the raise, he told me to set up a meeting with him
Fantastic! 
emailed back quickly asking when worked for him

and I've yet to get a response.
that was 2 months ago, I have since sent an email every Friday, kindly asking to set somthing up.
No response.
so it seems his tactic is to ignore me and hope I just give up.

Well I'm not, at this point I'm livid, I work 11 hour days (legal maximum) every day with barely a day off. I'm literally never seeing my family, I haven't gone to the gym in months and I have no time to enjoy any hobbies.
So I email the HR manager again, asking if she could pretty please help me.
Nope
all pay rises go through the director.

""For fuck sake"", I scream from 15,000ft in the air.

ok fine. I see the HR manager in person, she handles all the directors affairs, can she set up a meeting?
Nope
apparently he's now got covid and is house and bed ridden for days.
ok well who do I see then now that the director is literally bed ridden.

Apparently still the director.

but... he's bedridden and can't so anything

well he still handles it all, but I shouldn't message him because he's very very sick.

so here I sit, again, 15,000ft in the air working for less than I was getting as a bar tender. Just wishing this company would collapse.

sorry for the rant. I'm just so mad",1644455837.0
sothzu,Just got fired today for politely asking customers to put their dogs away,19,0.91,antiwork,https://www.reddit.com/r/antiwork/comments/sothzu/just_got_fired_today_for_politely_asking/,27,"I am (was) an appliance installation guy, I got in with this company from a dude I played football with in high school. He’s the lead install man there. I had construction experience for the past 3 years so he wanted me for my tool experience yada yada yada. He thought I would be a good fit for the job. So I took it, and he started me off high in terms of pay hoping I would stay. This is beginning of January this year. My first week, I get bit by a customers dog while I’m carrying their refrigerator on the dolly. I’m on a blood thinner, so I go to the urgent care to get taken care of. From this point on, I ask if we can tell customers to please put their dogs away while we’re working in their home. I bring this up to our boss and he’s totally cool with it. Most people at this point agree with me that it’s common courtesy for customers to do this anyway. The problem is, the lead install guy who got me the job is a dog lover. He himself owns two pit bulls who he loves to death. He feels that it’s RUDE of me to ask customers to put their dogs away, and he refuses to do it himself. So I continue to do this since the boss is okay with it, and I’m not trying to get bit again by somebody’s 200lb mastiff. At this point my anxiety is high around large dogs. Weeks go on and he becomes visibly irritated by me asking customers to politely put their dogs away before we come in. Today at the end of the day, he tells me that he’s letting me go. His words were “it sucks man, you’re a good worker and you pick up really fast but I can’t have you be afraid to go into somebody’s house who has a big dog. I think that we are doing our customers a disservice by asking them to put them away.” I ask him if this is seriously the only reason he’s letting me go, that there has to be something else. He says yes this is it. I am honestly baffled by this. The only reason he can have me fired is because he’s the lead install guy and has been with the company for 7 years, since we were in high school. I don’t see the big boss much, he basically just checks in with him and tells him how I am doing. I thought I was doing quite good otherwise, considering I have experience with more tools and was picking up fast. I even texted him when I got home, saying there has to be an underlying reason he wanted me gone. He hasn’t replied yet.",1644455811.0
sotg0e,Management included this motivating message along with our schedule for the week,8,0.79,antiwork,https://i.redd.it/n40zhemfpwg81.jpg,27,,1644455655.0
sotfpx,How would capitalism work without countries?,6,0.8,antiwork,https://www.reddit.com/r/antiwork/comments/sotfpx/how_would_capitalism_work_without_countries/,23,"Don’t countries enable the structure for capitalism to operate through arbitration between the laws and taxation and corruption at the intersection of those corporations and the companies and their borders?

Isn’t that a corruption of them and the substrate that they operate through to affect their goals in our messed up world where we are controlled by borders that really don’t exist and should not exist in reality but are there because of control. Controlled by thugs that used to be the armies that beat us to death and killed us in our huts and then told us we needed them for our protection? Thugs that the capitalists pay for to beat us if we try to get more money from the capitalist?

All of this comes down!!!",1644455632.0
sotd87,Anti Work Anthem?,6,0.76,antiwork,https://www.reddit.com/r/antiwork/comments/sotd87/anti_work_anthem/,18,"Just wondering if anyone knows of any songs we could use as our unofficial anthem?

&#x200B;

I've always enjoyed [Thats it, I quit](https://www.youtube.com/watch?v=EiI05ebwvfs) by hayseed dixie (in fact i even emailed it to an old boss along with my letter of resignation many years ago). But it may be a tad too ""redneck"" for some people.... any other suggestions?

&#x200B;

(and yes, before someone points it out, we dont need an anthem, but i thought this might be fun, at the very least we can share some antiwork songs and rib each others taste in music :P )",1644455429.0
sotd7d,When is it acceptable to walk out before a job interview?,24,1.0,antiwork,https://www.reddit.com/r/antiwork/comments/sotd7d/when_is_it_acceptable_to_walk_out_before_a_job/,41,"I have been waiting for 20 minutes for the interviewer and I'm just about ready to walk out. 

For future reference, how long do you normally wait before leaving?

-Edit: The next person to be interviewed has arrived and I'm still waiting",1644455428.0
sotchs,"Told last week my job is going away in a month, will I jeopardize unemployment if I don't stay until the end?",7,0.77,antiwork,https://www.reddit.com/r/antiwork/comments/sotchs/told_last_week_my_job_is_going_away_in_a_month/,11,"Starting on the 15th the workload will decrease along with my hours until the account they're losing is gone for good first week of March.  I feel like my time would be better spent throwing it into a job search rather than all the wasted time commuting, etc.",1644455374.0
sot8kx,"So if the company saves over £100,000, I could get a day's salary in gift cards? Can I sign up twice?",18,0.95,antiwork,https://i.redd.it/6sxsnq6omwg81.jpg,6,,1644455052.0
sot5wy,I think I was rejected because I’ve worked bottom-of-the-ladder labor jobs before,5,0.78,antiwork,https://www.reddit.com/r/antiwork/comments/sot5wy/i_think_i_was_rejected_because_ive_worked/,8,"Long story short: I have a BS in environmental science and policy and have been trying to find a job in the field for about 2 years now but it seems like every other company that gets back to me has a similar “thanks but we think you would fit better in our $10/hr unskilled labor position” I’ve worked in a couple of jobs in construction and factories before I got my degree, is it ruining my chances? 

Okay to start off this is kind of a rant to vent. I’m currently 24, living with my parents working about 70-80 hours a week at a construction company and grocery store. I make the payments on my student loans,car insurance, cell phone, help with groceries on occasion and save a small amount that’s left over.  

I pretty much “did everything right.”  I got straight a’s in high school played sports, did some academic extra curricular, got Eagle Scout with the bsa, and worked over the summers to save for college. I took a gap year and worked for a construction company and then started school the next fall. 

I graduated a year early because of some AP credits and community college program my high school had. That was spring 2020 and since then I’ve worked for a factory that had 12 hour overnight shifts that were hell, and then the same grocery store I’m at now that won’t give benefits even when i was working well over 40hrs/week.  I’m also working for a local construction company that contracts out to penndot, and according to most of the other guys it’s basically a temp position the first couple of years so I’m probably getting laid off in April.

From what I’ve seen it seems like my degree is kind of a joke anyway, but it’s still a stem field and I have my OSHA 40hr hazwoper and environmental specialist cert.  Ive been thinking about going back to school for an engineering degree while my parents are still cool with me staying with them, but I don’t like the idea of more debt, and although it’s not unbearable, and I’m grateful for having a place to stay, I’d like to move out at some point. On top of that I don’t know if going to school for another 3-4years is worth it for something that’s not guaranteed, but I don’t know what else to do. I never go out and pretty much just work , sleep, and sit around on my day off because I’m always tired.",1644454833.0
sot1el,I got a new career!!!,54,0.97,antiwork,https://www.reddit.com/r/antiwork/comments/sot1el/i_got_a_new_career/,10,"Old Job:
Retail Manager.
50+ hour work week.
Retail Hours(as in no life)
1 hour commute each way.
2% raise last year.
$46k salary
Boss was micromanager

New Job:
Human Resources
40 hour work week.
No nights or weekends.
After 6 months can work from home.
20 min commute.
$65k base salary
Boss is a former coworker.

After 6 years with current employer I hit my breaking point. Nothing is good enough that we did. Despite massive sales increases. And making profit.

I will be giving my notice Friday at 5pm.",1644454490.0
sosvno,Expressing my Covid concerns to my boss and my boss got pissed🙃,6,0.88,antiwork,https://www.reddit.com/r/antiwork/comments/sosvno/expressing_my_covid_concerns_to_my_boss_and_my/,10,"**Summary:**

I only worked at this place for 4 days and my boss only came into the office on Tuesday which was my first day at work. She did not come in the rest of the days that week. My coworker told me, my boss's kids got Covid after my boss left the office. This was something that made me uncomfortable since I was sitting next to her when she was going through the employee handbook with me and taking off her mask to drink coffee.

I didn't have a strong feeling at that time but was just uncomfortable until Friday that week when my boss said she tested positive for Covid. This made me upset, uncomfortable and felt disrespected. So I sent an email to my boss about my concerns and feelings.

All I wanted and expected from her is just something like ""Thank you for your concern, I will be more careful and transparent about the situation next time."" Instead, I got this.

[Part 1 - Friday](https://preview.redd.it/z98x4dgmlwg81.jpg?width=10800&format=pjpg&auto=webp&s=0af747f42e0f48285f025bb1dadd2f3a37562488)

[Part 2 - Monday after](https://preview.redd.it/fxliszgmlwg81.jpg?width=10800&format=pjpg&auto=webp&s=0099054f720b30ce15ee4cd14bca7d7906b6d9fb)",1644454029.0
sosuaa,What’s your go to long/short term disability? Asking for a friend,0,0.18,antiwork,https://www.reddit.com/r/antiwork/comments/sosuaa/whats_your_go_to_longshort_term_disability_asking/,6,,1644453917.0
sostp4,Note put in my file at work while I was on FMLA TW: suicide,177,0.99,antiwork,https://www.reddit.com/r/antiwork/comments/sostp4/note_put_in_my_file_at_work_while_i_was_on_fmla/,17,"My son was trying to kill himself. And he has Crohn's disease. I am a teacher and had saved my leave for years in case of an emergency like this. I took 5 weeks off back in September. My principal went through my records and put a disciplinary note in my file about not following expectations to record grades, even tho I was on leave. 

They also tried to say I didn't follow my department protocols, but my department chair is a duplicitous piece of shit who never says what the expectation is, so I was never told what to do. 

I took my union rep to the meeting because they lied to me about what the meeting was about. I did my homework. I had all the emails to demonstrate I was following expectations. He didn't care and put it in my file anyway. He blatantly interrupted me while I was trying to share my side of things (my union rep isn't very good), and  blatantly told me when I pointed out that I was answering his questions but that he kept interrupting and I asked ""do you want me to share my information with you""? He replied ""honestly, no. I don't want to listen to you read that word for word"". Not only that he tried to get me to not tell anyone else in the school about the situation. 

The last part was that I pointed out to him this was an incredible technicality to be dealing with since I have a spotless employee record. He tried to say that it was just standard practice on their end (it's not. I am well aware of teachers who break important rules and are ignored). I said, this wasn't how this had to be handled. And be tried to insist it was. That when I pointed out this is not how ""family"" works. 

He was visibly flabbergasted. He said at that point he had said all he had to say. 

Fuck that mother fucker. Fuck him. I have not once been disciplined at that job in seven years and he went back 5 months to find something that happened while I was on FMLA and would not even listen to what I had to say. 

Here's the kicker. A few years ago we worked in a different district at different schools. I worked at an ALE for kids who are struggling at regular school. I always took their stories with a grain of salt, because I know what it feels like to be an angry teenager. I believed them, but I left room for a different pov. Nope. Those kids were right to the letter. He is an absolute piece of shit and if he got ran over by a truck tomorrow, I would go out and get a beer to celebrate. He has hurt so many of my students just because he loves rules. That's it. I've tried to stand up for the kids. And that may be why I got punished. The kids like me. They told him as much. I get zero parent complaints. But he hates anyone who stands up for people who are marginalized. He wants kids to sit in their seat, shut up, work their ass off to get good test scores to make himself look good. We'll see how that works out. Lol

Teachers, quit. You guys need to quit. I wanted to save the kids and the schools, but this is what they always do. They hire someone like him to keep everyone beat down and following orders. Just quit got Christ sake.

Anyway, they'll be lucky if I finish the semester.",1644453870.0
sospti,"Watch ""NoFx - Go To Work Wasted"" on YouTube",9,0.84,antiwork,https://youtu.be/eWTyE43AzsA,2,,1644453550.0
sosoy7,Put on the clown costume wagie,50,0.9,antiwork,https://i.redd.it/etsmmf7viwg81.png,13,,1644453481.0
soso24,Beyond inappropriate…,5,0.79,antiwork,https://vm.tiktok.com/TTPdkTSm3M/,4,,1644453408.0
sosm3a,I got a six cent “raise”,31,0.83,antiwork,https://www.reddit.com/r/antiwork/comments/sosm3a/i_got_a_six_cent_raise/,42,"I’m an anesthesia tech at a hospital. I make significantly less than the certified techs (i am not) despite doing 99% the same job. I’m talking 10-15$ less. Most places there is a pay difference but not a massive one, sometimes not one at all from what I hear. Whatever. They decided to increase the minimum wage to $x at the hospital. They said “anyone already making above that will be given an ‘equitable’ raise” so I found out today my “equitable” raise was 6 cents. I’m so insulted. I’m now making $1 more than people who clean the hospital and stock the warehouse. Those people were given multi dollar raises but I wasn’t even given 50 cents? I take part in codes and emergency airways. You’d think my skill set is more valuable than a dollar above the new minimum wage. Anyway, i’m livid. Is there anything I can do? There are two others in the same situation as me.",1644453245.0
soslu2,The government is completely apathetic to the motherload of worker health and safety posts here,10,0.92,antiwork,https://www.reddit.com/r/antiwork/comments/soslu2/the_government_is_completely_apathetic_to_the/,1,"Reporting your shitty boss and poor working conditions is probably not going to work unless your case is going to make a lawyer money. It might even be a waste of time. If any of the protection or regulation agencies cared they would be looking to make contact with people to go after these shitty employers. A strike will be the only tool to make any difference. Dont sign write ups, get everything in writing, discuss your wages, call out abusive behavior, help each other find better jobs, and organize.",1644453225.0
soslsu,Dave Chappelle's Latest Achievement: Helping Kill an Affordable Housing Development,37,0.72,antiwork,https://www.rollingstone.com/culture/culture-news/dave-chappelle-affordable-housing-yellow-springs-1297588/,31,,1644453222.0
sosjzx,"When your boss asks you to go ""Above and Beyond"" at work",28,0.95,antiwork,https://c.tenor.com/sPppxfpALSsAAAAd/%D9%86%D9%82%D9%84-strong.gif,6,,1644453073.0
sosj7p,One of the only valuable things I've seen on FB in a while. It's alarming how many people see no issue with verbally abusing and threatening children.,5513,0.99,antiwork,https://i.redd.it/e1yeewpkhwg81.jpg,194,,1644453012.0
soshwr,FedEx driver chased and shot at during delivery; has to take unpaid time off and still has not received a new route.,398,0.99,antiwork,https://www.reddit.com/r/antiwork/comments/soshwr/fedex_driver_chased_and_shot_at_during_delivery/,43,"“Despite the traumatic incident, FedEx did not change his delivery route. Gibson has not returned to work and is currently on unpaid time-off, stating he was “uncomfortable” and “anxious” about resuming the assignment.”


https://www.yahoo.com/news/attempted-murder-two-white-men-133000363.html",1644452906.0
sosg7y,Entitlement,32,0.97,antiwork,https://www.reddit.com/r/antiwork/comments/sosg7y/entitlement/,5,"If they can't afford to rent the building, the business gets evicted.  If they can't afford to pay their suppliers, they have to slow down or shut down production.  If they can't afford to pay their employees enough to keep them, they bitch about how nobody wants to work anymore.  One of these things is out of place.",1644452768.0
