post_id,title,score,upvote_ratio,subreddit, url,num_comments,body,created
spgbus,Genuine Question: How do I find out what my work is actually worth?,3,0.81,antiwork,https://www.reddit.com/r/antiwork/comments/spgbus/genuine_question_how_do_i_find_out_what_my_work/,8,I’ve grown up with my parents not telling me how much they make and that’s really messed with my perception of how much I should be paid. I’m lucky enough to be independent of financial struggles because I will be living with my parents until I finish college but I want to be prepared. Any help would be greatly appreciated! Thank you :),1644525189.0
spgb42,"I honestly don't know why ""Work as a Choice"" is controversial?",20,0.87,antiwork,https://www.reddit.com/r/antiwork/comments/spgb42/i_honestly_dont_know_why_work_as_a_choice_is/,7,"Work as a choice makes perfect sense... a system or society where basic needs are covered by guaranteed min. income.

We all know, and it can be proven, that most people LOVE working. We're not anti-work, we're anti meaningless, dehumanizing, non-livable wage work. 

How is the idea of work as a choice so despised and demonized? It would make society healthier.",1644525136.0
spg9nm,Recruitment and Retention?,247,0.98,antiwork,https://i.redd.it/xigxcgsof2h81.jpg,66,,1644525021.0
spg8i2,Workplace injury,6,1.0,antiwork,https://www.reddit.com/r/antiwork/comments/spg8i2/workplace_injury/,22,"Hey guys I got hurt at work and told all my managers like 20 hours in advance that I need to go to the doctor and no one would respond. They were making me do a job that isn’t part of my jobs titles responsibility. They have also not scheduled me for this or next week when the doctors note I gave them says I was cleared to work with no restrictions on the 4th. They are really mad I brought up workman’s comp and are now saying I’m bad at my job and someone has reported that I seem under the influence. None of this has ever been brought up until I got injured. I think the drastically changing my hours,role and pay (a flat rate of cash under the table) means I qualify for unemployment but that won’t be enough to live off. They are making threats and scaring me away from filing for workman’s comp. What would you do?",1644524935.0
spg6z9,Is McDonald’s really so desperate they need to send a direct marketing email for recruitment to anyone who uses their app??,13,1.0,antiwork,https://i.redd.it/8bymxle3f2h81.jpg,10,,1644524819.0
spg3rp,Negotiating a Pay Cut,0,0.4,antiwork,https://www.reddit.com/r/antiwork/comments/spg3rp/negotiating_a_pay_cut/,14,"I work for a small business where I was promoted to general manager about 6 months ago. Prior to the promotion I made $8 an hour. In an evaluation today, the owner told me they could no longer afford to pay me my salaried rate of $16 an hour (40 hours a week, no overtime). They've also taken away a couple of my responsibilities (as a way of demoting me without actually removing me from the position). 
I am now being asked to negotiate my pay cut because they can ""no longer afford it"". They wanted to know what I think was ""fair"" rate, but I stalled and was able to ask to get back to them. They want an answer tomorrow and I have absolutely no idea what to say. How should I go about doing this? 
I'm not in a position where I can afford to leave, and I finally made it to a point in my life where I'm financially comfortable. I dont want to take a pay cut, but I also cant quit. Job searching in my area has been near impossible for anything over $9- even with a bachelors degree. My boss is pure bullshit, but I put up with it for the pay alone. 

Basically, my boss wants me to decide my pay cut, but how do I do that without shorting myself. Any advice possible would be appreciated.",1644524584.0
spg3pa,UPDATE: Boss cut my base pay in half. Told me through an email.,12,0.88,antiwork,https://www.reddit.com/r/antiwork/comments/spg3pa/update_boss_cut_my_base_pay_in_half_told_me/,2,"[You can read the original post here.](https://www.reddit.com/r/antiwork/comments/sbcmr8/boss_cut_my_base_pay_in_half_told_me_through_an/)

First off, many thanks to all who commented, gave me encouragement, and schooled me in the term constructive termination. I wrote my boss an email later that day and quit. She was not surprised, and was not planning on rehiring for my position. Knowing that I had a bit of a landing pad through unemployment was really huge. I had been thinking of changing career fields for a while now, and it encouraged me to apply to a couple of graduate programs doing something that I think is positive for the world and people, versus what I was doing, which was wringing money from local businesses to line my boss's pocket.

There were many questions about base pay vs commission. For anyone who's worked in sales, the base pay is usually a fraction of what you normally make overall. This is what I was expecting when I was recruited last year to do this job. In reality, the boss lady kept cancelling magazine issues (I sold advertising) after I had sold into them, which lost me money and clients. The base pay was just enough to cover my kids' childcare and allow me to break even. The commission would have been what I made on top of that. So, after the email that she sent me that cut my base pay in half (and said she would cut that in half again the month after), I was also seeing emails about her cancelling more issues. This was a poor business plan on her behalf; her competitor across town (and ex-business partner) was doing the opposite and increasing distribution and continuing to publish. Ex-partner was KILLING IT and taking all our business, while my boss was freaking out. In a company of 8 people, 5 (including me) had quit in the past 8 months.

 When I took this job, I signed my kids up for childcare, which meant a 10% nonrefundable deposit and a contract through the end of this June. So, within one month, I knew that not only would I be making substantially less, I also would no longer be making enough to even cover childcare, let alone my bills. I couldn't get out of the contract, so I really felt like my boss had screwed me over pretty hard.

Unemployment will be substantially less than what I make, but will still cover childcare while I change gears and get out of the cycle of work/spend and make a living doing something that's actually net beneficial for our society and environment.",1644524578.0
spg29j,Anyone on here a dentist that can write me a note. Went on a job interview this week and boss is asking for proof I “went to the dentist”. Dm me please 🥺,0,0.38,antiwork,https://www.reddit.com/r/antiwork/comments/spg29j/anyone_on_here_a_dentist_that_can_write_me_a_note/,17,"Edit: sorry I guess this was worded SO confusing. 
I told my current job I went to the dentist because I was asked by another prospective job to come in for an interview for the new job on less than 24 hours notice and I couldn’t just use a vacation day at my current job on less than 2 weeks notice",1644524486.0
spfzr2,BNSF filed this in response to our strike. This is what we are dealing with.,19,0.89,antiwork,https://i.redd.it/igmtovskd2h81.jpg,7,,1644524309.0
spfy9a,Definately not what the people are asking for!,7,0.89,antiwork,https://i.redd.it/ogi06c69d2h81.jpg,4,,1644524201.0
spfy76,"Just remembered “If you can lean, you can clean” -My supervisors from Whole Foods",6,0.75,antiwork,https://www.reddit.com/r/antiwork/comments/spfy76/just_remembered_if_you_can_lean_you_can_clean_my/,8,It’s like a PTSD flashback…,1644524197.0
spfxy0,URGENT!,5,0.73,antiwork,https://www.reddit.com/r/antiwork/comments/spfxy0/urgent/,17,"My friends are all convinced that u can still pick yourself up from the bootstraps and become super rich. I’m trying to prove them wrong but they just keep coming up with the classic brainwashed sayings like “if you cap how much money is made, no one will have incentive to work”. Please someone give me clear evidence of why it is near impossible to become rich when your at the bottom in todays society.",1644524178.0
spfxhy,It's being felt everywhere. Even the trades,81,0.99,antiwork,https://i.redd.it/t4edo9n3d2h81.jpg,15,,1644524149.0
spfwhk,"This was on one of my reviews, is this true?",11,0.93,antiwork,https://i.redd.it/ozquq79wc2h81.jpg,4,,1644524080.0
spfwek,Can you believe some people don’t want to be miserable at work? The nerve!,13,0.93,antiwork,https://i.redd.it/okhvcesvc2h81.jpg,1,,1644524075.0
spfw4v,I don’t give a fuck,0,0.27,antiwork,https://www.reddit.com/r/antiwork/comments/spfw4v/i_dont_give_a_fuck/,9,"I don’t give a fuck about unions
I don’t give a fuck about work hours 
I don’t give a fuck about benefits 
I don’t give a fuck about wages
I don’t give a fuck about policies
I don’t give a fuck about the world

I’m an anarchist I don’t even give a fuck if people have a driving license 

I just hate work

Stop whining steal from your job mess it up fuck your bosses and everyone complying with that",1644524056.0
spfuos,It’s Happening at All Levels,18,0.95,antiwork,https://i.redd.it/4q2krmdjc2h81.jpg,2,,1644523960.0
spftjg,Parental obligations before work,13,1.0,antiwork,https://www.reddit.com/r/antiwork/comments/spftjg/parental_obligations_before_work/,4,"I’m currently in the midst of a high risk pregnancy. Just finished the first trimester and have needed some time off from work to go to doctors appointments and ultrasounds. I was originally pregnant with twins and one isn’t going to make it. Needless to say it’s been tough on me and hard to process. Right after I got that news, me and my 1 1/2 yo got diagnosed with Covid. We were so so sick and since I WFH my manager expected me to just work through… until I specifically asked if there was someone I could talk to about taking time off to get better for me and my kid. They gave me 5 days and on the third I was threatened with losing my job because I didn’t say “ I’m still sick “ every morning to my manager. That was a couple weeks ago. Fast forward to yesterday. I requested half the day off to attend another doctor appointment for my pregnancy. Things went BAD, surviving twin is trying to send nutrients to non-surviving twin and now I have to go see specialists. Of course my manager has been getting on me about missing days of work/sales goals and how it counts against me blah blah blah. So even though I’m distraught I sign into work to sell fucking life insurance while I’m dealing with losing one child and possibly the other. By the grace of god my internet went out, preventing me from doing my job. I get a message from manager, this is a no call no show now and more points added on and blah blah fucking blah. This company only allows medical time taken off if you’ve been with them over a year which I haven’t. They’re not offering maternity leave and they give me an issue anytime I need time off even though I’ve shared more than I’m comfortable with about my situation. 

I say all this shit to say. There should be more leniency for medical situations and things that are out of our control as parents. Of course, we have a job to do. But our children need us more than a multi million dollar company. Shit they need us more than your local grocery store or hair supply shop. I just hate that my job is on the line because I have a child, had Covid and am going through an already tough pregnancy. 

I’m quitting today, but I needed to let this go.",1644523887.0
spfqi6,How much does my work is worth for an American company?,6,1.0,antiwork,https://www.reddit.com/r/antiwork/comments/spfqi6/how_much_does_my_work_is_worth_for_an_american/,7,"Just wondering if this question is allow for this sub, but my friend works at a Latin American country for a company at the USA, she is considered to be promoted to a SME (subject matter expert) however we think the company is thanking advantage of her because of where she is working, just curious to know how much an employee with 5 years of experience and essential for the company might be asking for a job.",1644523672.0
spfo1h,"Nothing has changed since 2016? It hasn't even changed since 1881! The investment class has always been happy to let workers drown during ""prosperous"" times.",65,0.97,antiwork,https://i.redd.it/ugpxx1u1b2h81.png,3,,1644523504.0
spfmf9,Suggestions on how to find an executives salary for a private company.,6,0.88,antiwork,https://www.reddit.com/r/antiwork/comments/spfmf9/suggestions_on_how_to_find_an_executives_salary/,6,Just looked up salaries for my kids daycare teachers and it is $12-14/hr!!! We pay over $1000/mo for this. These teachers have a difficult job with long hours. What I want to find out is the executives salaries but private companies do not have to post their salaries. What is the best way to find out? Email them? Email other board members?,1644523396.0
spfj3x,What's the worst/most ridiculous job interview process you have ever been put through?,15,0.94,antiwork,https://www.reddit.com/r/antiwork/comments/spfj3x/whats_the_worstmost_ridiculous_job_interview/,28,"Genuinely curious as to where my own awful interview experience stacks up — I work in media, and after an HR phone screening, multiple edit tests, and SIX in-person interviews (with multiple people each time) where I had to leave my own office for over two hours to get there and back, the company called and asked me to come into their office a SEVENTH time, promising it would be the last.

I think at that point, even they knew how ridiculous it was getting. And my boss at the job I was trying to leave thought there was something seriously wrong with my health, given the seven ""doctor's appointments"" I had to leave the office for (pre-pandemic) in the span of two months.

The real kicker is that they \*did\* end up offering me the job in the end ... for $20K less than asking. Leveraged it for a raise in my current position and honestly, it felt amazing to give the other company a hard ""no"" after what they put me through.  


EDIT: This was not for a high-level position btw — it was for an editor job that was literally offering to pay me $70K  ",1644523207.0
spfiup,Work\Life balance.,2,0.76,antiwork,https://www.youtube.com/watch?v=semdh-j8V6w,0,,1644523192.0
spfgt4,Every employee who leaves Apple becomes an ‘associate’,7,0.89,antiwork,https://www.washingtonpost.com/technology/2022/02/10/apple-associate/,1,,1644523041.0
spffk1,"People from other parts of the world: what made you come to this sub, what made you stay? Share your story",8,1.0,antiwork,https://www.reddit.com/r/antiwork/comments/spffk1/people_from_other_parts_of_the_world_what_made/,3,"I feel like this sub needs more international community discussions, as it is one of the most informative, active and decent places to talk about anti-work struggles for the unification of the common workers. I think it would benefit the general narrative if you, people from countries other than US, could share your perspectives, your grievances and your problems that led you to becoming curious in the antiwork movement.

Guess I'll start?

I'm a young (gen Z) office worker from CIS country where the usual monthly pay is around 400 to 500 USD and GDP per capita hovers just below 10k$. The minimum wage in my country is essentially 150$ a month, and people actually live on it here.  I got lucky as I was born to a well-off family and could get a decent education, even had opportunity to travel abroad extensively, and now have nice career prospects. For most of my life, I have been fed with two equally misleading promises: A) working hard will get you an even better life, B) you shoud focus on migrating to the West (especially to the US) if you wish to reach the paradise. As you might guess, reality hits hard. 

Things started falling apart when my family fell out of grace with authorities and we had to cut our spendings by a lot. I've started working since first year into university to pull my weight and that's when I started to suspect something is not adding up. I now make roughly x3 of what a median worker makes, and I have no idea of how to get back to even the fraction of life I had with my parents as a child. My mother, bless her heart, had the opportunity to show me the world when she made roughly two times less than I do now. I dread the prospect of moving out of my parent's place. If I'd wanted to buy the flat I live in right now, I'd have to save *for 24 years straight without spending a cent* (that is considering the prices don't go up any more)*.* Suffice to say, not even my parents can now afford anything within the city. The official inflation rate the govs pretend to see is around 7%, the real inflation for just the past 6 months surpasses 40%. The food on the shelves becomes more expensive each day, the quality keeps diminishing. The universal healthcare praised by my country is so bad I'm literally afraid of going to a local hospital (I can't blame the staff though - they often have to survive on 300$ a month). The payment inflation adjustments are literally nonxistent in the majority of companies I know of, mine included (and I actually love the place I work in as I get full health coverage and plenty of benefits). Getting another education? Having kids? Moving out? Having a car? Might as well dream of owning a phallic rocket. 

Then I encounter this subreddit. At first, I'm livid. ""They must be mistaken"", I think, ""They must be lazy pricks who do nothing in life and want everything for free"". I was promised the American dream. I was told life would get better if I just made it to the other continent. If I was lucky or smart enough, or both. I have to admit, I hated this sub and every little post made here. I couldn't accept the fact that my dream was somebody else's nightmare. Still, I stick around, I read more, and with each post, each comment thread, I become more and more infatuated with the ideas spread here. I start normalizing common things like labor condition discussions and payment discussion in workplace (actually helped my colleague to negotiate a better deal not so long ago), I start standing up to my parents, who continue to preach their outdated capitalist mantras while steadily ruining their health for the sake of staying afloat, I start to indulge myself in political and economic discussions with my friends again, start re-reading Marx, Weber, Kant. 

I feel helpless, I feel derailed, I feel as though I'm denied a fraction of hope I had up to this moment, that somewhere across the ocean there is the perfect paradise for future rich hardworking me (ha-ha-ha). Turns out, it sucks being just a normal person no mater where you go. At the same time, I see that I'm not alone. I know I'm not mad, lazy or stupid. I know there is a big community of people who share my disdain with the rich and the powerful running this helltrain down the cliff for a quick buck - no matter the country you name. Most of all, I feel that this desire for change that unifies me with more than a million people across the world keeps growing and keeps getting stronger. 

Whether intentionally or not, this sub has become more than the sum of it parts. I'd like to thank each of you for making, keeping and growing this community. For saying out loud that we are not alone. That would be all from me. 

What about you?",1644522953.0
spfe6q,"Randomly came across this song today, thought it fits quite well with the sentiment of this sub!",4,0.83,antiwork,https://www.youtube.com/watch?v=Q3jz3bJWVvs,2,,1644522860.0
spfbk6,based squidward,233,0.95,antiwork,https://i.redd.it/gjnyw0vq82h81.png,22,,1644522685.0
spfb4p,Anybodu need help picketing their unsafe workplaces in the U.S.A.,4,0.75,antiwork,https://www.reddit.com/r/antiwork/comments/spfb4p/anybodu_need_help_picketing_their_unsafe/,1,"Let me know !  I am here for you, you are much more valuable know you are more than a robot and you don't deserve to be exposed to dangerous, unsafe, and unfair work environments.  Workers united!",1644522656.0
spf9yf,The new pizza party.,5,1.0,antiwork,https://www.thegamer.com/ubisoft-gave-employees-ghost-recon-nft/,0,,1644522573.0
spf76j,Broke my bosses brain,21061,0.94,antiwork,https://www.reddit.com/r/antiwork/comments/spf76j/broke_my_bosses_brain/,946,I came to work 5 minutes late (still 25 minutes before the store opens) because I stepped in dog poo on my way to my car and had to wash my boots. I have a 30 minute commute and get up at 5 AM every morning to make it on time. When my boss asked why I don’t get up earlier to account for hiccups like that I looked at him and simply told him “because I don’t want to.” He simply just could not fathom that concept.,1644522370.0
spf73l,WFH vs On Site Interesting Treatment,5,0.86,antiwork,https://www.reddit.com/r/antiwork/comments/spf73l/wfh_vs_on_site_interesting_treatment/,9,"My company recently held a town hall with our CEO and I thought some of her decisions/reasons/thoughts on various topics were interesting.

My company was never really a remote work type of place. I won’t go into detail but most folks need to be onsite. That said, once the old pandy hit, the majority of people went remote. Because we hired a lot of folks during the pandemic we didn’t have desks for them full time combined with a work from home guideline for safety. Even after more departments started coming back, I’d say about 1/2-2/3 of the company is still remote, at least part time but most full time. With Omicron it became a “if you can work from home, stay home” which still exists today.

Someone asked what I’ve been thinking as someone who has not been able to work from home the whole time. Will there be any sort of benefits or subsidies for fuel etc… any considerations for the folks unable to work from home and risk their health to come in everyday while gas is also $5 a gallon while everyone else is safe at home and not spending money commuting.

CEO simply said no. Yet, people moving into a new facility we opened a few months ago get restaurant gift cards weekly and received welcome baskets.

I love how considerate the CEO is toward those of us without the luxury of working from home who get to expose ourselves (though lower risk now) daily.",1644522364.0
spf4sg,"Out of touch company who allows itself to screw their employees because that's what all other companies do, and that's just the way it is. Eat shit and die.",7,0.9,antiwork,https://i.redd.it/o1dv4j1c72h81.jpg,6,,1644522209.0
spf47x,Most these employers offering pittance of a salary,5,0.79,antiwork,https://www.reddit.com/r/antiwork/comments/spf47x/most_these_employers_offering_pittance_of_a_salary/,1,What is wrong with these woes?,1644522172.0
spf3j8,"Fired for discussion of wages and saying I didn't like my job out loud, they wrote it down as ""intimidation and coercion"" when they fired me.",59,0.95,antiwork,https://www.reddit.com/r/antiwork/comments/spf3j8/fired_for_discussion_of_wages_and_saying_i_didnt/,7,"New York, contacted a lawyer who wanted $18,000 and 1/3rd of the winnings, which I don't have considering I was just fired.

This was a first-offense. HR already didn't like me due to a previous argument, and I'm trying to figure things out here. The person I had spoken with was a new employee and I was just having a civil discussion and asking questions, but the person who reported me was listening in and claimed that I said I wanted to ""get the company"", whatever that means.",1644522123.0
spf39w,I am getting charged for benefits I do not actually have and don't know what to do,9,0.92,antiwork,https://www.reddit.com/r/antiwork/comments/spf39w/i_am_getting_charged_for_benefits_i_do_not/,14,"I am a grad student and I normally just use my wife insurance but she switched jobs so we figured we would just sign up for mine for a month or two as I have ADHD and need insurance else my meds are a shit load of money.

Anyways, I sent all of my shit to hr, but then was told that they now use a third party service for their benefits. I tried to sign up through said third party but needed information to make an account from HR and they simply just stopped responding to me. I figured everything was good.

A little bit later I notice my paycheck is significantly less and after a phone call I learn that they are taking out benefits many months in advance. Also, HR didn't send over all my documents to the third party so I don't even have insurance but I am still being charged for it.

Ok so I will just switch to my wifes new plan and take the cash in lieu option. But the fucking third-party website won't let me do it, and is sending me back to HR who then tries to send me back to the third-party website.

So currently, I am having large amounts of my paycheck being deducted for a service I don't actually have. What can I do?",1644522106.0
spf250,Found an interesting job with suspicious demands. What do you think will be doing a reporting manager there?,0,0.44,antiwork,https://i.redd.it/wlkv0yls62h81.jpg,4,,1644522027.0
spf03w,Labour Strikes on Mega Corps.....,11,0.93,antiwork,https://www.reddit.com/r/antiwork/comments/spf03w/labour_strikes_on_mega_corps/,6,"What if for example everybody who worked at walmart across the united states just decided to form the Walmart America union, and refuse to work until salaries were reasonable. 

The people technically have more power the corporations if they unite. 

Lets take over Walmart, with a collective union. 

The time of the Waltons making bank while the workers are on food stamps should be over.

Lets target corporations with united labour movement. 

6 figure salaries should not be reserved for tech bros and hedge fund kids. 

6 figure salaries should be for everybody who makes this world function.",1644521879.0
