post_id,title,score,upvote_ratio,subreddit, url,num_comments,body,created
spooqn,Let me just say...... FUCK DOLLAR GENERAL!!!!,5,1.0,antiwork,https://www.reddit.com/r/antiwork/comments/spooqn/let_me_just_say_fuck_dollar_general/,1,"Just got wrongly accused and terminated today for ""stealing"" I told the LP guy straight up I didn't steal anything and It's a fucking dollar store. There's nothing here worth stealing and risking your job over. He say's ""I'm not accusing you of stealing, there's just some behaviors going on in the store that need to stop"". He said I ""saw"" my co-worker steal milk and didn't say anything. UM hello? I was in the back changing the trash when she came in and put two gallons of milk from upfront and put them in the back freezer telling me she would buy them later. later in the night I go back there with her and we walk up to the register and I CHECK HER OUT AND HANDED HER THE RECIPT all under camera. The lp guy went over a few other things and asked me to sign a statement (which I probably shouldn't have but I just wanted to get rid of him). about an hour later he comes in with the district manager and they fire me stating ""not protecting company assets"". I was pissed. I did no wrong. my co-worker did no wrong. This was all out of the blue I had no idea this was being set up. The milk was fucking paid for!

I busted my ass for 3 years for this company. Never called off once. Always came in early. I went above and beyond and this is the thanks I'm Given?   

on a side note, Please join r/unionizedollargeneral if you haven't already we are 200+ members strong and growing. Let's stick it to this awful company together!",1644548957.0
spoo2t,"PSA: If you have student loans on deferment or forbearance, please check your credit reports immediately. They might be affecting your score.",1,1.0,antiwork,https://www.reddit.com/r/antiwork/comments/spoo2t/psa_if_you_have_student_loans_on_deferment_or/,0,"Because here's my situation:

So a while ago, I looked on my credit reports and noticed that my student loans were listed.

Now I left this alone for a while because my loans have been deferred for some time now. I haven't graduated yet due to unique circumstances, so I didn't think it would affect my score.

And then the other day, I looked more into my reports...

I can now see that one of the reasons my future applications for credit can be denied is due to me having outstanding loan balances. That reasoning was not listed when I last checked.

But I don't have outstanding loan balances. My student loans are deferred and all of my other debts on the reports are paid off. No other loans are listed.

I am currently in the process of correcting this. And I don't want sympathy, I just want as many people as possible to know about this. I knew loan servicers are predatory, but this is a new low from my personal experience. This is frustrating, but can I truly be surprised at this point?

And also, as I was just wrapping up this post draft, apparently my loans are not on deferment anymore. I just looked and they're actually on forbearance now. Which means that my loans have been accruing interest for a while.

Loans are only supposed to be paid back once a person graduates and is hired for employment, which I'm working on. I've never been hired for a full-time job yet my loans switched from deferment to forbearance. Yeah, that's a problem

Needless to say, I'll be contacting my loan servicer tomorrow. I'll update this post about the situation whenever I figure things out.

Check those reports!",1644548899.0
spomp3,Holiday request,3,1.0,antiwork,https://www.reddit.com/r/antiwork/comments/spomp3/holiday_request/,1,"August 2021, I requested vacation time off for March 2022.  Today my boss said I am not approved for vacation. Since I’m not approved I got a legitimate doctors excuse to have that week off. Now legally she can’t deny my time off. This sucks that I have to resort to such petty methods to get proper holiday time off.",1644548781.0
spoiop,Pay Me Less My Guy,3,1.0,antiwork,https://www.reddit.com/r/antiwork/comments/spoiop/pay_me_less_my_guy/,0,"Long time lurker, first time poster.

So I was finishing up college in the midwest. It was the spring semester of 2020 and I had accepted a position with a company of a couple hundred people in a small town in the middle of nowhere, hours away from where I was currently living. I asked for compensation slightly above average for grads from my college program. I had pretty good grades and internship experience . I ended up agreeing on $1k less than the average. A month later COVID hits and I get told I would be placed on hiring freeze until August. Alright, I guess just something I’ll have to live with. Well the beginning of June rolls around and I get called and asked if I could start at the beginning of July. But they need me to take a 10% pay cut through the end of the year. The one question I ask, “Is everyone in the company taking a pay cut?”. “Yes” is the reply from my potential boss on the other end of the line. I think, if everyone is doing it then I guess I can live with it. What else was a guy to do? The job market was completely dead and the outlook of finding another job anytime soon was bleak.

Fast forward to getting hired. I get presented with a new job contract with my new pay and told to sign. I look and the pay cut isn’t quite 10%. It’s rounded to the nearest thousand. I begin to think something is fishy, but I sign the contract. I start training and all seems fine and once I start to meet a few new coworkers I get comfortable enough with them to start poking around. “How have things been here since Covid? Any negative impacts on the business?” I find out they laid off a bunch of people right when it had started, but am told that COVID was probably used as a guise to fire people that weren’t great workers or didn’t fit well with the company. Interesting. No mention of pay cuts though. The next day I get worked up enough to ask one of my coworkers I was starting to become friends with about pay cuts point blank. “What pay cuts?” Is the response I receive. I then explain to him how I’m getting fucked over. He then tells me about how he was one of the people who were laid off. And they brought him back in different position.

I finish my job training the rest of the week without mentioning anything again to anyone and start in my new position while trying to figure out if saying anything to my boss will do anything to benefit me. He lied to my face before I ever started. Why would he have any moral compass to make things right? And although my blood is boiling and I want to quit this job immediately but I’m hesitant. I mean what sort of future do you really have with a company that’s going to do whatever is in their best interest and doesn’t mind if they have to fuck you to do it? But Covid is a thing and the job market is still dead. And no one wants to hire a college grad with two weeks of experience so where am I going to go? So I stay in my job and vow to never do more than the bare minimum job requirement for this company.

As far as my job goes it completely sucks and I dread coming to work every day. It is nothing like what my expectations were and the work is mind numbingly shit. I’m not working on half the stuff I was told I would be either. Mind you it doesn’t help that I’ve moved to a new town where I know nobody. My 2 year girlfriend and I broke up prior to the move. And any opportunity for meeting people is nonexistent with Covid in full effect. Oh and not to mention I’m living in a hotel until I find a spot to live. I stop looking for apartments though the minute I learn I’m being lied to because I refuse to have anything keeping me at this shit job. I let this be the state of my life for far too long and end up living in the hotel for seven months basically in a state of depression the whole time suffering through the shit job. 

Then the end of the year comes. At my end of the year review I get bumped back up to my pay I was suppose to receive when I started. I find out my job will be changing drastically and I see this as a big time positive. I actually start to not dread coming to work. I decide to give the job a chance for another year and commit to the town and job. I get an apartment and life starts to seem better. But it’s always in the back of my head. They lied to me and fucked me over so why put much effort into my work? Why meet their deadlines? I lose any motivation to develop in my career because I don’t want the company to benefit from it.

I see them fuck over many people while I’m there for the year and a half. They try to get the only HR person in the company for the last 8 years to take a 5 digit pay cut because they hired someone over her to run the department. She was smart enough to give them the bird and find a new job. I watched them give a management position to someone within the company who gets trained in and works the position for three months only to have the higher ups change their minds not long after. I watch them fire a guy two weeks before Christmas because they don’t want to pay him any of the time he’d be off. Nonstop turnover at certain positions and job postings that are open for months because the company won’t raise their pay rates. Not to mention horrible benefits. And a lot of people who work here don’t care about their job because most people are looking to get out. But it’s a small town and there aren’t many opportunities nearby.

Fast forward to the end of 2021. Time for my end of the year review. My boss tells me everything has been good. My works been good. They’re happy with my progress. They hand me a sheet to show me my new salary. It’s a 4.7% raise... the equivalent of core inflation for the year. I get told I’m getting a $1500 bonus to bring my salary up to where it should have been for the past year (because of the company not reaching profit sharing goals.) I tell him I’m not happy with that. I let them know I’m being paid less than the average college grad from my school would be projected to be making and I’ve been working there for a year and a half. You’re happy with the work I’ve done so I think I should be making a little more than the next warm body that walks through the door. I also let my boss know I’m aware that I was lied to. My boss wants to talk with upper management and get back to me.

My boss sets up a meeting a couple days later and leads off asking me how long I’ve known they lied to me. Then tells me it doesn’t help anyone to be resentful for the year and half I’ve worked there. Deflects blame onto upper management although the words came from my bosses mouth and then goes back to pretending nothing ever happened. They then slide me my new salary offer. They decided to take away my bonus and add $2k to the salary. Basically the equivalent of telling me to go fuck myself. Then tells me I haven’t been developing as well as they thought I’d be, contradicting everything they said in my initial meeting. My boss then has the audacity to tell me I received a big raise of 11% the previous year and asks if I’m expecting double digit raises every year. I also get fed the line that they gave everyone around the same percentage raise and that my boss considers us all equal in the department. Also try’s to say profit sharing is part of my salary even though it’s not guaranteed money as was proven that previous year by receiving nothing for three quarters. Also tells me I shouldn’t be making a certain amount of money because they had to work 7 years before making that amount of money. My boss obviously has zero grasp on the concept of inflation. 

 For the last month I have given less fucks than ever at that job. I have no incentive to work hard because “everyone gets treated equal in our department”.  Currently on pace to miss a month long deadline by at least a week. I can’t get past the fact I’m getting fucked repeatedly. I’m tired of showing up everyday and not giving a single fuck about what I do. The job search has begun but no matter what I’m getting out of this toxic shit hole when my lease is up in a couple months. 

Thought I’d share and let everyone know always do what’s best for you. Employers will fuck you the second they get the chance. And don’t stick with a company that doesn’t respect you. I would have rather been out of work since the beginning of covid than turned into the nihilistic prick I’ve become because of this company and the asshats who manage it.

Edit: Grammar",1644548466.0
spoinm,"Astro Boy, late 60s",3,1.0,antiwork,https://i.redd.it/1p9hvwmdd4h81.jpg,0,,1644548463.0
spoilx,"Manager tried to give exit interview, I refused, was asked to leave.",4,1.0,antiwork,https://www.reddit.com/r/antiwork/comments/spoilx/manager_tried_to_give_exit_interview_i_refused/,2,"Longtime lurker first time poster, sorry for the long ass post😬 So I quit my job over the summer to start a business with my brother, took some time off in between, and a good friend contacted me and asked if I could come help out. He manages a quick lube place, and his techs all up and quit one day(painfully obvious why now.) He got in touch and said he would start me at what I was making at my previous job and said it was even negotiable. He said I was worth that much and more but that he couldn’t do much better than that because of the position. I knew it was kind of an entry level position so I was fine with the cap. I mulled it over for a few days and signed on as a temporary thing. One thing led to another and the business with my brother fizzled out because I was dedicating myself to this job for now. Kind of sucked but I figured, oh well I’ll do this for a bit and find something else down the road more permanent. It was good for a while, he hired some other techs and we were getting the shop going again. I noticed pretty quickly that it was a pretty toxic place and that’s probably what the previous mutiny was about. I started looking a bit for something else, and was waiting to here back about a new opportunity at my previous employer. The longer I was there the more the other techs were getting fed up/offended by his verbal abuse/sporadic moods. It was getting really bad, I had to get out. I found another job and put in my notice. He pulled me aside today and said we had some paperwork to do, I said what kind of paperwork and followed him to the back room. He hands me some exit interview paperwork and I said what’s this? He says just standard stuff for corporate. I said shouldn’t someone who’s not my direct supervisor conduct the exit interview? He says no, that’s not how this works, to which I replied well that just seems grossly inappropriate to me, shouldn’t hr do this? He said I am hr, I said no you’re the manager, just because there isn’t a specific “hr” position doesn’t mean there isn’t another more appropriate person to do this at the dealership. It went straight down the gutter from there. He told me how he knew I would be a pain in the ass and not just walk away gracefully, to which I replied I couldn’t live with myself if I let you treat people this way knowing I may be able to change it. He started telling me all the favors he did for me when I was out of work, (he begged me) as if I hadn’t voluntarily left my former employer, (on fantastic terms, in fact the hr rep that conducted my exit interview said if I was ever in need of a job in the future, she had heard nothing but the best, and would absolutely recommend me
for a rehire) trying to say I wasn’t worth what he paid me(I didn’t even negotiate, he started at my current pay rate) I just couldn’t wrap my head around how many absolute bullshit contradictions to past statements, that I knew were flat out fallacies, he was spewing. I got sick of going back and forth as to why it was inappropriate so I walked out of the back room to try to go back to work. He followed me and I kept saying this is why it’s inappropriate for you to do the interview. It serves no purpose for the company going forward if they’re not airing out grievances, be it of outgoing employees or current to, a neutral party. I started getting a little loud because I had said that same thing literally a dozen times or better at that point. He got louder and then said I was causing a scene. I said I was trying to go back to work until my two weeks was up. He said I needed to leave, so I said are you firing me, and he said no you’ve already submitted your resignation, to which I replied, correct which is effective on the 17th, if you wish for me to leave before that date, you are terminating my employment. He said that’s not how that works and I said I think that’s exactly how that works, you’re confused. That went back and forth for another ten minutes and I got sick of his childish shit and said that’s fine I’ll be back later to get my box. When I went back he asked me if I was still being a dick, I said if being honest makes me a dick then I guess so, he said so yes, and I said if you say so I spose🤷🏻‍♂️ I got my shit and said I would like to amend the date on the exit interview that says my last day is the 17th, he looked at me blankly and said what? So I reiterated that he made me leave on this day which is not the last day of my employment per the terms of my resignation, and that I would like that paper to reflect that even if I wasn’t competing his white wash of an exit interview, so I wrote on it that he asked me to leave on this date and wrote it down next to my signature and took a picture of it and left, but not before he told me to go fuck myself…again! What a great boss!!caught him edit my hours down from just over 40 to just under, lest he suffer the consequences of them paying me time and a half for less than one tenth of one hour. Just petty thing after petty thing, with someone who I have been friends with for almost 20 years. Ya think ya know a person… 
Tl;dr longtime friend asked(begged)me to help him fill a spot in his shop, turns out he’s a giant asshole to his employees. Stuck it out for a bit, found something else, put in my two weeks, he tried to give me the exit interview and I had some shit I wanted to air out but not to him, to have it white washed. He got pissy, tried to make me leave before my final day without actually firing me and said that I was incorrect, in that that’s not how that works. accused me of ripping of his time clock and not working/making too much money. kinda just wanted to vent, kinda curious if I’m due unemployment for a couple weeks, kinda wonder if it’s worth pursuing the clock times legally for such a low offense? Anyone got some advice?",1644548460.0
spoh8i,Imagine getting off work for brewing beer...,6,0.88,antiwork,https://i.redd.it/8heghkh5d4h81.jpg,2,,1644548379.0
spogym,Please do our job for us!,3,1.0,antiwork,https://i.redd.it/yutfgmg2d4h81.jpg,4,,1644548357.0
spoftf,Never not working,1,1.0,antiwork,https://www.reddit.com/r/antiwork/comments/spoftf/never_not_working/,0,"&#x200B;

https://preview.redd.it/iimq7j4rc4h81.jpg?width=1186&format=pjpg&auto=webp&s=cfddca9a03355238ee7a565c3bae343549526443

&#x200B;

You'll be on call every single moment so you will never get a single moment of peace. And no we're not paying you for all those off-hour stuff you do outside of the stipulated numbers on your contract.

But hey at least you have a job amirite?",1644548261.0
spofle,Pharma Sales Let Down,1,1.0,antiwork,https://www.reddit.com/r/antiwork/comments/spofle/pharma_sales_let_down/,0,"I accepted a position with an expanding pharma company after a layoff in December. After a month my manager is riding me for my ""performance"". My territory basically sucks and I recently found that several people have failed in this area. I mean, how much opportunity can you have in a 15 mile radius. 

After being hired I immediately saw a problem and it was my territory. I spoke with my manager about expanding into other cities and I was met with ""I will get back to you"". After a month of diligently working my territory I get a call from the boss man. Basically he said I was underperforming compared to my class. I fire back: 

The other reps have 200+ quarterly prescriptions they are inheriting. 

There are 20+ demos in field for each clinic in other territories (easy in)

They have a 40+ square mile radius and I have 15 mile radius. (far less opportunity)

Needless to say he wants me to improve and get up to par with the others for prescriptions. I have tried to get into med sales since 2006 when I graduated. Please give some advice because I am ready to go back to b2b sales.",1644548242.0
spof6x,My boss just told me that my vacation should be reduced & will meet with the owner to discuss,5,1.0,antiwork,https://www.reddit.com/r/antiwork/comments/spof6x/my_boss_just_told_me_that_my_vacation_should_be/,2,"I am so pissed and am trying to just wrap my head around everything that happened today, please excuse my rant. I went to my manager (has been remote and when you try to reach her mia) she has been semi-present for a few months) to ask a question and long story short the conversation went well until the very end when I was about to leave. She told me that we need to have a sit down with the owner. I have been with company for 2.5 years and he has been present maybe 5 times (body, not mind) (nobody cares about your wife Jennifer) currently in Florida vacationing, told us all about how he works so hard, even when he is in Florida he works till noon. Work ethic is important that’s what his Dad taught him when he took over the company and everyone needs to be on time (our last meeting was re-scheduled 3 times, with our entire staff) once we finally had it all he talked about was COVID and how it isn’t going anywhere and his retirement, he has an 11 year plan blah blah lol how he is getting another assistant and his son will take over the company and how more or less how we need to make him more money, these assholes don’t show their face when I am ripping out my hair the other 7 months out of the year and my family life suffers (met his son 1 time in the parking lot after he finished a golf outing). I wish I had recorded it. He sounded like a big douche. I can’t even imagine what our new people thought He actually said “I contributed $170k to retirement for the employees the last 5 years” I looked around the room and just couldn’t believe that (25 plus employees) fuck off dude! (He has other business in a neighboring state) that he cares about much more than us, but you think you are the only one that can do simple math?!  So back to my conversation with my manager.  She said we need to talk about your vacation and are going to reduce it. She said I’m getting to much vacation for the amount of hours I’m working. (Background) When I was hired I told owner that I had x amount of clients and they would follow me. Every single client is still with me and brings so much revenue I pull my weight 10 fold. Our understanding was I work when it is busy and I will reduce hours when it is not win/win (he asked me to be salary and I said no (knowing from experience they will work you to the bone) I have a child and want flexibility) Win-win! You would think! No, everyone else at my job works/is there, chats for a few hours throughout the day, but I show up, bring my own clients, get my shit done, don’t milk the clock and leave and am getting about to get my fucking vacation/sick time  PTO fucking taken away because I only average 36 hours. I told her “so I manage my time, am hourly (you save money)!and I don’t milk clock and am willing to do whatever to get my job done and you are penalizing me and going to take away some of the only sanity I get, my time with my family!!!” I get a month, that includes sick etc… I worked throughout this whole fucking shit show with a child (worked and homeschool) and had COVID from home (never got time off when I was miserably sick) to make sure you didn’t have to lift a a finger. Fuck you, you miserable bitch!!! AND my generation is the problem and we don’t want to work?! FUCK YOU BITCH!! I’m sorry guys I’m so angry.",1644548212.0
spoee4,"I have a pretty chill boss, like sketching random stuff on my time card when another company stiffs us lol",1,1.0,antiwork,https://i.redd.it/ikvqubyfc4h81.jpg,0,,1644548144.0
spod8j,Is there any entry level jobs that pay more than slave wages?,1,1.0,antiwork,https://www.reddit.com/r/antiwork/comments/spod8j/is_there_any_entry_level_jobs_that_pay_more_than/,6,I am currently in college and am unemployed. My previous jobs would find me racking in enough money to last a day or two. I have to try and save my money while paying for college and food. 200-300 dollar paychecks aren’t enough if I want to balance school and work. If I wanted to make more I’d have to work well over 40 hours and that’s just not possible being a full time student. So is there any jobs that are decent pay for college students? I don’t mean fast food. I’d rather watch paint dry than do that. Fast Food workers are constantly harassed so I’ll pass on that.,1644548060.0
spob8n,"As a long time lurker, I look forward to when I finish my master's to start taking advantage of corporations by doing the bare minimum and jumping ship every few months without doing any actual work",5,0.86,antiwork,https://www.reddit.com/r/antiwork/comments/spob8n/as_a_long_time_lurker_i_look_forward_to_when_i/,0,I have a friend of the family that owns a business and told me I can just increase my time worked for them indefinitely to explain the employment gaps,1644547924.0
