post_id,title,flair,score,post_upvote_ratio,subreddit,url,num_comments,body,created
t7fffh,"Help! I invited a girl for dinner, she replied “well aren’t you fancy”. Idk what that means?",,3,0.64,AskReddit,https://www.reddit.com/r/AskReddit/comments/t7fffh/help_i_invited_a_girl_for_dinner_she_replied_well/,14,,1646504409.0
t7i66t,"If the Covid-19 pandemic didn't happen, what do you think would've happened to the world?",,2,1.0,AskReddit,https://www.reddit.com/r/AskReddit/comments/t7i66t/if_the_covid19_pandemic_didnt_happen_what_do_you/,7,,1646512321.0
t7dfdg,For people who are no longer on social media. What made you quit?,,3,0.64,AskReddit,https://www.reddit.com/r/AskReddit/comments/t7dfdg/for_people_who_are_no_longer_on_social_media_what/,34,,1646498739.0
t7i55s,"What's the most satisfying act of ""I don't give a fuck"" that you have ever witnessed?",,2,1.0,AskReddit,https://www.reddit.com/r/AskReddit/comments/t7i55s/whats_the_most_satisfying_act_of_i_dont_give_a/,4,,1646512234.0
t7i51d,Your final meal! Anything you want and as much as you want! What do you order?,,2,0.75,AskReddit,https://www.reddit.com/r/AskReddit/comments/t7i51d/your_final_meal_anything_you_want_and_as_much_as/,6,,1646512223.0
t7i4zz,"Is a black person, as in someone who has black parents, who is born albino still considered black?",,2,0.75,AskReddit,https://www.reddit.com/r/AskReddit/comments/t7i4zz/is_a_black_person_as_in_someone_who_has_black/,14,,1646512220.0
t7i4xh,What is a not-so-fun fact you know?,,2,0.75,AskReddit,https://www.reddit.com/r/AskReddit/comments/t7i4xh/what_is_a_notsofun_fact_you_know/,7,,1646512214.0
t7fduu,How has a women's presence in your life affected who you are today?,,3,0.71,AskReddit,https://www.reddit.com/r/AskReddit/comments/t7fduu/how_has_a_womens_presence_in_your_life_affected/,10,,1646504283.0
t7fdrm,What is something you’ll never be good at?,,3,1.0,AskReddit,https://www.reddit.com/r/AskReddit/comments/t7fdrm/what_is_something_youll_never_be_good_at/,13,,1646504274.0
t7fdoy,What’s a weird little snack you like making for yourself?,,3,1.0,AskReddit,https://www.reddit.com/r/AskReddit/comments/t7fdoy/whats_a_weird_little_snack_you_like_making_for/,6,,1646504269.0
t7i4i3,"People who have solved murder cases, how did you do it and what did it lead to?",,2,1.0,AskReddit,https://www.reddit.com/r/AskReddit/comments/t7i4i3/people_who_have_solved_murder_cases_how_did_you/,1,,1646512185.0
t7i3jq,"People of reddit 20+, what are the things you wished you did before 20?",,3,0.8,AskReddit,https://www.reddit.com/r/AskReddit/comments/t7i3jq/people_of_reddit_20_what_are_the_things_you/,1,,1646512101.0
t7i2ui,"you have the chance to make the world a different place. people, schools and working works differently. how's your world like?",,2,1.0,AskReddit,https://www.reddit.com/r/AskReddit/comments/t7i2ui/you_have_the_chance_to_make_the_world_a_different/,4,,1646512045.0
t7i2gp,What was the worst gift you've ever received?,,2,1.0,AskReddit,https://www.reddit.com/r/AskReddit/comments/t7i2gp/what_was_the_worst_gift_youve_ever_received/,8,,1646512015.0
t7i26u,"In speedruns, what does any % mean?",,2,1.0,AskReddit,https://www.reddit.com/r/AskReddit/comments/t7i26u/in_speedruns_what_does_any_mean/,5,,1646511993.0
t7fb7u,What is something you would bring back from the past in 2022?,,3,1.0,AskReddit,https://www.reddit.com/r/AskReddit/comments/t7fb7u/what_is_something_you_would_bring_back_from_the/,23,,1646504068.0
t7i24z,"How often should you see your gf/bf at the different stages of your relationship, and why do you feel this way?",,2,1.0,AskReddit,https://www.reddit.com/r/AskReddit/comments/t7i24z/how_often_should_you_see_your_gfbf_at_the/,0,,1646511989.0
t7i1lu,"Rest stop workers of Reddit, what silly, strange and sordid scenes have you witnessed?",,2,1.0,AskReddit,https://www.reddit.com/r/AskReddit/comments/t7i1lu/rest_stop_workers_of_reddit_what_silly_strange/,0,,1646511945.0
t6zz0f,What is something you don't like but wish you did?,,48,0.9,AskReddit,https://www.reddit.com/r/AskReddit/comments/t6zz0f/what_is_something_you_dont_like_but_wish_you_did/,178,,1646449412.0
