post_id,title,flair,score,post_upvote_ratio,subreddit,url,num_comments,body,created
t7fl4h,What are some unknown facts about the horn industry?,,3344,0.9,AskReddit,https://www.reddit.com/r/AskReddit/comments/t7fl4h/what_are_some_unknown_facts_about_the_horn/,524,,1646504848.0
t767gk,"If you could “Delete” anything from the world, what would it be?",,18034,0.9,AskReddit,https://www.reddit.com/r/AskReddit/comments/t767gk/if_you_could_delete_anything_from_the_world_what/,17023,,1646473936.0
t750yq,What are some unknown facts about porn industry?,,12742,0.89,AskReddit,https://www.reddit.com/r/AskReddit/comments/t750yq/what_are_some_unknown_facts_about_porn_industry/,4248,,1646468705.0
t7aqdr,What’s the best thing you’ve ever purchased for yourself?,,783,0.95,AskReddit,https://www.reddit.com/r/AskReddit/comments/t7aqdr/whats_the_best_thing_youve_ever_purchased_for/,1032,,1646490960.0
t70amu,What’s a weird little snack you like making for yourself?,,4956,0.97,AskReddit,https://www.reddit.com/r/AskReddit/comments/t70amu/whats_a_weird_little_snack_you_like_making_for/,3852,,1646450513.0
t6vvj8,"Non-picky eaters, what’s one food you absolutely can’t get behind?",,22926,0.91,AskReddit,https://www.reddit.com/r/AskReddit/comments/t6vvj8/nonpicky_eaters_whats_one_food_you_absolutely/,17495,,1646436304.0
t75zbv,What popular trend bothers you?,,1210,0.95,AskReddit,https://www.reddit.com/r/AskReddit/comments/t75zbv/what_popular_trend_bothers_you/,1551,,1646472887.0
t78ar8,"If animals could talk, which would be the rudest?",,542,0.94,AskReddit,https://www.reddit.com/r/AskReddit/comments/t78ar8/if_animals_could_talk_which_would_be_the_rudest/,672,,1646482692.0
t6ucd8,What was your “birth of a kink” moment?,,16096,0.9,AskReddit,https://www.reddit.com/r/AskReddit/comments/t6ucd8/what_was_your_birth_of_a_kink_moment/,5511,,1646431869.0
t7a238,What film is superior to the book it was adapted from?,,278,0.95,AskReddit,https://www.reddit.com/r/AskReddit/comments/t7a238/what_film_is_superior_to_the_book_it_was_adapted/,569,,1646488885.0
t7e2cn,"If the zombie apocalypse started today, what skills do you have that would make you useful to a band of survivors?",,149,0.93,AskReddit,https://www.reddit.com/r/AskReddit/comments/t7e2cn/if_the_zombie_apocalypse_started_today_what/,468,,1646500529.0
t6pau5,What is unbearable at 100% but at 65% is awesome?,,23509,0.93,AskReddit,https://www.reddit.com/r/AskReddit/comments/t6pau5/what_is_unbearable_at_100_but_at_65_is_awesome/,8333,,1646417998.0
t78lvm,What video game sequel have you been waiting for the longest?,,220,0.94,AskReddit,https://www.reddit.com/r/AskReddit/comments/t78lvm/what_video_game_sequel_have_you_been_waiting_for/,687,,1646483900.0
t79hi8,What are you addicted to?,,171,0.96,AskReddit,https://www.reddit.com/r/AskReddit/comments/t79hi8/what_are_you_addicted_to/,547,,1646487025.0
t6sb9j,What's a dead video game series that you think should be given another shot by a development team today?,,4342,0.96,AskReddit,https://www.reddit.com/r/AskReddit/comments/t6sb9j/whats_a_dead_video_game_series_that_you_think/,7663,,1646426217.0
t776qn,What to do if you beat your meat and someone sees you?,,150,0.73,AskReddit,https://www.reddit.com/r/AskReddit/comments/t776qn/what_to_do_if_you_beat_your_meat_and_someone_sees/,408,,1646478149.0
t71qi8,"People of reddit who didn't work hard at school, how did your life turn out to be?",,396,0.92,AskReddit,https://www.reddit.com/r/AskReddit/comments/t71qi8/people_of_reddit_who_didnt_work_hard_at_school/,522,,1646455570.0
t7e3dd,"When you’re in complete silence, do you hear a ringing tone, or is it just straight silent?",,37,0.87,AskReddit,https://www.reddit.com/r/AskReddit/comments/t7e3dd/when_youre_in_complete_silence_do_you_hear_a/,118,,1646500610.0
t77ogl,What's an older online game you would jump back on instantly if the servers were busy again and the game had a thriving community?,,100,0.91,AskReddit,https://www.reddit.com/r/AskReddit/comments/t77ogl/whats_an_older_online_game_you_would_jump_back_on/,345,,1646480223.0
t7fjqz,What is the most annoying sound you can hear?,,24,0.96,AskReddit,https://www.reddit.com/r/AskReddit/comments/t7fjqz/what_is_the_most_annoying_sound_you_can_hear/,137,,1646504746.0
t7b1e2,"Dear Redditors that respond to posts with irrelevant answers, why do you do that?",,42,0.78,AskReddit,https://www.reddit.com/r/AskReddit/comments/t7b1e2/dear_redditors_that_respond_to_posts_with/,230,,1646491915.0
t7eerc,What’s a weird quirk of your body?,,26,0.92,AskReddit,https://www.reddit.com/r/AskReddit/comments/t7eerc/whats_a_weird_quirk_of_your_body/,123,,1646501491.0
t6y100,what do you say when someone knocks on the restroom door?,,514,0.88,AskReddit,https://www.reddit.com/r/AskReddit/comments/t6y100/what_do_you_say_when_someone_knocks_on_the/,1282,,1646442973.0
t73ekn,What movie did you rewatch most as a kid?,,190,0.95,AskReddit,https://www.reddit.com/r/AskReddit/comments/t73ekn/what_movie_did_you_rewatch_most_as_a_kid/,677,,1646461878.0
t7fvn3,"Toy Story is 27 years old. What other things that you think of as relatively recent are, in fact, ancient?",,21,0.82,AskReddit,https://www.reddit.com/r/AskReddit/comments/t7fvn3/toy_story_is_27_years_old_what_other_things_that/,64,,1646505684.0
t78li3,"redditors that are in a relationship, what's something your partner does that you absolutely can't get enough of?",,58,0.88,AskReddit,https://www.reddit.com/r/AskReddit/comments/t78li3/redditors_that_are_in_a_relationship_whats/,102,,1646483858.0
t7du1g,What is a video game that you really enjoyed playing that no one seems to talk about?,,24,0.93,AskReddit,https://www.reddit.com/r/AskReddit/comments/t7du1g/what_is_a_video_game_that_you_really_enjoyed/,76,,1646499870.0
t7dgqf,What movie would have it's plot resolved if the main character had simply done nothing?,,21,0.96,AskReddit,https://www.reddit.com/r/AskReddit/comments/t7dgqf/what_movie_would_have_its_plot_resolved_if_the/,36,,1646498850.0
t78rwd,What's a daily inconvenience that you live with because you are too lazy to resolve it?,,43,0.92,AskReddit,https://www.reddit.com/r/AskReddit/comments/t78rwd/whats_a_daily_inconvenience_that_you_live_with/,42,,1646484532.0
t7hhga,How do you wear glasses and a mask simultaneously? without fogging your eyes? Is there an answer? can it be done?,,11,0.79,AskReddit,https://www.reddit.com/r/AskReddit/comments/t7hhga/how_do_you_wear_glasses_and_a_mask_simultaneously/,28,,1646510335.0
t7auu4,What famous person/movie character has the most iconic laugh?,,32,0.87,AskReddit,https://www.reddit.com/r/AskReddit/comments/t7auu4/what_famous_personmovie_character_has_the_most/,143,,1646491343.0
t7cbmt,"What company secrets can you reveal, now that you don't work for the company anymore?",,22,0.83,AskReddit,https://www.reddit.com/r/AskReddit/comments/t7cbmt/what_company_secrets_can_you_reveal_now_that_you/,42,,1646495644.0
t7hhbz,"[Serious] What do you know for a fact, that the government is hiding from us?",Serious Replies Only,10,0.81,AskReddit,https://www.reddit.com/r/AskReddit/comments/t7hhbz/serious_what_do_you_know_for_a_fact_that_the/,24,,1646510325.0
t7gdus,What sentence immediately reminds you of your parents?,,10,0.78,AskReddit,https://www.reddit.com/r/AskReddit/comments/t7gdus/what_sentence_immediately_reminds_you_of_your/,29,,1646507131.0
t7hoxr,"You have 5 minutes to live, who would you like to talk to in those minutes?",,9,0.91,AskReddit,https://www.reddit.com/r/AskReddit/comments/t7hoxr/you_have_5_minutes_to_live_who_would_you_like_to/,43,,1646510922.0
t7gray,What would you want your last words to be?,,10,0.92,AskReddit,https://www.reddit.com/r/AskReddit/comments/t7gray/what_would_you_want_your_last_words_to_be/,41,,1646508229.0
t7exod,"Today here in Germany we reached €2.07 per liter diesel, which is equivalent to $8.54 per gallon! What do you pay?",,13,0.88,AskReddit,https://www.reddit.com/r/AskReddit/comments/t7exod/today_here_in_germany_we_reached_207_per_liter/,40,,1646502996.0
t7hfoa,How different would life be on earth if the maximum age a human could reach is 25?,,9,0.85,AskReddit,https://www.reddit.com/r/AskReddit/comments/t7hfoa/how_different_would_life_be_on_earth_if_the/,13,,1646510181.0
t7apwd,What exactly should every person experience at least once in their life?,,24,0.84,AskReddit,https://www.reddit.com/r/AskReddit/comments/t7apwd/what_exactly_should_every_person_experience_at/,105,,1646490910.0
t7icaj,What little thing infuriates you the most?,,7,1.0,AskReddit,https://www.reddit.com/r/AskReddit/comments/t7icaj/what_little_thing_infuriates_you_the_most/,8,,1646512817.0
t7bc19,What's the stinkiest place you've ever been to?,,19,0.85,AskReddit,https://www.reddit.com/r/AskReddit/comments/t7bc19/whats_the_stinkiest_place_youve_ever_been_to/,91,,1646492755.0
t7ddr3,Do you own a gun? Why or why not?,,14,0.75,AskReddit,https://www.reddit.com/r/AskReddit/comments/t7ddr3/do_you_own_a_gun_why_or_why_not/,176,,1646498614.0
t7gfbx,What’s a random fact that people often get wrong?,,9,0.91,AskReddit,https://www.reddit.com/r/AskReddit/comments/t7gfbx/whats_a_random_fact_that_people_often_get_wrong/,36,,1646507247.0
t7dwav,If you had 1 wish what would it be?,,13,0.93,AskReddit,https://www.reddit.com/r/AskReddit/comments/t7dwav/if_you_had_1_wish_what_would_it_be/,60,,1646500045.0
t7i10c,"When fish jump out of the water, is it because they are also trying to escape their own reality, however so briefly, even while knowing they are fully aware that they can't survive outside of the ocean?",,7,1.0,AskReddit,https://www.reddit.com/r/AskReddit/comments/t7i10c/when_fish_jump_out_of_the_water_is_it_because/,8,,1646511895.0
t6yjhc,What's an invention you wish would be invented already?,,211,0.94,AskReddit,https://www.reddit.com/r/AskReddit/comments/t6yjhc/whats_an_invention_you_wish_would_be_invented/,634,,1646444691.0
t7hs7v,Which celebrity has a pretty cool sounding name?,,7,0.89,AskReddit,https://www.reddit.com/r/AskReddit/comments/t7hs7v/which_celebrity_has_a_pretty_cool_sounding_name/,26,,1646511184.0
t7f835,Whats your opinion on spicy food?,,11,0.79,AskReddit,https://www.reddit.com/r/AskReddit/comments/t7f835/whats_your_opinion_on_spicy_food/,61,,1646503817.0
t7ghmc,"If someone tells you ""you need to smile more"" how do you respond?",,8,0.9,AskReddit,https://www.reddit.com/r/AskReddit/comments/t7ghmc/if_someone_tells_you_you_need_to_smile_more_how/,51,,1646507430.0
t7eqn5,What’s with all the avid hikers on dating apps?,,10,0.92,AskReddit,https://www.reddit.com/r/AskReddit/comments/t7eqn5/whats_with_all_the_avid_hikers_on_dating_apps/,25,,1646502439.0
t6c0th,"We hear a lot about toxic masculinity, but what are your favourite examples of positive masculinity?",,16500,0.91,AskReddit,https://www.reddit.com/r/AskReddit/comments/t6c0th/we_hear_a_lot_about_toxic_masculinity_but_what/,4455,,1646373218.0
t7eov4,"If humans suddenly disappeared, who would be the next species to dominate Earth?",,10,0.86,AskReddit,https://www.reddit.com/r/AskReddit/comments/t7eov4/if_humans_suddenly_disappeared_who_would_be_the/,48,,1646502294.0
t7i2rk,What is your favourite smell and why?,,6,1.0,AskReddit,https://www.reddit.com/r/AskReddit/comments/t7i2rk/what_is_your_favourite_smell_and_why/,12,,1646512039.0
t7bk0l,"What is one thing you could simply ""delete"" to make your life more happy and free?",,17,0.81,AskReddit,https://www.reddit.com/r/AskReddit/comments/t7bk0l/what_is_one_thing_you_could_simply_delete_to_make/,57,,1646493425.0
t7hsys,Which would be the smartest animal if they could all talk?,,6,0.8,AskReddit,https://www.reddit.com/r/AskReddit/comments/t7hsys/which_would_be_the_smartest_animal_if_they_could/,21,,1646511249.0
t7by36,"Men of Reddit, when is the last time you cried?",,14,0.85,AskReddit,https://www.reddit.com/r/AskReddit/comments/t7by36/men_of_reddit_when_is_the_last_time_you_cried/,139,,1646494590.0
t7eyxq,"In your opinion, What is the most beautiful word ?",,9,0.91,AskReddit,https://www.reddit.com/r/AskReddit/comments/t7eyxq/in_your_opinion_what_is_the_most_beautiful_word/,46,,1646503099.0
t7hpc4,what’s something a famous person has done that just completely changed how you viewed them?,,7,0.89,AskReddit,https://www.reddit.com/r/AskReddit/comments/t7hpc4/whats_something_a_famous_person_has_done_that/,25,,1646510954.0
t6g1ez,How can you say you're an adult without saying you're an adult?,,3306,0.93,AskReddit,https://www.reddit.com/r/AskReddit/comments/t6g1ez/how_can_you_say_youre_an_adult_without_saying/,4443,,1646389611.0
t7de3v,"If every celebrity had a rhyming, relevant name like ""Bill Nye the Science Guy"", what would some of them be?",,10,0.75,AskReddit,https://www.reddit.com/r/AskReddit/comments/t7de3v/if_every_celebrity_had_a_rhyming_relevant_name/,32,,1646498642.0
t7ertp,"If people suddenly started becoming sick because of a certain food product, which brand/company would be the most likely suspect?",,9,0.71,AskReddit,https://www.reddit.com/r/AskReddit/comments/t7ertp/if_people_suddenly_started_becoming_sick_because/,14,,1646502531.0
t7hic1,"Cat parents, what is your cats favorite habit?",,6,0.88,AskReddit,https://www.reddit.com/r/AskReddit/comments/t7hic1/cat_parents_what_is_your_cats_favorite_habit/,17,,1646510403.0
t6esv2,"A surprisingly high amount of people (adults) still sleep with a comfort item, what’s yours?",,4337,0.95,AskReddit,https://www.reddit.com/r/AskReddit/comments/t6esv2/a_surprisingly_high_amount_of_people_adults_still/,3401,,1646384201.0
t7gak2,What are some unknown facts about the corn industry?,,7,0.71,AskReddit,https://www.reddit.com/r/AskReddit/comments/t7gak2/what_are_some_unknown_facts_about_the_corn/,37,,1646506863.0
t7h4tu,What’s the worst thing about Reddit?,,6,0.88,AskReddit,https://www.reddit.com/r/AskReddit/comments/t7h4tu/whats_the_worst_thing_about_reddit/,25,,1646509311.0
t7g2cx,"If everyone was required to plant a tree every year, what would you plant?",,7,1.0,AskReddit,https://www.reddit.com/r/AskReddit/comments/t7g2cx/if_everyone_was_required_to_plant_a_tree_every/,28,,1646506228.0
t7i3qv,How do you feel about pubes? Your own and partners’?,,5,0.73,AskReddit,https://www.reddit.com/r/AskReddit/comments/t7i3qv/how_do_you_feel_about_pubes_your_own_and_partners/,17,,1646512119.0
t7fp6v,Raisins in potato salad people: what goes through your mind when you make that terrible decision?,,7,0.73,AskReddit,https://www.reddit.com/r/AskReddit/comments/t7fp6v/raisins_in_potato_salad_people_what_goes_through/,17,,1646505161.0
t7eql2,"redditor, why do you answer questions in this sub?",,8,0.79,AskReddit,https://www.reddit.com/r/AskReddit/comments/t7eql2/redditor_why_do_you_answer_questions_in_this_sub/,32,,1646502434.0
t7gomg,What was your biggest fear when you were a child?,,6,0.88,AskReddit,https://www.reddit.com/r/AskReddit/comments/t7gomg/what_was_your_biggest_fear_when_you_were_a_child/,27,,1646508013.0
t7fjhu,What is the longest time you went without pooping and how did you solve the unfortunate situation?,,8,0.9,AskReddit,https://www.reddit.com/r/AskReddit/comments/t7fjhu/what_is_the_longest_time_you_went_without_pooping/,22,,1646504727.0
t7fibd,What career is populated with arrogant people?,,8,0.9,AskReddit,https://www.reddit.com/r/AskReddit/comments/t7fibd/what_career_is_populated_with_arrogant_people/,21,,1646504633.0
t7hs5w,"[Serious] Fellow Redditors, what perspective/mindset did you have that helped you heal during a difficult breakup?",Serious Replies Only,5,0.86,AskReddit,https://www.reddit.com/r/AskReddit/comments/t7hs5w/serious_fellow_redditors_what_perspectivemindset/,6,,1646511179.0
t7hrxk,How do you know if someone likes you?,,5,1.0,AskReddit,https://www.reddit.com/r/AskReddit/comments/t7hrxk/how_do_you_know_if_someone_likes_you/,10,,1646511159.0
t7hnbv,What tv show/movie are you watching tonight?,,5,1.0,AskReddit,https://www.reddit.com/r/AskReddit/comments/t7hnbv/what_tv_showmovie_are_you_watching_tonight/,9,,1646510790.0
t7hjj3,"What are your thoughts on going to see a popular movie alone, but buying 3 seats next to each other because you don't want some sitting right next to you?",,6,1.0,AskReddit,https://www.reddit.com/r/AskReddit/comments/t7hjj3/what_are_your_thoughts_on_going_to_see_a_popular/,24,,1646510482.0
t7hj8r,What is the most useless item you know of that sells for a ridiculously overpriced amount?,,5,0.86,AskReddit,https://www.reddit.com/r/AskReddit/comments/t7hj8r/what_is_the_most_useless_item_you_know_of_that/,14,,1646510461.0
t7dg2l,What was your biggest a-ha moment about the opposite sex?,,9,0.72,AskReddit,https://www.reddit.com/r/AskReddit/comments/t7dg2l/what_was_your_biggest_aha_moment_about_the/,34,,1646498796.0
t7hf4s,"People who never used their earned college degree, what is your story?",,6,1.0,AskReddit,https://www.reddit.com/r/AskReddit/comments/t7hf4s/people_who_never_used_their_earned_college_degree/,6,,1646510139.0
t7g5kr,What is a dead TV series that should be revived today?,,6,1.0,AskReddit,https://www.reddit.com/r/AskReddit/comments/t7g5kr/what_is_a_dead_tv_series_that_should_be_revived/,20,,1646506483.0
t7hdd1,What is a good catch phrase to let someone know you have a crush on them?,,5,1.0,AskReddit,https://www.reddit.com/r/AskReddit/comments/t7hdd1/what_is_a_good_catch_phrase_to_let_someone_know/,9,,1646510001.0
t7h8y8,"When you ’re in complete silence, do you hear a ringing tone, or is it just straight silent?",,5,1.0,AskReddit,https://www.reddit.com/r/AskReddit/comments/t7h8y8/when_you_re_in_complete_silence_do_you_hear_a/,22,,1646509636.0
t7h8ti,"What’s a movie you loved as a kid, that you found out later in life was actually horrible?",,5,0.86,AskReddit,https://www.reddit.com/r/AskReddit/comments/t7h8ti/whats_a_movie_you_loved_as_a_kid_that_you_found/,24,,1646509627.0
t7h8rf,What's the most memorable compliment you've ever gotten?,,5,0.86,AskReddit,https://www.reddit.com/r/AskReddit/comments/t7h8rf/whats_the_most_memorable_compliment_youve_ever/,20,,1646509621.0
t7h8bu,What brands would superheroes endorse?,,5,1.0,AskReddit,https://www.reddit.com/r/AskReddit/comments/t7h8bu/what_brands_would_superheroes_endorse/,8,,1646509585.0
t7h82s,What can you do if you're life is falling apart?,,5,1.0,AskReddit,https://www.reddit.com/r/AskReddit/comments/t7h82s/what_can_you_do_if_youre_life_is_falling_apart/,17,,1646509566.0
t7h7s0,"If you were a truck, which part would be messed up right now?",,5,0.86,AskReddit,https://www.reddit.com/r/AskReddit/comments/t7h7s0/if_you_were_a_truck_which_part_would_be_messed_up/,13,,1646509541.0
t7h6o1,Mates birthday. We’re playing drinking games involving pick up lines. What’s your best worst lines?,,5,0.78,AskReddit,https://www.reddit.com/r/AskReddit/comments/t7h6o1/mates_birthday_were_playing_drinking_games/,10,,1646509460.0
t785hx,"People who need trigger warnings, isn't social media just too dangerous for you?",,23,0.62,AskReddit,https://www.reddit.com/r/AskReddit/comments/t785hx/people_who_need_trigger_warnings_isnt_social/,76,,1646482104.0
t7a3e1,What random thing made you feel old recently?,,15,0.94,AskReddit,https://www.reddit.com/r/AskReddit/comments/t7a3e1/what_random_thing_made_you_feel_old_recently/,55,,1646488994.0
t7bjqk,Do you believe in God? why or why not?,,11,0.63,AskReddit,https://www.reddit.com/r/AskReddit/comments/t7bjqk/do_you_believe_in_god_why_or_why_not/,215,,1646493400.0
t7gxxu,"Office workers of reddit, what's the most NSFW thing a co-worker did?",,5,1.0,AskReddit,https://www.reddit.com/r/AskReddit/comments/t7gxxu/office_workers_of_reddit_whats_the_most_nsfw/,10,,1646508765.0
t7fpd8,If you suddenly lost your hearing. What sounds would you miss the most?,,7,0.89,AskReddit,https://www.reddit.com/r/AskReddit/comments/t7fpd8/if_you_suddenly_lost_your_hearing_what_sounds/,24,,1646505177.0
t7bisc,"Your username is what you'll be eating for dinner, how screwed are you?",,13,0.76,AskReddit,https://www.reddit.com/r/AskReddit/comments/t7bisc/your_username_is_what_youll_be_eating_for_dinner/,89,,1646493319.0
t7gwek,Which song is so good to you that you can listen it on repeat every day?,,5,1.0,AskReddit,https://www.reddit.com/r/AskReddit/comments/t7gwek/which_song_is_so_good_to_you_that_you_can_listen/,16,,1646508644.0
t7gw61,What's your favorite line from your favorite song?,,5,1.0,AskReddit,https://www.reddit.com/r/AskReddit/comments/t7gw61/whats_your_favorite_line_from_your_favorite_song/,12,,1646508626.0
t7gvsc,What would a ideal government look like?,,5,1.0,AskReddit,https://www.reddit.com/r/AskReddit/comments/t7gvsc/what_would_a_ideal_government_look_like/,31,,1646508599.0
t7ekdv,What differences have you noticed between people of different races that’s not racist?,,7,0.77,AskReddit,https://www.reddit.com/r/AskReddit/comments/t7ekdv/what_differences_have_you_noticed_between_people/,41,,1646501938.0
t7icqa,"Fast food workers of Reddit, what is the most absurd thing someone ordered?",,5,1.0,AskReddit,https://www.reddit.com/r/AskReddit/comments/t7icqa/fast_food_workers_of_reddit_what_is_the_most/,2,,1646512853.0
t7beo2,What was the stupidest misconception you believed as a child?,,9,0.77,AskReddit,https://www.reddit.com/r/AskReddit/comments/t7beo2/what_was_the_stupidest_misconception_you_believed/,40,,1646492974.0
t7iavd,What's the most severe case of a TV show gradually making a character dumber and dumber throughout the series?,,4,1.0,AskReddit,https://www.reddit.com/r/AskReddit/comments/t7iavd/whats_the_most_severe_case_of_a_tv_show_gradually/,7,,1646512709.0
t7fiq6,"Which song you listen to, every single day and would recommend others too?",,8,0.83,AskReddit,https://www.reddit.com/r/AskReddit/comments/t7fiq6/which_song_you_listen_to_every_single_day_and/,23,,1646504662.0
t7dhgm,"If you could ask one person in history a question and get a genuine response, who/what would it be?",,8,0.79,AskReddit,https://www.reddit.com/r/AskReddit/comments/t7dhgm/if_you_could_ask_one_person_in_history_a_question/,15,,1646498907.0
t7gpa1,What’s a weird little snack you like making for yourself?,,5,1.0,AskReddit,https://www.reddit.com/r/AskReddit/comments/t7gpa1/whats_a_weird_little_snack_you_like_making_for/,13,,1646508064.0
t7i7b9,What is the pettiest/stupidest grudge that you still hold today?,,4,1.0,AskReddit,https://www.reddit.com/r/AskReddit/comments/t7i7b9/what_is_the_pettieststupidest_grudge_that_you/,2,,1646512414.0
t7i5y5,What is the most useless skill you possess?,,4,1.0,AskReddit,https://www.reddit.com/r/AskReddit/comments/t7i5y5/what_is_the_most_useless_skill_you_possess/,12,,1646512299.0
t7i3x4,What was your most embarrassing moment?,,4,1.0,AskReddit,https://www.reddit.com/r/AskReddit/comments/t7i3x4/what_was_your_most_embarrassing_moment/,3,,1646512133.0
t7i2xi,What is a fun fact about yourself?,,4,1.0,AskReddit,https://www.reddit.com/r/AskReddit/comments/t7i2xi/what_is_a_fun_fact_about_yourself/,9,,1646512052.0
t7i1wp,What’s something you like that everyone else seems to hate?,,4,0.83,AskReddit,https://www.reddit.com/r/AskReddit/comments/t7i1wp/whats_something_you_like_that_everyone_else_seems/,9,,1646511970.0
t7i13w,"What phrase do you find condescending, that shouldn’t be?",,4,1.0,AskReddit,https://www.reddit.com/r/AskReddit/comments/t7i13w/what_phrase_do_you_find_condescending_that/,7,,1646511904.0
t7hytg,What technology would you like to see invented/perfected at some point in your life?,,4,1.0,AskReddit,https://www.reddit.com/r/AskReddit/comments/t7hytg/what_technology_would_you_like_to_see/,5,,1646511717.0
t7hvdv,What are the childish acts you still enjoy doing up until now?,,4,1.0,AskReddit,https://www.reddit.com/r/AskReddit/comments/t7hvdv/what_are_the_childish_acts_you_still_enjoy_doing/,6,,1646511444.0
t7gcr7,What is a subreddit that you absolutely hate?,,5,0.86,AskReddit,https://www.reddit.com/r/AskReddit/comments/t7gcr7/what_is_a_subreddit_that_you_absolutely_hate/,14,,1646507045.0
t7hurn,What does your brain try to make you do and you have to resist yourself not to do it?,,4,0.83,AskReddit,https://www.reddit.com/r/AskReddit/comments/t7hurn/what_does_your_brain_try_to_make_you_do_and_you/,16,,1646511393.0
t7bk2b,How do you react to compliments?,,8,0.8,AskReddit,https://www.reddit.com/r/AskReddit/comments/t7bk2b/how_do_you_react_to_compliments/,48,,1646493430.0
t7gb5o,What do you usually say after losing an argument with someone ?,,5,1.0,AskReddit,https://www.reddit.com/r/AskReddit/comments/t7gb5o/what_do_you_usually_say_after_losing_an_argument/,27,,1646506912.0
t7hs4m,"For people who are 30+, what’s something that needs to be done before someone turns 30?",,4,1.0,AskReddit,https://www.reddit.com/r/AskReddit/comments/t7hs4m/for_people_who_are_30_whats_something_that_needs/,11,,1646511176.0
t7hrtb,"Have you ever stayed in a relationship that you knew was toxic? If yes, why?",,4,1.0,AskReddit,https://www.reddit.com/r/AskReddit/comments/t7hrtb/have_you_ever_stayed_in_a_relationship_that_you/,9,,1646511148.0
t7eykv,[Serious] If you want back in time and saw your 13 old self what would say to them?,Serious Replies Only,6,0.75,AskReddit,https://www.reddit.com/r/AskReddit/comments/t7eykv/serious_if_you_want_back_in_time_and_saw_your_13/,52,,1646503069.0
t7dv6j,What mistake will you never make again?,,7,0.89,AskReddit,https://www.reddit.com/r/AskReddit/comments/t7dv6j/what_mistake_will_you_never_make_again/,28,,1646499957.0
t7hnqe,Who's the most relatable TV character you've ever seen?,,4,1.0,AskReddit,https://www.reddit.com/r/AskReddit/comments/t7hnqe/whos_the_most_relatable_tv_character_youve_ever/,7,,1646510822.0
t7hnij,You wake up and see you're trending as a meme. What's your first reaction?,,4,1.0,AskReddit,https://www.reddit.com/r/AskReddit/comments/t7hnij/you_wake_up_and_see_youre_trending_as_a_meme/,8,,1646510805.0
t7hmyo,"If you were forced to live france or brazil, which one would you pick?",,4,1.0,AskReddit,https://www.reddit.com/r/AskReddit/comments/t7hmyo/if_you_were_forced_to_live_france_or_brazil_which/,27,,1646510762.0
