post_id,title,flair,score,post_upvote_ratio,subreddit,url,num_comments,body,created
t7dn70,What's the worst movie you've ever seen and why?,,4,0.84,AskReddit,https://www.reddit.com/r/AskReddit/comments/t7dn70/whats_the_worst_movie_youve_ever_seen_and_why/,19,,1646499353.0
t7ccs1,"You have to pick an animal to be your accomplice in life, akin to a Pokémon, what do you choose and why?",,5,0.67,AskReddit,https://www.reddit.com/r/AskReddit/comments/t7ccs1/you_have_to_pick_an_animal_to_be_your_accomplice/,26,,1646495732.0
t7h47r,Are Robert Munsch books a must read childhood staple in your country? And where are you from?,,3,1.0,AskReddit,https://www.reddit.com/r/AskReddit/comments/t7h47r/are_robert_munsch_books_a_must_read_childhood/,8,,1646509264.0
t7h40z,What's a joke that went too far?,,3,1.0,AskReddit,https://www.reddit.com/r/AskReddit/comments/t7h40z/whats_a_joke_that_went_too_far/,11,,1646509248.0
t7h3yq,"People who got laser eye surgery, how was the experience, is it covered by insurance if not how much was it, we’re you scared prior, and how long did recovery take?",,3,1.0,AskReddit,https://www.reddit.com/r/AskReddit/comments/t7h3yq/people_who_got_laser_eye_surgery_how_was_the/,8,,1646509243.0
t7h36z,"Whether to alcohol, drugs, sex, food, soda, sugar, etc... How did you overcome your addiction and what advice do you have for anyone who is ready to overcome theirs?",,3,1.0,AskReddit,https://www.reddit.com/r/AskReddit/comments/t7h36z/whether_to_alcohol_drugs_sex_food_soda_sugar_etc/,21,,1646509190.0
t7h2bu,What's the dumbest thing someone's argued against you on social media?,,3,0.8,AskReddit,https://www.reddit.com/r/AskReddit/comments/t7h2bu/whats_the_dumbest_thing_someones_argued_against/,23,,1646509120.0
t7h2aq,"If your phone could talk, what would it say?",,3,1.0,AskReddit,https://www.reddit.com/r/AskReddit/comments/t7h2aq/if_your_phone_could_talk_what_would_it_say/,13,,1646509117.0
t7h24v,When do you guys delete or unfollow someone off social media?,,3,1.0,AskReddit,https://www.reddit.com/r/AskReddit/comments/t7h24v/when_do_you_guys_delete_or_unfollow_someone_off/,14,,1646509102.0
t7f3x9,What career attracts the most egomaniac?,,4,1.0,AskReddit,https://www.reddit.com/r/AskReddit/comments/t7f3x9/what_career_attracts_the_most_egomaniac/,6,,1646503479.0
t7h0pu,"People who like to talk/chat during movies. What is your reasoning, how do you justify this?",,3,0.8,AskReddit,https://www.reddit.com/r/AskReddit/comments/t7h0pu/people_who_like_to_talkchat_during_movies_what_is/,12,,1646508989.0
t7h0j8,How this could trigger ww3?,,3,0.8,AskReddit,https://www.reddit.com/r/AskReddit/comments/t7h0j8/how_this_could_trigger_ww3/,9,,1646508976.0
t7gznh,How did you get over your last heartbreak?,,3,1.0,AskReddit,https://www.reddit.com/r/AskReddit/comments/t7gznh/how_did_you_get_over_your_last_heartbreak/,9,,1646508903.0
t7f16l,What do you not want someone to do with your stuff?,,4,0.83,AskReddit,https://www.reddit.com/r/AskReddit/comments/t7f16l/what_do_you_not_want_someone_to_do_with_your_stuff/,12,,1646503264.0
t7gy2t,"If you can make perfume out of your cat's scent, what would it be named?",,3,1.0,AskReddit,https://www.reddit.com/r/AskReddit/comments/t7gy2t/if_you_can_make_perfume_out_of_your_cats_scent/,5,,1646508778.0
t7ez69,You must have sex while the song you most recently listened to is playing the whole time. What song are you fucking to and does it help or hinder the mood?,,4,0.63,AskReddit,https://www.reddit.com/r/AskReddit/comments/t7ez69/you_must_have_sex_while_the_song_you_most/,83,,1646503119.0
t7gx0q,What would be the worst animal to have a Wild Krats episode on?,,3,1.0,AskReddit,https://www.reddit.com/r/AskReddit/comments/t7gx0q/what_would_be_the_worst_animal_to_have_a_wild/,4,,1646508694.0
t7gwp4,What is the best story of “it’s a small world” that you know?,,3,1.0,AskReddit,https://www.reddit.com/r/AskReddit/comments/t7gwp4/what_is_the_best_story_of_its_a_small_world_that/,9,,1646508669.0
t7ewyn,What would you do if everyone you know all went on vacation and none of them invited you?,,4,0.83,AskReddit,https://www.reddit.com/r/AskReddit/comments/t7ewyn/what_would_you_do_if_everyone_you_know_all_went/,16,,1646502939.0
t7ewyi,Artists whose art you hate but personalities you like ?,,3,0.72,AskReddit,https://www.reddit.com/r/AskReddit/comments/t7ewyi/artists_whose_art_you_hate_but_personalities_you/,0,,1646502938.0
t7guv0,What was the weirdest and most off-turning thing someone ever said to you during sex?,,3,1.0,AskReddit,https://www.reddit.com/r/AskReddit/comments/t7guv0/what_was_the_weirdest_and_most_offturning_thing/,17,,1646508518.0
t7gseq,"What was your biggest ""culture shock"" when visiting another country?",,3,1.0,AskReddit,https://www.reddit.com/r/AskReddit/comments/t7gseq/what_was_your_biggest_culture_shock_when_visiting/,12,,1646508317.0
t7gqa7,How would you react if you woke up one morning and realized that you were the only one left of all humanity and all other people disappeared?,,3,1.0,AskReddit,https://www.reddit.com/r/AskReddit/comments/t7gqa7/how_would_you_react_if_you_woke_up_one_morning/,9,,1646508149.0
t7d6xb,What cool fact do you know about your favorite animal?,,4,0.75,AskReddit,https://www.reddit.com/r/AskReddit/comments/t7d6xb/what_cool_fact_do_you_know_about_your_favorite/,8,,1646498080.0
t7gp1z,"People that died and came back, what happened?",,3,0.67,AskReddit,https://www.reddit.com/r/AskReddit/comments/t7gp1z/people_that_died_and_came_back_what_happened/,10,,1646508047.0
t7go95,What is the most disturbing movie you ever saw?,,3,1.0,AskReddit,https://www.reddit.com/r/AskReddit/comments/t7go95/what_is_the_most_disturbing_movie_you_ever_saw/,8,,1646507989.0
t746jg,What is a funky smell that you really enjoy?,,26,0.84,AskReddit,https://www.reddit.com/r/AskReddit/comments/t746jg/what_is_a_funky_smell_that_you_really_enjoy/,173,,1646465034.0
t7ep04,"Which have Americans misinterpreted worse, The Bible or The Constitution?",,4,0.62,AskReddit,https://www.reddit.com/r/AskReddit/comments/t7ep04/which_have_americans_misinterpreted_worse_the/,29,,1646502306.0
t7gni7,"People who know that they are psychopaths, what is the worst you have done to someone?",,2,0.67,AskReddit,https://www.reddit.com/r/AskReddit/comments/t7gni7/people_who_know_that_they_are_psychopaths_what_is/,5,,1646507924.0
t7gn3o,"What’s something that you enjoyed before COVID, but can no longer stand?",,2,0.63,AskReddit,https://www.reddit.com/r/AskReddit/comments/t7gn3o/whats_something_that_you_enjoyed_before_covid_but/,10,,1646507890.0
t7gmhd,"When it comes to new clothes, what type of person are you? The type to wash them first before wearing? Or the type to delay washing as much as possible so the clothes remain fresh, new-looking, and non-faded?",,3,1.0,AskReddit,https://www.reddit.com/r/AskReddit/comments/t7gmhd/when_it_comes_to_new_clothes_what_type_of_person/,6,,1646507838.0
t7btby,What celebrity sex tape would break the internet?,,7,0.6,AskReddit,https://www.reddit.com/r/AskReddit/comments/t7btby/what_celebrity_sex_tape_would_break_the_internet/,83,,1646494216.0
t7emw3,How do you contribute to society?,,4,1.0,AskReddit,https://www.reddit.com/r/AskReddit/comments/t7emw3/how_do_you_contribute_to_society/,23,,1646502133.0
t7gker,"Redditors who saw a dead body for the first time, what is something you experienced that television, movies, and even real life crime scene photos didn't prepare you for?",,3,1.0,AskReddit,https://www.reddit.com/r/AskReddit/comments/t7gker/redditors_who_saw_a_dead_body_for_the_first_time/,9,,1646507666.0
t7gjun,"Nurses and Doctors of Reddit, what is the dumbest thing you’ve had someone come into the hospital/doctors office for?",,3,1.0,AskReddit,https://www.reddit.com/r/AskReddit/comments/t7gjun/nurses_and_doctors_of_reddit_what_is_the_dumbest/,1,,1646507622.0
t7giwd,What is the worst theme song that you have ever Heard?,,3,1.0,AskReddit,https://www.reddit.com/r/AskReddit/comments/t7giwd/what_is_the_worst_theme_song_that_you_have_ever/,2,,1646507541.0
t7givc,"Redditors that live in house boats, is it worth it? What are the pros/cons?",,3,1.0,AskReddit,https://www.reddit.com/r/AskReddit/comments/t7givc/redditors_that_live_in_house_boats_is_it_worth_it/,1,,1646507539.0
t7gisc,how do you overcome a mental instability?,,3,0.8,AskReddit,https://www.reddit.com/r/AskReddit/comments/t7gisc/how_do_you_overcome_a_mental_instability/,7,,1646507532.0
t7ggpx,[serious]How do you see yourself in 5 years?,Serious Replies Only,3,1.0,AskReddit,https://www.reddit.com/r/AskReddit/comments/t7ggpx/serioushow_do_you_see_yourself_in_5_years/,17,,1646507357.0
t7gfy1,"If you had to become a millionaire in 5 years or face death, how would you do it?",,3,1.0,AskReddit,https://www.reddit.com/r/AskReddit/comments/t7gfy1/if_you_had_to_become_a_millionaire_in_5_years_or/,16,,1646507294.0
t7gf2g,What’s the worst movie theater experience you’ve had?,,3,0.8,AskReddit,https://www.reddit.com/r/AskReddit/comments/t7gf2g/whats_the_worst_movie_theater_experience_youve_had/,8,,1646507227.0
t7g9gn,what is something in the future that's going to suck?,,4,0.83,AskReddit,https://www.reddit.com/r/AskReddit/comments/t7g9gn/what_is_something_in_the_future_thats_going_to/,18,,1646506794.0
t7bgk7,What would you do If you were the only surviver of a nuclear attack?,,6,0.88,AskReddit,https://www.reddit.com/r/AskReddit/comments/t7bgk7/what_would_you_do_if_you_were_the_only_surviver/,25,,1646493136.0
t7g7gg,What is something you don't want to talk about?,,3,1.0,AskReddit,https://www.reddit.com/r/AskReddit/comments/t7g7gg/what_is_something_you_dont_want_to_talk_about/,15,,1646506631.0
t7e88j,What celebrity gives you the ick?,,4,0.75,AskReddit,https://www.reddit.com/r/AskReddit/comments/t7e88j/what_celebrity_gives_you_the_ick/,16,,1646500991.0
t7g6g1,What is the first diet change you would suggest making towards a healthier life?,,3,1.0,AskReddit,https://www.reddit.com/r/AskReddit/comments/t7g6g1/what_is_the_first_diet_change_you_would_suggest/,15,,1646506551.0
t7g619,What are the worst type of coworkers to deal with?,,3,1.0,AskReddit,https://www.reddit.com/r/AskReddit/comments/t7g619/what_are_the_worst_type_of_coworkers_to_deal_with/,18,,1646506518.0
t7g5w0,What.... Do you believe in ghosts and why?,,3,0.72,AskReddit,https://www.reddit.com/r/AskReddit/comments/t7g5w0/what_do_you_believe_in_ghosts_and_why/,14,,1646506509.0
t7g4ue,What’s an unforgivable crime against food?,,2,0.67,AskReddit,https://www.reddit.com/r/AskReddit/comments/t7g4ue/whats_an_unforgivable_crime_against_food/,30,,1646506427.0
t7cm5y,What seat do you prefer on a plane?,,7,0.82,AskReddit,https://www.reddit.com/r/AskReddit/comments/t7cm5y/what_seat_do_you_prefer_on_a_plane/,36,,1646496440.0
t7g44c,What non serious thing you seen someone take it very serious?,,3,1.0,AskReddit,https://www.reddit.com/r/AskReddit/comments/t7g44c/what_non_serious_thing_you_seen_someone_take_it/,7,,1646506369.0
t7g3pc,What's your favorite gaming memory?,,3,1.0,AskReddit,https://www.reddit.com/r/AskReddit/comments/t7g3pc/whats_your_favorite_gaming_memory/,12,,1646506335.0
t7g2xn,"Redditors who have beaten depression, how did you do it?",,2,0.67,AskReddit,https://www.reddit.com/r/AskReddit/comments/t7g2xn/redditors_who_have_beaten_depression_how_did_you/,9,,1646506271.0
t7g1ji,What do y’all hate about having long hair?,,3,0.67,AskReddit,https://www.reddit.com/r/AskReddit/comments/t7g1ji/what_do_yall_hate_about_having_long_hair/,33,,1646506161.0
t7g0qz,What are some wonderful words used to describe something specific only found in one language?,,3,1.0,AskReddit,https://www.reddit.com/r/AskReddit/comments/t7g0qz/what_are_some_wonderful_words_used_to_describe/,3,,1646506096.0
t7b9ge,If you had to choose between your mom or wife who would you choose?,,6,1.0,AskReddit,https://www.reddit.com/r/AskReddit/comments/t7b9ge/if_you_had_to_choose_between_your_mom_or_wife_who/,20,,1646492547.0
t7e1lk,"People who have asked your children to ""be the bigger person"" when dealing with your immature spouse: Do you regret any choices you've made in your life?",,4,0.84,AskReddit,https://www.reddit.com/r/AskReddit/comments/t7e1lk/people_who_have_asked_your_children_to_be_the/,2,,1646500467.0
t7g028,what board game would suck to play if you were colourblind?,,4,0.83,AskReddit,https://www.reddit.com/r/AskReddit/comments/t7g028/what_board_game_would_suck_to_play_if_you_were/,15,,1646506039.0
t7fzxk,How has quitting cannabis impacted your life?,,2,0.63,AskReddit,https://www.reddit.com/r/AskReddit/comments/t7fzxk/how_has_quitting_cannabis_impacted_your_life/,7,,1646506029.0
t7e0a2,How does water taste to you?,,4,0.83,AskReddit,https://www.reddit.com/r/AskReddit/comments/t7e0a2/how_does_water_taste_to_you/,17,,1646500361.0
t6gwwt,[Serious] What disease or disorder do you think everyone should be more aware about?,Serious Replies Only,972,0.95,AskReddit,https://www.reddit.com/r/AskReddit/comments/t6gwwt/serious_what_disease_or_disorder_do_you_think/,2037,,1646393269.0
t7fwrq,What is the most thoughtful/wholesome thing anyone has ever said/done for you?,,3,1.0,AskReddit,https://www.reddit.com/r/AskReddit/comments/t7fwrq/what_is_the_most_thoughtfulwholesome_thing_anyone/,7,,1646505771.0
t7fw4u,What gesture(s) do you do almost unconsciously?,,3,0.8,AskReddit,https://www.reddit.com/r/AskReddit/comments/t7fw4u/what_gestures_do_you_do_almost_unconsciously/,9,,1646505720.0
t7dvi1,What's something you wanted to do but never did it?,,4,1.0,AskReddit,https://www.reddit.com/r/AskReddit/comments/t7dvi1/whats_something_you_wanted_to_do_but_never_did_it/,16,,1646499982.0
t7fthg,"What is a movie where you think the ""villain"" is actually the real hero and the ""hero"" was the one whose mistaken ?",,3,1.0,AskReddit,https://www.reddit.com/r/AskReddit/comments/t7fthg/what_is_a_movie_where_you_think_the_villain_is/,6,,1646505511.0
t7ft3o,What’s your secret guilty pleasure TV show?,,3,0.8,AskReddit,https://www.reddit.com/r/AskReddit/comments/t7ft3o/whats_your_secret_guilty_pleasure_tv_show/,17,,1646505481.0
t7fsrk,"If you could only listen to one song, which would it be?",,4,0.83,AskReddit,https://www.reddit.com/r/AskReddit/comments/t7fsrk/if_you_could_only_listen_to_one_song_which_would/,13,,1646505452.0
t7dt7k,What is the scariest experience you have ever had?,,5,0.69,AskReddit,https://www.reddit.com/r/AskReddit/comments/t7dt7k/what_is_the_scariest_experience_you_have_ever_had/,12,,1646499808.0
t7c93o,What movie do you enjoy but later discovered it was hated by most?,,4,0.67,AskReddit,https://www.reddit.com/r/AskReddit/comments/t7c93o/what_movie_do_you_enjoy_but_later_discovered_it/,10,,1646495443.0
t7fsef,"People of Reddit that have witnessed death, what happened?",,3,1.0,AskReddit,https://www.reddit.com/r/AskReddit/comments/t7fsef/people_of_reddit_that_have_witnessed_death_what/,9,,1646505423.0
t7fr6t,Do you think Jesus Christ existed as a historical person? Why or why not?,,2,0.67,AskReddit,https://www.reddit.com/r/AskReddit/comments/t7fr6t/do_you_think_jesus_christ_existed_as_a_historical/,25,,1646505322.0
t7985d,"People of reddit, what is your phobia?",,8,0.83,AskReddit,https://www.reddit.com/r/AskReddit/comments/t7985d/people_of_reddit_what_is_your_phobia/,72,,1646486136.0
t76td6,What is your favourite Color?,,14,0.75,AskReddit,https://www.reddit.com/r/AskReddit/comments/t76td6/what_is_your_favourite_color/,102,,1646476590.0
t7fpf0,"redditors, what's your weirdest ""I walked in on..."" story?",,3,1.0,AskReddit,https://www.reddit.com/r/AskReddit/comments/t7fpf0/redditors_whats_your_weirdest_i_walked_in_on_story/,9,,1646505182.0
t7dpcc,Your sexual kink is now a super power. What would be your super hero name?,,4,0.63,AskReddit,https://www.reddit.com/r/AskReddit/comments/t7dpcc/your_sexual_kink_is_now_a_super_power_what_would/,28,,1646499533.0
t7ife5,What isn't a crime but should be?,,2,1.0,AskReddit,https://www.reddit.com/r/AskReddit/comments/t7ife5/what_isnt_a_crime_but_should_be/,1,,1646513078.0
t7iexf,If you could combine the best of two subreddits what would they be?,,2,1.0,AskReddit,https://www.reddit.com/r/AskReddit/comments/t7iexf/if_you_could_combine_the_best_of_two_subreddits/,0,,1646513042.0
t7foit,"If your financial circumstances were dire, would you beg for money? Why or why not?",,3,1.0,AskReddit,https://www.reddit.com/r/AskReddit/comments/t7foit/if_your_financial_circumstances_were_dire_would/,9,,1646505106.0
t7domn,"Which TV series has the best opening credit song, music or score?",,4,0.83,AskReddit,https://www.reddit.com/r/AskReddit/comments/t7domn/which_tv_series_has_the_best_opening_credit_song/,27,,1646499473.0
t7fnxe,What have you had to stop doing or buying because its too expensive now?,,4,1.0,AskReddit,https://www.reddit.com/r/AskReddit/comments/t7fnxe/what_have_you_had_to_stop_doing_or_buying_because/,17,,1646505059.0
t7do0s,What is something that you are afraid of that mostly likely will never happen to you?,,4,0.84,AskReddit,https://www.reddit.com/r/AskReddit/comments/t7do0s/what_is_something_that_you_are_afraid_of_that/,8,,1646499421.0
t7ie33,You’re a 2000s teen with an iPod. What’s a song you will play on your iPod?,,2,1.0,AskReddit,https://www.reddit.com/r/AskReddit/comments/t7ie33/youre_a_2000s_teen_with_an_ipod_whats_a_song_you/,6,,1646512967.0
t7idy2,What’s the funniest thing you’ve done when your brain was on autopilot?,,2,1.0,AskReddit,https://www.reddit.com/r/AskReddit/comments/t7idy2/whats_the_funniest_thing_youve_done_when_your/,1,,1646512955.0
t7idvk,What’s the weirdest thing you’ve found underwater or washed up on a beach?,,2,1.0,AskReddit,https://www.reddit.com/r/AskReddit/comments/t7idvk/whats_the_weirdest_thing_youve_found_underwater/,1,,1646512949.0
t7fnb8,"If there was a horror movie porn parody, What would it be called?",,3,1.0,AskReddit,https://www.reddit.com/r/AskReddit/comments/t7fnb8/if_there_was_a_horror_movie_porn_parody_what/,15,,1646505013.0
t7dnkf,"Book readers out there, who's your all time favourite couple/s?",,4,0.84,AskReddit,https://www.reddit.com/r/AskReddit/comments/t7dnkf/book_readers_out_there_whos_your_all_time/,6,,1646499383.0
t7idh7,So what are your fun plans today?,,2,1.0,AskReddit,https://www.reddit.com/r/AskReddit/comments/t7idh7/so_what_are_your_fun_plans_today/,5,,1646512912.0
t7dn8a,What are some good martial arts/super power anime?,,4,1.0,AskReddit,https://www.reddit.com/r/AskReddit/comments/t7dn8a/what_are_some_good_martial_artssuper_power_anime/,8,,1646499356.0
t7idc7,What minor injury has been really annoying?,,2,1.0,AskReddit,https://www.reddit.com/r/AskReddit/comments/t7idc7/what_minor_injury_has_been_really_annoying/,1,,1646512901.0
t7id2d,"All your butter, salt and pepper has been confiscated, what foods aren't worth eating?",,3,1.0,AskReddit,https://www.reddit.com/r/AskReddit/comments/t7id2d/all_your_butter_salt_and_pepper_has_been/,3,,1646512879.0
t7icwg,What is your favorite adult jokes in a kids cartoon?,,2,1.0,AskReddit,https://www.reddit.com/r/AskReddit/comments/t7icwg/what_is_your_favorite_adult_jokes_in_a_kids/,2,,1646512867.0
t7fm7b,What’s your pick for an un hate-able song?,,3,0.8,AskReddit,https://www.reddit.com/r/AskReddit/comments/t7fm7b/whats_your_pick_for_an_un_hateable_song/,5,,1646504932.0
t7fm18,What is/are your hobby/hobbies?,,3,1.0,AskReddit,https://www.reddit.com/r/AskReddit/comments/t7fm18/what_isare_your_hobbyhobbies/,5,,1646504920.0
t7flot,"What is a bullet you did not dodge, but instead hit you right in the heart?",,3,1.0,AskReddit,https://www.reddit.com/r/AskReddit/comments/t7flot/what_is_a_bullet_you_did_not_dodge_but_instead/,2,,1646504893.0
t7auuv,What's the best dad joke you've ever heard?,,7,1.0,AskReddit,https://www.reddit.com/r/AskReddit/comments/t7auuv/whats_the_best_dad_joke_youve_ever_heard/,16,,1646491345.0
t7flcf,What’s one decision you would change from the past?,,3,1.0,AskReddit,https://www.reddit.com/r/AskReddit/comments/t7flcf/whats_one_decision_you_would_change_from_the_past/,4,,1646504865.0
t7fkwq,What is your favorite sound to hear that always makes you happy?,,3,1.0,AskReddit,https://www.reddit.com/r/AskReddit/comments/t7fkwq/what_is_your_favorite_sound_to_hear_that_always/,24,,1646504833.0
t7ibg4,"To the people who lived from a venomous snake/animal bite, what was going on?",,3,1.0,AskReddit,https://www.reddit.com/r/AskReddit/comments/t7ibg4/to_the_people_who_lived_from_a_venomous/,4,,1646512755.0
t7fkv3,What challenges do you think a military would face in invading Sweden?,,4,1.0,AskReddit,https://www.reddit.com/r/AskReddit/comments/t7fkv3/what_challenges_do_you_think_a_military_would/,8,,1646504829.0
t7ibf7,What do you expect the future to be like?,,2,1.0,AskReddit,https://www.reddit.com/r/AskReddit/comments/t7ibf7/what_do_you_expect_the_future_to_be_like/,2,,1646512753.0
t7ibe2,What is the weirdest thing someone has tried to show off to you about?,,2,1.0,AskReddit,https://www.reddit.com/r/AskReddit/comments/t7ibe2/what_is_the_weirdest_thing_someone_has_tried_to/,2,,1646512750.0
t7dl5m,what is the most overrated in your opinion ?,,4,0.83,AskReddit,https://www.reddit.com/r/AskReddit/comments/t7dl5m/what_is_the_most_overrated_in_your_opinion/,19,,1646499194.0
t7fknk,"People who are a part of Organized religions, why did you join?",,3,0.8,AskReddit,https://www.reddit.com/r/AskReddit/comments/t7fknk/people_who_are_a_part_of_organized_religions_why/,1,,1646504813.0
t7ib74,what was your dream job growing up?,,2,1.0,AskReddit,https://www.reddit.com/r/AskReddit/comments/t7ib74/what_was_your_dream_job_growing_up/,13,,1646512735.0
t7ias1,what was the luckiest thing that happened to you?,,2,1.0,AskReddit,https://www.reddit.com/r/AskReddit/comments/t7ias1/what_was_the_luckiest_thing_that_happened_to_you/,4,,1646512701.0
t7iaa4,What’s the most drama you’ve witnessed at a wedding ?,,2,1.0,AskReddit,https://www.reddit.com/r/AskReddit/comments/t7iaa4/whats_the_most_drama_youve_witnessed_at_a_wedding/,1,,1646512660.0
t7ia7l,"What do you look like, are you content with your looks?",,2,1.0,AskReddit,https://www.reddit.com/r/AskReddit/comments/t7ia7l/what_do_you_look_like_are_you_content_with_your/,12,,1646512654.0
t78fxg,How is gaslighting different from….ordinary lying?,,9,0.7,AskReddit,https://www.reddit.com/r/AskReddit/comments/t78fxg/how_is_gaslighting_different_fromordinary_lying/,42,,1646483260.0
t7ia0u,[Serious] People who live near airports and complain about the noise…has the noise increased or were you unaware of how noisy an airport could be?,Serious Replies Only,2,1.0,AskReddit,https://www.reddit.com/r/AskReddit/comments/t7ia0u/serious_people_who_live_near_airports_and/,5,,1646512640.0
t7i9pj,What comes to mind when you think of Charlie Day?,,3,1.0,AskReddit,https://www.reddit.com/r/AskReddit/comments/t7i9pj/what_comes_to_mind_when_you_think_of_charlie_day/,7,,1646512614.0
t7fiyh,What are your thoughts about India and bollywood?,,4,0.83,AskReddit,https://www.reddit.com/r/AskReddit/comments/t7fiyh/what_are_your_thoughts_about_india_and_bollywood/,9,,1646504681.0
t7fipm,What are some early warning signs that your partner is crazy?,,3,1.0,AskReddit,https://www.reddit.com/r/AskReddit/comments/t7fipm/what_are_some_early_warning_signs_that_your/,7,,1646504662.0
t7i8v6,What is something that make you uncomfortable even though other people don’t seem to mind it?,,2,1.0,AskReddit,https://www.reddit.com/r/AskReddit/comments/t7i8v6/what_is_something_that_make_you_uncomfortable/,5,,1646512545.0
t7i8pt,What's the most strange thing you do before going to bed?,,2,1.0,AskReddit,https://www.reddit.com/r/AskReddit/comments/t7i8pt/whats_the_most_strange_thing_you_do_before_going/,1,,1646512532.0
t7i84r,Which celebrity looks like they have a funk?,,2,1.0,AskReddit,https://www.reddit.com/r/AskReddit/comments/t7i84r/which_celebrity_looks_like_they_have_a_funk/,1,,1646512483.0
t7i7uc,What is something you believe in that makes you feel like an outsider?,,2,1.0,AskReddit,https://www.reddit.com/r/AskReddit/comments/t7i7uc/what_is_something_you_believe_in_that_makes_you/,12,,1646512460.0
t7i7sm,"Those who went through a hard time, how long did it last for you?",,2,1.0,AskReddit,https://www.reddit.com/r/AskReddit/comments/t7i7sm/those_who_went_through_a_hard_time_how_long_did/,9,,1646512455.0
t7fgxm,How do you say goodbye?,,2,0.67,AskReddit,https://www.reddit.com/r/AskReddit/comments/t7fgxm/how_do_you_say_goodbye/,15,,1646504528.0
t7i7rh,"34 year olds, what sums up our teenage years?",,2,1.0,AskReddit,https://www.reddit.com/r/AskReddit/comments/t7i7rh/34_year_olds_what_sums_up_our_teenage_years/,4,,1646512451.0
t7fgqb,People say if it was easy everyone would be doing it. But what's something that is easy that not everyone is doing?,,3,1.0,AskReddit,https://www.reddit.com/r/AskReddit/comments/t7fgqb/people_say_if_it_was_easy_everyone_would_be_doing/,6,,1646504512.0
t7i7db,"How does it feel being you, how would someone else feel if they were you?",,4,1.0,AskReddit,https://www.reddit.com/r/AskReddit/comments/t7i7db/how_does_it_feel_being_you_how_would_someone_else/,6,,1646512418.0
t7fggq,What subreddits have you recently unsubbed from and why?,,4,0.83,AskReddit,https://www.reddit.com/r/AskReddit/comments/t7fggq/what_subreddits_have_you_recently_unsubbed_from/,9,,1646504489.0
t7fggl,What video game was popular when you were a kid?,,3,0.8,AskReddit,https://www.reddit.com/r/AskReddit/comments/t7fggl/what_video_game_was_popular_when_you_were_a_kid/,25,,1646504489.0
t7i760,What interesting intergovernmental traditions does your country have?,,2,1.0,AskReddit,https://www.reddit.com/r/AskReddit/comments/t7i760/what_interesting_intergovernmental_traditions/,3,,1646512403.0
t7i72f,What's the first thing that comes to mind when you think of half and half (for coffee)?,,2,1.0,AskReddit,https://www.reddit.com/r/AskReddit/comments/t7i72f/whats_the_first_thing_that_comes_to_mind_when_you/,4,,1646512396.0
