post_id,title,flair,score,post_upvote_ratio,subreddit,url,num_comments,body,created
t7hlnc,"People who choose kindness every day, despite not receiving the same kindness back… What motivates you?",,5,1.0,AskReddit,https://www.reddit.com/r/AskReddit/comments/t7hlnc/people_who_choose_kindness_every_day_despite_not/,9,,1646510652.0
t7ap7i,What was the sentence/words that hurt you the absolute most in your life?,,10,0.86,AskReddit,https://www.reddit.com/r/AskReddit/comments/t7ap7i/what_was_the_sentencewords_that_hurt_you_the/,36,,1646490849.0
t7hksr,How would you describe a color to a blind person?,,4,1.0,AskReddit,https://www.reddit.com/r/AskReddit/comments/t7hksr/how_would_you_describe_a_color_to_a_blind_person/,9,,1646510588.0
t7hkb8,What is your opinion on tipping at restaurants if you order carry-out?,,4,1.0,AskReddit,https://www.reddit.com/r/AskReddit/comments/t7hkb8/what_is_your_opinion_on_tipping_at_restaurants_if/,9,,1646510547.0
t7hjuy,What’s the worst or lowest effort meal you’ve seen someone bring to a potluck?,,4,1.0,AskReddit,https://www.reddit.com/r/AskReddit/comments/t7hjuy/whats_the_worst_or_lowest_effort_meal_youve_seen/,10,,1646510508.0
t7g0f6,What is the dirtiest thing you have ever done in public?,,6,0.8,AskReddit,https://www.reddit.com/r/AskReddit/comments/t7g0f6/what_is_the_dirtiest_thing_you_have_ever_done_in/,32,,1646506069.0
t7hi71,What do you wish your last words will be?,,4,1.0,AskReddit,https://www.reddit.com/r/AskReddit/comments/t7hi71/what_do_you_wish_your_last_words_will_be/,17,,1646510394.0
t72psi,What movie traumatized you?,,56,0.88,AskReddit,https://www.reddit.com/r/AskReddit/comments/t72psi/what_movie_traumatized_you/,281,,1646459170.0
t7hi1t,What are some unknown facts about the cardboard box industry?,,4,0.83,AskReddit,https://www.reddit.com/r/AskReddit/comments/t7hi1t/what_are_some_unknown_facts_about_the_cardboard/,6,,1646510383.0
t7hhg4,"After finishing The Sopranos, which character does your heart long to see more of the most?",,4,1.0,AskReddit,https://www.reddit.com/r/AskReddit/comments/t7hhg4/after_finishing_the_sopranos_which_character_does/,4,,1646510335.0
t7hh38,What is the price of gas where you live?,,4,1.0,AskReddit,https://www.reddit.com/r/AskReddit/comments/t7hh38/what_is_the_price_of_gas_where_you_live/,18,,1646510303.0
t7hg0l,What did a tv show that depicts your town/area get wrong?,,4,1.0,AskReddit,https://www.reddit.com/r/AskReddit/comments/t7hg0l/what_did_a_tv_show_that_depicts_your_townarea_get/,8,,1646510212.0
t700a1,What is perfectly lawful but you think it should be illegal?,,88,0.83,AskReddit,https://www.reddit.com/r/AskReddit/comments/t700a1/what_is_perfectly_lawful_but_you_think_it_should/,603,,1646449537.0
t7heqg,What’s the most damage you could do to society with 3 cucumbers?,,4,1.0,AskReddit,https://www.reddit.com/r/AskReddit/comments/t7heqg/whats_the_most_damage_you_could_do_to_society/,5,,1646510108.0
t7he3v,What song you have in mind for so long without knowing the title or the lyrics and still don't know which one is it ?,,4,1.0,AskReddit,https://www.reddit.com/r/AskReddit/comments/t7he3v/what_song_you_have_in_mind_for_so_long_without/,6,,1646510062.0
t7em24,what fictional character do you think would be your mortal enemy in real life?,,6,0.88,AskReddit,https://www.reddit.com/r/AskReddit/comments/t7em24/what_fictional_character_do_you_think_would_be/,14,,1646502068.0
t7el9k,How old were you when you stopped getting your ID checked for alcohol?,,5,0.78,AskReddit,https://www.reddit.com/r/AskReddit/comments/t7el9k/how_old_were_you_when_you_stopped_getting_your_id/,31,,1646502008.0
t7ekzp,"What screams ""I have no personality.""?",,5,0.78,AskReddit,https://www.reddit.com/r/AskReddit/comments/t7ekzp/what_screams_i_have_no_personality/,31,,1646501987.0
t7ftxz,Which celebrities haven't realized that they are no longer in their prime?,,4,0.67,AskReddit,https://www.reddit.com/r/AskReddit/comments/t7ftxz/which_celebrities_havent_realized_that_they_are/,41,,1646505550.0
t7hc29,What are the best romcom animes you've watched?,,4,1.0,AskReddit,https://www.reddit.com/r/AskReddit/comments/t7hc29/what_are_the_best_romcom_animes_youve_watched/,4,,1646509891.0
t7h7xp,What's the strangest porno you've ever watched?,,4,1.0,AskReddit,https://www.reddit.com/r/AskReddit/comments/t7h7xp/whats_the_strangest_porno_youve_ever_watched/,13,,1646509554.0
t7efyf,What do you do after you catch someone lying to you?,,6,1.0,AskReddit,https://www.reddit.com/r/AskReddit/comments/t7efyf/what_do_you_do_after_you_catch_someone_lying_to/,20,,1646501585.0
t7efxu,What’s the current gas price in your region/country?,,7,0.82,AskReddit,https://www.reddit.com/r/AskReddit/comments/t7efxu/whats_the_current_gas_price_in_your_regioncountry/,32,,1646501584.0
t7fo9f,"How do you say, “hello there,” in your foreign language?",,5,0.73,AskReddit,https://www.reddit.com/r/AskReddit/comments/t7fo9f/how_do_you_say_hello_there_in_your_foreign/,33,,1646505084.0
t7h0lm,"If you were hired to make a compilation of the worst songs ever, what is the track you would open with?",,4,1.0,AskReddit,https://www.reddit.com/r/AskReddit/comments/t7h0lm/if_you_were_hired_to_make_a_compilation_of_the/,10,,1646508982.0
t7aqwh,What have you been dying to get off your chest?,,11,0.87,AskReddit,https://www.reddit.com/r/AskReddit/comments/t7aqwh/what_have_you_been_dying_to_get_off_your_chest/,29,,1646491007.0
t7gzii,What’s a problem that’s WAY overblown on social media?,,4,1.0,AskReddit,https://www.reddit.com/r/AskReddit/comments/t7gzii/whats_a_problem_thats_way_overblown_on_social/,20,,1646508892.0
t7aqb8,"If you had to eradicate one breakfast cereal, what would it be?",,8,0.73,AskReddit,https://www.reddit.com/r/AskReddit/comments/t7aqb8/if_you_had_to_eradicate_one_breakfast_cereal_what/,69,,1646490953.0
t7fg5o,What’s a secret you’re taking to the grave?,,5,0.69,AskReddit,https://www.reddit.com/r/AskReddit/comments/t7fg5o/whats_a_secret_youre_taking_to_the_grave/,34,,1646504465.0
t7gylp,"People who work jobs that have a reputation for being undesirable (call center employee, care assistant, retail, etc) but like their jobs, what makes your job enjoyable?",,4,1.0,AskReddit,https://www.reddit.com/r/AskReddit/comments/t7gylp/people_who_work_jobs_that_have_a_reputation_for/,6,,1646508819.0
t7gx2v,What video game do you regret buying?,,4,1.0,AskReddit,https://www.reddit.com/r/AskReddit/comments/t7gx2v/what_video_game_do_you_regret_buying/,30,,1646508698.0
t7gwts,Men of Reddit when your pants or shorts don’t have a fly and you have to pull it out to go to the bathroom do you take out just the twig or the twig and berries?,,4,0.75,AskReddit,https://www.reddit.com/r/AskReddit/comments/t7gwts/men_of_reddit_when_your_pants_or_shorts_dont_have/,17,,1646508679.0
t7gon1,"Women of reddit, what is something you love about women?",,5,1.0,AskReddit,https://www.reddit.com/r/AskReddit/comments/t7gon1/women_of_reddit_what_is_something_you_love_about/,11,,1646508014.0
t7glsf,When did you realise you’re “old”?,,4,0.7,AskReddit,https://www.reddit.com/r/AskReddit/comments/t7glsf/when_did_you_realise_youre_old/,32,,1646507777.0
t7gl5h,What is your kryptonite?,,4,0.83,AskReddit,https://www.reddit.com/r/AskReddit/comments/t7gl5h/what_is_your_kryptonite/,23,,1646507725.0
t7ierx,What subject always turns into a political rant?,,3,1.0,AskReddit,https://www.reddit.com/r/AskReddit/comments/t7ierx/what_subject_always_turns_into_a_political_rant/,8,,1646513027.0
t7ey4n,"Not counting movies or television, what can you literally watch all day?",,5,0.86,AskReddit,https://www.reddit.com/r/AskReddit/comments/t7ey4n/not_counting_movies_or_television_what_can_you/,36,,1646503032.0
t7gfty,"Ok, so when other people think about things, can you actually, like, see things?Do you see what you are thinking about? Does it matter if your eyes are open or closed?",,4,0.84,AskReddit,https://www.reddit.com/r/AskReddit/comments/t7gfty/ok_so_when_other_people_think_about_things_can/,7,,1646507285.0
t7id7a,Picture a dog in your mind. What's the default breed when you think of dogs?,,3,1.0,AskReddit,https://www.reddit.com/r/AskReddit/comments/t7id7a/picture_a_dog_in_your_mind_whats_the_default/,4,,1646512890.0
t7iaiu,What’s the best book you’ve read on wattpad?,,3,1.0,AskReddit,https://www.reddit.com/r/AskReddit/comments/t7iaiu/whats_the_best_book_youve_read_on_wattpad/,4,,1646512680.0
t7i9ag,"You have the opportunity to travel 5 years into the past, but you can only tell one of the things that has happened to your past self. What would you tell them?",,3,1.0,AskReddit,https://www.reddit.com/r/AskReddit/comments/t7i9ag/you_have_the_opportunity_to_travel_5_years_into/,5,,1646512578.0
t7gbb7,What is your least favorite subject in school?,,3,0.72,AskReddit,https://www.reddit.com/r/AskReddit/comments/t7gbb7/what_is_your_least_favorite_subject_in_school/,45,,1646506925.0
t7i87l,Why can't Turks join the European Union?,,3,1.0,AskReddit,https://www.reddit.com/r/AskReddit/comments/t7i87l/why_cant_turks_join_the_european_union/,14,,1646512490.0
t7i7fu,What's bad for you that is normal for the others?,,3,1.0,AskReddit,https://www.reddit.com/r/AskReddit/comments/t7i7fu/whats_bad_for_you_that_is_normal_for_the_others/,5,,1646512424.0
t7i6jh,What did you dream of last night?,,3,1.0,AskReddit,https://www.reddit.com/r/AskReddit/comments/t7i6jh/what_did_you_dream_of_last_night/,8,,1646512351.0
t7g83d,What is the most disgusting thing you have witnessed at your workplace?,,5,0.78,AskReddit,https://www.reddit.com/r/AskReddit/comments/t7g83d/what_is_the_most_disgusting_thing_you_have/,19,,1646506683.0
t7g7t9,To those who are happily in a relationship right now. How did you meet the one?,,4,0.75,AskReddit,https://www.reddit.com/r/AskReddit/comments/t7g7t9/to_those_who_are_happily_in_a_relationship_right/,9,,1646506660.0
t7i5g6,"If you could take a pill that changes one thing about yourself, what would it be?",,3,1.0,AskReddit,https://www.reddit.com/r/AskReddit/comments/t7i5g6/if_you_could_take_a_pill_that_changes_one_thing/,15,,1646512260.0
t7g6vr,"Parents of reddit, what's in your house that shows you 100% have kids?",,4,1.0,AskReddit,https://www.reddit.com/r/AskReddit/comments/t7g6vr/parents_of_reddit_whats_in_your_house_that_shows/,14,,1646506584.0
t7g6sx,What’s the best book you’ve ever read?,,4,1.0,AskReddit,https://www.reddit.com/r/AskReddit/comments/t7g6sx/whats_the_best_book_youve_ever_read/,24,,1646506579.0
t7i434,Teacher's of Reddit what was the dumbest question a student has asked?,,3,1.0,AskReddit,https://www.reddit.com/r/AskReddit/comments/t7i434/teachers_of_reddit_what_was_the_dumbest_question/,1,,1646512149.0
t7i3zr,"People who have won the lottery, what happened after?",,3,1.0,AskReddit,https://www.reddit.com/r/AskReddit/comments/t7i3zr/people_who_have_won_the_lottery_what_happened/,4,,1646512141.0
t7i2q3,Which conspiracy theory do you think is actually true?,,3,1.0,AskReddit,https://www.reddit.com/r/AskReddit/comments/t7i2q3/which_conspiracy_theory_do_you_think_is_actually/,5,,1646512036.0
t7i1xg,What is meaning and purpose?,,3,1.0,AskReddit,https://www.reddit.com/r/AskReddit/comments/t7i1xg/what_is_meaning_and_purpose/,0,,1646511973.0
t7i1o8,What’s the pettiest thing you’ve ever done?,,3,1.0,AskReddit,https://www.reddit.com/r/AskReddit/comments/t7i1o8/whats_the_pettiest_thing_youve_ever_done/,4,,1646511950.0
t7i1bb,Diplomacy has failed and war is not allowed. How are countries resolving their conflicts from now on?,,3,0.8,AskReddit,https://www.reddit.com/r/AskReddit/comments/t7i1bb/diplomacy_has_failed_and_war_is_not_allowed_how/,14,,1646511922.0
t7c7uk,You can't time travel but your phone has the internet from 5 years in the future. What do you search for first?,,6,0.72,AskReddit,https://www.reddit.com/r/AskReddit/comments/t7c7uk/you_cant_time_travel_but_your_phone_has_the/,27,,1646495344.0
t7hz4s,[Serious] How does trauma/PTSD affect your everyday life?,Serious Replies Only,3,1.0,AskReddit,https://www.reddit.com/r/AskReddit/comments/t7hz4s/serious_how_does_traumaptsd_affect_your_everyday/,9,,1646511740.0
t7hz3z,What do we today that will be looked down upon in the future?,,3,1.0,AskReddit,https://www.reddit.com/r/AskReddit/comments/t7hz3z/what_do_we_today_that_will_be_looked_down_upon_in/,4,,1646511739.0
t7g0jg,What was something you didn’t expect to witness during childbirth?!,,4,0.83,AskReddit,https://www.reddit.com/r/AskReddit/comments/t7g0jg/what_was_something_you_didnt_expect_to_witness/,15,,1646506080.0
t7egq7,"veterinarians of reddit, what is the saddest moment you’ve been through working?",,6,0.87,AskReddit,https://www.reddit.com/r/AskReddit/comments/t7egq7/veterinarians_of_reddit_what_is_the_saddest/,1,,1646501642.0
t7b7s6,What is something that you can NEVER bring at a funeral?,,8,0.79,AskReddit,https://www.reddit.com/r/AskReddit/comments/t7b7s6/what_is_something_that_you_can_never_bring_at_a/,42,,1646492417.0
t7hw3s,"People of reddit that has had student x teacher/professor relationships, how was it? And did you get caught?",,3,0.8,AskReddit,https://www.reddit.com/r/AskReddit/comments/t7hw3s/people_of_reddit_that_has_had_student_x/,3,,1646511500.0
t7fxvg,What's the weirdest thing you've done while your brain was on autopilot?,,5,0.86,AskReddit,https://www.reddit.com/r/AskReddit/comments/t7fxvg/whats_the_weirdest_thing_youve_done_while_your/,18,,1646505863.0
t7fxe8,Men of Reddit: Do you REALLY prefer women who are more natural?,,5,0.78,AskReddit,https://www.reddit.com/r/AskReddit/comments/t7fxe8/men_of_reddit_do_you_really_prefer_women_who_are/,54,,1646505823.0
t7hvdr,What do you know about the human body that isn't yet proven by science?,,3,1.0,AskReddit,https://www.reddit.com/r/AskReddit/comments/t7hvdr/what_do_you_know_about_the_human_body_that_isnt/,1,,1646511443.0
t7c1cf,"For those of you who do. Why do you hate the, Marvel Cinematic Universe?",,8,0.67,AskReddit,https://www.reddit.com/r/AskReddit/comments/t7c1cf/for_those_of_you_who_do_why_do_you_hate_the/,68,,1646494840.0
t7hu14,What would be your rap name?,,3,1.0,AskReddit,https://www.reddit.com/r/AskReddit/comments/t7hu14/what_would_be_your_rap_name/,10,,1646511331.0
t7b48c,What made you happy recently?,,8,0.83,AskReddit,https://www.reddit.com/r/AskReddit/comments/t7b48c/what_made_you_happy_recently/,45,,1646492149.0
t7htd5,"What song seems serious/sad, but the lyrics are silly?",,3,1.0,AskReddit,https://www.reddit.com/r/AskReddit/comments/t7htd5/what_song_seems_serioussad_but_the_lyrics_are/,3,,1646511280.0
t7fv92,What are some basic little gifts men would appreciate? [Serious],Serious Replies Only,4,1.0,AskReddit,https://www.reddit.com/r/AskReddit/comments/t7fv92/what_are_some_basic_little_gifts_men_would/,34,,1646505652.0
t68ee8,What's the worst thing about oral sex that nobody talks about?,,19634,0.84,AskReddit,https://www.reddit.com/r/AskReddit/comments/t68ee8/whats_the_worst_thing_about_oral_sex_that_nobody/,8363,,1646361183.0
t7hrlc,"If Heaven had a Hall of Fame for unhated people, who would be in it?",,3,1.0,AskReddit,https://www.reddit.com/r/AskReddit/comments/t7hrlc/if_heaven_had_a_hall_of_fame_for_unhated_people/,22,,1646511133.0
t7hqxg,"Without mentioning your country’s name, which brand identifies where you’re from?",,3,1.0,AskReddit,https://www.reddit.com/r/AskReddit/comments/t7hqxg/without_mentioning_your_countrys_name_which_brand/,30,,1646511079.0
t7hqu3,What childhood show did you rewatch as an adult and did you feel different about it?,,3,1.0,AskReddit,https://www.reddit.com/r/AskReddit/comments/t7hqu3/what_childhood_show_did_you_rewatch_as_an_adult/,4,,1646511072.0
t7e91k,"The human race is wiped out and discovered by aliens. If you could choose one thing to leave behind to be the only evidence of humanity existing, what would you choose to really screw with them?",,6,0.87,AskReddit,https://www.reddit.com/r/AskReddit/comments/t7e91k/the_human_race_is_wiped_out_and_discovered_by/,14,,1646501058.0
t7fs4g,What is your comfort food?,,4,0.75,AskReddit,https://www.reddit.com/r/AskReddit/comments/t7fs4g/what_is_your_comfort_food/,22,,1646505400.0
t7hpvj,What's your favorite TV Show Series?,,3,1.0,AskReddit,https://www.reddit.com/r/AskReddit/comments/t7hpvj/whats_your_favorite_tv_show_series/,4,,1646510996.0
t7hpvc,What are your favourite shitty movies and why?,,3,1.0,AskReddit,https://www.reddit.com/r/AskReddit/comments/t7hpvc/what_are_your_favourite_shitty_movies_and_why/,6,,1646510995.0
t7hpr2,What TV show has the best series premiere episode?,,3,1.0,AskReddit,https://www.reddit.com/r/AskReddit/comments/t7hpr2/what_tv_show_has_the_best_series_premiere_episode/,5,,1646510986.0
t7frkn,[Serious] What was the most fucked up thing an employer made you/tried to make you do?,Serious Replies Only,4,0.83,AskReddit,https://www.reddit.com/r/AskReddit/comments/t7frkn/serious_what_was_the_most_fucked_up_thing_an/,19,,1646505356.0
t7frd8,"you just discovered a planet, what would you name it?",,5,0.86,AskReddit,https://www.reddit.com/r/AskReddit/comments/t7frd8/you_just_discovered_a_planet_what_would_you_name/,20,,1646505338.0
t7e73d,"People who are friends with an asshole, what is their spouse/partner like?",,4,0.67,AskReddit,https://www.reddit.com/r/AskReddit/comments/t7e73d/people_who_are_friends_with_an_asshole_what_is/,10,,1646500905.0
t78kff,How do you see yourself 10 years form now?,,12,0.78,AskReddit,https://www.reddit.com/r/AskReddit/comments/t78kff/how_do_you_see_yourself_10_years_form_now/,171,,1646483741.0
t7fpof,What is the scariest post you saw on Reddit ?,,4,0.83,AskReddit,https://www.reddit.com/r/AskReddit/comments/t7fpof/what_is_the_scariest_post_you_saw_on_reddit/,7,,1646505203.0
t7hno9,What movie did you watch as a child that you definitely should NOT have watched at that age?,,3,1.0,AskReddit,https://www.reddit.com/r/AskReddit/comments/t7hno9/what_movie_did_you_watch_as_a_child_that_you/,11,,1646510817.0
t7hnmm,What Ruined your Relationship with a Family member?,,3,1.0,AskReddit,https://www.reddit.com/r/AskReddit/comments/t7hnmm/what_ruined_your_relationship_with_a_family_member/,3,,1646510814.0
t7fozh,"Guitarists of Reddit, what are some interesting or amazing sounding ""chords"" that are impossible to play (i.e. the notes are spread out all over the neck)?",,5,0.86,AskReddit,https://www.reddit.com/r/AskReddit/comments/t7fozh/guitarists_of_reddit_what_are_some_interesting_or/,1,,1646505143.0
t7756f,What is your favourite subreddit and why?,,16,0.79,AskReddit,https://www.reddit.com/r/AskReddit/comments/t7756f/what_is_your_favourite_subreddit_and_why/,22,,1646478007.0
t7hkng,"When did you start using reddit, and do you wish that you had found it before?",,3,1.0,AskReddit,https://www.reddit.com/r/AskReddit/comments/t7hkng/when_did_you_start_using_reddit_and_do_you_wish/,3,,1646510574.0
t7hk8f,What is the soundtrack of your life?,,3,1.0,AskReddit,https://www.reddit.com/r/AskReddit/comments/t7hk8f/what_is_the_soundtrack_of_your_life/,5,,1646510540.0
t7hk06,What was that one TV show you really wanted to like but just couldn't seem to force yourself to?,,3,1.0,AskReddit,https://www.reddit.com/r/AskReddit/comments/t7hk06/what_was_that_one_tv_show_you_really_wanted_to/,5,,1646510520.0
t7hjtm,what weird symptom is making you anxious about having cancer right now?,,3,1.0,AskReddit,https://www.reddit.com/r/AskReddit/comments/t7hjtm/what_weird_symptom_is_making_you_anxious_about/,4,,1646510505.0
t7e1tu,What are the best songs from Disney movies?,,5,0.78,AskReddit,https://www.reddit.com/r/AskReddit/comments/t7e1tu/what_are_the_best_songs_from_disney_movies/,10,,1646500486.0
t7hjbr,What is something that terrifies you but shouldn't?,,3,1.0,AskReddit,https://www.reddit.com/r/AskReddit/comments/t7hjbr/what_is_something_that_terrifies_you_but_shouldnt/,10,,1646510467.0
t7hivo,What's the most common random number?,,3,1.0,AskReddit,https://www.reddit.com/r/AskReddit/comments/t7hivo/whats_the_most_common_random_number/,13,,1646510432.0
t7hivk,What are the wisest words you've ever heard?,,3,1.0,AskReddit,https://www.reddit.com/r/AskReddit/comments/t7hivk/what_are_the_wisest_words_youve_ever_heard/,8,,1646510432.0
t7hipw,How much money did you have at 25? What was your life like?,,4,1.0,AskReddit,https://www.reddit.com/r/AskReddit/comments/t7hipw/how_much_money_did_you_have_at_25_what_was_your/,9,,1646510420.0
t7hiep,What is an unusual topping you want to try on a pizza?,,3,1.0,AskReddit,https://www.reddit.com/r/AskReddit/comments/t7hiep/what_is_an_unusual_topping_you_want_to_try_on_a/,10,,1646510408.0
t7hib4,Those who speed every time you drive. Why?,,3,1.0,AskReddit,https://www.reddit.com/r/AskReddit/comments/t7hib4/those_who_speed_every_time_you_drive_why/,13,,1646510402.0
t7hhrz,What would you do if your country asked you to join the army for WW3?,,3,0.8,AskReddit,https://www.reddit.com/r/AskReddit/comments/t7hhrz/what_would_you_do_if_your_country_asked_you_to/,14,,1646510362.0
t7hhbj,You get the ability to teleport for a small distance and stop time for a short (in your perception) amount of time. How do you cause mild chaos using this?,,3,1.0,AskReddit,https://www.reddit.com/r/AskReddit/comments/t7hhbj/you_get_the_ability_to_teleport_for_a_small/,5,,1646510324.0
t7hh1i,If you could give anyone but yourself 1 thing what would it be?,,3,1.0,AskReddit,https://www.reddit.com/r/AskReddit/comments/t7hh1i/if_you_could_give_anyone_but_yourself_1_thing/,6,,1646510299.0
t7hg01,"In your opinion, where out in the Northeast part of the US (think VT, NH, NY, RI, and MA) is the best place to live?",,3,1.0,AskReddit,https://www.reddit.com/r/AskReddit/comments/t7hg01/in_your_opinion_where_out_in_the_northeast_part/,10,,1646510210.0
t7hfzj,"What would a police officer at a situation where a person who doesn’t speak English that moves to the USA and breaks the law unknowingly since they don’t speak the language? And if the person has autism, or mental impairment, breaks the law unknowingly, would the cop still shoot them?",,3,0.67,AskReddit,https://www.reddit.com/r/AskReddit/comments/t7hfzj/what_would_a_police_officer_at_a_situation_where/,12,,1646510209.0
t7fh5d,What is a video game you cant get enough of?,,4,1.0,AskReddit,https://www.reddit.com/r/AskReddit/comments/t7fh5d/what_is_a_video_game_you_cant_get_enough_of/,16,,1646504545.0
t7fg8y,(Serious) What is one thing you cannot live without?,Serious Replies Only,5,0.99,AskReddit,https://www.reddit.com/r/AskReddit/comments/t7fg8y/serious_what_is_one_thing_you_cannot_live_without/,18,,1646504472.0
t7cnaj,What trend are you glad is gone?,,6,0.88,AskReddit,https://www.reddit.com/r/AskReddit/comments/t7cnaj/what_trend_are_you_glad_is_gone/,37,,1646496528.0
t7ffba,What is something popular that you could never get behind?,,3,0.72,AskReddit,https://www.reddit.com/r/AskReddit/comments/t7ffba/what_is_something_popular_that_you_could_never/,18,,1646504401.0
t7dw5a,What is the Best thing on Netflix?,,6,1.0,AskReddit,https://www.reddit.com/r/AskReddit/comments/t7dw5a/what_is_the_best_thing_on_netflix/,11,,1646500033.0
t7hbzh,What do you think about your dream?,,3,1.0,AskReddit,https://www.reddit.com/r/AskReddit/comments/t7hbzh/what_do_you_think_about_your_dream/,6,,1646509884.0
t7ducu,What is a secret you cannot tell people you know but will tell random redditors?,,5,1.0,AskReddit,https://www.reddit.com/r/AskReddit/comments/t7ducu/what_is_a_secret_you_cannot_tell_people_you_know/,17,,1646499896.0
t7fcts,What is the most WTF moment in the Bible?,,4,0.7,AskReddit,https://www.reddit.com/r/AskReddit/comments/t7fcts/what_is_the_most_wtf_moment_in_the_bible/,22,,1646504199.0
t7h9ud,"Honestly, what are you wearing right now?",,4,0.67,AskReddit,https://www.reddit.com/r/AskReddit/comments/t7h9ud/honestly_what_are_you_wearing_right_now/,58,,1646509709.0
t7fb64,"People of reddit who have read a popular reddit post and then realized it's about you, what's your side of the story?",,4,1.0,AskReddit,https://www.reddit.com/r/AskReddit/comments/t7fb64/people_of_reddit_who_have_read_a_popular_reddit/,0,,1646504064.0
t7h8zd,What the fuck is your favorite song?,,3,0.57,AskReddit,https://www.reddit.com/r/AskReddit/comments/t7h8zd/what_the_fuck_is_your_favorite_song/,34,,1646509638.0
t7h8yj,What’s a trick to picking a restaurant when someone can’t make up their mind ?,,3,1.0,AskReddit,https://www.reddit.com/r/AskReddit/comments/t7h8yj/whats_a_trick_to_picking_a_restaurant_when/,10,,1646509637.0
t7h7fa,What music would you like to be played at your funeral?,,4,1.0,AskReddit,https://www.reddit.com/r/AskReddit/comments/t7h7fa/what_music_would_you_like_to_be_played_at_your/,10,,1646509514.0
t7dp9r,"Limo drivers of Reddit, what was the craziest thing you’ve ever witnessed go on in the back?",,5,1.0,AskReddit,https://www.reddit.com/r/AskReddit/comments/t7dp9r/limo_drivers_of_reddit_what_was_the_craziest/,3,,1646499527.0
t7h76j,"Women of Reddit, what's your favorite eye color on men?",,3,1.0,AskReddit,https://www.reddit.com/r/AskReddit/comments/t7h76j/women_of_reddit_whats_your_favorite_eye_color_on/,18,,1646509499.0
t7h74c,What’s the weirdest thing you have ever had happen while out in public?,,3,1.0,AskReddit,https://www.reddit.com/r/AskReddit/comments/t7h74c/whats_the_weirdest_thing_you_have_ever_had_happen/,5,,1646509494.0
t7h6t6,What sorta bullshit are you mixed up in right now?,,3,0.8,AskReddit,https://www.reddit.com/r/AskReddit/comments/t7h6t6/what_sorta_bullshit_are_you_mixed_up_in_right_now/,10,,1646509471.0
t7h6kn,What R-rated movie can you remember sneaking into when you were a kid?,,3,1.0,AskReddit,https://www.reddit.com/r/AskReddit/comments/t7h6kn/what_rrated_movie_can_you_remember_sneaking_into/,8,,1646509452.0
t7f7gk,What instrument(s) do you play and for how long have you been playing?,,4,0.84,AskReddit,https://www.reddit.com/r/AskReddit/comments/t7f7gk/what_instruments_do_you_play_and_for_how_long/,31,,1646503766.0
