post_id,title,flair,score,post_upvote_ratio,subreddit,url,num_comments,body,created
t77kht,"Humans can't endure temperatures and humidities as high as previously thought. The actual maximum wet-bulb temperature is lower — about 31°C wet-bulb or 87°F at 100% humidity — even for young, healthy subjects. The temperature for older populations, is likely even lower.",Environment,26742,0.94,science,https://www.psu.edu/news/story/humans-cant-endure-temperatures-and-humidities-high-previously-thought/,1611,,1646479769.0
t79o27,"Study found that shopping trolleys with horizontal handlebar save shoppers money, as pushing them activates triceps that are associated with rejecting things we don’t like – for example when we push or hold something away from us –",Economics,1018,0.82,science,https://www.city.ac.uk/news-and-events/news/2021/11/shopping-trolleys-save-shoppers-money-as-pushing-reduces-spending-finds-new-study,142,,1646487633.0
t6ytop,National narcissism identified as a robust predictor of belief in COVID-19 conspiracy theories,Psychology,14926,0.84,science,https://www.psypost.org/2022/03/national-narcissism-identified-as-a-robust-predictor-of-belief-in-covid-19-conspiracy-theories-62663,859,,1646445609.0
t772vb,Researchers have found people will feel better if they are alone by choice than if they are with others not by choice. Yet being in the company of others by choice contributes most to improving sense of well-being at any given moment,Psychology,1437,0.97,science,https://link.springer.com/article/10.1007/s10902-022-00506-5,34,,1646477732.0
t7gbsw,"By combining CRISPR technology with a protein designed with artificial intelligence, it's possible to awaken dormant genes by disabling the chemical “off switches” that silence them: Approach allows researchers to understand the role genes play in cell growth and development, in aging, and cancer.",Genetics,240,0.99,science,https://www.eurekalert.org/news-releases/945500,12,,1646506967.0
t6uf2k,"Just one drink per day can shrink your brain, study says",Health,15849,0.83,science,https://amp.cnn.com/cnn/2022/03/04/health/alcohol-brain-shrinkage-wellness/index.html,1438,,1646432089.0
t6wlak,The Black Lives Matter movement appears to have helped Joe Biden in the 2020 election. Increases in perceptions of racial inequality significantly increased the probability of vote switching toward the Democratic candidate between the 2016 and 2020 elections.,Social Science,2805,0.84,science,https://www.science.org/doi/epdf/10.1126/sciadv.abj9140,617,,1646438438.0
t7edbw,A recent case-controlled analysis of articles containing problematic image duplications suggested that country of affiliation of first and last authors is a significant predictor of scientific misconduct.,Social Science,75,0.92,science,https://journals.plos.org/plosone/article?id=10.1371/journal.pone.0255334,8,,1646501385.0
t7c35s,"APOE ε4 Gene is Not Associated with Increased Risk for Alzheimer’s Disease and Dementia in American Indians, Unlike Other Racial Groups",Genetics,99,0.92,science,https://www.nia.nih.gov/news/apoe-e4-not-associated-increased-risk-alzheimers-disease-and-dementia-american-indians,3,,1646494978.0
t7hfkb,"AI-designed protein awakens silenced genes, one by one Technique allows researchers to toggle on individual genes that regulate cell growth, development and function. University of Washington School of Medicine/UW Medicine",Genetics,30,0.95,science,https://www.eurekalert.org/news-releases/945500,2,,1646510172.0
t6vbjx,Isolated Bolivian Tribe Has Healthiest Brains On Earth,Health,1129,0.95,science,https://news.usc.edu/187075/tsimane-amazon-indigenous-people-healthy-brain-aging-usc-study/,74,,1646434685.0
t7bm9z,Breastfed infants receive anti-RBD antibodies with the potential to confer passive immunity against SARS-CoV-2.,Health,41,0.83,science,https://journals.lww.com/greenjournal/Fulltext/2022/02000/Neutralizing_Antibodies_and_Cytokines_in_Breast.6.aspx,1,,1646493612.0
t7hh6v,Physicists uncover the secret behind the behavior of unique superconducting materials - Physicists use the Summit supercomputer to better understand a family of superconductors. - DOE/US Department of Energy,Physics,14,1.0,science,https://www.eurekalert.org/news-releases/945499,2,,1646510312.0
t75q2s,How you search for groceries predicts which products you will forget,Neuroscience,95,0.88,science,https://www.science.org/doi/10.1126/sciadv.abl9754,5,,1646471757.0
t7c70b,NASA Finds Each State Has Its Own Climatic Threshold for Flu Outbreaks,Environment,23,0.83,science,https://www.nasa.gov/feature/jpl/nasa-finds-each-state-has-its-own-climatic-threshold-for-flu-outbreaks,3,,1646495278.0
t7hrwl,Breaking down how “single-atom” catalysts help remove organic pollutants Mechanistic insights into state-of-the-art iron -based catalysts - Tokyo Metropolitan University,Environment,9,1.0,science,https://www.eurekalert.org/news-releases/945080,1,,1646511156.0
t6c5j4,"Protein tweak makes CRISPR gene editing 4,000 times less error-prone",Genetics,13590,0.97,science,https://newatlas.com/science/crispr-gene-editing-error-correction-protein/,449,,1646373686.0
t6lb9r,Fat levels in blood predict risk of type 2 diabetes and heart disease,Health,1457,0.95,science,https://www.newscientist.com/article/2310609-fat-levels-in-blood-predict-risk-of-type-2-diabetes-and-heart-disease/,99,,1646407349.0
t6qa0f,"Scientists have found that for sedans, SUVs and pickup trucks, battery-electric vehicles have approximately 64% lower cradle-to-grave life cycle greenhouse gas emissions than internal-combustion-engine vehicles on average across the United States.",Environment,688,0.94,science,https://news.umich.edu/study-greater-greenhouse-gas-reductions-for-pickup-truck-electrification-than-for-other-light-duty-vehicles/,73,,1646420580.0
t779x3,"Network meta-analysis on medications for autism: ""...data for 41 drugs and 17 dietary-supplements, from 125 RCTs (n = 7450 participants) in children/adolescents and 18 RCTs (n = 1104) in adults."",""..routine prescription of medications for the core symptoms cannot be recommended.""",Medicine,33,0.9,science,https://rdcu.be/cIgWC,8,,1646478506.0
t750z0,"Stearic Acid, a Long-chain saturated fatty acid, was found to ameliorate Alcohol-induced Liver by strengthening intestinal tight junction and regulating Gut Microbiota.",Health,54,0.84,science,https://www.sciencedirect.com/science/article/abs/pii/S0963996922001521,7,,1646468705.0
t6gaz4,"Following a major study of the effects of personality on job performance, researchers found that agreeableness has a desirable effect on hundreds of physical, psychological and occupational metrics that impact not only job performance but general life success.",Psychology,2828,0.95,science,https://arkansasresearch.uark.edu/study-agreeableness-a-helpful-trait-for-general-success-in-life/,232,,1646390750.0
t73gnt,"Updated IQ and Well-Being Scores for the 50 U.S. States [""state IQ most strongly predicted FICO credit scores, alcohol consumption (directly), income inequality, and state temperature. Interestingly, state IQ derived here also correlated 0.58 with state IQ estimates from over 100 years ago""]",Psychology,50,0.79,science,https://www.mdpi.com/2079-3200/10/1/15,17,,1646462099.0
t6incb,People with ADHD are more likely to be hoarders | People with ADHD were 10 times more likely to exhibit clinically significant hoarding behaviors compared to the general population.,Psychology,1213,0.93,science,https://www.zmescience.com/science/news-science/people-with-adhd-are-more-likely-to-be-hoarders/,122,,1646399413.0
t79lox,"Comparing and Contrasting Rates of Firearm Homicides and Suicides [""local parasite burden strongly and positively predicted firearm homicide rate (sR = .58, p = < .0001)...psychopathology rate alone positively predicted suicide rate (sR = .42, p = < .0001)""]",Social Science,11,0.88,science,https://link.springer.com/article/10.1007/s40806-021-00311-y,4,,1646487408.0
t70stn,"Rapid, Multianalyte Detection of Opioid Metabolites in Wastewater",Physics,61,0.86,science,https://pubs.acs.org/doi/pdf/10.1021/acsnano.1c07094,7,,1646452263.0
t64qbs,Tinnitus disappeared or significantly reduced: Integrative Treatment for Tinnitus Combining Repeated Facial and Auriculotemporal Nerve Blocks With Stimulation of Auditory and Non-auditory Nerves.,Health,52885,0.94,science,https://www.frontiersin.org/articles/10.3389/fnins.2022.758575/full,2689,,1646350003.0
t6wj7q,"Study (N=195, N=158) suggest when a partner in a romantic relationship shows ""behavioral responsiveness,"" it allows the other partner to cope more effectively with both preexisting vulnerabilities (e.g., depression) and external stress.",Psychology,91,0.9,science,https://www.psychologytoday.com/us/blog/finding-new-home/202203/is-how-supportive-relationships-reduce-stress,3,,1646438275.0
t7ajx7,Facial transplant techniques may extend to other types of severe facial injuries,Health,5,0.7,science,https://www.eurekalert.org/news-releases/945392,1,,1646490380.0
t6rnzk,"Single test for over 50 genetic diseases will cut diagnosis from decades to days Validating genetic diagnosis of neurological and neuromuscular diseases using faster, smaller, cheaper sequencing technologies - Garvan Institute of Medical Research",Genetics,142,0.96,science,https://www.eurekalert.org/news-releases/945088,15,,1646424425.0
t759ws,Coenzyme Q10 supplementation improves adipokine profile in dyslipidemic individuals: a randomized controlled trial - Nutrition & Metabolism,Health,12,0.75,science,https://nutritionandmetabolism.biomedcentral.com/articles/10.1186/s12986-022-00649-5,1,,1646469798.0
t7azx3,High levels of subcutaneous fat in the body can protect against atherosclerosis,Health,5,0.63,science,https://www.internationaljournalofcardiology.com/article/S0167-5273(08)00494-4/fulltext,4,,1646491790.0
t6f5tr,"Study reports the case of a domestic house cat in southeastern Pennsylvania, which was diagnosed as having SARS-CoV-2 in September 2021. Subsequent genome testing has since identified the infection as the Delta variant AY.3 – the same variant circulating amongst humans in the area at the time.",Animal Science,724,0.94,science,https://penntoday.upenn.edu/news/covid-cat-penn-vet-elizabeth-lennon,29,,1646385751.0
t6rf77,"Massive trial shows COVID rapid tests excel at detecting silent cases. In a trial in 73 workplaces, the tests detected hundreds of people with asymptomatic COVID-19 and generated very few false positives.",Medicine,82,0.86,science,https://www.science.org/doi/10.1126/sciadv.abm3608,5,,1646423757.0
t6ufov,Monkey teeth are shedding new light on how early humans used tools,Anthropology,39,0.82,science,https://theconversation.com/monkey-teeth-are-shedding-new-light-on-how-early-humans-used-tools-178246,2,,1646432136.0
t6sxty,"After 3, 6, 9, 12, 18, and 24 months of treatment, a statistically significant difference in the effective rate between the ketogenic diet group and the Anti-epilepsy-drugs group was seen, favoring the ketogenic diet.",Health,43,0.77,science,https://www.ncbi.nlm.nih.gov/labs/pmc/articles/PMC8825928/,9,,1646427963.0
t60047,"Working, studying in ‘off’ hours can harm motivation. Scientists have found working a nontraditional schedule, and checking in at all hours of the day, night and weekends, is not necessarily beneficial for the 21st-century workforce, according to new Cornell research.",Psychology,5139,0.97,science,https://news.cornell.edu/stories/2022/03/working-studying-hours-can-harm-motivation,119,,1646336967.0
t6oxg7,Study Finds Link Between Irregular Periods and Liver Disease,Health,73,0.88,science,https://painresource.com/news-experts/study-finds-link-between-irregular-periods-and-liver-disease/,3,,1646417000.0
t6ge49,"Air pollution increases may have an important influence on European and Asian weather. Changes in air pollution levels in the two regions was likely the primary driving force behind changing atmospheric conditions, which favoured prolonged summer extremes in Europe, and dry spells in Central Asia.",Environment,269,0.95,science,"https://ncas.ac.uk/air-pollution-changes-linked-with-dry-spells-in-asia-and-heatwaves-in-europe/#:~:text=The%20research%20counters%20previous%20suggestions,extreme%20weather%20over%20vast%20regions.",6,,1646391125.0
t5teb0,"Scientists have identified the molecular mechanism and therapeutic payload for delivering pharmacologic treatment directly to affected joints, effectively halting the onset and progression of post-traumatic osteoarthritis.",Health,14928,0.97,science,https://www.nsf.gov/discoveries/disc_summ.jsp?WT.mc_id=USNSF_1&cntn_id=304571,198,,1646319456.0
t6sqib,Tiny 'flower' formation spotted on Mars by Curiosity rover,Astronomy,32,0.71,science,https://www.cnn.com/2022/03/03/world/mars-flower-curiosity-rover-scn/index.html,8,,1646427409.0
t6dlfg,Adding new letters to DNA alphabet doubles density of data storage,Genetics,379,0.91,science,https://newatlas.com/technology/dna-data-storage-density-double-new-letters/,48,,1646379150.0
t6jgpw,Multistate Outbreak of Melioidosis Associated with Imported Aromatherapy Spray,Epidemiology,108,0.93,science,https://www.nejm.org/doi/full/10.1056/NEJMoa2116130?af=R&rss=currentIssue,9,,1646402078.0
t6rvuf,Visualizing the invisible: New fluorescent DNA label reveals nanoscopic cancer features - University of Pittsburgh,Genetics,28,0.81,science,https://www.eurekalert.org/news-releases/945223,1,,1646425034.0
t79y97,BNT162b2 Vaccine‐Associated Myo/Pericarditis in Adolescents: A Stratified Risk‐Benefit Analysis,Epidemiology,3,0.57,science,https://onlinelibrary.wiley.com/doi/10.1111/eci.13759,22,,1646488569.0
t5x1gc,"Researchers have, for the first time, decoded the highly complex genome of the potato. This technically demanding study lays the biotechnological foundation to accelerate the breeding of more robust varieties",Biology,3414,0.98,science,https://www.mpg.de/18386613/potato-genome,152,,1646329117.0
t6qrjq,"Researchers have found in mice that the dopamine is a trigger for the shift from non-REM to REM sleep stage. They also forced the mice into the REM phase by controlling dopamine-producing nerve cells using lasers and genetic techniques, whether a similar thing happens in people isn’t known",Neuroscience,26,0.77,science,https://www.sciencenews.org/article/dopamine-mice-rem-sleep-dream,2,,1646421906.0
t6si88,"T2DM patients who receive a very low-carbohydrate ketogenic diet diet to lower blood glucose are not associated with increased levels of total cholesterol and LDL, and decreased levels of HDL. Additionally, this diet can achieve a short-term reduction of triglyceride levels.",Health,16,0.77,science,https://pubmed.ncbi.nlm.nih.gov/35243868/,3,,1646426760.0
t6mwls,Longitudinal study confirms religious styles change in adulthood: Findings indicate that the majority of people develop a higher religious style. Factors include higher scores on openness to experience or a low level of agreement with the truth of text and teachings of their own religion.,Psychology,35,0.74,science,https://www.eurekalert.org/news-releases/945396,12,,1646411605.0
t5r73r,"Believing that sexual satisfaction takes work and is more than natural compatibility may help couples dealing with sexual challenges, according to a study",Psychology,4306,0.96,science,https://www.psypost.org/2022/03/growth-beliefs-about-sexual-satisfaction-may-help-couples-navigating-womens-low-sexual-desire-study-finds-62669,140,,1646312829.0
t5qvym,"Meta-analysis of 15 studies on nearly 50,000 participants, founds that the amount of daily walking steps that will optimally improve adults’ health and longevity is 6-8000 (8-10000 for younger adults)",Health,4514,0.97,science,https://www.umass.edu/news/article/meta-analysis-15-studies-reports-new-findings-how-many-daily-walking-steps-needed,380,,1646311837.0
t65jzc,"Authoritarian rulers only have incentives to have competent militaries when the entire regime faces an existential outside threat. To rulers, competent militaries are a coup threat & they may allow popular uprisings to proceed. Thus, there are few purely domestic reasons to have competent militaries",Social Science,503,0.96,science,https://www.cambridge.org/core/journals/american-political-science-review/article/abs/reframing-the-guardianship-dilemma-how-the-militarys-dual-disloyalty-options-imperil-dictators/FAB035DCE1D5EA6CE383D3A7DFB48062,50,,1646352380.0
t6oq8s,"Diversity, biology, and history of psilocybin-containing fungi: Suggestions for research and technological development",Biology,17,0.78,science,https://www.sciencedirect.com/science/article/pii/S1878614622000095,1,,1646416482.0
t61j0z,Scientists Watch a Memory Form in a Living Brain,Neuroscience,807,0.97,science,https://www.quantamagazine.org/scientists-watch-a-memory-form-in-a-living-brain-20220303/,49,,1646341064.0
t5lm7g,"Brown crabs can’t resist the electromagnetic pull of underwater power cables and that change affects their biology at a cellular level: “They’re not moving and not foraging for food or seeking a mate, this also leads to changes in sugar metabolism, they store more sugar and produce less lactate""",Animal Science,25839,0.96,science,https://www.hw.ac.uk/news/articles/2021/underwater-cables-stop-crabs-in-their-tracks.htm,746,,1646290650.0
t6mb2b,New research suggests a causal link between blood group and severe COVID-19,Biology,20,0.74,science,https://www.eurekalert.org/news-releases/945181,7,,1646409987.0
t6i1hm,Compromised periodontal status could increase mortality for patients with COVID-19,Medicine,38,0.78,science,https://www.thelancet.com/journals/laninf/article/PIIS1473-3099(22)00065-2/fulltext,5,,1646397390.0
t67vkm,UN report shows a terrible picture of the future of the Gulf of Mexico,Environment,179,0.9,science,https://www.toisthe.com/2022/03/un-report-climate-science-business-new-orleans-gulf-of-mexico.html,8,,1646359530.0
t5kaiy,Transgender and nonbinary youth who received gender affirming medical care experienced greatly reduced rates of suicidality and depression over the course of 12 months.,Medicine,13308,0.78,science,https://jamanetwork.com/journals/jamanetworkopen/fullarticle/2789423?fbclid=IwAR07n-Ll6CtnjPH4CQDsCo8UfHrnvj9ghFEOIu-_-ghufWmYGtx4bGHUYKQ,1770,,1646285702.0
t6mt28,"Combination treatment is effective for treating smokers who drink heavily: Results show that the combination treatment of nicotine replacement and varenicline was indeed more effective for smoking cessation, with 44.3% of participants abstaining from smoking.",Health,10,0.72,science,https://www.eurekalert.org/news-releases/945195,2,,1646411346.0
t65xj9,Vaping is now being linked to a higher risk of prediabetes,Health,192,0.86,science,https://www.mic.com/life/vaping-prediabetes-study,47,,1646353499.0
t6amia,Stalled weather: how stuck air pressure systems drive floods and heatwaves,Environment,83,0.89,science,https://theconversation.com/stalled-weather-how-stuck-air-pressure-systems-drive-floods-and-heatwaves-178157,1,,1646368388.0
t6pqn6,"Viewing Images From Childhood Reduces Pain Perception. After observing triggers of childhood memories, participants reported experiencing weaker feelings of pain in response to the thermal stimuli, particularly at low stimulus intensities",Neuroscience,6,0.62,science,https://www.jneurosci.org/content/early/2022/02/15/JNEUROSCI.2123-21.2022,5,,1646419154.0
t68idm,Stanford-led research reveals how people’s experience with climate-related disasters affects their willingness to take and accept protective actions,Social Science,75,0.86,science,https://news.stanford.edu/2022/03/01/personal-experience-disaster-adaptation/,2,,1646361551.0
t5w9fr,"Resistance exercise may be superior to aerobic exercise for getting better sleep: Resistance exercise may be superior to aerobic exercise as a way to get better sleep, and sleep is important for cardiovascular health, according to new study.",Health,304,0.92,science,https://www.eurekalert.org/news-releases/944460,20,,1646327120.0
t62e5g,Magnetic excitations could provide information transfer without heat loss Magnons could transport information much more easily than electrical conductors - Technical University of Munich (TUM),Physics,117,0.95,science,https://www.eurekalert.org/news-releases/945336,3,,1646343501.0
t5ce9d,"Wild fish stocks squandered to feed farmed salmon, study finds | Wealthy nations accused of depriving poorer ones of nutrient-rich food and wasting mackerel, sardine and anchovy stocks.",Environment,9393,0.96,science,https://www.theguardian.com/environment/2022/mar/02/wild-fish-stocks-squandered-to-feed-farmed-salmon-study-finds,382,,1646261235.0
t5tgto,"New research has found that people with mild cognitive impairment may not inevitably develop dementia and, in fact, having higher education and advanced language skills more than doubles their chances of returning to normal.",Neuroscience,369,0.94,science,https://uwaterloo.ca/news/media/higher-education-and-language-skills-may-help-ward-dementia,4,,1646319637.0
t69byr,Supramolecular Immobilization of Adamantyl and Carboxylate Modified N-Heterocyclic Carbene Ligand on Cucurbituril Substrates,Chemistry,37,0.75,science,https://www.mdpi.com/1526174,17,,1646364140.0
t644gk,Study comparing mRNA COVID vaccines and seasonal influenza vaccination did not identify any significant safety concerns. The overall safety profile patterned a lower risk of serious adverse events following mRNA vaccines compared to influenza vaccines.,Epidemiology,75,0.8,science,https://onlinelibrary.wiley.com/doi/10.1002/jmv.27424,3,,1646348264.0
t5at4i,"Vaccinating pregnant women for COVID seems to give future protection to babies.When a mother passes antibodies to her child, it’s known as passive immunity, and this can be generated by a mother being vaccinated or infected during pregnancy. It happens with COVID as it does with many other diseases.",Medicine,28711,0.77,science,https://theconversation.com/vaccinating-mothers-during-pregnancy-protects-their-babies-from-covid-177480,1095,,1646256941.0
t67ucv,New research suggests a causal link between blood group and severe COVID-19,Biology,29,0.78,science,https://www.eurekalert.org/news-releases/945181,6,,1646359431.0
t5ppop,"U.S. study (n=492) finds people with high levels of institutional trust felt more secure in their job, had higher levels of affective commitment and psychological well-being, and higher levels of behavioral compliance with CDC recommended COVID-19 prevention practices.",Psychology,350,0.84,science,https://www.eurekalert.org/news-releases/945198,76,,1646307772.0
t5hwx1,"""Drug factory"" beads implanted in mice take out tumors within a week",Medicine,1593,0.96,science,https://newatlas.com/medical/drug-factory-beads-tumors-cancer-week/,54,,1646277794.0
t6ki4c,Defining the mechanisms underlying cyclin dependent kinase control of HIF-1α,Cancer,2,0.59,science,https://www.oncotarget.com/article/28208/text/,1,,1646405088.0
t6d3hr,Sex-specific responses to anthropogenic risk shape wild chimpanzee social networks in a human-impacted landscape,Biology,8,0.69,science,https://linkinghub.elsevier.com/retrieve/pii/S0003347222000276,5,,1646377196.0
t57qgq,"Study suggests eating salmon-feed fish, instead of farmed salmon. Commercial salmon feed contains fish oil and fish meal, which are obtained from wild-caught fish like sardines and anchovies. According to new research, it would be ecologically better if we just ate those feed fish ourselves.",Environment,4779,0.93,science,https://newatlas.com/environment/salmon-feed-wild-fish-human-consumption/,595,,1646248512.0
t61hr4,"Dark energy: Neutron stars will tell us if it’s only an illusion - SISSA scientists provide the first simulation of neutron star collisions in extensions of general relativity relevant for cosmology, offering a new approach to test gravity. The work has been published in Physical Review Letters",Physics,35,0.85,science,https://www.eurekalert.org/news-releases/945257,4,,1646340968.0
t64v86,Role of chronic neuroinflammation in neuroplasticity and cognitive function: A hypothesis - Lecca - - Alzheimer's &amp; Dementia - Wiley Online Library,Neuroscience,18,0.76,science,https://alz-journals.onlinelibrary.wiley.com/doi/10.1002/alz.12610,1,,1646350407.0
t60831,Ultra-processed food intake and animal-based food intake and mortality in the adventist health study-2 — Greater consumption of ultra-processed foods was associated with higher all-cause mortality in this health-conscious Adventist population with many vegetarians.,Epidemiology,31,0.73,science,https://academic.oup.com/ajcn/advance-article-abstract/doi/10.1093/ajcn/nqac043/6535558,19,,1646337552.0
t5rczs,"A new study does not support the assumption that grandparents would always participate more in a grandchild’s life during difficult circumstances, such as by providing childcare or monetary support. However, maternal grandmothers seem to be an exception.",Social Science,110,0.93,science,https://royalsocietypublishing.org/doi/10.1098/rspb.2021.2574,16,,1646313362.0
t61f3w,"Discovery may explain why more females than males get knee osteoarthritis - New genetic research could lead to a blood test, better preventive strategies and even potential drug treatments.",Medicine,25,0.78,science,https://www.eurekalert.org/news-releases/945215,1,,1646340761.0
t53v8f,"Germans who believe in conspiracy theories, distrust government or don't follow politics are highly receptive to Russian propaganda while the rest of the population is not. Fact-checks from mainstream sources and outing the Russian sources does not make them less susceptible to propaganda.",Social Science,5352,0.91,science,https://journals.sagepub.com/doi/abs/10.1177/00104140211060277,445,,1646238404.0
