post_id,title,flair,score,post_upvote_ratio,subreddit,url,num_comments,body,created
t3wax1,"The origin of ~ 30,000 year old figurine Venus from Willendorf was discovered via on new tomography scans of numerous oolite samples ranging ~ 2500 km from France to the Ukraine",Anthropology,620,0.95,science,https://www.nature.com/articles/s41598-022-06799-z,18,,1646100010.0
t45h1d,Neighbourhoods Play A Role In Health Of Adults. Results confirm previous findings but now also show a clear link between living environments and physical and mental health. He believes they should help inform city planning policy and decision-making.,Health,89,0.91,science,https://www.sciencedirect.com/science/article/abs/pii/S0277953622001071?dgcid=raven_sd_search_email&_cldee=ZWRpdG9yQHNjb29wLmNvLm56&recipientid=contact-af731e301a68ea11a811000d3ad199c8-88f00935fcf74e338fabb17b23c94625&esid=c149806c-ee98-ec11-b400-00224892f05d,6,,1646132676.0
t4af7m,"Red light stimulates angiogenesis in vitro, with more efficient stimulation at 650 nm than 808 nm. Irradiation promotes Ca ion influx, cell cycle progression, proliferation, and NO generation in endothelial cells. A new activation pathway of endothelial cell metabolism is revealed.",Biology,27,0.82,science,https://www.sciencedirect.com/science/article/abs/pii/S1011134422000021,11,,1646148396.0
t3j5ia,Scientists make first detection of exotic “X” particles in quark-gluon plasma,Physics,1639,0.97,science,https://news.mit.edu/2022/x-particles-quark-gluon-plasma-detection-0121,114,,1646064799.0
t3q48a,Healthy gut microbiome improves success of cancer treatment. Less than 50% of patients respond positively to immunotherapy for melanoma so finding strategies to increase the number of positive responders is crucial.,Health,561,0.96,science,https://www.kcl.ac.uk/news/healthy-gut-microbiome-improves-success-of-cancer-treatment,19,,1646082832.0
t4j9o0,Ammonolytic Hydrogenation of Secondary Amides: An Efficient Method for the Recycling of Long-Chain Polyamides,Chemistry,7,0.9,science,https://doi.org/10.1021/acssuschemeng.1c08538,1,,1646171162.0
t3k2d4,Giving omega-3 supplements to pregnant women with low levels of this fatty acid could prevent about 14 per cent of early preterm births. The finding has inspired a world-first screening and treatment programme for omega-3 deficiencies in pregnant women in South Australia.,Health,1175,0.97,science,https://www.newscientist.com/article/2309696-omega-3-supplements-could-reduce-the-number-of-premature-births/,37,,1646067279.0
t3d9fm,"Over half of brains donated to the Australian Sports Brain Bank have signs of chronic traumatic encephalopathy (CTE), a degenerative brain disease associated with repeated blows to the head, researchers have found.",Neuroscience,2476,0.97,science,https://www.mja.com.au/journal/2022/216/10/chronic-traumatic-encephalopathy-australia-first-three-years-australian-sports,75,,1646046869.0
t3mtv0,Freshwater from thin air: a team of researchers has now found a way to quickly extracting large amounts of freshwater from air using a specially developed hydrogel containing a hygroscopic,Earth Science,576,0.93,science,https://onlinelibrary.wiley.com/page/journal/15213773/homepage/press/202203press.html,65,,1646074380.0
t3vr1x,"T. rex may have had 2 equally terrifying sibling species, new research suggests",Biology,168,0.92,science,https://whdh.com/news/t-rex-may-have-had-2-equally-terrifying-sibling-species-new-research-suggests/,23,,1646098365.0
t42tp6,"A potent and selective nociceptin receptor antagonist, BTRX-246040, shows anti depressant effect in rodent models, further challenging the idea of the monoamine hypothesis of depression. It is currently in Phase II for MDD.",Neuroscience,44,0.85,science,https://www.mdpi.com/1420-3049/27/2/533,7,,1646121649.0
t3v2cu,"Extract from the bark of the Neem tree may help treat and reduce the spread of coronavirus, according to a new study. Components of Neem bark may target a wide range of viral proteins, suggesting its potential as an antiviral agent against emerging variants of coronaviruses (including SARS-CoV-2).",Medicine,174,0.89,science,https://www.eurekalert.org/news-releases/944844,32,,1646096333.0
t42nen,"Researchers found that the brain couples lower frequencies of oscillations of neural activity with higher ones to allows fine-tuning the brain and is thus the basis for higher cognitive functions, such as selective attention",Neuroscience,44,0.88,science,https://www.dpz.eu/en/home/single-view/news/auf-den-rhythmus-kommt-es-an.html,4,,1646120954.0
t3lyz9,"New, nature-inspired concepts for turning CO2 into clean fuels. The researcher has improved fuel production efficiency by 18 times in a laboratory setting, demonstrating that polluting carbon emissions can be turned into green fuels efficiently without any wasted energy",Chemistry,486,0.95,science,https://www.cam.ac.uk/research/news/new-nature-inspired-concepts-for-turning-co2-into-clean-fuels,30,,1646072171.0
t4a854,Magnetic nanoelements attract great interest due to their prospects for data storage and signal processing. Spin-wave confinement in these elements is strongly dependent on the elements' geometry. Our results offer a way for the creation of spin-wave systems with spectrally narrow magnetic noise.,Nanoscience,11,0.75,science,https://journals.aps.org/prb/abstract/10.1103/PhysRevB.105.014407,2,,1646147865.0
t4c8ho,Belief in Having Had COVID-19 Linked With Long COVID Symptoms,Medicine,8,0.61,science,https://jamanetwork.com/journals/jama/fullarticle/2787741,2,,1646153101.0
t42ko7,"Smiling won’t make you feel better, but it might make people like you more: Interpersonal and intrapersonal consequences of response-focused emotion regulation strategies",Psychology,30,0.74,science,https://journals.sagepub.com/doi/full/10.1177/02654075221077233,5,,1646120647.0
t3nfe5,Researchers report that cholesterol-lowering drugs (statins) may slow down cancer cell metastases.,Cancer,240,0.96,science,https://www.mdc-berlin.de/news/press/cholesterol-lowering-drugs-may-slow-down-metastases,26,,1646075923.0
t3s1td,Tropical carbon loss has doubled due to forest clearance,Environment,125,0.91,science,https://www.leeds.ac.uk/main-index/news/article/5030/tropical-carbon-loss-has-doubled-due-to-forest-clearance,1,,1646087921.0
t3xe3n,Lack of association between pandemic chilblains (COVID toes) and SARS-CoV-2 infection,Medicine,30,0.76,science,https://www.pnas.org/doi/10.1073/pnas.2122090119,4,,1646103214.0
t3ua85,"Brain neuroactive steroid levels are altered after one month of withdrawal from paroxetine, which could explain the mechanism behind PSSD (Post SSRI Sexual Dysfunction), an iatrogenic condition where side effects remain even after discontinuing the SSRI.",Neuroscience,41,0.79,science,https://www.sciencedirect.com/science/article/abs/pii/S0306453021002389?dgcid=coauthor,29,,1646094015.0
t2q4e5,A research team in Korea has synthesized metal nanoparticles that can drastically improve the performance of hydrogen fuel cell catalysts by using the semiconductor manufacturing technology.,Nanoscience,13333,0.97,science,https://www.eurekalert.org/news-releases/944760,252,,1645974358.0
t2v6zk,Brain bank data reveals neurodegeneration in sports players exposed to repetitive head injury — Over half of brains donated to the Australian Sports Brain Bank have signs of chronic traumatic encephalopathy (CTE),Neuroscience,3644,0.98,science,https://www.abc.net.au/news/health/2022-02-28/brain-bank-data-reveals-head-injury-sports-cte/100862422,169,,1645988563.0
t3osis,New MRI Method Developed by Researchers at the University of Illinois Images Epigenetic Changes Occurring in the Brain,Medicine,31,0.87,science,https://www.technologynetworks.com/genomics/news/new-mri-method-images-epigenetic-changes-in-piglet-brains-359071,1,,1646079401.0
t3r28t,"Variation in the COVID-19 infection–fatality ratio by age, time, and geography during the pre-vaccine era: a systematic analysis",Epidemiology,25,0.84,science,https://www.thelancet.com/journals/lancet/article/PIIS0140-6736(21)02867-1/fulltext,3,,1646085325.0
t3d6mn,"A new study has identified 228 clinical practices in Canada that are used inappropriately (diagnostic and therapeutic), with underuse being more common than overuse. Evaluating more than 28.9 million patients between 2007 and 2021, the researchers found inappropriate care in 30% of cases.",Medicine,146,0.95,science,https://www.eurekalert.org/news-releases/944462,27,,1646046559.0
t3noj7,"New research quantifies effect of black carbon particles on health and suggests flaring of natural gas from oil and gas fields in the United States, primarily in North Dakota and Texas, contributed to dozens of premature deaths in 2019.",Health,30,0.78,science,https://news.rice.edu/news/2022/gas-flares-tied-premature-deaths,7,,1646076581.0
t349a8,Public health interventions (such as closing businesses) to contain spread of the flu during the 1918 influenza pandemic successfully reduced mortality at little economic cost. The economic costs were likely low because the interventions protected the labor force in the long run.,Health,678,0.9,science,https://www.cambridge.org/core/journals/journal-of-economic-history/article/abs/what-happened-to-the-us-economy-during-the-1918-influenza-pandemic-a-view-through-highfrequency-data/C94B9A150CC0BD5E2E968CBCA7CED813,34,,1646014519.0
t3p3mg,How a two-faced molecule can silence problematic genes ( Tokyo Medical and Dental University ),Genetics,23,0.78,science,https://www.eurekalert.org/news-releases/944811,1,,1646080213.0
t3js7t,A mindfulness-based intervention for concurrent chronic pain and opioid misuse demonstrated significant pain reduction and opioid dose deescalation compared to supportive group psychotherapy in a large (n=250) randomized clinical trial.,Health,47,0.84,science,https://jamanetwork.com/journals/jamainternalmedicine/fullarticle/2789279,5,,1646066522.0
t38amq,"Direct comparison of the acute effects of LSD & psilocybin suggests that effects do not really differ beyond the effect duration, a double-blind placebo-controlled study in healthy subjects",Psychology,294,0.94,science,https://www.nature.com/articles/s41386-022-01297-2,46,,1646027358.0
t3msyg,Doubling of annual forest carbon loss over the tropics during the early twenty-first century | High-resolution satellite datasets to show a doubling of gross tropical forest carbon loss worldwide | This is higher than in bookkeeping models forced by land-use statistical data,Environment,24,0.79,science,https://www.nature.com/articles/s41893-022-00854-3,4,,1646074314.0
t3p331,Study reveals chemical link between wildfire smoke and ozone depletion,Environment,19,0.76,science,https://news.mit.edu/2022/wildfire-smoke-ozone-depletion-0228,1,,1646080178.0
t3mz0w,A meta analysis finds a higher baseline level of psychopathology or depression is associated with deterioration in mental health after a meditation intervention,Psychology,23,0.79,science,https://bpspsychub.onlinelibrary.wiley.com/doi/full/10.1111/bjhp.12589,3,,1646074752.0
t3njic,Bark of Neem Tree May Protect Against Coronavirus Variants,Medicine,22,0.7,science,https://news.cuanschutz.edu/news-stories/bark-of-neem-tree-may-protect-against-coronavirus-variants,5,,1646076221.0
t3gi18,﻿Diversity of Fusarium associated banana wilt in northern Viet Nam,Biology,48,0.82,science,https://mycokeys.pensoft.net/articles.php?id=72941,2,,1646057486.0
t2qr3x,"An ancient skull uncovered at a 6,000-year-old megalithic monument in Spain still holds signs of what would have been a brutal ear surgery. Archaeologists suspect the patient probably had a double-sided acute middle ear infection, which can cause earaches and fevers.",Neuroscience,2671,0.98,science,https://www.nature.com/articles/s41598-022-06223-6#Fig5,39,,1645976274.0
t388mp,"COVID-related cases of diabetes may be temporary, study finds. A new study shows that blood sugar levels of COVID-19 patients newly diagnosed with diabetes during hospital admission often returned to normal following discharge, and that only eight percent used insulin after one year.",Medicine,192,0.93,science,https://newatlas.com/health-wellbeing/covid19-diabetes-temporary/,8,,1646027169.0
t2nygi,Neural Noise Shows the Uncertainty of Our Memories - The electrical chatter of our working memories reflects our lack of confidence about their contents,Neuroscience,3694,0.97,science,https://www.quantamagazine.org/neural-noise-shows-the-uncertainty-of-our-memories-20220118/,41,,1645967588.0
t3og49,Response of organic grain and forage crops to struvite application in an alkaline soil,Earth Science,12,0.82,science,https://acsess.onlinelibrary.wiley.com/doi/10.1002/agj2.20943,1,,1646078540.0
t2v6fe,"Vaccine effectiveness against severe COVID-19 declines after 200 days but remains highly effective against hospitalisation, particularly for older patients or those with specific comorbidities. A booster vaccination might be warranted for everyone, but especially for these populations",Health,915,0.87,science,https://www.thelancet.com/journals/lanres/article/PIIS2213-2600(22)00042-X/fulltext,76,,1645988519.0
t3ouwz,Compensatory hydraulic uptake of water by tomato due to variable root-zone salinity,Earth Science,9,0.81,science,https://acsess.onlinelibrary.wiley.com/doi/10.1002/vzj2.20161,3,,1646079576.0
t2w09h,"Scientists unveil 'unified genealogy of modern and ancient humans' | With more than 3,600 individual genome sequences that date back more than 100,000 years, it is largest human family tree ever created.",Anthropology,722,0.96,science,https://www.science.org/doi/10.1126/science.abi8264,27,,1645990860.0
t3p1nz,"MBL team discovers new DNA modification system in animals, captured from bacteria more than 60 MYA - ( Marine Biological Laboratory )",Genetics,6,0.7,science,https://www.eurekalert.org/news-releases/944730,4,,1646080068.0
t3oxkc,Nonpoint source arsenic contamination of soil and groundwater from legacy pesticides,Earth Science,7,0.7,science,https://acsess.onlinelibrary.wiley.com/doi/10.1002/jeq2.20304,1,,1646079763.0
t3hsm0,"'Staying mad' was linked to recidivism among violent juvenile offenders, whereas 'short fuse' was linked to continuing a pattern of nonviolent offending (N = 548; 2-year follow-up). Overall anger was related to youths' current violent behaviour, but not recidivism.",Psychology,10,0.67,science,https://doi.org/10.1080/07418825.2022.2028882,2,,1646061104.0
t3owol,Livestock feed resources in the West African Sahel,Earth Science,3,0.64,science,https://acsess.onlinelibrary.wiley.com/doi/10.1002/agj2.20955,1,,1646079698.0
t2d05q,"Evidence suggests an asteroid impact that killed off most dinosaurs might have happened in spring. Palaeontologists studying fossilized fish suggest that spring was in full bloom in the Northern Hemisphere when an asteroid slammed into Earth, triggering a devastating global winter & mass extinction.",Paleontology,7446,0.97,science,https://www.nature.com/articles/d41586-022-00511-x,172,,1645926817.0
t2hn1q,Scientifists have identified head diection cells (HD) in the brain of birds that might act like internal compasses to help them navigate during their initial migratory flight,Animal Science,2948,0.95,science,https://www.nagoya-u.ac.jp/researchinfo/result-en/2022/02/20220224-01.html,69,,1645942378.0
t26d7z,"New research has found significant differences between the two types of vitamin D, with vitamin D2 having a questionable impact on human health. Scientists found evidence that vitamin D3 had a modifying effect on the immune system that could fortify the body against viral and bacterial diseases.",Health,21502,0.96,science,https://www.surrey.ac.uk/news/study-questions-role-vitamin-d2-human-health-its-sibling-vitamin-d3-could-be-important-fighting,662,,1645907536.0
t2r2vj,"Axion is the most favored candidate for dark matter. Axion’s mass is more than twice as big as previously thought, according to a new supercomputer simulation of how axions were produced shortly after the Big Bang 13.8 billion years ago.",Physics,189,0.93,science,https://news.berkeley.edu/2022/02/25/new-simulations-refine-axion-mass-refocusing-dark-matter-search/,15,,1645977248.0
t26q57,"Masks impair the recognition of six basic facial expressions, according to new research. The findings suggests that visual information from lower portions of the face play an important role in understanding facial expressions.",Social Science,6986,0.89,science,https://www.psypost.org/2022/02/new-research-shows-masks-make-it-more-difficult-to-read-emotions-from-faces-62640,676,,1645908567.0
t2g3pf,"Effective drug combinations in breast, colon and pancreatic cancer cells (Feb 2022)",Cancer,770,0.96,science,https://www.nature.com/articles/s41586-022-04437-2,2,,1645937001.0
t2v7ar,What Brain-eating Amoebae Can Tell Us About the Diversity of Life on Earth and Evolutionary History,Biology,44,0.82,science,https://www.umass.edu/news/article/what-brain-eating-amoebae-can-tell-us-about-diversity-life-earth-and-evolutionary,2,,1645988586.0
t2wli2,How status of research papers affects the way they are read and cited,Social Science,25,0.81,science,https://www.sciencedirect.com/science/article/pii/S0048733322000129?via%3Dihub,2,,1645992474.0
t1z31h,Women with more testosterone have more sexual desire. N=3268,Health,5701,0.95,science,https://www.sciencedirect.com/science/article/abs/pii/S1743609522005483,483,,1645887877.0
t25vih,World's smallest battery can power a computer the size of a grain of dust,Engineering,1181,0.93,science,https://onlinelibrary.wiley.com/doi/10.1002/aenm.202103641,92,,1645906152.0
t2g8qp,Iron supplementation is sufficient to rescue skeletal muscle mass and function in cancer cachexia (Feb 2022),Cancer,200,0.94,science,https://www.embopress.org/doi/full/10.15252/embr.202153746,3,,1645937494.0
t1wr3z,"Meat intake is positively correlated with life expectancies. In contrast, carbohydrate crops showed weak and negative correlation with life expectancy.",Biology,3085,0.73,science,https://www.dovepress.com/total-meat-intake-is-associated-with-life-expectancy-a-cross-sectional-peer-reviewed-fulltext-article-IJGM?fbclid=IwAR2bagSSQDiZZ6Q4fJsC96QNtT-_wQvUjP3dHjj9tjJGrAH7grrY-z8ys40,661,,1645880966.0
t243oi,"Scientists have developed a new technique that uses microscopic magnetic particles to remotely activate brain cells, the discovery in rats could potentially lead to the development of a new class of non-invasive therapies for neurological disorders",Neuroscience,520,0.95,science,https://www.ucl.ac.uk/news/2022/feb/touch-sensitive-brain-cells-controlled-micromagnets,21,,1645901325.0
t1l724,Euler’s 243-Year-Old mathematical puzzle that is known to have no classical solution has been found to be soluble if the objects being arrayed in a square grid show quantum behavior. It involves finding a way to arrange objects in a grid so that their properties don’t repeat in any row or column.,Physics,21423,0.93,science,https://physics.aps.org/articles/v15/29,728,,1645841448.0
t2gaac,Genome-wide CRISPR screen identifies synthetic lethality between DOCK1 inhibition and metformin in liver cancer (Feb 2022),Cancer,72,0.91,science,https://link.springer.com/article/10.1007/s13238-022-00906-6,4,,1645937635.0
t21kzx,Data-Driven Flood Alert System (FAS) Using Extreme Gradient Boosting (XGBoost) to Forecast Flood Stages,Environment,564,0.94,science,https://www.mdpi.com/2073-4441/14/5/747,2,,1645894692.0
t1xxnt,"Becoming a parent -- or even feeling nurturing toward children -- is linked to being more religious, according to 5 studies from around the world.",Psychology,605,0.73,science,https://journals.sagepub.com/doi/full/10.1177/01461672221076919,231,,1645884591.0
t26u9b,"Mystical experiences might bridge the gap between LSD-induced “madness” and healing: A new randomized, double-blind, placebo-controlled study helps to bridge the gap between previous research that had examined LSD as a model of psychosis and research on the therapeutic value of psychedelic drugs.",Psychology,106,0.92,science,https://www.psypost.org/2022/02/mystical-experiences-might-bridge-the-gap-between-lsd-induced-madness-and-healing-62643,7,,1645908900.0
t26i09,Rainforest ability to store moisture critical to its resilience,Environment,97,0.93,science,https://onlinelibrary.wiley.com/doi/10.1111/gcb.16115?af=R,3,,1645907921.0
t2jovy,"Mitochondrial COA7 is a heme-binding protein with disulfide reductase activity, which acts in the early stages of complex IV assembly",Biology,10,0.74,science,https://www.pnas.org/content/119/9/e2110357119,1,,1645950541.0
t1jita,Cleaning products cause indoor pollution levels similar to a busy road.,Health,3322,0.97,science,https://www.newscientist.com/article/2309721-cleaning-products-cause-indoor-pollution-levels-similar-to-a-busy-road/,281,,1645836800.0
t2joiu,Gain- but not loss-related self-perceptions of aging predict mortality over a period of 23 years: A multidimensional approach,Health,7,0.71,science,https://pubmed.ncbi.nlm.nih.gov/35201819/,11,,1645950498.0
t1uzsg,"Robots are increasing mortality among US adults. Analysis shows that automation exacts a toll on the health of individuals both directly — by reducing employment, wages, and access to healthcare — as well as indirectly, by reducing the economic vitality of the broader community",Health,379,0.84,science,https://www.eurekalert.org/news-releases/944524,110,,1645874826.0
t2jteh,Using RDNA sequences to define dinoflagellate species,Biology,8,0.84,science,https://dx.plos.org/10.1371/journal.pone.0264143,1,,1645951064.0
t2jsiy,Host-symbiont stress response to lack-of-sulfide in the giant ciliate mutualism,Biology,7,0.78,science,https://dx.plos.org/10.1371/journal.pone.0254910,1,,1645950957.0
t2g7gb,Mechanisms of mitochondrial promoter recognition in humans and other mammalian species (Feb 2022),Biology,15,0.79,science,https://academic.oup.com/nar/advance-article/doi/10.1093/nar/gkac103/6534357,3,,1645937372.0
t1uow7,Study: Bullying interventions in early adolescence could play an important role in improving students’ mental health by the time they reach high school. Students who are isolated and targeted by peers’ rumors in early adolescence are more likely to experience symptoms of depression by high school.,Psychology,275,0.93,science,https://doi.apa.org/doiLanding?doi=10.1037%2Fdev0001300,6,,1645873626.0
t1mubl,"Questionnaire study among male victims of partner abuse aims to identify the barriers to their help-seeking: common issues include disbelief from police and social services, threats of counter-allegations from partners, and fear of losing contact with their children",Social Science,1005,0.96,science,https://doi.org/10.1177/08862605211035870,131,,1645846163.0
t1gs8j,"A review on cannabis in sports ""confirms that CBD and tetrahydrocannabinol (THC) do not enhance performance"" and that ""CBD possesses anti-inflammatory and analgesic properties which have not been adequately evaluated in the area of sport.""",Biology,2384,0.96,science,https://onlinelibrary.wiley.com/doi/10.1111/imj.15724,92,,1645829149.0
t262cm,New research explores the impact of the Covid-19 pandemic on nuclear security,Social Science,43,0.74,science,https://www.kcl.ac.uk/news/kings-research-explores-the-impact-of-covid-19-on-nuclear-security,6,,1645906694.0
t1ux9p,Hyperbaric oxygen therapy induces neuroplasticity indicates potentially positive effects on veterns with treatment resistant PTSD,Neuroscience,220,0.95,science,https://journals.plos.org/plosone/article?id=10.1371/journal.pone.0264161,13,,1645874538.0
t1bx7r,"New research has found that people with Attention Deficit/Hyperactivity Disorder (ADHD) are significantly more likely to also exhibit hoarding behaviours, which can have a serious impact on their quality of life.",Neuroscience,2591,0.98,science,https://aru.ac.uk/news/adhd-linked-to-hoarding-behaviour-new-study,158,,1645816420.0
t1va9e,"Researchers discover new information about the effects of sleep on the human brain. In the areas where the pulsations intensified, an increase in delta waves was also observed in the EEG, which is indicative of increased brain clearance",Neuroscience,85,0.87,science,https://www.oulu.fi/en/news/researchers-discover-new-information-about-effects-sleep-human-brain,3,,1645875962.0
t17448,"Ammonia-secreting bacteria bring us closer to a world free of industrial fertilizers - Scientists have engineered bacteria that release ammonia, in quantities high enough to feed rice plants",Environment,2871,0.98,science,https://www.anthropocenemagazine.org/2022/02/ammonia-secreting-bacteria-bring-us-closer-to-a-world-free-of-industrial-fertilizers%EF%BF%BC,50,,1645804174.0
t1hw58,In a new study scientists analyzed wolf behavior in Yellowstone and found they have changed their feeding habits to adapt to climate change. Less snow and rising temperatures resulted in more scavenging of carcasses and hunting smaller animals.,Environment,517,0.93,science,https://zslpublications.onlinelibrary.wiley.com/doi/abs/10.1111/jzo.12957,11,,1645832178.0
t11tv7,"For the first time, researchers have had ""conversations"" involving novel questions and math problems with lucid dreamers—people who are aware that they are dreaming. the findings suggest people can receive and process complex external information while sleeping.",Neuroscience,3203,0.98,science,https://www.science.org/content/article/scientists-entered-peoples-dreams-and-got-them-talking?utm_campaign=NewsfromScience&utm_source=Social&utm_medium=Twitter,129,,1645788576.0
t1dfk8,"Scientists reveal 4.4 million galaxies in a new map - Embargoed until 0900 GMT Friday, 25 February 2022 - Durham University",Astronomy,514,0.95,science,https://www.eurekalert.org/news-releases/944281,20,,1645820334.0
