post_id,title,flair,score,post_upvote_ratio,subreddit,url,num_comments,body,created
t0t1hu,"At least 5.2 million children have lost a parent or caretaker to Covid-19, study estimates.",Health,22941,0.89,science,https://www.cnn.com/2022/02/24/health/covid-parent-caretaker-deaths-study/index.html,870,,1645757908.0
t0udxe,"Democrats and Republicans see each other as “more stupid than evil,” according to new psychology research.",Psychology,10828,0.94,science,https://www.psypost.org/2022/02/democrats-and-republicans-see-each-other-as-more-stupid-than-evil-according-to-new-psychology-research-62634,1431,,1645761849.0
t1gh97,"Food processing groups and colorectal cancer risk in Morocco: evidence from a nationally representative case–control study - Our results suggest that the consumption of ultra-processed foods and drink products may be associated with an increased risk of developing CRC,but longitudinal studies needed",Epidemiology,241,0.94,science,https://link.springer.com/article/10.1007/s00394-022-02820-3,7,,1645828323.0
t1uleq,"Researchers examined how the Medicaid expansion in California affected coverage levels, hospital use, and patient health. They found that both publicly and privately owned hospitals had boosts to their bottom lines from the ACA, although as expected the former experienced greater profitability.",Health,25,0.76,science,https://www.aeaweb.org/research/charts/aca-impact-hospitals-california,2,,1645873252.0
t1xthq,CIMB | Free Full-Text | Intracellular Reverse Transcription of Pfizer BioNTech COVID-19 mRNA Vaccine BNT162b2 In Vitro in Human Liver Cell Line,Biology,12,0.65,science,https://www.mdpi.com/1467-3045/44/3/73/htm?s=09,16,,1645884246.0
t1n7na,New model may improve Bay Area seismic hazard maps,Geology,67,0.88,science,https://news.stanford.edu/2022/02/25/new-model-may-improve-bay-area-seismic-hazard-maps/,2,,1645847295.0
t1c3tm,Scientists reveal 4.4 million galaxies in a new map. The vast majority of these objects are billions of light years away and are either galaxies that harbour massive black holes or are rapidly growing new stars.,Astronomy,261,0.94,science,https://www.durham.ac.uk/news-events/latest-news/2022/02/scientists-unveil-most-accurate-virtual-representation-of-the-universe/,7,,1645816908.0
t1k44v,Soil health and nutrient density: preliminary comparison of regenerative and conventional farming. Preliminary support for the conclusion that regenerative soil-building farming practices can enhance the nutritional profile of conventionally grown plant and animal foods.,Health,85,0.9,science,https://peerj.com/articles/12848/,2,,1645838390.0
t18878,"Chemists have developed a novel way to synthesize himastatin, a natural compound that has shown potential as an antibiotic.",Chemistry,382,0.96,science,https://news.mit.edu/2022/himastatin-synthesis-chemical-0224,13,,1645807004.0
t0nyou,"Being Around Water Could Make You Happier, According to Research",Psychology,19127,0.93,science,https://www.eatingwell.com/article/7948883/being-around-water-could-make-you-happier-research/,707,,1645743520.0
t0ycpe,"New research finds that mountains ""sway to the seismic song of Earth""; the famed Matterhorn is in constant motion, gently swaying back and forth about once every 2 seconds.",Earth Science,1133,0.97,science,https://eos.org/articles/mountains-sway-to-the-seismic-song-of-earth,57,,1645775248.0
t1esoa,Human choices in a simulated pandemic: New study tests interventions to foster safer behaviour. Research has shown that it is possible to test the effectiveness of interventions designed to foster safer behaviour in order to slow the spread of a virus.,Health,66,0.78,science,https://www.eurekalert.org/news-releases/944371,5,,1645823874.0
t0fvze,"Nearly all dogs that lose a ""companion"" dog from the same household show behaviours like going off their food and seeking more human attention.",Animal Science,19859,0.97,science,https://www.newscientist.com/article/2309505-pet-dogs-really-do-grieve-the-deaths-of-other-dogs-they-live-with/,441,,1645722307.0
t11agj,Scientists are recruiting elephant seals to eavesdrop on whales,Animal Science,342,0.94,science,https://www.vox.com/down-to-earth/22945867/elephant-seals-listening-beaked-whales-ocean,29,,1645786613.0
t16bpx,"A positive view of aging is linked to living significantly longer, according to a 23-year study of Germans aged 40 and older (N = 2,400). For individuals who perceived aging as associated with ongoing development, the risk of death was half that of individuals with less positive views.",Psychology,152,0.93,science,https://psycnet.apa.org/record/2022-31793-001,12,,1645802043.0
t1anbi,"In cross-sectional data analysis of 175 contemporary populations, stepwise linear regression selected meat intake, not carbohydrate crops, as one of the significant predictors of life expectancy. In contrast, carbohydrate crops showed weak and negative correlation with life expectancy.",Health,83,0.77,science,https://www.dovepress.com/total-meat-intake-is-associated-with-life-expectancy-a-cross-sectional-peer-reviewed-fulltext-article-IJGM,42,,1645813147.0
t1ik0t,A cell-free self-replenishing CO2-fixing system,Engineering,26,0.74,science,https://www.nature.com/articles/s41929-022-00746-x,1,,1645833998.0
t12yjz,"PFAS pollution led to contamination of US drinking water wells, study finds",Geology,169,0.92,science,https://www.theguardian.com/environment/2022/feb/25/pfas-us-drinking-water-wells-study,11,,1645792398.0
t148cr,"Even moderate levels of car pollution have substantial adverse health effects: each additional cheating Wolkswagen ""clean diesel"" car per 1,000 cars increased particulate pollution by more than 2%, increased the infant mortality rate by 1.7% and low birth weight by 1.9%.",Environment,125,0.86,science,https://academic.oup.com/restud/advance-article-abstract/doi/10.1093/restud/rdac007/6529413,2,,1645796262.0
t0bm3g,UN report warns climate change could spur 50% more wildfires by 2100,Environment,25456,0.87,science,https://grist.org/climate/un-report-warns-climate-change-could-spur-50-more-wildfires-by-2100/,717,,1645711002.0
t1bkgm,"Study has found that hippocampal neurons in rats accurately map the position of a moving object even while the rat is stationary. The results challenge the idea that the hippocampus, a region of the brain involved in learning and memory, only encodes a map of space based on movement.",Neuroscience,42,0.8,science,https://connect.uclahealth.org/2022/02/10/brain-track-moving-objects/,1,,1645815536.0
t192yu,#CoronavirusCruise: Impact and implications of the COVID-19 outbreaks on the perception of cruise tourism,Social Science,52,0.75,science,https://doi.org/10.1016/j.tmp.2022.100948,10,,1645809164.0
t1bx4f,"New research provides detailed, nationwide evidence of how the public uses open access scientifi- cally based information. Contrasts starkly with a narrative of a misinformed public manipulated by social media",Social Science,28,0.71,science,https://www.pnas.org/content/119/9/e2107760119,4,,1645816413.0
t159go,Experiences of racism in adolescence raise risk of depression for Black women,Psychology,72,0.71,science,https://www.eurekalert.org/news-releases/944681,12,,1645799150.0
t11i56,"Young Children Intuitively Divide Before They Recognize the Division Symbol. ""These findings highlight the depth of intuitive math knowledge that children possess before formal education.""",Psychology,120,0.92,science,https://www.frontiersin.org/articles/10.3389/fnhum.2022.752190/full,3,,1645787350.0
t1ejz0,CDC recommends 4-month regimen for drug-susceptible TB,Medicine,19,0.72,science,https://www.healio.com/news/infectious-disease/20220225/cdc-recommends-4month-regimen-for-drugsusceptible-tb,3,,1645823217.0
t1d9rp,HKUST scientists reveal the mechanism of skeletal muscle stem cell activation in muscle regeneration,Medicine,19,0.76,science,https://www.eurekalert.org/news-releases/944595,1,,1645819953.0
t1cquh,Geopsychology of instrumental aggression: daily concurrence of global terrorism and solar-geomagnetic activity (1970-2018),Psychology,14,0.68,science,https://www.researchgate.net/publication/352197833_Geopsychology_of_instrumental_aggression_daily_concurrence_of_global_terrorism_and_solar-geomagnetic_activity_1970-2018,5,,1645818611.0
t0bxeo,Researchers found older adults who were current dog owners were approximately half as likely to have a disability than those who had never been dog owners. This relationship held true even after accounting for other sociodemographic and health factors,Health,2921,0.93,science,https://www.eurekalert.org/news-releases/943653,134,,1645711835.0
t1kdy0,Inferring human evolutionary history,Genetics,5,0.67,science,https://www.science.org/doi/10.1126/science.abo0498,6,,1645839187.0
t0dj2d,An interview study with patients finds that they wish that doctors would discuss the cost of different treatment options. Collaborative informatics tools could facilitate cost conversations and shared decision-making,Medicine,1846,0.96,science,https://academic.oup.com/jamia/advance-article/doi/10.1093/jamia/ocac010/6532355,217,,1645716068.0
t0k0w7,Astronomers find a puzzling black hole spinning sideways. Astronomers recently discovered a misaligned black hole spinning off of its axis by about 40 degrees. This is the first time scientists have observed such unusual behavior from a black hole.,Astronomy,683,0.97,science,https://www.inverse.com/science/this-sideways-black-hole-is-vexing-astronomers,37,,1645733105.0
t0zaxw,Ancient DNA and deep population structure in sub-Saharan African foragers,Anthropology,60,0.88,science,https://www.nature.com/articles/s41586-022-04430-9.epdf?,3,,1645779009.0
t0gloh,"Scientists have found approximately 1,000 plant species were newly identified as potential sources of five different B vitamins: B1, B2, B3, B5 and B9. They also discovered that 63 of the plants are threatened in their natural environment.",Health,912,0.96,science,http://www.imperial.ac.uk/news/234115/researchers-identify-1044-underused-plants-that/,24,,1645724169.0
t0yvck,Africa’s oldest human DNA helps unveil an ancient population shift,Genetics,62,0.85,science,https://www.sciencenews.org/article/africa-oldest-human-dna-mating-long-distance-stone-age,1,,1645777223.0
t0qcx9,A new way of dating collisions between asteroids and planetary bodies throughout our Solar System’s history could help scientists reconstruct how and when planets were born.,Geology,208,0.95,science,https://www.cam.ac.uk/research/news/microscopic-view-on-asteroid-collisions-could-help-us-understand-planet-formation,2,,1645750164.0
t0r5ux,Largest bacterium ever discovered has an unexpectedly complex cell | Science,Biology,156,0.94,science,https://www.science.org/content/article/largest-bacterium-ever-discovered-has-unexpectedly-complex-cells,10,,1645752426.0
t09ral,"New study shows that rising temperatures are causing Earth’s coldest forests to shift northward, raising concerns about biodiversity, an increased risk of wildfires and mounting impacts of climate change on northern communities.",Environment,1150,0.93,science,https://www.eurekalert.org/news-releases/944401,38,,1645705433.0
t0rq6l,NASA Helps Fly 'Vanilla' Ice Drone to Study Arctic Sea Ice Thickness. Here’s What That Means for Sea Ice and Sea Level Change.,Environment,87,0.91,science,https://www.nasa.gov/feature/goddard/2022/nasa-helps-fly-drone-in-alaska-to-study-sea-ice-thickness,3,,1645754099.0
szygdk,"Vegetarians have 14% lower cancer risk than meat-eaters, study finds",Health,21246,0.77,science,https://www.theguardian.com/lifeandstyle/2022/feb/24/vegetarians-have-14-lower-cancer-risk-than-meat-eaters-study-finds,1457,,1645667405.0
t17aoc,Attempts to close the gender divide in Wikipedia biographies covering women increase focal article length and page views; no effects on focal article quality or centrality.,Social Science,7,0.59,science,https://academic.oup.com/joc/advance-article-abstract/doi/10.1093/joc/jqac004/6529454?redirectedFrom=fulltext,1,,1645804665.0
t1fj50,"An Innovative, Paradigm-Shifting Lifestyle Intervention to Reduce Glucose Excursions With the Use of Continuous Glucose Monitoring to Educate, Motivate, and Activate Adults With Newly Diagnosed Type 2 Diabetes: Pilot Feasibility Study",Health,2,0.58,science,https://diabetes.jmir.org/2022/1/e34465,4,,1645825810.0
t0oclf,"The unprecedented fires that devastated parts of Australia in 2020 can be attributed in part to colonialism. The arrival of British settlers disrupted Indigenous burning practices, setting the stage for large and destructive blazes.",Anthropology,115,0.74,science,https://esajournals.onlinelibrary.wiley.com/doi/10.1002/fee.2395,16,,1645744516.0
t14b82,Revealing the armour of superbug C. difficile,Biology,6,0.62,science,https://www.nature.com/articles/s41467-022-28196-w,1,,1645796490.0
t10ut2,Dephosphorylation accelerates the dissociation of ZAP70 from the T cell receptor,Biology,12,0.69,science,https://www.pnas.org/content/119/9/e2116815119,2,,1645784946.0
t0i5pa,"A chemical -ammonia borane- used in electric vehicle batteries could also give us carbon-free fuel for space flight, in addition to emission reductions, this chemical also has several advantages over other types of rocket fuels: higher energy, lower costs, and no requirement for frozen storage",Engineering,254,0.94,science,https://news.ucr.edu/articles/2022/02/23/streets-stratosphere-clean-driving-technology-enables-cleaner-rocket-fuel,20,,1645728165.0
t1343x,Quantum sensing for gravity cartography,Physics,10,0.72,science,https://www.nature.com/articles/s41586-021-04315-3,1,,1645792917.0
t0k8ui,Physicists report a quantum sensor that uses atom interferometry to sense gravitational changes that can detect a tunnel under a city street.The sensor is shown to be capable of detecting a tunnel of two-metre-square cross-sectional area under a road surface between two multi-storey buildings.,Physics,146,0.93,science,https://www.nature.com/articles/d41586-022-00464-1,10,,1645733678.0
szus5v,Climate change is intensifying Earth's water cycle at twice the predicted rate,Earth Science,5167,0.94,science,https://www.theguardian.com/environment/2022/feb/24/climate-change-is-intensifying-earths-water-cycle-at-twice-the-predicted-rate-research-shows,225,,1645657428.0
t0su3s,Artificial intelligence to help farmers see cloud-covered fields. A Cornish start-up has developed a technique using artificial intelligence to predict what the surface of the UK looks like under gloomy skies.,Earth Science,29,0.79,science,https://www.bbc.com/news/science-environment-60513742,2,,1645757325.0
t0tvb1,A soft thumb-sized vision-based sensor with accurate all-round force perception,Engineering,20,0.69,science,https://www.nature.com/articles/s42256-021-00439-3,1,,1645760312.0
t0l7mg,A new dimension in Stem Cell Signaling - German-Argentinian Max Planck Partner groups reveal molecular morse code in stem cells encrypting differentiation information,Genetics,69,0.84,science,https://www.eurekalert.org/news-releases/944557,2,,1645736258.0
t10vm0,The bacterial toxin colibactin triggers prophage induction.,Biology,7,0.69,science,https://doi.org/10.1038/s41586-022-04444-3,2,,1645785024.0
t0mtxf,Why Women Seem to Have Better COVID-19 Outcomes Than Men,Biology,28,0.79,science,https://time.com/6149597/women-covid-19-estrogen/,4,,1645740466.0
t0a0y1,"Severe COVID-19 in pregnancy increases the risk of pre-labor caesarean birth, a very or extreme preterm birth, stillborn birth, and the need for admission to a neonatal intensive care unit. But the data show that vaccination protects pregnant women from illness and the need for hospital admission.",Medicine,141,0.87,science,https://www.bmj.com/content/376/bmj.o480,3,,1645706293.0
t0iydv,Oxford Team Create a “First Draft” of Humanity’s Family Tree,Biology,37,0.81,science,https://www.technologynetworks.com/genomics/news/oxford-team-create-a-first-draft-of-humanitys-family-tree-358935,3,,1645730278.0
t0okzv,"A comprehensive map of genetic relationships among diagnostic categories based on 48.6 million relative pairs from the Danish genealogy [""Heritability estimates for mental disorders were consistently the highest ...whereas estimates for cancers were the lowest""]",Biology,15,0.75,science,https://www.pnas.org/content/119/6/e2118688119,1,,1645745180.0
t06v4e,Hiring women into senior leadership positions is associated with a reduction in gender stereotypes in organizational language,Social Science,193,0.79,science,https://www.pnas.org/content/119/9/e2026443119,9,,1645694845.0
szqr0r,"Study estimates that each individual sight-seeing visitor to the Antarctic Peninsula contributes about 80 additional tons of snowmelt annually, & each researcher about 600 tons. Black carbon concentrations were considerably higher near tourist routes and research stations than elsewhere.",Environment,2096,0.94,science,https://www.inverse.com/science/researchers-tourists-pollute-antarctica,64,,1645647216.0
t0f9zr,"Low doses of the organic insecticide spinosad trigger lysosomal defects, elevated ROS, lipid dysregulation, and neurodegeneration in flies | popular organic insecticide spinosad has profound effects on beneficial insects",Biology,43,0.8,science,https://elifesciences.org/articles/73812,6,,1645720716.0
t01ib4,"New research shows that the red rock towers found in Southern Utah and throughout the Colorado Plateau are in constant motion, vibrating with their own signature rhythms",Geology,436,0.95,science,https://attheu.utah.edu/facultystaff/measuring-the-tempo-of-utahs-red-rock-towers/,24,,1645676125.0
szt3gg,"Effects of 5 Years Aerobic Exercise on Cognition in Older Adults: The Generation 100 Study: A Randomized Controlled Trial - Sports Medicine — Overall, exercise was not significantly associated with cognition among older adults.",Health,1301,0.85,science,https://link.springer.com/article/10.1007/s40279-021-01608-5,135,,1645653173.0
t0l45y,Tumor tissue modified viral (TTMV)-HPV DNA biomarker test predicts recurrence of HPV-driven oropharynx cancer after treatment,Genetics,17,0.81,science,https://www.eurekalert.org/news-releases/944353,2,,1645736013.0
t0694d,People who own a dog have a much lower risk of disability in older age,Health,109,0.89,science,https://www.newscientist.com/article/2309337-dog-owners-are-half-as-likely-to-develop-a-disability-in-older-age/,13,,1645692403.0
szeuit,"Firearms have overtaken car crashes as main cause of premature US trauma deaths. Firearm homicides also increased, rising from 11,493 deaths in 2009 to 13,958 in 2018, equivalent to 633,656 years of potential life lost in 2018, up from 554,260 in 2009.",Health,24146,0.67,science,https://www.eurekalert.org/news-releases/944021,3694,,1645614212.0
t09p5q,"Physicists report the first experimental observation of the quantum-boomerang effect in the momentum space of a Bose-Einstein condensate (BEC). After being pushed in one direction, the average momentum of a Bose-Einstein condensate is seen to slow and return to its original value.",Physics,50,0.81,science,https://physics.aps.org/articles/v15/s24,2,,1645705241.0
szft9n,"Science journalists are blamed for exaggerating, but a new study suggests that journalists are actually pretty careful when reporting science and they tend to ""contextualize and temper scientific conclusions within the broader space,"" not exaggerate.",Anthropology,4914,0.84,science,https://www.zmescience.com/science/journalists-temper-not-exaggerate-scientific-claims-22022022/,293,,1645617682.0
szlvmv,Baby boomers are the unhappiest generation in the UK. People born between 1946 and 1964 reported lower happiness than other cohorts in surveys spanning 16 years – probably because the size of the group means more competition.,Psychology,1419,0.92,science,https://www.newscientist.com/article/2309317-baby-boomers-are-the-unhappiest-generation-in-the-uk/,148,,1645634740.0
t04mxe,Demonstration of a portable quantum sensor for measuring the gravitational field gradient. The sensor has been used to detect a 2m tunnel under a road in an urban setting.,Physics,94,0.92,science,https://doi.org/10.1038/s41586-021-04315-3,10,,1645686287.0
t0e2a1,Short‐Duration High Frequency MegaHertz‐Order Nanomechanostimulation Drives Early and Persistent Osteogenic Differentiation in Mesenchymal Stem Cells,Health,19,0.74,science,https://onlinelibrary.wiley.com/doi/abs/10.1002/smll.202106823,7,,1645717515.0
t0l5tw,New stem cell population provides a new way to study the awakening of the human genome - Cells resembling the 8-cell embryo will help researchers advance our knowledge of the earliest events in development,Genetics,8,0.73,science,https://www.eurekalert.org/news-releases/944463,1,,1645736129.0
t0fxmc,French-fried potatoes consumption and energy balance: a randomized controlled trial,Health,11,0.65,science,https://pubmed.ncbi.nlm.nih.gov/35179193/,12,,1645722425.0
t0ay1k,Mosquitoes might be attracted to certain colours – new research,Animal Science,20,0.75,science,https://theconversation.com/mosquitoes-might-be-attracted-to-certain-colours-new-research-176423,15,,1645708994.0
szyll7,'Superionic' material found inside Earth's inner core,Earth Science,164,0.92,science,https://www.usatoday.com/story/news/world/2022/02/15/superionic-material-found-inside-earths-inner-core/6796897001/,36,,1645667823.0
t05wn7,A biophysical account of multiplication by a single neuron,Neuroscience,46,0.85,science,https://www.nature.com/articles/s41586-022-04428-3,3,,1645691008.0
szvc76,"X-rays help unlock secrets of King Tut’s iron dagger, made from a meteorite",Materials Science,215,0.93,science,https://arstechnica.com/science/2022/02/x-rays-help-unlock-secrets-of-king-tuts-iron-dagger-made-from-a-meteorite/,6,,1645658882.0
sznylx,"Researchers develop a cheap sensor that can detect dangerous infections hiding in chronic wounds (common in diabetics). It works by simply ""sniffing"" for CO2.",Chemistry,549,0.95,science,https://www.wired.com/story/this-plastic-dot-sniffs-out-infections-doctors-cant-see/,5,,1645640071.0
t0c15a,"Acceptance and Commitment Therapy improves quality of life in people with muscle diseases. Participants receiving ACT demonstrated a statistically significant improvement in their quality of life, including their independence, social and emotional functioning and body image",Psychology,15,0.69,science,https://www.kcl.ac.uk/news/acceptance-and-commitment-therapy-improves-quality-of-life-in-people-with-muscle-diseases,2,,1645712124.0
sz3gv2,"Court-related fees imposed on misdemeanor defendants saddle them with debt, place them at risk of ongoing court involvement (through new warrants and debt collection), have no crime deterrence impact, and do not meaningfully lead the state to recover the costs of trial.",Social Science,27235,0.93,science,https://doi.org/10.1177%2F00031224221075783,778,,1645577131.0
t0ancg,Nitrogen recycling via gut symbionts increases in ground squirrels over the hibernation season,Biology,13,0.7,science,https://www.science.org/doi/10.1126/science.abh2950,3,,1645708086.0
szj84e,"Children with higher exposure to air pollution and lower exposure to green space have 62% increased risk of ADHD. On the contrary, children living in greener and less polluted areas have a 50% lower risk of developing the disorder.",Environment,742,0.92,science,https://www.eurekalert.org/news-releases/944392,76,,1645627747.0
t0e68p,"Ancient DNA and deep population structure in sub-Saharan African foragers — we present genome-wide ancient DNA data for six individuals from eastern and south-central Africa spanning the past approximately 18,000 years (and 28 other individuals)",Genetics,8,0.79,science,https://www.nature.com/articles/s41586-022-04430-9,3,,1645717816.0
t06wru,"The importance of race, gender, and religion in naturalization adjudication in the United States",Social Science,14,0.69,science,https://www.pnas.org/content/119/9/e2114430119,3,,1645695037.0
szve3p,"Women who experience sexual assault, workplace harassment are more likely to develop hypertension, study says",Psychology,67,0.79,science,https://eu.usatoday.com/story/news/health/2022/02/23/sexual-assault-workplace-harassment-linked-hypertension-nih-study/6910071001/,10,,1645659019.0
t0cjj6,Nutritional Benefits from Fatty Acids in Organic and Grass-Fed Beef,Health,4,0.6,science,https://www.mdpi.com/2304-8158/11/5/646/htm,4,,1645713520.0
szr6of,"A new study from Karolinska Institutet in Sweden shows how certain RNA molecules control the repair of damaged DNA in cancer cells, a discovery that could eventually give rise to better cancer treatments - The study is published today in the journal Nature Communications.",Genetics,114,0.92,science,https://www.eurekalert.org/news-releases/944181,2,,1645648357.0
szt4sh,Scientists enhance energy storage capacity of graphene supercapacitors via solar heating,Materials Science,86,0.89,science,https://techxplore.com/news/2022-01-scientists-energy-storage-capacity-graphene.html,5,,1645653267.0
szhk6i,"Children eat what they like, but food intake driven more by what they dislike: results of a new study suggests that when it comes to meals, it is more accurate and more relevant to say, “children do not eat what they dislike.”",Social Science,368,0.9,science,https://www.psu.edu/news/research/story/children-eat-what-they-food-intake-driven-more-what-they-dislike/,44,,1645623090.0
szpn39,"Associations Between Unprocessed Red Meat and Processed Meat With Risk of Recurrence and Mortality in Patients With Stage III Colon Cancer — Findings In this cohort study of 1011, intake of unp red meat or p meat was not associated with risk of cancer recurrence or death or overall mortality.",Cancer,94,0.81,science,https://jamanetwork.com/journals/jamanetworkopen/fullarticle/2789266,25,,1645644376.0
