post_id,title,flair,score,post_upvote_ratio,subreddit,url,num_comments,body,created
t4z38e,Only half of US adolescents receive adequate sex education — and Black and Hispanic youth are especially left behind,Social Science,26570,0.86,science,https://www.psypost.org/2022/03/only-half-of-us-adolescents-receive-adequate-sex-education-and-black-and-hispanic-youth-are-especially-left-behind-62664,1089,,1646224197.0
t5o9e5,New research hypothesizes nerve damage is the cause of long COVID symptoms in some people. The small study found treating patients with immunotherapies targeting the neuropathy could improve long COVID symptoms.,Neuroscience,171,0.9,science,https://newatlas.com/health-wellbeing/nerve-damage-vagus-long-covid/,1,,1646301817.0
t61zpn,Whole-genome sequencing reveals new secrets about killer fungus - New research from the University of Exeter reports the largest ever whole-genome sequencing project for the potentially fatal yeast infection Candida glabrata from hospitals across Scotland.,Genetics,21,0.79,science,https://www.eurekalert.org/news-releases/945108,1,,1646342299.0
t5sl0u,Gene Editing Gets Safer Thanks to Redesigned Cas9 Protein,Genetics,70,0.85,science,https://news.utexas.edu/2022/03/02/gene-editing-gets-safer-thanks-to-redesigned-protein/,2,,1646317132.0
t5gwos,AI Model Detects Mental Disorders Based on Web Posts,Health,608,0.87,science,https://home.dartmouth.edu/news/2022/03/ai-model-detects-mental-disorders-based-web-posts?page=698,127,,1646274665.0
t61yip,"Common cause of heart attacks in younger adults linked to gene variants - Disruptive variants in genes involved in the production of collagen are implicated in spontaneous coronary artery dissection, a major cause of heart attacks in women under 50.",Genetics,18,0.73,science,https://www.eurekalert.org/news-releases/945216,1,,1646342204.0
t61wcm,New method to produce chemically modified mRNA developed - University of Cologne,Genetics,18,0.76,science,https://www.eurekalert.org/news-releases/945261,1,,1646342042.0
t61tyr,Boosting function and survival of stem cell-derived pancreatic cells by genetic engineering - International Society for Stem Cell Research,Genetics,14,0.74,science,https://www.eurekalert.org/news-releases/945230,1,,1646341857.0
t5os7g,"An oral medication shows benefits treating Type 1 diabetes for at least two years after diagnosis. Benefits of the blood pressure medication verapamil include delayed disease progression, lowered insulin requirements and preservation of some beta cell function.",Medicine,97,0.89,science,https://www.eurekalert.org/news-releases/944927,2,,1646304026.0
t61sg5,"Understanding genomes, piece by piece - Genomes are made up of thousands of individual pieces – genes – which are expressed at different levels. Researchers at EMBL have shed light on how the placement of a gene affects its expression, as well as that of its neighbours",Genetics,13,0.79,science,https://www.eurekalert.org/news-releases/945227,2,,1646341748.0
t61265,Autopsy Histopathologic Cardiac Findings in Two Adolescents Following the Second COVID-19 Vaccine Dose,Medicine,11,0.67,science,https://meridian.allenpress.com/aplm/article/doi/10.5858/arpa.2021-0435-SA/477788/Autopsy-Histopathologic-Cardiac-Findings-in-Two,7,,1646339773.0
t5nfgd,Sewage Water Could Be Purified For Drinking And Mined For Treasure,Environment,106,0.83,science,https://www.cnet.com/news/sewage-water-could-be-purified-for-drinking-and-mined-for-treasure/,22,,1646298230.0
t61jqo,SwRI-designed ultraviolet instrument to play integral part of NASA’s Europa Clipper mission - Europa-UVS will search for potential water vapor plumes erupting from a moon of Jupiter.,Astronomy,10,0.81,science,https://www.eurekalert.org/news-releases/945288,1,,1646341119.0
t5vfnh,Nostalgia Successfully Relieves Physical Pain,Psychology,20,0.81,science,https://thedebrief.org/nostalgia-successfully-relieves-physical-pain/,8,,1646324981.0
t5iyiv,"People with weakened immune systems established to respond poorer to covid-19 vaccines, but a third dose of a covid-19 mRNA vaccine is associated with seroconversion among vaccine non-responders with solid cancers, blood cancers, and immune mediated inflammatory disorders",Medicine,173,0.88,science,https://www.bmj.com/content/376/bmj-2021-068632,13,,1646281159.0
t5nxk9,"Sturdy 3D-printed objects can be broken down into materials that can be used to print new objects. Researchers 3D printed a model Easter Island head using a novel ink, then degraded the figure into numerous tiny particles, created a new ink from the particles and used this to 3D print a toy boat.",Chemistry,65,0.86,science,https://www.nature.com/articles/d41586-022-00590-w,2,,1646300418.0
t61qdn,New tool reveals function of enigmatic gene sequences - Karolinska Institutet,Genetics,5,0.67,science,https://www.eurekalert.org/news-releases/945286,1,,1646341587.0
t5t3y3,Inferring lumbar lordosis in Neandertals and other hominins,Anthropology,22,0.74,science,https://academic.oup.com/pnasnexus/article/1/1/pgab005/6540637,3,,1646318646.0
t4y1b7,These solar panels pull in water vapor to grow crops in the desert,Earth Science,3036,0.96,science,https://techxplore.com/news/2022-03-solar-panels-vapor-crops.html,129,,1646220068.0
t5m84n,‘Powerful warm wind’ seen blowing through the universe after neutron star devours its neighbour,Astronomy,58,0.86,science,https://www.independent.co.uk/space/neutron-star-wind-explosion-universe-b2026918.html,8,,1646293102.0
t4shzq,"Two Supermassive Black Holes on Track to Collide Will Warp Space and Time in about 10,000 years.",Astronomy,9169,0.96,science,https://www.cnet.com/news/two-supermassive-black-holes-on-collision-course-will-warp-space-and-time/,735,,1646198072.0
t5s3oz,The application of machine learning to predict genetic relatedness using human mtDNA hypervariable region I sequences,Biology,14,0.78,science,https://journals.plos.org/plosone/article?id=10.1371/journal.pone.0263790#sec021,1,,1646315726.0
t5hrsl,Researchers demonstrate how milk can trigger MS symptoms,Health,80,0.86,science,https://newatlas.com/health-wellbeing/how-milk-dairy-triggers-ms-symptoms-allergy-immune/,4,,1646277348.0
t55y81,Genetic overlap between bipolar disorder and intelligence,Psychology,438,0.91,science,"https://www.med.uio.no/norment/english/research/news-and-events/news/2019/genetic-overlap-bipolar-disorder-intelligence.html#:~:text=They%20found%20that%2012%20risk,was%20associated%20with%20cognitive%20impairment.",63,,1646243823.0
t4p80l,ADHD linked to 'significantly higher' risk of hoarding.Study found people with attention deficit/hyperactivity disorder (ADHD) have a significantly higher frequency of hoarding symptoms compared to the general population. This indicates that hoarding should be routinely assessed in those with ADHD.,Neuroscience,6207,0.97,science,https://theconversation.com/hoarding-people-with-adhd-are-more-likely-to-have-problems-new-research-176211,424,,1646187866.0
t5eb5u,"Covid has intensified gender inequalities, global study finds",Social Science,89,0.61,science,https://www.theguardian.com/world/2022/mar/02/covid-intensified-existing-gender-inequalities-global-study-finds,30,,1646266766.0
t5uaf5,Astronomers thought they'd found the closest black hole to Earth. It turns out they were wrong.,Astronomy,5,0.61,science,https://www.eso.org/public/news/eso2204/,6,,1646321873.0
t50xgn,Thoughts of harming baby a normal but unpleasant part of postpartum experience. It is the first large-scale study to investigate the relationship between postpartum-occurring obsessive compulsive disorder (OCD) and maternal aggression towards the infant,Psychology,468,0.94,science,https://www.eurekalert.org/news-releases/945045,51,,1646230170.0
t5p7re,COPD or chronic airflow obstruction in sub-Saharan Africa,Epidemiology,10,0.73,science,https://www.ingentaconnect.com/contentone/iuatld/ijtld/2022/00000026/00000003/art00001,1,,1646305769.0
t5p8u5,Small lungs and cardiovascular disease,Epidemiology,8,0.75,science,https://respiratory-research.biomedcentral.com/articles/10.1186/s12931-022-01939-5,5,,1646305888.0
t54ezn,“Closest black hole” system found to contain no black hole,Astronomy,155,0.94,science,https://www.eso.org/public/news/eso2204/,9,,1646239852.0
t57ta6,"The ozone layer is often seen as a success story for human action to correct a climate emergency – but a new study has shown that smoke from wildfires, such as those that recently devastated parts of Australia, can deplete the ozone layer further, delaying its recovery.",Earth Science,100,0.88,science,https://newatlas.com/environment/wildfire-smoke-damage-ozone-layer/,5,,1646248735.0
t5alyk,The Universe’s First Type of Molecule Is Found at Last,Astronomy,52,0.82,science,https://www.nasa.gov/feature/the-universe-s-first-type-of-molecule-is-found-at-last,15,,1646256344.0
t4wt4f,Zero-emission vessels being developed for Europe's ferry industry,Earth Science,401,0.97,science,https://techxplore.com/news/2022-03-zero-emission-vessels-europe-ferry-industry.html,4,,1646214910.0
t5dzgh,Chinese researchers build 100 Trillion Parameter AI model (571x larger than GPT-3),Computer Science,31,0.71,science,https://spectrum.ieee.org/china-us-militarized-ai,16,,1646265806.0
t5h7ql,Self-organization and information transfer in Antarctic krill swarms | Proceedings of the Royal Society B: Biological Sciences,Biology,16,0.75,science,https://royalsocietypublishing.org/doi/10.1098/rspb.2021.2361#.Yh9jpQaLG1l,1,,1646275618.0
t4lnbh,"People who are relatively sleep-deprived at home increase the amount of time they sleep when they travel. Data from thousands of wearable monitors suggest that travelling can help people to catch up on sleep, contrary to popular belief.",Neuroscience,2204,0.97,science,https://www.nature.com/articles/s41562-022-01291-0,68,,1646177468.0
t4axr9,"People who are more vulnerable to having their jobs replaced by automation tend to be more supportive of radical right-wing groups, according to new research",Social Science,36050,0.81,science,https://www.psypost.org/2022/02/exposure-to-automation-boosts-support-for-the-radical-right-study-finds-62650/,2488,,1646149753.0
t4wuk9,"San Andreas fault line could cause greater earthquakes than first thought, researchers say",Earth Science,243,0.95,science,https://www.independent.co.uk/climate-change/news/san-andreas-fault-earthquakes-california-study-b2025289.html,24,,1646215079.0
t59z79,UChicago study shows promise for treating resistant tumors with unique approach,Cancer,25,0.83,science,https://news.uchicago.edu/story/could-tiny-devices-made-out-dna-treat-cancer,3,,1646254560.0
t4e6y1,"Face masks play a crucial role, new Covid research confirms",Health,3397,0.78,science,"https://news.cision.com/chalmers/r/face-masks-play-a-crucial-role--new-covid-research-confirms,c3513165",755,,1646158101.0
t5e4xf,Recovery time of a plasma-wakefield accelerator | Nature,Physics,11,0.75,science,https://www.nature.com/articles/s41586-021-04348-8,1,,1646266256.0
t4z9e9,"Abrupt shifts in the evolution of animals have long been a challenge for theorists including Darwin. Now, evolutionary biologists have proposed a new statistical model which seeks to explain these sudden changes and long periods of stasis",Biology,92,0.95,science,https://www.nature.com/articles/s41467-022-28595-z,11,,1646224809.0
t4qa9t,"Stonehenge may have been an ancient solar calendar, study finds",Anthropology,495,0.87,science,https://www.nbcnews.com/science/weird-science/stonehenge-may-ancient-solar-calendar-study-finds-rcna18020,96,,1646191068.0
t56uan,"UCI researchers find fewer low-cost air pollution sensors in disadvantaged communities | First-of-its-kind state study examined distribution, sociodemographic factors over time",Social Science,28,0.76,science,https://news.uci.edu/2022/03/02/uci-researchers-find-fewer-low-cost-air-pollution-sensors-in-disadvantaged-communities/,7,,1646246146.0
t4yz0o,Nanoparticles of discarded tires cause reduced growth in indicator estuarine species,Environment,78,0.94,science,https://www.sciencedirect.com/science/article/abs/pii/S0045653522004271,6,,1646223747.0
t4cw7h,"Small particles from tires inhibited the growth and caused adverse behavioral changes in organisms found in freshwater and coastal estuary ecosystems, two new Oregon State University studies found. Tire particles are one of the most common microplastic types in aquatic ecosystems.",Environment,2431,0.97,science,https://today.oregonstate.edu/news/tiny-tire-particles-inhibit-growth-organisms-freshwater-coastal-estuaries-studies-find,116,,1646154770.0
t50ho9,Study: Fungal infections cost U.S. $6.7B in a year,Medicine,51,0.81,science,https://news.uga.edu/fungal-infections-cost-us-6b-a-year/?utm_medium=social&utm_content=text_link&utm_source=reddit&utm_campaign=news_release,8,,1646228848.0
t4xniq,Scientists have found lower oxidative stress in children who live and study near green spaces. The association between green space and oxidative stress was not found to be related to the frequency of children's physical activity,Environment,92,0.94,science,https://www.isglobal.org/en/-/study-finds-lower-oxidative-stress-in-children-who-live-and-study-near-green-spaces,5,,1646218531.0
t5bl14,Personality traits associate with behavioral problems in pet dogs,Animal Science,13,0.88,science,https://www.nature.com/articles/s41398-022-01841-0,0,,1646259047.0
t5ax8n,"Erythrocytes Induce Vascular Dysfunction in COVID-19 — Mechanistically, we show that targeting reactive oxygen species or arginase 1 improves vascular dysfunction mediated by red blood cells.",Health,10,0.69,science,https://www.ncbi.nlm.nih.gov/labs/pmc/articles/PMC8849181/,6,,1646257251.0
t58i3c,"Population-scale dietary interests during the COVID-19 pandemic - “The largest (up to threefold) increases occurred for calorie-dense carbohydrate-based foods such as pastries, bakery products, bread, and pies.”",Epidemiology,10,0.67,science,https://www.nature.com/articles/s41467-022-28498-z,6,,1646250568.0
t42b06,New fast radio burst found in area that shouldn’t have any sources,Earth Science,15242,0.96,science,https://arstechnica.com/science/2022/02/new-fast-radio-burst-found-in-area-that-shouldnt-have-any-sources/,553,,1646119537.0
t4kre2,Researchers find that certain immune cells help breast cancer cells to metastasize to lymph nodes. Interfering in this process could stop metastasis early in its tracks.,Cancer,509,0.96,science,https://www.cell.com/cell-reports/fulltext/S2211-1247(22)00174-7,5,,1646175097.0
t4qylx,Tiny Robots Could Remove Chemical Pollution From Our Waterways,Environment,179,0.92,science,https://www.cnet.com/news/tiny-robots-could-remove-chemical-pollution-from-our-waterways/,13,,1646193150.0
t4ccl2,"Porous kitchen sponges provide the perfect physical architecture for a bacterial community, offering the ideal number of compartments of varying sizes for the microbes to occupy, a study finds.",Health,1195,0.96,science,https://www.sciencenews.org/article/sponge-kitchen-bacteria-microbe-diversity,260,,1646153409.0
t4otf6,"Methylene Blue, a century old medicine, is a highly effective, broad-spectrum UV irradiation protector that absorbs UVA and UVB, repairs ROS (Free Radicals) and UV irradiation induced DNA damages, and is safe for coral reefs",Health,191,0.92,science,https://www.eurekalert.org/news-releases/944735,38,,1646186653.0
t4ik4v,"Labelling of plastic products needs a drastic overhaul including a new 'sustainability scale' to help consumers. Estimates of recycling rates vary dramatically. For example, Germany recycles 62% of its plastic waste. Meanwhile, China recycles an estimated 25%, while the figure in the USA is just 8%.",Environment,461,0.94,science,https://www.exeter.ac.uk/research/news/articles/plasticlabellingneedssust.html,24,,1646169300.0
t4hqyx,Feeding small fish to people instead of to farmed salmon could make seafood production more sustainable: Study finds redirecting wild-caught fish towards human consumption instead of salmon farming could relieve pressure on fish stocks while increasing seafood production.,Environment,496,0.94,science,https://www.eurekalert.org/news-releases/944148,52,,1646167208.0
t4vdrr,"Carbon emissions from deforestation doubled in two decades and continue to accelerate, with animal agriculture and oilseed production being some of the main drivers",Environment,54,0.89,science,https://www.nature.com/articles/s41893-022-00854-3,1,,1646208768.0
t476og,"Alcohol use by parents of young children was related to how many bars and restaurants were near where they shopped, where they worked and where their children went to school, a new study finds.",Social Science,1542,0.87,science,https://news.osu.edu/how-the-density-of-bars-restaurants-affects-parents-alcohol-use/,188,,1646138910.0
t58am6,A liquid fraction of extracellular matrix inhibits glioma cell viability in vitro and in vivo,Cancer,3,0.64,science,https://www.oncotarget.com/article/28203/text/,2,,1646250013.0
t4f5s0,"Study using human blood samples suggests antibodies from 2-dose mRNA vaccines against the original SARS-CoV-2 virus & early variants wane substantially over time & offer essentially no protection against omicron. Breakthrough COVID-19 infection + vaccine increased immunity, but not against omicron.",Medicine,394,0.87,science,https://news.osu.edu/booster-critical-as-covid-19-vaccine-induced-antibodies-wane-in-6-months-dont-protect-against-omicron/,75,,1646160561.0
t4xlm9,Using data from 10 states scientists have found that two doses of an mRNA vaccine provide protection against COVID-19 associated emergency department and urgent care visits as well as very high protection against hospitalization among adolescents aged 12 to 17,Epidemiology,19,0.72,science,https://www.cdc.gov/mmwr/volumes/71/wr/mm7109e3.htm?s_cid=mm7109e3_w,6,,1646218308.0
t55vef,Constraints for electric charge from Maxwell's equations and boundary conditions,Physics,5,0.78,science,https://doi.org/10.1088/1402-4896/ac50c7,1,,1646243614.0
t45eus,Ultrasound scan can diagnose prostate cancer. The ultrasound scans missed only 4.3 per cent more clinically important prostate cancer cases – cancer that should be treated rather than monitored – compared to magnetic resonance imaging (MRI) scans currently used to detect prostate cancer,Cancer,1302,0.97,science,https://www.eurekalert.org/news-releases/944840,74,,1646132446.0
t41c2a,A study has reported the results of the first modern clinical investigation to compare the acute effects of psychedelics LSD and psilocybin. The study reveals little subjective difference between the two drugs beyond LSD lasting longer than psilocybin.,Neuroscience,2946,0.95,science,https://newatlas.com/science/study-compares-lsd-psilocybin-experiences-trial-differences/,346,,1646115831.0
t4x0kw,Researchers propose an economical and accurate power estimation method to inform energy conservation decisions for commercial buildings. The technology will enable commercial building energy-managers to make low-cost as well as highly accurate energy-saving proposals.,Environment,17,0.81,science,https://www.tus.ac.jp/en/mediarelations/archive/20220228_3861.html,2,,1646215771.0
t4c47y,Scientists discover one-centimeter long bacterium that’s visible to the naked eye,Biology,420,0.96,science,https://english.elpais.com/science-tech/2022-03-01/the-one-centimeter-long-bacterium-thats-visible-to-the-naked-eye.html,17,,1646152797.0
t3t9ru,"Muscle strengthening lowers risk of death from all causes, study shows",Health,15653,0.97,science,https://www.theguardian.com/society/2022/feb/28/muscle-strengthening-lowers-risk-of-death-from-all-causes-study-shows,458,,1646091155.0
t4anc5,Photosynthesis rates are increasing globally due to rising CO2 levels,Environment,372,0.95,science,https://www.newscientist.com/article/2309890-photosynthesis-rates-are-increasing-globally-due-to-rising-co2-levels/,32,,1646149013.0
t3o15q,"Study reveals road salt is increasing salinization of lakes and killing zooplankton, harming freshwater ecosystems that provide drinking water in North America and Europe:",Environment,68810,0.94,science,https://www.inverse.com/science/america-road-salt-hurting-ecosystems-drinking-water,2336,,1646077487.0
t4qfus,How omicron’s mutations make it the most infectious coronavirus variant yet: A unique anatomy may have fueled omicron’s dominance,Health,32,0.75,science,https://www.sciencenews.org/article/covid-coronavirus-omicron-variant-mutation-infectious,1,,1646191534.0
t4m369,"Combining questions about a person’s health with data from smartwatch sensors, a new app developed using research at Princeton University can predict within minutes whether someone is infected with COVID-19.",Health,52,0.79,science,https://engineering.princeton.edu/news/2022/02/28/deep-learning-diagnoses-edge-ai-detects-covid-19-smartwatch-sensors,3,,1646178708.0
t48udf,"Penn Medicine awarded $12.3m NIH grant to study ultra-fast, high-dose flash radiation therapy for cancer | Researchers to study best methods for administering emerging form of radiotherapy treatment with shorter duration and frequency",Cancer,290,0.95,science,https://www.eurekalert.org/news-releases/944775,5,,1646144063.0
t4sxmq,Paper airplanes show off new aerodynamic effects,Physics,15,0.68,science,https://www.futurity.org/paper-airplanes-flight-stability-aerodynamics-drones-2704682-2/?utm_source=rss&utm_medium=rss&utm_campaign=paper-airplanes-flight-stability-aerodynamics-drones-2704682-2,2,,1646199545.0
t4l7fc,"Secondary craters around larger craters are well known from other planets and moons but have never been found on Earth until now. Several dozen small impact craters, 10-70 m in size, have been discovered in southeastern Wyoming, formed by ejected blocks from a large primary crater.",Geology,52,0.84,science,https://www.geosociety.org/GSA/News/pr/2022/22-07.aspx,4,,1646176279.0
t4pfeh,Pharmaceutical pollution of the world’s rivers,Environment,25,0.84,science,https://www.pnas.org/doi/10.1073/pnas.2113947119?,2,,1646188494.0
t42o0a,"Tyrannosaurus rex may have been three species, scientists say. Experts say there is enough variation in samples to argue there was also a Tyrannosaurus imperator and a regina",Paleontology,494,0.94,science,https://www.theguardian.com/science/2022/mar/01/tyrannosaurus-rex-may-have-been-three-species-scientists-say,43,,1646121019.0
t4ic07,Scientists have discovered that a human receptor protein has the ability to detect individual amino acids in the same way bacteria do. This could lead to better GABA-derived drugs & adds to the sparse evidence of commonalities between bacteria & humans – sensing essentials such as oxygen & food.,Biology,39,0.8,science,https://news.osu.edu/the-rare-discovery-of-a-protein-function-universal-to-bacteria-and-humans/,2,,1646168710.0
t4czfg,"Feeling deprived of affection was associated with important mental health outcomes during lockdown, study finds",Psychology,74,0.85,science,https://www.psypost.org/2022/03/feeling-deprived-of-affection-was-associated-with-important-mental-health-outcomes-during-lockdown-study-finds-62655,6,,1646155004.0
t3hu50,White police officers are substantially more likely than non-white officers to use force and shoot civilians when they are dispatched to minority neighborhoods. [Data from 1.6 million 911 calls],Social Science,22153,0.8,science,https://www.aeaweb.org/articles?id=10.1257/aer.20201292,1727,,1646061227.0
t4gm84,RIT astrophysicist awarded research leave to study gravitational waves as a Simons Fellow - Associate Professor Richard O’Shaughnessy named a 2022 Simons Fellow in Theoretical Physics,Physics,38,0.78,science,https://www.eurekalert.org/news-releases/945024,1,,1646164338.0
t4hlgf,"Early menopause may raise risk of dementia later in life: Women who enter menopause very early, before age 40, were found to be more likely to develop dementia of any type later in life compared to women who begin menopause at the average menopause-onset age of 50 to 51 years.",Health,33,0.81,science,https://www.eurekalert.org/news-releases/944454,2,,1646166808.0
t4bniu,Archerfish can distinguish animals from nonanimals—even if they’ve never seen them before | Study finds fish rely heavily on shape to categorize new objects,Animal Science,62,0.87,science,https://www.science.org/content/article/archerfish-can-distinguish-animals-nonanimals-even-if-they-ve-never-seen-them,4,,1646151603.0
t4rtte,"Modeling assortative mating and genetic similarities between partners, siblings, and in-laws [""We found evidence of genetic similarity between partners for educational attainment (rg = 0.37), height (rg = 0.13), and depression (rg = 0.08)""]",Biology,8,0.79,science,https://www.nature.com/articles/s41467-022-28774-y,1,,1646195852.0
t4fc31,"A team from the MBL has discovered a DNA modification system in animals, previously only seen in bacteria",Biology,29,0.8,science,https://www.mbl.edu/blog/mbl-team-discovers-new-dna-modification-system-in-animals-captured-from-bacteria/,3,,1646161007.0
t3d7sm,"Climate change causing widespread and irreversible impacts, says IPCC",Environment,41306,0.85,science,https://www.newscientist.com/article/2309795-climate-change-causing-widespread-and-irreversible-impacts-says-ipcc/,1585,,1646046684.0
t4hrr0,"Individuals in England reduced social contacts by up to 75% during the COVID-19 pandemic: Transmission of respiratory viruses depends partly on the rate of close social contacts in a population. In the United Kingdom, the number of reported contacts decreased by 75% from pre-pandemic levels.",Health,22,0.82,science,https://www.eurekalert.org/news-releases/944336,2,,1646167259.0
t4kcde,An integrated solar-driven system produces electricity with fresh water and crops in arid regions,Environment,15,0.77,science,https://www.sciencedirect.com/science/article/pii/S2666386422000480,1,,1646173988.0
