post_id,title,flair,score,post_upvote_ratio,subreddit,url,num_comments,body,created
t6v057,Applied on 1/25 I have since applied elsewhere interviewed and accepted a different job. Something tells me this company complains no one wants to work.,,14,0.82,WorkReform,https://i.redd.it/p5rdefqc3gl81.jpg,0,,1646433759.0
t71lfg,Some guidance on how to to quit would be appreciated,,4,0.84,WorkReform,https://www.reddit.com/r/WorkReform/comments/t71lfg/some_guidance_on_how_to_to_quit_would_be/,5,"I started January 25th, part time, $13 an hour. Not great but it was a place I really wanted to work. 

They figure out I’m a great employee and dump an entire second job (Assessments) on me in addition to the job I was hired for (Support). 

I met with my boss and asked for a $2 raise to match the compensation that the Assessment person gets. He said as long as I was part time he couldn’t raise my salary, but if I went to full time and became a manager they’d give me $15. I told him I wanted to think about it and I’d talk to him Monday. 

I don’t want to work there anymore. It’s been a huge struggle and there’s incompetence everywhere. How do I go about this? Is it ok to just text my boss and tell him I won’t be back?",1646455065.0
t70jcd,ADVICE WANTED: Former manager made employees buy coffee whenever we were late,,6,0.88,WorkReform,https://www.reddit.com/r/WorkReform/comments/t70jcd/advice_wanted_former_manager_made_employees_buy/,5,"Pretty much exactly what the title says.

The manager of a small car audio company in Kennewick that I (then 18M for context) used to work for would make whoever was late buy coffee for all of the salesman working that day, otherwise they'd get written up.

The coffee would be purchased with our own money and we would have to clock out to go get it (all us salesmen were on hourly), thus losing even more money.

Was my manager breaking any labor laws in doing this? If so, am I still able to report him even though I no longer work for the company?",1646451367.0
t5ql19,Over $600.00 before deductions and less than $400.00 after. I brought home more money when I started this job at $11.00 an hour than I am making $16.30 an hour. Soul crushing. I would GLADLY pay a little more taxes to avoid paying such high premiums on insurance that barely covers anything.,,9536,0.95,WorkReform,https://i.redd.it/jfm3lfqkx5l81.jpg,998,,1646310757.0
t6nwhi,"I keep getting Anti-union, or ""opt out"" junk mail at home from some dumb foundation - how can I tell them to screw off and get my name off their list?",,37,0.97,WorkReform,https://www.reddit.com/r/WorkReform/comments/t6nwhi/i_keep_getting_antiunion_or_opt_out_junk_mail_at/,9,"I'm a teacher in a union, unions are great, but apparently my union shared union info and now all union members are getting junk mail from some ""freedom foundation"" bullshit - How can I get my mailbox to stop being crammed with this shit every week?",1646414258.0
t71txq,Job threatened because i refuse to be treated like a child.,,4,0.7,WorkReform,https://www.reddit.com/r/WorkReform/comments/t71txq/job_threatened_because_i_refuse_to_be_treated/,2,"My job requires you to ask customers to be in their ""free "" club. No problem there. Ill ask every customer. What i dont feel the need to do is RECORD EVERY ONE MYSELF. 

They want a tally of every customer that gets a NEW card. The the current customers dont count towards our ""goal"" so it always looks like we are slacking. 

Heres the thing. Besides asking people to join the club, i have ZERO control over what we do with said numbers. I dont plan sales, i dont track customer orders, nothing. 

The kicker? The only reason they want US to personally tally it is to see if we are lying. Why? Why treat me like a child when you can plainly see the numbers and could ask me about the dip. 

When i refused to record them myself, I was told, ""its your job."".......the unspoken part of that was ""to do what i tell you to""

I wont be someone's child. I come in, i stay late, i work hard, i stay busy. Since when was that not enough???",1646455924.0
t72tkp,How long does a call back usually take? Us. Illinois,,3,1.0,WorkReform,https://www.reddit.com/r/WorkReform/comments/t72tkp/how_long_does_a_call_back_usually_take_us_illinois/,2,"Handed an app Friday. 

Monday they wanted an “interview” 
Quotations because they just told me the same stuff from Friday. Talked a bit about the job. They looked like they hadn’t even looked at my application. 

Ended by telling me they’ll call me. That they’ll do the back ground check. Been 5 days now. No call. They have my number. I’ve texted the boss already last Friday when I dropped the app. 

Just hate not knowing anything. Lol. Thank you. Let me know if I should delete this.

Edit. I have it understood that they need people. Just hate being in the dark. I want to work lol",1646459575.0
t5vkbm,"Employees unionizing isn't a ""blow"" to Starbucks. Unions are associated with higher productivity, lower employee turnover, improved workplace communication, and a better-trained workforce.",,2961,0.99,WorkReform,https://i.redd.it/z7saor4s47l81.jpg,69,,1646325322.0
t6tq3d,REI disables chat on post. FB ad got blasted to pieces for trying to block the union. I guess they learned a lesson.,,15,0.69,WorkReform,https://i.redd.it/u4qgeqfksfl81.jpg,6,,1646430132.0
t6nxaq,The story of John: the homeless man who lives on my street works more hours than most people I know.,,30,1.0,WorkReform,https://www.reddit.com/r/WorkReform/comments/t6nxaq/the_story_of_john_the_homeless_man_who_lives_on/,2,"I really feel like the collapse is coming soon. It’s crazy how many people think or say shit like “homeless people are just lazy drug addicts!” Well let me tell you a story about John (name changed for his privacy.) 

When I first met John, I didn’t know he was homeless. I went into the tobacco shop, when I first moved here, to go get some blunt wraps. John works there. He’s gruff and grumpy, he looks kinda like a rough around the edges type. I didn’t think much of it other than “ah he’s probably just some crotchety old guy who doesn’t have much to say. I usually love to chat it up with people but he wasn’t really having it. 

Well fast forward over the next few months, I go in almost every other day and John is always working. Maybe twice in the last six months it wasn’t him at the counter but instead the owner of the store. I inquired about John and the owner said he was “out sick.” I started catching on pretty quick that this dude usually works every day from open until close. 9am-9pm most days. 

There’s nothing really across the street so I didn’t go over there much, but one night my girlfriend and I decided to go for a walk, low and behold, the homeless man sleeping in the doorway of the abandoned shop across from the center with the tobacco shop, is John. What the hell! I couldn’t believe it. This dude works probably close to 80-90 hours A WEEK and lives on the street. I was truly heartbroken. 

My partner and I don’t have much means, but last Christmas we had a crap ton of food left over because a bunch of my friends and family dropped off food as I was going through recovery from a surgery at the time. We decided we could never finish the leftovers ourselves so we made up two big ass plates and heated them up and wrapped them in foil, a bag of pan dulce and cookies, and some hot chocolate with a little rum. We figured they deserve as much as anyone for a little extra warmth. Well we brought it over to them, along with a joint, so maybe they would sleep a little better or help their body pain some. (We asked them if they drank/smoke and we brought the hot chocolate without the booze mixed in.) It was pouring when we brought them the food, John’s girlfriend, we’ll call her Mary, started crying and thanking us profusely. 

We told them we genuinely didn’t want to embarrass them or anything but we had a ton of leftovers and could never finish it and wanted them to have a nice Christmas dinner too! We talked to them for a bit and turned out John and Mary both have full time jobs. John also had a triple bypass less than 4 months before that Christmas! Mary also struggled with various health problems. 

I couldn’t believe it, I cried the whole walk home and for an hour after we got inside. We didn’t know what else to do to help, but sometimes when we have extra stuff we stop over and ask if they need anything. 

This story is not to get any praise but to just show that this capitalism shit is really failing. These people don’t deserve this.. they succumbed to the same temptations that capitalism praises us for! Markets to us.. why should we allow people to suffer like this and demonize them?? 

Truly just such a sad sight to behold.. working 90 hours of your week to sleep on the street.. what the fuck. We nee this system to move in to something better, and fast.",1646414318.0
t5y57r,Good ones do exist,,1860,0.99,WorkReform,https://i.redd.it/z524dmnpo7l81.jpg,81,,1646331981.0
t5w7s0,"“Just get a job? Why don’t I strap on my job helmet and squeeze down into a job cannon and fire off into Jobland, where jobs grow on jobbies!”",,2261,0.99,WorkReform,https://i.redd.it/w6w7ek3r97l81.png,125,,1646327001.0
t6rw83,"TX school districts vote to sanction burned out teachers who resign mid-year. AISD has a “Chief of Human Capital” 🤔 (neat title, isn’t it? 😒)",,14,0.95,WorkReform,https://www.reddit.com/gallery/t6rw83,6,,1646425064.0
t72ybi,"Massachusetts demanding thousands of dollars of unemployment ""overpayment"" from the people struggling the most financially. I love my country.",,2,0.75,WorkReform,https://www.boston25news.com/news/local/thousands-mass-residents-told-they-owe-state-unemployment-overpayments/AXVXPXXNEJHOLEHA6DBOV3WHPE/,3,,1646460065.0
t6oybc,Was told at 7:40pm last night that nobody would be getting paid. President lied about why,,18,1.0,WorkReform,https://www.reddit.com/r/WorkReform/comments/t6oybc/was_told_at_740pm_last_night_that_nobody_would_be/,3,"In an email from the President. Essentially, he said ""Good evening everyone. I hope you've all had a good week. We've made the decision to work with a different financial institution. This means we will be moving payday from Friday to Monday. I only found out an hour ago that this will be happening and there's nothing I can do about it. Sorry for the late notice. But on a more positive note, we're bringing on two more accounts! This is a great time for (company) and I'm glad you're all a part of it.""

He's lying about using a new financial institution. Payroll hasn't changed. He just didn't send the wire for it. Why? Nobody knows. The company has made over a million dollars last year. He knew this would happen Wednesday when he didn't send the wire and chose not to tell anybody until the night before. 

Then the part about bringing on more accounts. We are. But we're already short staffed. This means ""Congratulations! You've all got a lot more work to do."" But we're not getting paid. 

Payroll won't be processed on Monday, even if he sends the wire today.

He's blatantly lying. And he has the audacity to expect everyone to keep working diligently today as if nothing happened. Nobody is working today.

Edit: This is the second time this has happened. The first time was in September. Nobody was paid. CEO needed a mental health break and took two weeks off while everyone else was left wondering if we still had jobs.",1646417066.0
t6yj3p,How can I respectfully word an email negotiating more vacation time afyer a job offer.,,4,1.0,WorkReform,https://www.reddit.com/r/WorkReform/comments/t6yj3p/how_can_i_respectfully_word_an_email_negotiating/,3,"After following this sub and finally beimg fed up with my current work environment, I started looking for a new job. I went through 3 interview stages, each 1.5hrs long and all of them were extremely positive, the best I have ever experiences. Today I visited the site for about 5 hours (called out of work to do so) and had another great experience. 

I have been looking for a more positive environment and a pleasant place to work and this definitely seems to be it. At the end of the day the owner sat me down and presented me with a compensation package. They offered me 7.5% more that I am making now (6 figures) and a bonus structure 66% more than my current one. The only gripe I have is the vacation plan. They offered 12 days vacation, my current job gives me 20 (French owned, so a global standard) but my current job sucks. How can I politely word an email negotiating an additional 5 days of vacation time without blowing my chances?

I feel their monetary compensation package to be extremely generous for the size of the company so I feel guilty for asking for more vacation time but I want to make sure I have adequate time with my family (my wife gets 6 weeks). How would you go about wording this?",1646444653.0
t6mlp4,"If you’re somehow confused about why people are unhappy with the economy even though job growth is good, you should maybe read up on ever-increasing costs for health care, housing, energy and other basic necessities of life as corporations and billionaires reap a jackpot.",,19,0.95,WorkReform,https://twitter.com/davidsirota/status/1499770657415974917,0,,1646410799.0
t5y5s1,Maybe it was Big Pharma's plan all along. Just because it's a conspiracy doesn't mean it's not true.,,1011,0.97,WorkReform,https://i.imgur.com/aXOK06d.jpg,56,,1646332026.0
t6yua9,Been working as an esthetician for 5 years and I’ve had to take time off for work related tendonitis that makes it impossible to work. My job assures me they are covering everything through our worker’s comp but disability pay is taking forever. It’s been 2 months- why is this taking so long??,,3,1.0,WorkReform,https://www.reddit.com/r/WorkReform/comments/t6yua9/been_working_as_an_esthetician_for_5_years_and/,3,,1646445661.0
t70l2m,Employee Appreciation Day,,2,1.0,WorkReform,https://www.reddit.com/r/WorkReform/comments/t70l2m/employee_appreciation_day/,2,Everyday should be employee appreciation day,1646451547.0
t5rif5,"Pay scale for teachers in Seminole County, FL. I work a county over and make 13,000 less than this.",,2241,0.98,WorkReform,https://i.redd.it/ugj2zjvb66l81.png,475,,1646313858.0
t684j9,Busting some myths on taxation comparing USA vs. a Nordic country (Finland),,205,0.97,WorkReform,https://www.reddit.com/r/WorkReform/comments/t684j9/busting_some_myths_on_taxation_comparing_usa_vs_a/,51,"Hello,


please bear with me as this is my 2nd ever Reddit post hence formatting will propably be a shitshow.

I just noticed [this post](https://old.reddit.com/r/WorkReform/comments/t5ql19/over_60000_before_deductions_and_less_than_40000/) on this subreddit and decided to compare their wages to mine as it seemed similar and I am under the impression many Americans believe the Nordics tax people very heavily.


From the post we can see that they earned $617.07 in a workweek, working 37 hours after which the takeaway was $385.24, bringing total taxes and deductions to a whopping 37,6%! Net earned is hence 62,4% and net per day is $77.406, gross per day is $123.414.

I'll use the ""official"" calculation method of 21.5 workdays a month, that we use here in Finland in pretty much everywhere.

My salary in Finland in my job year is 2476.54€ per month. I will earn my monthly salary times 12.5 this year, since we get a holiday pay each year, totalling 30 965.75€. I am working 8 hour days with an hour non-paid lunch each day. Two 10 minute coffee breaks. Job is very relaxed, no stress over it.


Every worker in Finland earns holiday days and holiday pay if they are working enough, rules for accruing holiday days and hence holiday pay are [here](https://www.tyosuojelu.fi/web/en/employment-relationship/annual-holidays/number-of-holiday-days).

My total net/takehome each month with a similar salary as per the post I linked will on average 1928€ assuming I do not work overtime, which should not happen in my work. With the 21.5 workdays rule each month that means average net daily of just a few euro cents under 90 euros. Compare that to the just the 77 dollars of the post I linked.
In addition to the salary abowe, I will be getting half a month's of salary before my yearly summer holiday, as per the law and I will take a 4 week paid holiday in the summer.

I used our governmental tax administration's [official tax percentage calculator](https://www.vero.fi/en/individuals/tax-cards-and-tax-returns/tax_card/tax-percentage-calculator/) to do the math.
I did not input any deductions that would make me pay less taxes, these might be using your own car to drive long distances to work etc. These can actually give you tax breaks in Finland!

So while the American (I assume American) paid taxes and deductions on a similar salary for 37.6%, I pay them for 22.15%. This 22.15% includes actual taxes for 13.5%, national unemployment insurance for 1.5% and national pension insurance contribituon for 7.15% all of which I benefit from.

I do not have to pay for healthcare except for a measly twenty something euros if I need to go to the doctor, all yearly health payments are capped at 800 euros a year.

I also wanted to include some graphs.

Median salaries in the [USA](https://www.ssa.gov/OACT/COLA/central.html) and [Finland](https://stat.fi/tup/kokeelliset-tilastot/tulorekisterin_palkat_ja_palkkiot/2021-joulukuu/index.html) (notice the spikes in the summer holidays, that is the holiday pay people are getting just as they head to summer holidays in july and august)
Also here is a chart depicting [tax brackets in Finland](https://www.veronmaksajat.fi/luvut/Laskelmat/Palkansaajan-veroprosentit/). Though taxation rises heavily the more you earn, as you can see in in the marginal tax rate (the tax you pay from the money earned above what you make now) low income earners pay very little tax in Finland and we pay pretty much nothing ""extra"" beyond taxes. Some consumer goods are more expensive like gasoline for example which is around the 2€/l mark now, but housing is quite affordable compared to North America for example, especially out of the Helsinki metropolitan area.

Tl;dr: In short, you are getting royally fucked, I am paying less in taxes and deductions and taking more home than this poor American fella and getting much more out of them in nearly free healthcare, education etc.

Edit: please point out any errors I might have made and I'll rectify them.",1646360283.0
t6r8j0,Your life belongs to us,,9,0.91,WorkReform,https://i.redd.it/kp6jdlo18fl81.jpg,9,,1646423232.0
t6nl4s,"For Employment Appreciation Day at my job, all employees received….",,11,0.87,WorkReform,https://www.reddit.com/r/WorkReform/comments/t6nl4s/for_employment_appreciation_day_at_my_job_all/,1,A 2 sentence email saying how much they appreciate us!!,1646413394.0
t6768k,My company decided to cut everyone's pay,,183,0.98,WorkReform,https://www.reddit.com/r/WorkReform/comments/t6768k/my_company_decided_to_cut_everyones_pay/,54,"After like 5 rounds of layoffs in the last year, and outsourcing a lot of our work to some company in India, the mortgage company I work for just decided to cut the commissions for everyone in my department. These account for over a third of my income and are now only 15% of what they were before. Not gonna be able to afford rent now, I was already living paycheck to paycheck. How is this legal?",1646357328.0
t6ucy1,forced working 7 days a week 14 hour days; WHILE CAMPING IN SHIT,,4,0.75,WorkReform,https://www.reddit.com/r/WorkReform/comments/t6ucy1/forced_working_7_days_a_week_14_hour_days_while/,2,"To start this is in the state of California. 

There is a program here called the California Conservation Corps (CCC) that houses and works young adults in California for ""environmental conservation purposes.""

Part of the program is what they call ""Emergencies"", where the people in the ""program"" can ordered to be transported far distances to camps supporting personal fighting wildfires with as little as 2 hours to prepare.. where they are worked **FOR 2-3 WEEKS STRAIGHT, 14 HOURS A DAY MINIMUM**. You do not know how long you will be there, and they withhold the information from the workers. You will be fired if you ask to work fewer hours. You will be fired if you ask to not roll on an ""Emergency"". These ""Emergencies"" are planned ahead of time, and aren't simply responding to a natural disaster.

**They sleep in small tents, often times in animal pens with literal shit everywhere.** There are no guidelines around labor laws that are followed. *Temperatures are often extremely hot, air condition is extremely poor, and the work is labor intensive(and outside).*

Several people experience extreme burnout and emotional distress going as far as **injuring themselves.** Most of the people in the CCC are neuro-diverse, struggling and looking for help, which the CCC advertises itself as being accepting and helping, mind you. 

I saw somebody suffering from a breakdown literally smash their metal canteen into their head repeatedly from stress, they were fired weeks later.
 
After the 2-3 weeks are up, crews get 2-3 days of ""rest"" (Which may include working a normal project, such as removing invasive plants) before being sent back out to another camp.

Oh and **overtime pay isn't time and a half. It's $16 hour flat** because crews are paid on a stipend. (And they're told we can't unionize because it's a ""program"", constantly)

nbsp;

I think this is an excellent microcosm of what's wrong with our labor system.

TL;DR: The bold parts.",1646431912.0
t5w22r,"Why can’t I save more than 2,000?",,870,0.98,WorkReform,https://www.reddit.com/r/WorkReform/comments/t5w22r/why_cant_i_save_more_than_2000/,189,"I get my tax return and I finally have 2 grand in my savings but not even a week later my car needs over $1,000 fix. Every. Single. Time. I get above $1500 there’s a major bill in my life. It’s exhausting. On one hand I’m lucky I have the money right now but I was also so close to living on my own. I just feel trapped in poverty.",1646326627.0
t6yffz,"Anyone know the law related to working a temporary position (for an event) where you work 6 days and ~80 hours when it comes to OT, but the company workweek is in the middle of that period? Friend got ripped off, but are being told it's legal.",,2,0.75,WorkReform,https://www.reddit.com/r/WorkReform/comments/t6yffz/anyone_know_the_law_related_to_working_a/,3,"Long story short: they worked over 80 hours over a six day period. The company's official workweek has been and *is* Thursday-Thursday, basically. As such, conveniently for them, the checks were split up into two ~40 hour checks - instead of an 80+ hour check with lots of OT pay. 

They called the state's labor line, to which ended up getting routed to some national help-line, where they were informed that since the company has ~always had the same workweek (they didn't change it for the event, in other words), then it's legal and there's nothing you can do about that. Such is the ""luck"" of when they started and so on. 

Seems to me such a law/rule would be ripe for exploitation. And, as we can see here, it is - coincidence or not. 

Anyone have any insight andor resources?",1646444318.0
t6ohkc,Would you EVER consider working for Amazon?,,6,0.67,WorkReform,https://www.reddit.com/r/WorkReform/comments/t6ohkc/would_you_ever_consider_working_for_amazon/,22,"After everything you’ve heard about working there, would you ever consider it? 

If you’ve already worked there, “Hell no” is probably the option that you’re looking for.

[View Poll](https://www.reddit.com/poll/t6ohkc)",1646415808.0
t5gwl1,hOw cAn YoU dO tHiS TO Uss ?!,,10605,0.98,WorkReform,https://i.redd.it/essi6499y2l81.jpg,234,,1646274655.0
t6li0y,"""Resources""",,8,0.79,WorkReform,https://www.reddit.com/r/WorkReform/comments/t6li0y/resources/,12,"Reform starts with the words we use. Let's de-normalize the use of the word ""resources"" to talk about people. 

It's a creepy, dehumanizing, devaluing thing to say, and so naturally it has become standard business vocabulary. 

We have a perfectly good word for people. It's *""people""*. Don't add resources. *Hire people.* And don't reduce resources. Confront the fact that you're talking about *firing people*. 

I'll also accept ""folks"". 

""Talent"" also sucks. When someone refers to people as ""talent"", they mean those people should be flattered to be considered such important ""resources"".",1646407850.0
t6o51t,Unionization isn't Unionism,,5,1.0,WorkReform,https://gusselsprouts.substack.com/p/unionization-isnt-unionism,0,,1646414889.0
t6ivm9,A Labor Movement to Challenge the Billionaires,,8,0.91,WorkReform,https://www.ueunion.org/ue-news/2022/a-labor-movement-to-challenge-the-billionaires,0,,1646400181.0
