post_id,title,flair,score,post_upvote_ratio,subreddit,url,num_comments,body,created
t40yty,"Earned almost a third of a company's gross revenue, made less than half the people in the office",,180,0.98,WorkReform,https://www.reddit.com/r/WorkReform/comments/t40yty/earned_almost_a_third_of_a_companys_gross_revenue/,23,"I see some people sharing stories here, and I thought mine might fit in. I run Amazon accounts for a living. I'm fairly good at it. My first time running an account was courtesy of a company taking a chance on me. But I dug into the position and very quickly realized I was good at it. In relatively short time, what was an account earning almost nothing hit half a million in a year. Almost $2 million the year after that. Three years in, and we're hitting half a mil every month. 

In doing this job, I created the artwork for listings (taught myself Illustrator), I wrote product copy, optimized everything for search, ran ads, and did a dozen different things completely unrelated to the job description. I actually built custom applications for data analysis and task automation for my job. Even ran customer service when the manager was out. 

And then I realized it. My boss was selling to small businesses, that were in turn selling on Amazon. See, any work I did benefited anyone selling our product along side us. If I improved a listing, it made more money for *everyone*. I knew these stores carried our product, but what I didn't realize was he collecting commission on them. Had been the whole time. 

Also, the new guy they hired was bored out of his mind with no work to do, but turned out he was getting paid more than me. The web developer, graphic artist, accountant, and even sales reps were too. I became privy to sales figures for other areas of the company, and found I was pulling in 30% of the entire company's revenue. By myself. I generated more revenue than the entire sales team. 

To put it into perspective, if I had quit my job from the beginning, bought the product at wholesale value, and sold it on Amazon myself, I'd be making $65k a month after 3 years. One store my boss sold to was making about $20k a month in profit from our products. 

We had COVID make its way into the office around this time. I quit shortly after when I was asked to take on more work and ""we can discuss a possible pay raise in the future if it goes well."" Yeah, no thanks. I work from home now, have unlimited PTO, and get to work with my dog sitting next to me.",1646114528.0
t3cm1x,Stop telling minimum wage causes inflation,,6637,0.98,WorkReform,https://i.redd.it/trsw7phzwjk81.jpg,284,,1646044250.0
t495to,"There are good jobs/employers/bosses out there. Keep looking for one, now is the time!",,31,0.9,WorkReform,https://www.reddit.com/r/WorkReform/comments/t495to/there_are_good_jobsemployersbosses_out_there_keep/,1,"I love my job and am passionate about what I do. My boss is great and we really get along. I recently had my annual review, everything was pretty procedural. At the end my boss tells me that I have been preforming above my pay grade for two years now. In response to that I was given a promotion and a raise. 

All workers deserve to be treated like this. Find somewhere where you are. 

Never despair, nothing without labour.",1646144969.0
t4bhfa,I asked for $15 minimum for a Healthcare job that would have me cleaning up blood. They said they needed to reconsider other candidates,,21,0.93,WorkReform,https://www.reddit.com/r/WorkReform/comments/t4bhfa/i_asked_for_15_minimum_for_a_healthcare_job_that/,3,"So I'd applied to a position as a front desk person at a dental office. Recently I made the decision to relocate in a couple months. I called the company back to let them know.

They brightened, telling me they actually had some temporary positions to fill. They wanted me to come in today. This job is for a sterilization assistant- would have me cleaning up after procedures, and this would definitely include blood.

I'd already accepted a fast food job that I'm using purely to save. Fast food job pays $12/hr.

I'd asked before what they would be paying and they tried to tell me to wait for the interview. I called back today and told them I never any to a job without knowing the pay (which is true). They said, ""Well because it's just a temporary job for a sterry assistant, the range would be $12-$17 depending on experience. But the doctor makes the final offer.""

I told her, ""Well a fast food job is paying $12/hr, so to clean up blood I'm going to need at least $15/hr.""

She replied, ""OK. I'll tell [coworker] to reconsider other candidates.""

I was initially hesitant to ask, but I'm glad I did. If I'm choosing between a longer drive to do a fairly unpleasant (and potentially hazardous) job, or a shorter drive to a job that would give me a free meal every day and discounts on others- I mean, is that even a question for anyone?",1646151162.0
t4iqi7,How do you fight feeling guilty for poor performance?,,8,0.9,WorkReform,https://www.reddit.com/r/WorkReform/comments/t4iqi7/how_do_you_fight_feeling_guilty_for_poor/,6,"I work for a start up that has dragged me through the mud for years. Promises of bonuses that never happen, opportunities to train in other areas given and then taken away, a micromanager boss who is a self-described ""prick"", and constantly shifting goal posts. After four years I feel beat down.

So I stopped working as hard. I make $17 an hour for a job that usually pays 60-70k for high performers (which I once was). Now, I spend my days doing the bare minimum, defending myself constantly for my work. I feel both guilty and completely undervalued at the same time.

I'm looking for another job, but how do I stop feeling guilty for not putting 110% into a job that quite frankly never rewarded me when I did? I'm the kind of person who places a lot of value in what I can do, but now that I'm not doing it, I feel shitty.

Can anyone relate? Besides getting a new job, is there anything I can do to alleviate the guilt?",1646169759.0
t4lrbj,How do I ask for an annual raise when my job has stayed consistent?,,3,0.72,WorkReform,https://www.reddit.com/r/WorkReform/comments/t4lrbj/how_do_i_ask_for_an_annual_raise_when_my_job_has/,10,"My 1 year mark is coming up at my job and I’m wondering how I should ask for a raise when I don’t feel like my job has gotten harder in a year. 

I have definitely changed responsibilities as needed, but I wouldn’t necessarily say it’s been “more work”. 

I don’t feel like I go above and beyond at my job. I don’t work extra hours, and I’m very strict on my work life balance. I’m completing my work every day, and never leave anything unfinished, but it’s also work that isn’t very time bound. I do my 40 hours and I’ve only worked over a few times this year. 

I always finish my work quickly (I would say ahead of my colleagues), and help out when asked. What would be the best way for me to have this conversation with my boss? 

Also to point out I feel as if I have a very good relationship with my direct supervisor but I’m not even sure if he’s the one in charge of payroll. I feel comfortable talking to him though and would obviously do this over the phone (WFH job, my boss lives out of state). 

Any advice or phrases I should use?",1646177784.0
t3s3cs,Sorry you made too much in tips! Management needs a piece of the cut.,,360,0.98,WorkReform,https://www.reddit.com/gallery/t3s3cs,54,,1646088029.0
t3k2tu,Huge News out of Ontario!!!,,1024,0.99,WorkReform,https://i.redd.it/cjotjrvptlk81.png,12,,1646067315.0
t4kj5h,Oh you want to call off for being sick? What kind of sick?,,4,1.0,WorkReform,https://www.reddit.com/r/WorkReform/comments/t4kj5h/oh_you_want_to_call_off_for_being_sick_what_kind/,8,"Jesus Christ, why the fuck do employers feel the need to ask how or what kind of sickness you have when trying to call off a day in advance. We have sick days for a reason do we not? Am I supposed to have a life threatening illness in order for them to be like “oh ok no worries, get better & we’ll see you the day after”",1646174484.0
t4727f,Read a book and thought of you,,23,1.0,WorkReform,https://www.reddit.com/r/WorkReform/comments/t4727f/read_a_book_and_thought_of_you/,1,"""America is the wealthiest nation on Earth, but its people are mainly poor, and poor Americans are urged to hate themselves. To quote the American humorist Kin Hubbard, 'It ain’t no disgrace to be poor, but it might as well be.' It is in fact a crime for an American to be poor, even though America is a nation of poor. Every other nation has folk traditions of men who were poor but extremely wise and virtuous, and therefore more estimable than anyone with power and gold. No such tales are told by the American poor. They mock themselves and glorify their betters. The meanest eating or drinking establishment, owned by a man who is himself poor, is very likely to have a sign on its wall asking this cruel question: 'if you’re so smart, why ain’t you rich?' There will also be an American flag no larger than a child’s hand – glued to a lollipop stick and flying from the cash register.

Americans, like human beings everywhere, believe many things that are obviously untrue. Their most destructive untruth is that it is very easy for any American to make money. They will not acknowledge how in fact hard money is to come by, and, therefore, those who have no money blame and blame and blame themselves. This inward blame has been a treasure for the rich and powerful, who have had to do less for their poor, publicly and privately, than any other ruling class since, say Napoleonic times. Many novelties have come from America. The most startling of these, a thing without precedent, is a mass of undignified poor. They do not love one another because they do not love themselves.""

Kurt Vonnegut slaughterhouse 5",1646138483.0
t4amux,"As of March 1, GMG Union is officially on strike. They're asking people not to click on—or contribute content to— Gizmodo, Jalopnik, Jezebel, Kotaku, Lifehacker, and The Root. FAIR CONTRACT NOW",,11,0.93,WorkReform,https://twitter.com/gmgunion/status/1498661232030666752,2,,1646148974.0
t4cjnk,Like... why else?,,8,0.9,WorkReform,https://www.reddit.com/r/WorkReform/comments/t4cjnk/like_why_else/,1,"&#x200B;

https://preview.redd.it/rc485zk5zsk81.png?width=843&format=png&auto=webp&s=2b7ab1734ed447b7d974e4aa6d95c4c107d337f7",1646153902.0
t48syo,IT job : Can’t handle the stress,,13,1.0,WorkReform,https://www.reddit.com/r/WorkReform/comments/t48syo/it_job_cant_handle_the_stress/,10,"I have reached my saturation point. It’s been 5 years since I started in IT. I have jumped several projects except every project has been a single-developer team. Me and a manager that I report to. Last two months , I have worked an avg of 15 hours a day. 

How do you deal with the stress ?

PS : I logged out of work today because of the constant throbbing pain in my wrist and fingers. I had it a year back for almost 3 months and I’m not ready to deal with it again.",1646143947.0
t3xsyk,Poll Shows Majority of US Voters Blame Corporate Profiteering for Inflation,,99,1.0,WorkReform,https://www.commondreams.org/news/2022/02/28/poll-shows-majority-us-voters-blame-corporate-profiteering-inflation,9,,1646104437.0
t4ainc,My experience working at a chocolate store / café,,10,0.92,WorkReform,https://www.reddit.com/r/WorkReform/comments/t4ainc/my_experience_working_at_a_chocolate_store_café/,1,"So I got my first job last year and I was really happy. I thought I'd finally be able to live on my own, so I rent a house and moved in. I live in Brazil, so I'll explain this in our local currency, but for the record, R$1 is worth about USD 0,19.

They were paying me about R$1500 a month for 9 hours a day, 6 days a week.  This averages R$ 6,66 BEFORE taxes, so that means I was working my ass off for USD 1,29 an hour before taxes. Kind of hard to believe, but this is way above the minimum wage over here.

The house I rent was in very poor condition, in a very poor and violent area, and it cost me about R$750 per month. Other expenses such as groceries, electricity, water and internet bills were about another R$710 per month. I didn't have the money to pay all that because taxes, so I had the help of my parents. I was living mostly off noodles and eggs. It's also important to note that I am very conservative about electricity and water, so I kept all uses to the bare minimum. I've not even mentioned the meds I have to take, because I have depression and autism. They're expensive af and there's no way to get them for free.

The work conditions were shit. It was at the mall and we didn't have a restroom in the store. So we had to walk all the way to the mall's restroom whenever we needed to pee. That's not a problem per se, but the manager often gave us an earful when we needed to pee.

I often had to work overtime, with no extra payment. This was at least 4 times a week.

My only day off during the week was always in the middle of the week, in a Tuesday or Wednesday.

I barely had any time to breathe, as we were always understaffed, with 4 or 5 employees to keep a giant ass store running. Sometimes 3.

The customers were mostly very rude Karens. I had to listen to insults all day, because of course the fault was on me if the line was gigantic and we didn't have any change. Not because we were severely understaffed or because they gave us almost no change money to work with.

I had to fullfill all roles, clean the store, wash dishes, take care of the inventory, be a cashier, serve customers, and a hell of a lot more.

The last straw was when I had food intoxication. My manager forced me to work when I was so sick that I couldn't stand still without throwing up or shitting my pants. The other day I went to the hospital, and they said I couldn't work until I got better. My boss said it was hard to work with me because I was unreliable, then he threatened to fire me. So I said fuck it, and quit that job for good.

Because of this job I sank deeper into my depression, and had frequent panic attacks. It also gave me PTSD because of how poorly I was treated and how hard they made me work.

TLDR: I had a job where I was mentally abused and overworked, barely had money to eat, and it aggravated my mental disorders, while also acquiring some new ones.

If anyone wants to know the name of the company, I'll gladly say it. Just ask in the comments.",1646148657.0
t4bocd,"Fast food owner in St. Thomas, Ont. Ups the Ante - paid birthdays off, paid breaks, retirement plans, free meals and uniforms! Wages start at $1 above minimum wage too.",,8,0.84,WorkReform,https://www.cbc.ca/news/canada/london/fast-food-owner-in-st-thomas-ont-ups-the-ante-on-benefits-to-keep-staff-happy-1.6367015?__vfz=medium%3Dsharebar&fbclid=IwAR0dfBwzpUA1f3W44l59n0tLp07UB5-I_E-eHBbgZ2nAq3n41xGz7LSidYY,2,,1646151655.0
t4lset,something to think about..pick a side,,2,0.75,WorkReform,https://news.yahoo.com/how-much-is-corporate-greed-fueling-inflation-210156552.htmlll,0,,1646177869.0
t4flkn,Need advice for roommate who got skimped 1/2 their pay and now being ghosted by employer,,3,0.81,WorkReform,https://www.reddit.com/r/WorkReform/comments/t4flkn/need_advice_for_roommate_who_got_skimped_12_their/,11,"For context they started a new job at a privately owned doggy daycare business in WA state. The business has no management tier other than the owner which results in miscommunication and tension among staff. My roommate put in two full weeks of work and got only half their earned pay, now the owner is giving away their shifts and avoiding email and phone communication. The owner infrequently shows up at the building which makes it difficult to arrange a meeting.

My roommate doesn't know what to do and can't afford to take the matter to court. Any advice that I can pass on to them?",1646161666.0
t4doeh,Former geologist turns coffee cart into full-blown shop on CU Denver campus. Owner making an average of what the employees do to incentivize raising wages for all workers.,,5,0.86,WorkReform,https://www.denverpost.com/2022/03/01/dnvr-coffe-co-anschutz-medical-campus/,0,,1646156826.0
t4ki3k,Crazy ass work schedule,,2,0.75,WorkReform,https://www.reddit.com/r/WorkReform/comments/t4ki3k/crazy_ass_work_schedule/,1,"I am needing to vent about this crazy fucking work schedule my work is forcing us to do. I work in customer service (WFH currently) for a company that helps with online security. I normally work Monday-Friday 7-3:30 and I love it. When I got hired back in November of 2021 we were required to work Saturdays which rotated between me and the other 2 customer service reps. In January of this year they temporarily paused Saturday shifts to see if it was worth it or not to have us work them.

Well recently (this past February) they decided it’s worth it to make us work Saturdays but here’s the kicker- instead of working a full 8 hour shift they are making us work 8-12 Saturday and then the following week work 1 hour extra M-Thurs and then have Friday off. And we’re not even getting paid OT for working that 1 extra hour those 4 days. 

This rotates so I don’t work every Saturday- ends up being 2 a month but what fucking shitty company is this for making us work this with NO say at all.",1646174408.0
t4dimv,Is there such a thing as a good boss?,,5,0.78,WorkReform,https://www.reddit.com/r/WorkReform/comments/t4dimv/is_there_such_a_thing_as_a_good_boss/,25,Has anyone encountered an amazing boss to work for and what did they like about them? Are there any bosses that exist that are the opposite of what is normally being posted on here?,1646156402.0
t4boml,I feel genuinely bad for people who want to go back into the office.,,7,0.61,WorkReform,https://www.reddit.com/r/WorkReform/comments/t4boml/i_feel_genuinely_bad_for_people_who_want_to_go/,37,"My company is forcing us back into the office 3 days per week starting next week and a small percentage of people are actually looking forward to it.

I feel genuinely bad for these people who’s coworkers are the closest thing to friends that they have.  Many of these people have spouses and children but still want to commute into the office everyday to see their coworkers.  It’s sad to see that they can look past the fact that these people have to literally be forced into seeing each other again but still feel like there is some kind of meaningful connection there.  It makes me wonder what kind of life these people have outside of work if any at all.",1646151676.0
t3nl8c,This first section seems sketch to me. Can anybody explain if this is good/bad?,,254,0.98,WorkReform,https://i.redd.it/0e104athkmk81.png,114,,1646076346.0
t47yke,"No, supervisor, no they're not. (Luckily he doesn't hold anyone else in the dept to this workaholic standard)",,9,0.85,WorkReform,https://imgur.com/pWusZ1u,0,,1646141463.0
t4a7w9,From WorkChronicles,,8,1.0,WorkReform,https://www.reddit.com/r/WorkReform/comments/t4a7w9/from_workchronicles/,1,"&#x200B;

https://preview.redd.it/905kcl25hsk81.png?width=4800&format=png&auto=webp&s=f7602a5134d04a10da612add07be5b5cdc4d59cf",1646147845.0
t3ro6b,Sorry if this doesn’t belong here but I made some stickers.,,136,0.94,WorkReform,https://i.redd.it/tjdj88k0gnk81.jpg,2,,1646086918.0
t48sk1,I'm leaving my job soon... It's starting to stress me out,,7,1.0,WorkReform,https://www.reddit.com/r/WorkReform/comments/t48sk1/im_leaving_my_job_soon_its_starting_to_stress_me/,0,"I'm leaving my job soon, hopefully within the next month at the longest. I started this position like 2 years ago as a lending originator for a big bank after working on a desk for a couple years. I was great at my job, like best in my market great, had my market manager fight to get me this job great, didn't need to interview with my current bosses boss like other people great at it... I came from another company alot of my Co workers had left to come here, they all failed and I succeeded giving about 80%... And I liked my job, because my manager let me do as I pleased as long as the numbers were up, she was happy and I wasn't being asked by her to do anything I didn't think was wrong. My dad tried to help me growing up with saving and such, but us being lower middle class growing up he didn't like credit and didn't really teach me about it.... I was happy to help kids and even parents learn about things it took me a long time to grasp so they could be better off than me at my age.

So when my boss was moving, and they were upping the amount of cold calls they wanted us doing (they call them warm because they're already customers, but really they're cold calls and I'm just not comfortable with doing them) I took this job because it was supposed to be more freedom, and better pay... First year for most of it I helped with ppp loans, then got told ""well your part is done, go do your job you never learned properly now"" and I did, and got OK at it... I could be better, I could probably be the best in my region.... If I cared.... But I don't... Not about making someone else money anymore anyway. I still stick my neck out for clients, and make sure they're taken care of... But I'm not going out of my way to pad the numbers anymore. They gave us a new title about a year in, it was supposed to make things better for us, it's just been a way for them to take compensation away in our bonus plan when they realize too many people are getting it... They took away a $2000/ quarter bonus most people got easily... Replaced with nothing... That's an 8k pay cut for most people... We were told ""well if you just have more files you'll make it back up""

I'm also in a location that treats me like garbage, I ended up having to take a leave of absence because of it and they won't move me out of this location. 

The kicker was the other day, I'm doing a loan for someone I know and closing has been rescheduled 5 times now, underwriting has been rude to me and unhelpful to him. I told my manager about this on a one on one call we had last week... His response was that I should have more loans in so if one falls through I don't need to worry so much about it.... I don't care about the money, I won't see a bonus anyway because I don't have many files between it being slow and me just getting back the beginning of the year... And even if I did it wasn't the point... I was concerned about this client, I would have been even if it was Joe shmo off the street... He's had a shit experience, he's upset and his loan should have closed... It wasn't going to be denied, it was our fault for rushing the closing and not getting things out in time... They complain about surveys but then this is their response to an upset client?

I knew I was planning to leave, but that just killed any drive I had left, I'm barely going through the motions anymore and I can't in good conscience work for this place any longer.

The good and bad thing is that I'm training for a new job, career really, starting this weekend... But I will probably have to do a couple months of unpaid (if I'm lucky) ride alongs. It's to be a home inspector, and there aren't alot of multi inspector firms, it's really an own your own business kind of thing... I was under the impression when I signed up that there were places that hire (and there are, just not as many in my state because you have to ride along on 125 inspections)

The worst of it is I'm actually really interested in this, so far I've enjoyed the material I've gone through and am really looking forward to getting into the field and seeing homes and such... And also helping people make an informed decision on the biggest investment they'll probably ever make. Not to mention the idea of probably working less if I own my own business and making more money for me and my family instead of someone else is great...

I don't know, I saw someone else's post about what people do if they arent working and I'm just getting stressed, I don't really want to go back to working evenings selling cell phones or something to get by and get stuck doing it long term again (previous job i mentioned) because I'm just so over sales.... And I'm actually excited to be doing something that I'm paid for based on my own merits, not how well I can push someone into something they don't need, or just how lucky I get I got a good call. Not to mention something that's done for the day when I go home... I dunno maybe I just needed to rant a bit",1646143915.0
t4edm0,Anyone actually getting a raise to match inflation?,,3,1.0,WorkReform,https://www.reddit.com/r/WorkReform/comments/t4edm0/anyone_actually_getting_a_raise_to_match_inflation/,26,,1646158572.0
