post_id,title,flair,score,post_upvote_ratio,subreddit,url,num_comments,body,created
t7dir6,And Rachel never got the fashion job because no places hire without experience,,14147,0.95,WorkReform,https://i.redd.it/ufc7cxfdhll81.jpg,387,,1646499008.0
t7atk5,The bootstrap crowd loves to gloss over these facts.,,1203,0.98,WorkReform,https://i.redd.it/yt659jy8ukl81.jpg,76,,1646491233.0
t7fo3t,Do I walk out?,,538,0.97,WorkReform,https://i.redd.it/2h926hmezll81.jpg,178,,1646505073.0
t6znsg,We have our own oligarchs,,13562,0.95,WorkReform,https://i.redd.it/kuy3llgtahl81.jpg,384,,1646448379.0
t6wvmh,"The President, regardless of party should not be encouraging ""return to the office"".",Discuss,8701,0.94,WorkReform,https://www.reddit.com/r/WorkReform/comments/t6wvmh/the_president_regardless_of_party_should_not_be/,531,"This is the second time now I've read an article seeing Biden encouraging/urging ""return to the office"".

My opinion has always been - if you _can_ work from home, you _should_.  There are obviously some lines of work that can't work remotely, and I understand that.  Even ""hybrid"" is fine if the commute isn't severe.   A forced full scale return?  No way.  It's been proven throughout the pandemic that remote work _works_.

Biden keeps talking about filling the downtowns and such again.  No.   That's not a reason to force return to the office.  With rising prices I'll not be going out to eat other than for very special occasions and/or ""treat yourself"" type things.   

It just makes me uncomfortable/rubs me the wrong way that he's pushing this.  (And again I would feel this regardless who was in office - R, D, I, etc....)

Thoughts?",1646439323.0
t7cl2a,Not your typical Linkedin post,,320,0.99,WorkReform,https://i.redd.it/lc41yjch9ll81.jpg,10,,1646496356.0
t7fiwi,listen to marty :),,135,1.0,WorkReform,https://i.redd.it/rvjegj58yll81.jpg,1,,1646504677.0
t6upli,I just finished a tedious job application and got an email saying that my application will not be considered unless I complete this survey. There were 18 pages of this nonsense.,,5873,0.97,WorkReform,https://i.redd.it/22ekth9w0gl81.jpg,490,,1646432936.0
t75ull,New manager is asking us every Saturday to come in even though he might just send us home,,621,0.99,WorkReform,https://www.reddit.com/r/WorkReform/comments/t75ull/new_manager_is_asking_us_every_saturday_to_come/,119,"Tomorrow is the first weekend he is asking us all to come in to work. Only one production line of three is going to be operational. His reasoning is, ""Some people might call in on that line so we need people to cover."" If we don't have to work, we don't get paid. I live 30 minutes away. So I have to wake up early, shower, drive 30 minutes, get told no, then drive 30 minutes back without pay. Is this even legal? That line staffs 12 people and they're making 30 people of the other lines come in.",1646472321.0
t6z2z6,Inequality will never be solved until the workplace is owned by the worker!,,1745,0.96,WorkReform,https://i.redd.it/613jmi905hl81.jpg,109,,1646446450.0
t741ii,"My grandfather making 13.50/hr in 1987. If they could do it then, they can do way more now.",,462,0.98,WorkReform,https://i.redd.it/n56xx86mmil81.jpg,46,,1646464451.0
t6z778,"Yep, I'm going to use a bonus to take my BOSS to lunch, and then I'm going to work through my lunch breaks. . . .",,1121,1.0,WorkReform,https://www.reddit.com/gallery/t6z778,147,,1646446849.0
t6wfza,Sister-in-law told she was being fired (she’s 7 months pregnant) and they made her resign. Is she screwed?,,1397,0.98,WorkReform,https://www.reddit.com/r/WorkReform/comments/t6wfza/sisterinlaw_told_she_was_being_fired_shes_7/,143,"My sister-in-law is 7 months pregnant, has had all excellent reviews and no warnings. Today she was told she was being fired or she could resign, she signed that she resigns. Anything she can do?

Edit: this is in the US, she signed because she’s never been fired before and she’s 7 months pregnant (pretty emotional time in her life)

Edit2: she signed an exit interview, not necessarily resignation. This is all unfolding in real time.",1646438004.0
t7hpq3,"You’re an asset to us, but….",,28,1.0,WorkReform,https://v.redd.it/iq3870uygml81,1,,1646510984.0
t6ts64,Maybe you wouldn't have such a hard time finding employees if it didn't take you so long to even look at an application.,,1327,0.98,WorkReform,https://www.reddit.com/r/WorkReform/comments/t6ts64/maybe_you_wouldnt_have_such_a_hard_time_finding/,139,"I've been at my current job since September of 2021, so about six months. When I first started interviewing for it, I ceased applying for other positions. My point is that I haven't applied for anything in more than six months. 

This morning, I got an email from a hiring manager letting me know that they had reviewed my application and would like to meet me for an interview. 

For an application that I would have had to submitted more than six months ago. I don't even remember applying, so maybe much longer.

This is not the only time something like this has happened. Do these managers really expect me to still be available after all that time? 

Why does it take so long to make a decision? 

Are you only contacting me now because all of your other employees ran out on you? 

I seriously don't understand this logic.",1646430292.0
t72oti,I am in the US and I applied to and have had two interviews with a company based in Europe.,,259,0.99,WorkReform,https://www.reddit.com/r/WorkReform/comments/t72oti/i_am_in_the_us_and_i_applied_to_and_have_had_two/,41,"The benefits are unreal, and the interviews have been like a conversation at the bar. I am astounded at the employee-centric mentality.

It's lower level and lower pay than i am qualified for. But I can always move up.

It's also mostly work from home. 

I am excited to experience working in an environment that isn't based on american work culture. 

Meanwhile, my current job is writing me up for missing a 6 hour shift on a dead Wed evening, because my wife was in the hospital having major surgery.",1646459065.0
t7ehsx,"It started in Russia. In Nizhnekamsk, workers at the Hemont plant went on a spontaneous strike because they were not paid part of their salaries due to the sharp collapse of the ruble.",,27,1.0,WorkReform,https://twitter.com/EspresoTV/status/1500097646714839041?s=20&t=GhpAgVV_6Nveqdzk8LqxrQ,1,,1646501726.0
t6j36j,Update to the Required 84 Hour Week Situation,,4832,0.98,WorkReform,https://www.reddit.com/r/WorkReform/comments/t6j36j/update_to_the_required_84_hour_week_situation/,189,"Original is here: https://www.reddit.com/r/WorkReform/comments/sluh81/i_have_no_choice_but_to_work_84_hours_a_week/?utm_source=share&utm_medium=ios_app&utm_name=iossmf

Since this post, I’ve gotten into contact with our parent company parent’s company about our dire personnel problem. After investigating the issue and seeing that I’ve been working all day every day since mid-late 2021 they found that the effort on my parent company’s part to find, hire, and train personnel was poor, at best, and told them their work practices were against their core values.

As a result they made them institute a few changes to “encourage” the solving of the problem. These really punish them/reward me financially for their reliance on one worker.

First, I am no longer capped at time-and-a-half for overtime. At 60 I get double, and at 70 I get triple.

Second, they created a max carry-over limit for vacation time and made it a requirement for it to be taken up until that limit. If it is not taken, the remaining balance is paid as quadruple overtime values and it automatically escalates to the larger parent company. I have over 100 days stored and I have to use 70 by August, the beginning of my “fiscal” year (my anniversary date).

Third, they said that there needs to be a dedicated HR manager overseeing my location and all US locations. This one isn’t in effect yet but I assume it will be soon.

Since the first post I’ve gotten two days off, which doesn’t sound like much but they were the best days I can remember. We’ve hired three people that I am training and preparing since I have to basically take 2 entire months of vacation. Obviously my pay has shot into the stratosphere, which is great too.

I wanted to say thank you to all the solutions and words of wisdom offered by so many of you. I can see the light at the end of the tunnel and I’m pretty happy that the top of my food chain gets it.

Edit: Thank you to everyone for the well-wishes, as well as all of you that have messaged me regarding unions - whether it was today or on my previous post. It’s something I’m seriously looking into.

Regarding my parent company’s parent company, they operate in and are based out of Europe. My company and my parent company are in North America. I’m sure you can connect the dots as to why the treatment of employees seems to differ drastically.

Again, thank you to everyone that reached out in an effort to help, offer words of wisdom, and show support. It means a lot and I appreciate the solidarity.",1646400884.0
t6onww,"Employee appreciation day at the 3rd biggest automotive supplier, free tea or coffee.",,1443,0.98,WorkReform,https://i.redd.it/2vo9f5ffnel81.jpg,156,,1646416299.0
t7d3bc,Why the hell are companies using gross income to determine if you can pay for stuff?,,21,0.89,WorkReform,https://www.reddit.com/r/WorkReform/comments/t7d3bc/why_the_hell_are_companies_using_gross_income_to/,8,I just can't understand how the hell they think our gross income is the best thing to use to determine if we can make certain payments. It's not how much money we have. I pay thousands per year in taxes that I will never actually see yet places like hospitals want to use your gross income to determine if they think you can make a certain payment to them. It's dumb as hell! Makes no damn sense! They should be required to use net income. That's how much money I actually see!,1646497809.0
t7cu32,I have a meeting with the owner of the company I work at on Monday because of my “performance issues”,,18,1.0,WorkReform,https://www.reddit.com/r/WorkReform/comments/t7cu32/i_have_a_meeting_with_the_owner_of_the_company_i/,20,"I’m really, really pissed. I started here as a general helper and was quickly moved into a foreman position due to the business rapidly expanding. I work in construction. My crew as a helper was 3 people, but once I became foreman I was limited to 2 people. The workload was not limited. My equipment, all of it, was on the verge of breaking to the point where I watched several hours of online mechanic videos on my off time to learn to service it myself to keep it running because it would break down every day at almost every job site and sending it to the shop would look bad on me for costing us money. What wasn’t broken was stolen from me on an almost weekly basis at our equipment yard (my socket set, my shovels, my brushes, my ice chest, my blower, my brooms, my pickaxes, my weed eaters, my hammers, my trash bags, my boots, quite literally everything that wasn’t nailed down) and *then* I was crucified for repurchasing all the things that were taken for me because I was “bloating up business expenses.”

They said I’m the most junior so I have to deal with it. Regardless, I was *still profitable.* I worked from 7:30am until 8pm M-F, sometimes saturdays to keep up, with my one helper to get our work done in between buying tools that were stolen and fixing our expensive machines on the job. I have been told to drive a CDL vehicle carrying hazmat material since we can’t afford a driver, I did that too. We finished out the season right on track with where we were supposed to be profit wise. I have recently been promoted into not just foreman, but project manager as well for my type of work. 

I only, *only* did all of this because they would hold money over my head. My base salary is 41k before taxes. Foremen and project managers get a commission structure where they get a percentage of profit generated for the week minus operational costs. HOWEVER, as I came to learn, I earned all of $1.79 in commission for 5 MONTHS of selling, scheduling, AND running my jobs due to me essentially shouldering the cost of every other crew who took all the things I’d buy every week. 

Anyways, recently my car broke down and my household went down to one vehicle. I got someone to handle picking up my son while my partner works and got a ride to work with my helper, everything is fine, except that for one day I’d have to leave early (3pm) to get my son. We had one job that day, and my international 4400 truck that carries our work rig catastrophically bit the dust. Wouldn’t run, wouldn’t jump, grinding metal and oil dripping from the engine, whatever. I personally towed it to the job site and did the job. I towed it back to the yard with a chain on a dump truck and then left. 

But because I left early, after clearing it with my boss and with the owner, I have gotten my ass chewed out so hard on the phone that I had to leave the family day with my partner and son at the park because I was so extremely mad and I didn’t want him to see me that way. I was called lazy, dishonest (someone claimed to see me at a bar at 4?) a waste of time, and overall disappointment for the business. They put my job on “final notice” and I was told they’d be contacting my friends and family (references) to “get to the bottom of where I was yesterday” and y’all I am so. Fucking. Mad. I’m having trouble thinking straight. I still finished my work, I did it cheaper because I had one less person, and I overcame catastrophic failure but I *dare* to leave early after getting my stuff done to get my son from school *one time?*

Anyways, I have a meeting with the owner and the person who accused me on Monday. I hate to say it, but I need this job. I cannot afford to quit or be fired and they know it. They’ve always held money over my head. Does anyone have ANY advice for me or my situation? I work in asphalt, concrete, and chip sealing. Basically road and driveway work. They said that to meet goals, I need to be twice as profitable as last year with no change in crew or equipment. Last year we cleared about 30k a month in profit. I’m almost thinking of saying they need me and my skill set far more than I need them and their treatment of me, but I have never ever put my foot down here and I’d like to know what you guys think.

Edit: Just for some additional info, I’ve had to purchase several expensive things that have been stolen and/or unreimbursed as well. Most expensive being my tool sets and brand new iPhone to use for our job app. I know the common answer is to bring the tools home, but there’s so much and so many that I simply can’t transport them all. I took the things that would fit in my vehicle, but I live in an apartment with no garage so I can’t bring much more than that home with me.",1646497070.0
t6vq2a,Union starting to form in my hospital,,386,0.99,WorkReform,https://www.reddit.com/r/WorkReform/comments/t6vq2a/union_starting_to_form_in_my_hospital/,22,"One of our longest standing operating room nurses is leading meetings to start a union. Management put out fliers in the break room basically saying 'how can your union guarantee things will change or get better, and do you want to pay dues?' they're so scared it's funny. I think they'll start pushing back pretty hard soon.

On top of that we had an unheard of DNVXX review this week with, in the words of our OR manager she hasn't seen in 15 years where there were no complaints. We are operating perfectly by DNV standards and she said we will be rewarded with a, wait for it... ICE CREAM SOCIAL! Can you believe how lucky we are to be graced with ice cream?! Meanwhile 30-40% of our staff are travelers who make an easy 2-3x our wage.

We're fed up. We're burnt out. We need change and most of us to my knowledge know it's not going to happen with sticking together.",1646435847.0
t6tz25,A thought crossed my mind today; how much is inflation a real thing rather than corporate greed and price gouging?,,482,0.95,WorkReform,https://www.reddit.com/r/WorkReform/comments/t6tz25/a_thought_crossed_my_mind_today_how_much_is/,128,"Prices have gone up for nearly everything, but is that demand talking more than supply or something altogether different?",1646430840.0
t7db4b,My friend works for one of the largest retail corporations in the US. She shared this with the group chat this morning. Good for him.,,16,1.0,WorkReform,https://i.redd.it/0in8369lfll81.jpg,0,,1646498409.0
t7g8i1,"Start questioning WHY and WHO? Wherever in the world you are. Me thinks oligarchs haven't shared their cake. Who writes these fucking laws or pays off the right people to keep the whole of humanity in a state of desperation, taking away prosperity. PROGRESS OVER PROFITS!",,9,1.0,WorkReform,https://i.redd.it/o7wf8sm14ml81.png,1,,1646506715.0
t7hwc3,The End of a Customer Service Survey,,6,1.0,WorkReform,https://i.redd.it/3982x4ckiml81.png,2,,1646511516.0
t6i57j,forced working 7 days a week 12 hours a day,,1955,0.92,WorkReform,https://www.reddit.com/r/WorkReform/comments/t6i57j/forced_working_7_days_a_week_12_hours_a_day/,404,"Personally I don't think working 7 days a weeks 12 hours a day should be legal, like how are you supposed to have a life outside of work? 
Either pick one or the other not both. 
Just a personal opinion, been doing it for over 2 years now and it's starting to catch up with me",1646397748.0
t6y2tm,LinkedIn post. Why do people promote this toxic work ethic? It’s so sad.,,183,0.88,WorkReform,https://www.reddit.com/gallery/t6y2tm,40,,1646443148.0
t7eg1s,Amy's Kitchen workers expose unsafe working conditions,,8,1.0,WorkReform,https://youtu.be/eA0ZFmTiMtQ,1,,1646501592.0
t7aojc,"Love how little some people care. Like seriously, everyone is broke enough already",,13,1.0,WorkReform,https://i.redd.it/kpaji42yskl81.png,3,,1646490794.0
t6fn7v,"How about you don't tell us to come in on my day off, and we won't tell you where to shove it",,2440,0.99,WorkReform,https://i.redd.it/qmpdnq8t7cl81.jpg,63,,1646387930.0
t7i8p4,my wife emailed starbucks asking why they are anti union and this is the response,,3,0.8,WorkReform,https://www.reddit.com/r/WorkReform/comments/t7i8p4/my_wife_emailed_starbucks_asking_why_they_are/,3," 

Response (02/21/2022 07:01 AM)

Hello ,  
   
Thank you for contacting Starbucks. I appreciate you taking the time to share your concerns with us.   
   
Angela, from the beginning, we have been clear in our belief that we are better together as partners, without a union between us, and that conviction has not changed.  
   
We remain focused on creating the best Starbucks Experience for all our partners as well as maintaining open, transparent, and direct conversations.  
   
We are at our best when we work collaboratively. That is who we have always been, for the last 50 years, and who will continue to be.   
   
Thank you for your question, you can also read the updates on our Starbucks Stories website at [stories.starbucks.com](http://stories.starbucks.com/)   
   
If you ever have any questions or concerns in the future, please don't hesitate to get in touch with us again!   
   
Have a wonderful day and stay safe!   
   
Sincerely,   
Nadia A.  
Starbucks Customer Care   
\--------------------------------------------------------------------------------   
Visit us online at [www.Starbucks.com](http://www.starbucks.com/).

Customer (02/21/2022 12:03 AM)

For a company that considers itself progressive, why are you against workers that want to unionize? What better way to SHOW how much you appreciate your employees, and show the world how progressive you are, than by SUPPORTING these workers who only want fair treatment and pay (especially when profits are up and the CEO gets a raise!). I will not, and will encourage friends and family not to purchase anything from Starbucks until workers are free to unionize and are not penalized for doing so.",1646512530.0
t7alt2,Just realized my employer is desperate for workers.,,13,1.0,WorkReform,https://www.reddit.com/r/WorkReform/comments/t7alt2/just_realized_my_employer_is_desperate_for_workers/,0,"I'm an undergrad student that juggles work, school and rent on my own with minimal parental help. My job, a count agent at a local indian casino is fulfilling but tiring.   
I am the youngest in my department and have a good 2 months of training under my belt and am very good at what I do.  
However despite the good pay and decent coworkers I was lied to by management on multiple occasions and HR before hiring me.   
They told me I'd work a maximum of 7-8 hours a day part time, its double that most of the time. This of course doesn't work with my schedule so I've scheduled it to take up my weekends, and due to this lie I've grown to resent my job, to the point where I skip, A LOT. And the crazy thing? They don't care, they won't fire me and CANT fire me. They're short staffed when I skip and have to cancel the drop unless they can push a manager on the job so I know they're bleeding employment.   
So moral of the story, employers are struggling right now and will lie to employ you. But don't think they can punish you for anything because firing you means they have to lie to and train another sucker.",1646490555.0
t6qcyi,Your opinion,,415,0.94,WorkReform,https://www.reddit.com/r/WorkReform/comments/t6qcyi/your_opinion/,162,"Brothers and Sisters.  Need your opinion.  

Wanted a job closer to home so I applied for a position at TELLE tire and auto in Richmond heights, Missouri.    Hiring process was a bit disorganized and long.   Waiting.  Called all my references all excellent.  Waiting. Waiting. Finally after a month they sent me a offer.    

I accepted.  Money was good.  Closer to home.  They were thrilled I accepted the position.  
All good right?

I leave notice at my current job.  They hire a replacement for me.    I am about to start new job and I emailed in to ask where do I park when I come to work. 

They email me back that I need to park on a side street a few blocks away that isn’t visible to the shop.   

So I emailed the owner who I have been dealing with and asked if there was any alternatives to parking on the street when it’s not even visible from the shop.   I have a newer truck and catalytic converter thefts are a epidemic in that area.  

So what does he do?   He emails me back that he rescinded his offer and good luck.  

I tried to call him and the coward wouldn’t even get on the phone.   So now since my position was already filled am left with no job and have to quickly look for something else that will work. 

What a way to screw over someone for asking something about a legitimate concern!!!  

I’ve served my country. Served my community for years as a volunteer Paramedic.   Have kids at home, one that has special needs, to support and give my shirt off my back to help people and first time ever I ever been put in a spot like this. 

Was I wrong for asking?   What are your thoughts?

I’d love to demolish their reviews grrrrr.   It’s sad that more and more employers could care less about their employees.

Thanks for your time and thoughts.  Please hope that I can find a good job and fit soon.    In the meantime wish all of you a great day!",1646420786.0
t7hgq7,"If we all want better quality of life, then we have to actually reform the workforce",,4,1.0,WorkReform,https://www.reddit.com/r/WorkReform/comments/t7hgq7/if_we_all_want_better_quality_of_life_then_we/,2,"People have so many different theories and complaints about what we need to change or what we need to do to make working conditions better and so many of them are just symptoms of the problem, not actual solutions. **I know exactly what we need to do for a better quality of life. You ready for this?**


**Employee owned equity companies.**


The best type of companies I have ever found in my entire life are employee-owned agencies. No stockholders to greedily throw money at the company and then take all of the pay away from everyone else. No insanely overpaid managers that get to steal from the lower level employees. All profit is shared in a fair and equitable way. Say profit is 3 million for the year. Lowest level employees get the biggest bonus, then managers, then owners. So managers and owners will still make quite a bit of money, just not as much as they would elsewhere, and the lower level employees get a living wage that they can actually survive off of and be happy about.",1646510272.0
