post_id,title,flair,score,post_upvote_ratio,subreddit,url,num_comments,body,created
t5wcoa,Survey for Minimum Wage Workers,,3,0.72,WorkReform,https://www.reddit.com/r/WorkReform/comments/t5wcoa/survey_for_minimum_wage_workers/,5,"Hello! I've been lurking here for a while and thought that this community would be the perfect group to help out with my research. I'm a student at Northeastern Illinois University and for one of my classes I'm conducting a research project on Minimum Wage Workers' attitudes with their work during the Covid-19 pandemic. 

This survey is completely anonymous and no identifying information will be recorded. 
Additionally, due to the scope of this project I have to ask that only people over the age of 18 participate. Unfortunately this survey only pertains to people who have worked minimum wage jobs within the United States. If I could, I'd open this up to everyone but not every country handled the pandemic in the same way. Still, if you're not from the U.S. but would like to share your experiences I would love to read about them in the comments. 

Thank you in advance for your participation, and I hope everyone has a lovely weekend.

Survey link: https://neiu.co1.qualtrics.com/jfe/form/SV_6DbZB0fjjGeW1NQ",1646327342.0
t5kbgp,REI Workers in New York Vote to Unionize,,25,0.92,WorkReform,https://www.nytimes.com/2022/03/02/business/rei-union-new-york.html,5,,1646285798.0
t5kjhg,Found this hanging up outside our college dorms.,,22,0.93,WorkReform,https://i.redd.it/abfgqlurx3l81.jpg,19,,1646286600.0
t5r1td,"This is the pilot episode of What Winning Looks Like, a new show from Organizing for Power that focuses on strategic choices in campaigns & the methods that lead to victory. In conversation with the workers & organizers who led them, we get to the heart of what makes a successful organizing drive",,7,0.89,WorkReform,https://m.youtube.com/watch?v=ZLZA_uvlY_w,0,,1646312389.0
t54tjp,REI Workers in NYC are Voting TODAY on Whether to Unionize with RWDSU! Results at 9 p.m. approx. Join us in sending solidarity & wishing @reiunionsoho luck.,,219,0.99,WorkReform,https://i.redd.it/23ir0dmt50l81.png,7,,1646240880.0
t5b8fm,How to Form a Union,Make a billionaire mad,84,0.96,WorkReform,https://aflcio.org/formaunion,9,,1646258111.0
t5az45,"Overworked Employee Quits Because He Wasn&#39;t Getting A Fair Wage, Costs The Company $40 Million",,74,0.89,WorkReform,https://www.boredpanda.com/underpaid-employee-quits-company-loses-40-million/,34,,1646257395.0
t4o6ex,Just started this job and received this email,,3126,0.99,WorkReform,https://i.redd.it/q3ku0fjwivk81.jpg,343,,1646184745.0
t5cjh6,About the many “my boss did this is it legal?” posts,,34,1.0,WorkReform,https://www.reddit.com/r/WorkReform/comments/t5cjh6/about_the_many_my_boss_did_this_is_it_legal_posts/,3,It would really be good if people mentioned the state they work in- the difference in laws between states is significant and you might get better info if the post was more state specific. Even differing federal circuit interpretations of title VII make it a good addition. Carry on.,1646261642.0
t5ms89,Why do people think a company can just raise prices?,,7,0.63,WorkReform,https://www.reddit.com/r/WorkReform/comments/t5ms89/why_do_people_think_a_company_can_just_raise/,32,"Usually it’s said as an excuse for low wages. “If a company has to raise its wages, it’s prices will go up!”

But like, that’s not how that works right? Just think about it for a minute. Do you think if any company could raise profits just by raising prices, they wouldn’t have done that already? If I’m selling X product for 4$, but could make more money for 5$, I’d sell it for 5$. If I’d lose too many sales to make more profit selling it for 6$, I won’t. 

How does raising any business expenses change this at all? It’s still not going to be any more profitable to raise the price. Raising prices isn’t just some magical way to increase revenue every time cost goes up. The only wait to actually increase revenue, is to perfectly balance price and demand. Your business cost has absolutely nothing to do with either of those factors.

Stop using raising prices to fight against raising wages.",1646295432.0
t51xji,Me wanting money for my labor makes me greedy?,,142,1.0,WorkReform,https://www.reddit.com/r/WorkReform/comments/t51xji/me_wanting_money_for_my_labor_makes_me_greedy/,16,"This was a comment I was going to put on a different post, but it turned into a post itself. 

I had this lady who apparently is in charge of recruiting for all the restaurants in the DFW airport spam me every day with automated messages on indeed. 
She offered to hire me for one restaurant with lower pay+tips then pushed me an automated message for a higher paying job without tips. In texted her and said I'd rather go for the higher paying job.  Suddenly acted like I was an awful greedy person only in it for the money. 
Got on the phone with her and tried to explain that as a human adult living in America, I don't work for free and news money to afford basic necessities. 
Later the head of HR there reached out to me and I told her about how the recruiter acted towards me. So I at least got to vent my frustration to someone higher up.

I'm still getting dumb automated recruitment messages from this person on indeed, though. I'm unsure if it really changed anything. 

Bottom line is that I would take a job with a bigger wage any day, no matter what. Having some damn income literally reduces stress!

TL;DR I got hired for one job at an airport, got notified of a higher paying job in the same airport, then got scolded and almost blacklisted for asking to have the better paying job because of money.",1646233154.0
t5adjz,I just hired my old boss.,,43,0.8,WorkReform,https://www.reddit.com/r/WorkReform/comments/t5adjz/i_just_hired_my_old_boss/,30,"When I was in my 20s I picked up a fun job working for a notable clothing manufacturer.  The work was tough but there was a lot of great international travel and I got paid 120/hr and I got some great mentorship from one of the executives there.  
Years later that same executive was at another company and he hired me again to help with a complicated project he was running, again, learned a lot, hard work, paid me what I asked for (this time 150/hr).  


Now I'm in a position where I'm hiring and he's looking so I'm returning the favor and hiring a great boss to join my team and paying him very well because I know he's going to do a great job.",1646255650.0
t4sxk9,Thanks for the timely response.,,761,0.99,WorkReform,https://i.redd.it/id7zdf6wqwk81.jpg,46,,1646199538.0
t5hly3,$11/hour!,,12,0.88,WorkReform,https://i.redd.it/3cdl9bpp43l81.jpg,4,,1646276829.0
t4yyqr,You are not a bad person for calling out sick,,184,0.98,WorkReform,https://www.reddit.com/r/WorkReform/comments/t4yyqr/you_are_not_a_bad_person_for_calling_out_sick/,31,"It doesn’t matter that you already called out once this week. Did you spend the day resting or taking care of other non work-related obligations? 

If you’re fortunate enough to have PTO? Take advantage of it. Use that shit. Don’t think about the work that’s not being done/being done wrong. Take a day for you.

Do it. Work is not life. 



I needed to hear this today and figured someone else might too.

Stay strong comrades.",1646223718.0
t541s3,"Around 100 workers at Gizmodo Media—at Jezebel, The Root, Gizmodo, Jalopnik, Lifehacker & Kotaku—are on strike, demanding better pay",,88,0.99,WorkReform,https://i.redd.it/w0xsjk3uzzk81.png,4,,1646238888.0
t5ju8l,Trick question,,8,1.0,WorkReform,https://i.redd.it/48a6i4xbq3l81.png,8,,1646284105.0
t48mke,"Found this on LinkedIn, what do you guys think of it?",,16160,0.94,WorkReform,https://i.redd.it/1hcyp4n34sk81.png,540,,1646143445.0
t4jbrq,"Weird flex, but ok. I feel sorry for his employees. Also…did he have a family member take this picture of him wasting their vacation time for a client call?",,2103,0.97,WorkReform,https://i.redd.it/s81nr8ryeuk81.jpg,230,,1646171313.0
t50n00,Not sure if this article has been posted here before but it seems relevant—link in comments because I still don’t understand how Reddit posts work lol,,85,0.98,WorkReform,https://i.redd.it/yjzuhw0g7zk81.jpg,19,,1646229318.0
t4l7bd,Had an uncomfortable call with my student loan provider,,1098,0.99,WorkReform,https://www.reddit.com/r/WorkReform/comments/t4l7bd/had_an_uncomfortable_call_with_my_student_loan/,113,"Just feel like venting a bit. 

I had to apply for a forbearance, and I feel like I was feeding into the call center representative’s “pull yourself up by your bootstraps” mentality because he was so judgmental. For example I told him I have an unpaid internship instead of the truth (I’m legally unemployed because I’m a tattoo apprentice). He initially didn’t want to let me apply because I went to school for graphic design and he said “that’s a very lucrative field.”

The whole call was uncomfortable, but I’m left feeling gross now because at the end he told me he’s proud of me for taking an unpaid position because most young people refuse to. He also said McDonald’s managers have to go two years without pay to get their position (where did he hear that? Lol). 

I just know he’s going to go tell the “inspiring” story of a young mother who’s working without pay to ensure her family has a better future. I hate how much working without pay is romanticized.",1646176270.0
t5g18w,Does WFH penalize the lower middle class?,,9,0.91,WorkReform,https://www.reddit.com/r/WorkReform/comments/t5g18w/does_wfh_penalize_the_lower_middle_class/,11,"I remember a debate about the need to keep libraries open late because kids from lower-income families don’t have quiet space at home to do their homework. Does this have implications for WFH, where lower-income adults may not have appropriate space at home to concentrate on their work? I’m not trying to push an agenda, just trying to check my privilege.",1646272023.0
t4o9pt,"Starbucks Union Files 20 Complaints, Alleging Company Is Illegally Union Busting",,646,1.0,WorkReform,https://truthout.org/articles/starbucks-union-files-20-complaints-alleging-company-is-illegally-union-busting/,6,,1646185025.0
t5ctel,Gizmodo Union (GMG) is on Stike!,,13,1.0,WorkReform,https://www.reddit.com/r/WorkReform/comments/t5ctel/gizmodo_union_gmg_is_on_stike/,2,"Don't visit any of Gizmodos sites - Gizmodo, Jalopnik, Jezebel, Kotaku, Lifehacker, The Root, A.V.Club, etc.

Support the workers - https://gmgunion.com/",1646262393.0
t4d7js,"Trying to get a W2 from a former employer is easy, right?",,2922,0.94,WorkReform,https://www.reddit.com/gallery/t4d7js,308,,1646155590.0
t5g87r,So I applied for a job that pays $28 per hour,,7,0.77,WorkReform,https://www.reddit.com/r/WorkReform/comments/t5g87r/so_i_applied_for_a_job_that_pays_28_per_hour/,5,"It’s a Quality tech role which I have 10 years of experience in.

I got a call from the recruiter and they asked what I was looking for. I said the job ad said $28 so that. She said that was for experience and I immediately pointed out I had 10 years which it shows on my resume. She asked what the lowest I would go be and I said $25.

I was asked if I would do 12 hours and I said no, the most is 10. She said that she liked my resume and the manager of the company would call me tomorrow for an interview.

Even though I said $25 is my low I’m not taking anything less than $28 as I have what they need and the ad said fuck all about “up to.”",1646272605.0
t5dv0l,Good jobs exist. I just found a unicorn. Keep searching. Don't settle!,,10,0.82,WorkReform,https://www.reddit.com/r/WorkReform/comments/t5dv0l/good_jobs_exist_i_just_found_a_unicorn_keep/,8,"After four shitty jobs in a row with demeaning superiors, inappropriate duties assigned, unnecessarily complex and redundant procedures, shitty office layouts, terrible company cultures, shitty pay and even worse pto, campus wide pay reductions, nauseating mornings, nonexistent 403b matches and a constant fear of orgs running out of funds, I've finally done it. 

I found a place that respects their employees. They are committed to a healthy office environment with practices that are actually fair and transparent. The benefits are really wild. We get a 9% 403b employer contribution regardless of what we contribute. We get 15 days pto, 12 days sick, 2 days personal, and 25 holidays immediately upon hire. 6 weeks paid parental leave and lots of other cushy bennies. 

The office is 50% hybrid wfh, which means everyone works three days from home on week one and two days from home on week two. Since they (we) just started working in the office again after two years 100% wfh, they are giving everyone a $70 bonus for six paychecks. 

Here's the most amazing part: my job duties are specific and they end. I asked my boss what I do when I finish all of the work for the day and he seemed confused. He doesn't have a never ending list of busy duties. It's all so efficient. The procedures are simple and all make sense. 

My pay is 25% higher than my last position with actual room for growth. 

I got this job after being fired from my second to last position. I really thought my life was over when I got fired. Then after getting hired somewhere that sucked, I was job hunting again after only 8 months. I was again convinced I'd never find a well-paying job so quickly.

It took me three months of very active hunting. Three weeks of interviewing with 10 orgs. This is the only org that made an offer. I'm glad to share everything I know about job hunting and if you PM me I'll share the open positions with the org I'm currently at. Just keep your spirits up.

Keep hunting. Quit shitty jobs. Good jobs exist.",1646265449.0
t57emk,A lot of companies are snakes,,23,0.93,WorkReform,https://www.reddit.com/r/WorkReform/comments/t57emk/a_lot_of_companies_are_snakes/,12,"I was interviewing with a couple of companies some weeks ago and while having an interview with a specific company I asked them what was their salary range or department budget for the position.

The lady literally told me, I am supposed to ask you that. Then I said well I asked about the salary first. She said she would never tell anyone what the department budget is. Of course I did high ball her ass and realised the salary range wasn’t that good. Still why did I waste my time with her. Companies could be straightforward from the beginning. Most of them just want to get people as cheap as possible. If you can’t afford talent then just recruit people who are seeking your specific salary range.

Edit: ironically enough the recruiter of this company just sent me another offer for another position. It’s funny how companies are struggling right now.",1646247632.0
t576ph,"The GMG Union Is On The Ground In New York City, On Strike To Demand A Fair Contract",,23,1.0,WorkReform,https://gmgunion.com,3,,1646247076.0
t5dpus,Negotiationing a raise?,,9,1.0,WorkReform,https://www.reddit.com/r/WorkReform/comments/t5dpus/negotiationing_a_raise/,5,"I have lost housing, health issues, and my attendance has suffered. However, my daily reports show I'm a good employee minus attendance.

My performance review is coming up. I am already looking for a new job, but how can I argue attendance? I know that's more of an HR issue, but I need a raise to sustain my living costs.

How do I professionally say FU if they try to use attendance against me?

My housing situation isn't documented as it was me living at my parent's. We work from home so it was hard to access resources we are required. My health absences were covered by ADA.

Not sure how to use leverage as this is my first ""big girl"" job.",1646265016.0
t58nod,I was told that if you love what you do it isn't work; that's a lie.,,15,0.95,WorkReform,https://www.reddit.com/r/WorkReform/comments/t58nod/i_was_told_that_if_you_love_what_you_do_it_isnt/,8,"Two days ago I was up late and got the urge to write. Then I realized I couldn't because I had to be up early for a meeting with subject matter experts so that I can ""write "" their training program. In my opinion I've learned that when that urge hits you to write you take it because that's when the book in essence is writing itself as you see it as a movie, it's a beautiful phenomenon and one I've had to turn my back on one too many times.

I hate writing now because it's no longer about me or my creativity, it's about making money...",1646250989.0
t5d0zw,I've seen this Req posted about 12 times in two months. Details in comments.,,9,1.0,WorkReform,https://www.reddit.com/gallery/t5d0zw,5,,1646262993.0
t5fa3m,"Been applying to jobs all evening, the things you see on job boards are absolutely ridiculous.",,5,0.78,WorkReform,https://www.reddit.com/r/WorkReform/comments/t5fa3m/been_applying_to_jobs_all_evening_the_things_you/,7,"I'm applying for entry level IT jobs and some of these requirements are insane. 

I've seen entry level help desk jobs require a CCNA. 

For those of you who don't know IT, here's the context behind that:

An entry level help desk job starts at around $40,000-$45,000

A job that *actually* uses a CCNA certification typically starts at $70,000. 

This job posting was literally asking for a candidate who will do a $70k salary job for $45k salary. 

I'm not gonna name and shame (because I still applied), but holy crap. 

How can these companies be so selective about ***entry-level***???

I have all the technical qualifications for entry-level help desk jobs, but I'm having the hardest time because everyone wants a seasoned veteran for an entry-level job, when I ***know*** I can do the job just fucking fine, I just don't have 5 years IT experience for your ENTRY LEVEL JOB",1646269712.0
t4gqid,Biased much?,,1075,0.99,WorkReform,https://i.redd.it/ykzplus3vtk81.jpg,51,,1646164634.0
t58ukl,"Vented to my boss about the disparate off-hour expectiations between the US employees and the EU employees, it didn't go as expected.",,13,0.93,WorkReform,https://www.reddit.com/r/WorkReform/comments/t58ukl/vented_to_my_boss_about_the_disparate_offhour/,20,"I work in the US, and part of my roll is to be on-call every 5th or 6th week for overnight issues. I don't have any problem with this, except that most of the time, 1/2 of my teammembers aren't very familiar with things, and so they end up escalating to me when they get an issue and they are the person on call, so I'm effectively on call twice. The expectation is that I answer calls all the time, even when I'm not on call. 

We work for a global company, and have several teams in the EU. We have to frequently interact with these teams, and the ongoing joke is that asking them anything after hours is pointless because they don't answer calls/texts/emails until the next day. I understand that this is due to EU labor laws, and I personally agree with those laws. 

Today while my boss was talking about on-call, I vented that its unfair that our company is able to function as a worldwide company and that the teams out of EU have figured out a way to function without having to answer after-hours calls, but the teams in the US don't get that luxury. My intent was for him to understand the disparity and possibly discuss it with his peers and try to help design a system that is more equitable for all employees. If the company is able to operate profitiably in the EU, why can't they do the same in the US?

Instead of understanding my comment, he took it as me venting that our EU peers *should* have to answer their calls after hours. He vented how they are so upset about the new security monitoring tools that are being installed on their laptops and how they are so spoiled. He vented that in the 80s he would get threated with fines if he even emailed his coworkers in Germany. After he vented a bit, I asked whether our company could look at creating a more equal policy regarding after hours contact. I think it clicked on what I was getting at, and he talked a lot about the EU employees don't get paid as well, or that they pay higher taxes, and that they aren't afforded the same luxuries that we are in the US. We finished that call and I started looking for transfer opportunities to work for one of the EU based teams. 

Reflecting, its just funny to me that he thinks it's better to have low job enjoyment, but be able to have a ""bigger house"" or ""nicer things"" 

TL;DR: Boss thinks EU should be more like the US.",1646251465.0
t57f4z,"Amazon closing all brick and mortars, at least in Washington.",,14,0.86,WorkReform,https://www.reddit.com/r/WorkReform/comments/t57f4z/amazon_closing_all_brick_and_mortars_at_least_in/,13,"My SO just found out today, out of nowhere, that all the physical Amazon stores are closing, that’s thousands of people that are suddenly just out of jobs on less than a day’s notice. Feels pretty shitty.",1646247670.0
t55qn5,What’s the worst “bonus” you’ve ever gotten?,,17,0.95,WorkReform,https://www.reddit.com/r/WorkReform/comments/t55qn5/whats_the_worst_bonus_youve_ever_gotten/,80,,1646243264.0
t5foei,Came across this while preparing for an interview. If I get asked what color I would be in a crayon box I might just become capable of murder.,,3,0.72,WorkReform,https://i.redd.it/778d2qaqm2l81.png,7,,1646270944.0
t58b7y,"Wife passed up for promotion because of her ""tone of voice""",,11,0.92,WorkReform,https://www.reddit.com/r/WorkReform/comments/t58b7y/wife_passed_up_for_promotion_because_of_her_tone/,13,"My (f) wife works for an oil change place as an assistant manager. She is currently in the process of becoming a store manager. An issue came up where another employee was promoted to assistant and now makes a $1 more an hour for the same job wife has been doing for a couple of years.
This was brought up to the same people in charge of her promotion who said its only because she is in store manager process and will making more when that's done.
But now all of a sudden they are questioning if she really wants the promotion because of her ""tone of voice"" on the calls where they grill her to get her ready for promotion. Saying she doesn't seem excited. Who is excited about talking about oil changes?
I'm half thinking they are punishing her for bringing up the pay issue and half thinking they are being sexist and assume she should sound bubbly and flirty on the phone.",1646250058.0
t5ajzk,My parents just offered me a weekend/part time job offer driving a box truck delivering things.,,9,0.91,WorkReform,https://www.reddit.com/r/WorkReform/comments/t5ajzk/my_parents_just_offered_me_a_weekendpart_time_job/,39,"Is $.50 a mile a decent pay? I'm asking because I don't know any truckers or anything like that. 

They also put on $20 an hour for unloading stops, that part I know is good.",1646256166.0
t5fa0b,2022 'Employee Appreciation Day' where I work,,4,1.0,WorkReform,https://www.reddit.com/r/WorkReform/comments/t5fa0b/2022_employee_appreciation_day_where_i_work/,0,"> As a small token of appreciation, on March 4th and March 7th, I would like to invite ********** employees to enjoy a complimentary cupcake and hot beverage from our café.


Yeah... A cupcake and coffee.   C'mon guys, appreciate us a little more than that.",1646269705.0
t557a4,Waiter quit his job after being belittled by his manager in front of customers and the manager refusing to be an adult and apologize,,16,0.77,WorkReform,https://fb.watch/bvopqsT7mn/,7,,1646241861.0
t42d08,Company just went under. We were promised severance if we didn’t have any job offers by today. This was my CEO’s response when I asked about it.,,10899,0.97,WorkReform,https://i.redd.it/9jlyfryp5qk81.jpg,514,,1646119776.0
t49w45,From my Microeconomics textbook this semester.....,,1942,0.98,WorkReform,https://i.redd.it/gm1jjtimesk81.png,329,,1646146986.0
t4o3of,"Employers Who Violate Colorado’s Non-Compete Laws Face Stiff New Penalties, Including Jail",,266,0.98,WorkReform,https://i.redd.it/3bmh29y3ivk81.png,37,,1646184511.0
t5hr78,Rules to leveraging offers?,,2,1.0,WorkReform,https://www.reddit.com/r/WorkReform/comments/t5hr78/rules_to_leveraging_offers/,5,"I put in a request to be allowed to continue to work from home when my bosses announced that they were planning to have us return to work ""soon"" but hadn't set a date for it.

I stated that I've been more productive working from home and I find it easier to collaborate with coworkers who all also work remotely anyways.

Not only did they turn down my request, but they are now making me return to the office tomorrow even though everyone else is still remote. I will be the only person in the office.

Needless to say, I'm trying to leave this job now. I've been looking for postings but I'm impatient about getting an offer. If I were to lie to my current bosses and say I got an offer to work fully remotely to try to convince them they should work with me to keep me (turnover is high, imagine that), would they be able to insist that I show them my new job offer? Does anybody have any better advice I should maybe follow instead? Thank you so much in advance.",1646277293.0
t4gb2q,How is this legal?? I reported it for misleading description,,665,0.96,WorkReform,https://i.redd.it/8v4s54hsrtk81.jpg,49,,1646163520.0
t4d5b2,American Production company wants expert consultation for film without giving pay or credit.,,970,0.98,WorkReform,https://www.reddit.com/gallery/t4d5b2,49,,1646155428.0
